,Review,Rank
462,처음으로 극장판에서 본 짱구 기대 이상의 감동과 즐거움청춘은~ ,10
463,소소한 감동까지 챙긴 갓구 대작. ,10
464,짱구는 항상 옳다 ,10
465,엉덩이가 너무 많이 나와요 ,9
466,짱구와 친구들의 이야기에 중점을 두어서 재밌었다 ,9
467,귀엽고 유치하고 그냥 기분 좋은듯. 짱구 내 추억...애기들 다 귀여워 ㅠㅠ ,8
468,최근들어 나오는 극장판들 재미있다 ,10
469,짱구와 친구들이 주역으로 재밌고 아이들을 위한 메세지도 있어 좋았다 ,8
470,"지금 28살 먹고 취준하고 있는데 짱구가 위로해 준 느낌이다. 열심히 살아보자. 짱구가 응원한다. ""짱구야.. 위로 고마워. 그치만 난 꼭 이루어 낼게."" ",10
471,현 고3.. 고2때 무조건 공부만 보고 달려온 내가 참 불쌍해보인다.. 청춘은 바로 지금 이 순간인데 미래만 바라보고 달렸던 것 같다. 전교권이라고 우쭐해하는 내가 우스워진다. 가장 소중한 건 지금 이 순간을 즐기는...,10
472,"아, 웃고있어도 눈물이 난다 ",8
473,너무 감동이었어요 ㅠㅠ ,10
474,보고 존나움 ㅜ 보는걸 꼭 추천 ,10
475,떡잎마을 방범대 멤버들의 우정을 볼 수 있어 좋았다. ,9
476,그럭저럭 보긴 했지만 이게 그렇게 과대평가받을만한 영화인지는 모르겠음 ,5
477,재미있었어요 ,8
478,짱구와 철수의 진한 우정 ,7
479,,9
480,뭔 내용인지 하나도 모르겠음 ,1
481,어른들이 더 재미있게 보는 짱구에요 ,9
482,정말 재미있다. 웃음이 끊이지 않았음!!! ,8
483,마지막에 엄청 울었당 ㅠㅠㅠ ,10
484,유리가 젤 기억에 남고 재밌었움 ,9
485,너무 재미있어요 특히 철수 ㄷㄷ ,10
486,평생있겠다 짱구는 재미있어요 ,7
487,어른제국의 역습 같은 영화...다시보고싶다 ,1
488,처음엔 범인이 아닐거라 생각했는데 막상 보니 그 ㅅ사람이 범인인게 놀랏습니다 ,10
489,친구와 같이 보면 좋은 영화 ,8
490,낭만 합격 짱구 빅딜로 와라 ,10
491,,10
492,역시나 최고는 짱구였다! ,10
493,재밌어요 추천해요!! ,10
494,짱구 극장판 중 TOP3 . 너무 재밌는 영화 ,10
495,우리가 짱구를 못말려라는 만화를 보고 감명받은 이유 ,8
496,짱덕으로서 눈물콧물 줄줄 흘렸네여.. ㅠㅠㅠ ,10
497,짱구는 언제나 최고양!!! ,10
498,초반부터 짱구엄마가 짱구를 얼마나 사랑하는지도 느꼇으면 중간중간 뭔가 가슴이 아련했다 내가 본 짱구 극장판중에 탑 5에 들어갈정도로 재밋는듯 ,10
499,나만 보고 울었나.. 짱구 극장판은 다 최고네 ,10
500,,10
501,학생 입장에선 성적이 다가 아닌 후회하지 않는 청춘을 보내는게 중요하단 내용이 상당히 감동적이엿음.. ,8
502,재미있는 애니메이션 ,8
503,너무좋아요재미있어요 ,10
504,짱구는 역시 재밌어 ,7
505,우리는 그 자체로 이미 우등생 ,8
506,초반에 짱구엄마 무덤덤하다가 우는거 너무 감동적이네.. 초코비 몰래 넣어준것도.. 뒤에 갈수록 너무 재미있었고 감동적이였음 ,10
507,마지막 마라톤씬에서 폭풍 오열함 ㅜㅜ 다섯살 꼬맹이들한테 청춘을 배우다.. 개인적으로 어른제국보다 재밌었음 ,10
508,짱구 극장판 중에서 가장 재밌는것같아요~!! ,10
509,짱구팬이 아니라 그런지 재밌게 보진 않았지만 나쁘지 않았습니다 ,7
510,짱구는 나이들어서도 재밌구나 ,7
511,의리의 짱구극장판 ,8
512,보기 전에 들었던 평들보다는 다소 떨어지는느낌 ,7
513,장난만 칠 줄 알았던 짱구에게 한 수 배우다. ,8
514,재밌게 보았습니다!! ,8
515,극장에서 개봉했을 때 처음으로 짱구를 극장판으로 봤습니다 짱구의 응원메시지에 너무 감동이였습니다 ,10
516,재밌었어요 재밌었어요 ,10
517,재미있을것같아요.진짜로 ,10
518,웃긴 포인트가 엄청 많아서 웃으면서 봄 ,10
519,단순한 만화가 아닌 깊은 뜻이 담겨있는 영화. 어른이 되고 나서 본 지금 최근 본 영화중에 가장 순수하고 가장 감동적이었다. ,10
520,올더스 헉슬리의 멋진 신세계의 교훈을 아이들도 느낄수 있는 멋진 영화였다.인간은 완벽하지 않기에 후회하고 자책하며 나아갈 자유가 있다. ,10
521,훈발놈이 난생 처음 멋있고 귀여웠음 ,10
522,웃기는 내용도 많고 감동적인 면도 있고 개성가득한 짱구캐릭터 너무 좋아요 ,8
523,감동의 연속이었어요 완전 강추합니다!!!♡ ,10
524,“좋아하는 것은 포기하면 안되는 거에요. 그래서 저는 철수를 포기하지 않을 거에요”기대하고 봤지만 그 이상의 감동을 안겨준 영화였습니다. 29개의 극장판 중 26개를 본 사람으로써 top3 안에 드는 작품이라 자신있...,10
525,중국 같음 방 학교 다 공산국가 냄새 폴폴짱구도 망해간다예전의 짱구가 아니다. ,1
526,속 깊은 영화. 방황하고 있는 청춘들에게 깊은 여운을 주는 영화. ,10
527,청춘은 바로 지금이다! ,10
528,극장에서 처음보게 된 짱구!! 너무 귀여워서 보는 내내 웃음이 흘러나왔다. 다음 시리즈도 벌써부터 기대가된다. ,8
529,철구와 짱구의 관계성은 역시... ,10
530,내가 15년 넘게 짱구를 끊을수 없는 이유 ,10
531,철수가 너무 많이 달라져서 철수 어머니도 울고 나도 울었다 ,8
532,짱구를 좋아한다면 꼭 봐야하는 극장판 나이가 들고 서로의 직장 또는 일 때문에 친구를 쉽게 만나지 못하는 우리에게 우정이 무엇이었는지 상기 시켜주는 작품 ,9
533,정말 눈물나게 재미없었고 실망했다이딴식의 극장판은 돌아가신 짱구 작가에대한 모독이다. 평점이 8.9라니 정말 말도안되고 짱구도평점 알바를 쓰나 싶었다 극장에서안보길 천만다행이다더이상 나의 짱구를망치지마 ,1
534,,10
535,눈물났네요 추천합니다 ,8
536,웃기면서 감동적이네요 ,8
537,,10
538,옛날 짱구 극장판까진 아니더라도 최근 짱구 극장판 중에서는 가장 볼만했음. 옛날 짱구 극장판 그립네요 ㅠㅠ ,10
539,언제부턴가 의리로 보는 극장판 짱구와 코난.. 내용은 쏘쏘 그럭저럭.. ,6
540,스토리가 너무 산으로 가는느낌인데후반 킬포가 많음 ㅎ ,7
541,재밌어요 두 번 봤어요 ,8
542,,5
543,개봉하자마자 봐서 굿즈도 받고 좋았음^.^근데 어떤 꼬맹이들이 옆에서 해설처럼 머시기저시기 해서 좀 걸리적거리긴 했음 ㅠㅋ 그래도 영화볼 때 웃긴 장면 나오면 영화관에 꽉 차 있는 사람들이랑 같이 한바탕 웃으니 다정...,10
544,진짜 짱구 극장판 중에서 최고인거 같음...사춘기인 저한테 우정에 많은 명언을 안겨주었어요. 사실 민쩌미님이 성우로 나오신다길래 궁금해서 보러간거였는데 민쩌미님 말고도 진짜 모든게 다 재밌었어요...짱구는 극장에서 ...,10
545,재미있고 환상적인 퍼펙트한 영화였습니다 ,10
546,재미있게 관람 했습니다. ,8
547,,9
548,약간 예상되는 느낌이 있었는데 그래도 재미있었다 ^^ ,9
549,유치해도 본질을 꿰뚫는 화두부리부리부리~~ ,10
550,재밋어요 역시 짱구 극장판은 즐거움과 감동이죠ㅋㅋㅋ♡ 간만에 극장판 재밋게 봤어요! ,10
551,짱구 극장판중에 가장 재밌게 봤어요다들 한번쯤은 꼭 보시길 !! ,10
552,짱구아빠 원툴이던 명작 극장판 라인의 혁신 ,10
553,볼만함 ㅇㅇㅇ ,8
554,woalTjdq ,6
555,카스카베 방위대(떡잎마을 방범단)을 가장 잘 드러내지 않았나 싶다. 이 영화뿐만 아니라 짱구는 못말려 극장판에서 위기에 처했을 때 짱구를 외치는 장면은 항상 마음을 울린다. 추가적으로 역대 짱구는 못말려 시리즈 중 ...,10
556,울었습니다 가족애와 우정 등등 ,10
557,조카가 너무 재밌게 봄 ,9
558,조카가 좋아함 ,10
559,존잼 임 짱철커플 응원 할께 ,10
560,역시 극장판 짱구는 꿀잼임 ,10
561,삼삼이 나보는줄 알았다. 맹구는 이번편은 성격 특이하게 나오네 ㅋㅋ ,9
562,야자 째고 보고 왔는데 철수한테 감정이입해서 울 뻔 했어 ,10
563,상위1% 교육현실 짱구답게 풍자하다 ,8
564,최근 짱구 극장판 중에 스토리가 제일 좋았음 감동도 있고 재관람 의사가 있지만 분량이 적은 캐릭터여도 유튜버를 쓰는건 좀 아닌듯 거슬릴정도로 어색함 짱구가 인지도 낮은 애니도 아니고 유튜버 쓴다고 관객 수가 눈에 띄...,6
565,최근 극장판들 중에 제일 재미있게 봤던 것 같아요! 보는 내내 야끼소바빵 맛이 궁금했습니다. ,10
566,이제 아이때문에 가는것도 그만해야겠다; ,1
567,너무너무너무재밌다ㅜ 등장인물들 다 응원하게 되고 특히 맹구가 너무 귀여워요 ,10
568,후.. 떡잎마을방범대는 너무 의리있고 감동적이에요 그리구 등장인물 한명한명이 매력있어서 넘  좋았구 감동적인 부분이 좋았어요다만 아쉬운 점은 흰둥이가 조금나와서 아쉬웠어요 ㅠ ,10
569,개인적으로 너무 재밌게 봤고 19살인데 뭔가 울컥하기도 했음 ㅋㅋㅋㅋ 짱구는 역시 이런 게 좋은 것 같다 모두 다 으쌰으쌰하고 훈훈한 분위기 재밌었다 ,10
570,감동적이에요. 볼 만합니다. ,10
571,맹구가 차였을때 같은 기분이 들었습니다. ,10
572,생각보다 너무 재밌다 학창시절 향수를 떠오르게 하는 짱구 최고 ,10
573,저는 정말 재밌게 봤습니다!! 사립학교 견학이라는 소재도 너무 젛고 떡잎마을 방법대의 케미도 좋았습니닷!! 또 학생으로서 이 영화를 보니 학업 관련 많은 생각을 하게 되네요.. ,10
574,간만에 짱구다운 짱구가 나왔는데 호불호가 좀 갈릴수도...   카스카베 방범대가 모이면 일단 8점은 먹고 들어간다 ,8
575,추억의 짱구영화 너무 좋아요 ,7
576,재미있어요 굿 ,10
577,오랜만에 귀엽고 웃긴 얘기보려고 간거였는데 감동받아서 눈물 찔끔 흘리고 나옴 ,10
578,재밌었습니다. 편히 옛 기억을 떠올렸어요 ,10
579,청춘은…화이팅….!! ,10
580,청춘을 다시 한번 생각해보게된다 지금을 열심히 살고싶다 ,10
581,,8
582,,10
583,시간 가는줄 모르고 봤음 ,10
584,,10
585,수능 끝난 고3이라 그런지 웃으면서 볼 수 있는 대사나 장면에서도 눈물남... 새롭게 시작될 청춘을 준비하기에 최고의 영화! ,10
586,이번 극장판은 간만에 정말 재밌게 봤네요. 어떤 시간을 보내던 소중한 청춘! ㅎㅎㅎ ,10
587,짱구 극장판은 언제나 최고에요 ,10
588,중간에 루즈해졌긴 했지만 유머포인트 다양하고 스토리 재밌고 좋았습니다 ,9
589,진짜 너무 재밌게 봤고 스토리가 오래 기억에 남는다. 캐릭터마다 다양하고 파트들이 많아서 너무 좋다. 맹구 사랑해???? ,10
590,언젠가 헤어질 그들을 위하여 ,8
591,오랜만에 재밌었네요!! ,8
592,이게 영화지..이게 짱구야.. ,10
593,아 진짜 보는 중간중간 그리 슬픈 장면은 아니지만 울컥했음… 내가 원래 이렇게 눈물이 많았나… 믿고 보는 짱구다 진짜…. 이번 ost 역시 너무 좋음 몇번이고 다시 볼 듯 아 너무좋다 진짜로 ,10
594,,10
595,극장판 시리즈 중 스토리가 제일 좋았어요... ,10
596,"와 띵작이다. 감동,연출 크 제목부터 명작인데 진짜 명작이다 ",10
597,로봇아빠 이후로 감동적인 극장판 ,10
598,제 친구 이거 보고 울었어욬ㅋㅋㅋㅋ(너무 웃겨서) ,10
599,감동으로 눈물이 ㅠ ㅋㅋ 울고웃다 마음이 따뜻 말랑. 일본애니는 이런 포인트가 있음 ㅠ 짱구는 못말려 사랑한다♥ ,10
600,,10
601,진짜 마지막ㅠㅠㅠ 교훈이랑 대사가 진짜 너무 감동적이고 눈물날뻔했어요ㅠㅠ 짱구 극장판 중 가장 기억될 영화인거 같아요ㅠㅠ 그저 웃기기만한 영화가 아니라는 점ㅠㅠ ,10
602,"청춘은 콤플렉스, 청춘은 미스테리 ",10
603,짱구 영화 중에 가장 재미있었던 것 같아요 ,10
604,무서운 장면도 있었지만 재미있었어요7살 어린이가 ,8
605,웃겨서 토하는 줄 알았어요... 마지막쯤엔 거의 울면서 봄 ,10
606,마음이 따뜻해지는 영화입니다.젊음을 응원하는 영화! ,10
607,여전히 귀여운 짱구 그간 극장판 스토리 지루한 거 많았는데 간만에 재밌었음 추리요소가 들어간게 신선했음 ,7
608,재밌었어요…감동도 있어 찡했습니다 ,10
609,,9
610,긴 러닝 타임 중 짱구 엄마 아빠의 청춘에 관한 두 문장이 오랜만에 긴 여운을 안겨주었다. ,10
611,감동... 꼭 보세요 ,10
612,짱구 극장판 시리즈들은 딸아이들하고 항상 관람하면 재미있네요. ,10
613,앞에 잘 보고!  넘어지지 말고!혼자 봤으면 오열했다.. 청춘은 지금... 태일이 많이 컷구나에 이은 이별 애니가 되는게 아닐까.. 디지몬 처럼 떠나지마 제발ㄹ ㅜ ,10
614,,10
615,짱구에서 코난과 엉덩이탐정을 보았다.어른이 봐도 청춘에 대해서 다시 생각해보게만든 영화. 재미있다 ,10
616,무슨 시집이나 책한편 읽은 기분..초등아들이랑같이갔다가 후반부에 짱구엄빠대사에 훌쩍훌쩍 감동눈물...정말 잘보러갔다생각했네요 대사하나하나가 다 가슴을 후벼파네요 ,10
617,웃으면서 눈물나요..ㅜㅜ짱구 좋아하시는 분들은 꼭 보세요 ,10
618,넘 좋아요 아주 좋아요 굿 정말 좋아요 ,10
619,짱구 끝나지말아줘.. ,10
620,짱구는 옛날도 좋지만 지금도 좋다 ,7
621,재미있게 잘 관람했습니다. ,9
622,짱구야 사랑해 무럭무럭자라렴 ,10
623,짱구 극장판은 얼웨이즈 빌리브 ,10
624,재미있고 인상적이네요 ,10
625,별로였음... 짱구는 과거의 극장판 감동을 잃어버란것겉음 ,6
626,"극장판 중 제일 별로였음.. 아무리 그래도 기숙사에서 철수가 짱구 엄마에 대해 막말한 거 생각하면 진짜 최악이었고, 초반 지루하고 루즈하며 개연성도 억지스럽고 마지막 부분도 허무하게 끝남.. ",4
627,옛날 짱구 극장판이 조금 그리움 ,6
628,재밌게 시간 가는줄 모르고 봤어요 ,10
629,나는생각도못한인물이 갑자기 그리고 만화지만재밋엇음 마지막몇분까지도 집중이되는영화였음 ,10
630,괜찮게본듯 짱구최근극장판은 안본지꾀됐는데 ,10
631,감상평에 속아 친구랑 보러갔는데 ㄹㅇ 개노잼웃기긴 한데 감동적이진 않았음훈발놈이 ㄹㅇ 훈발놈 된 것 밖에 생각나는게 없어용 ,1
632,이제 다시 어느정도 궤도에 오른듯한 짱구 극장판을 보는 기쁨 ,9
633,내 청춘을 어떻게 보낼까 ,10
634,너무 재밌고 너무 감동적입니다. ,10
635,너무 재밌어요 큐ㅠ큐큐큐큨큐ㅠ큐 ,10
636,"30대이고 유머코드 진짜 독특한거 아니면 안웃는 편인데, 너무 재밌게 잘 웃으면서 봤네요.레알 존잼입니다. 너무 귀엽고 작화도 좋고 찐웃음나오게 만듭니다. tv애니메이션 중에 몇안되는 고퀄 극장판이네요 잘 봤습니다 ...",9
637,어른제국이랑 비빌라한 새기들 OO라고 ㅋㅋㅋㅋ 그래도 그려그려보단 나으니까 5점준다 ,5
638,넘 잼나요~~~~ 짱구 완전 광팬!!! ,10
639,뇌절의 끝판왕이걸 왜 추천하는지 모르겠음; ,2
640,과거의극장판의감동은 이제없지만 그냥 짱구란 자체로 10점 ,10
641,재밌었다 추천합니다~ ,8
642,중간에 쫌?? 졸렸지만 그래도 재밌어요 울면서 나왔어요 ,8
643,,10
644,역시 짱구는 믿고봅니다. ,10
645,엄청 감동적이지는 않지만 너무 귀엽고 친구를 위해 애쓴다는 마음자체가 너무 좋고 귀엽고 이쁘다 ,10
646,쩐다  진심 개재밌음 굳굳 추천 드림 ,10
647,오늘 혼자 가서 봤는데 웃음 참느라 힘들었어여ㅋ평이 좋은 이유가 있더라구요 어른이 보기 좋음ㅎ ,10
648,아이와 함께 봤는데 역시 츤데레 짱구친구들 생각하는 떡잎방범대 최고에요 ,10
649,나 20인데 보고 울엇다. ,10
650,"사람마다 다른 청춘의 정의, 잔잔한 감동 ",7
651,오랜만에 영화관에서 짱구 극장판봤는데 보길 잘 한것같네요 재밌습니다 ,10
652,레알 후반뇌절 오바다 재미없어요 ,2
653,어른이 되서 봐도 여전히 내 가슴을 울리는 영화. ,10
654,짱구팬으로써 엄청 재미있고 감동적이었습니다 ,10
655,대체 누가 어른제국의 역습과 비교하는건지... 마지막 부분이 그나마 괜찮았고 나머지는 별로 볼게 없었다. ,4
656,눈물이 올라와서 참느라 힘들었음~ 시간가는지모르고봄! ,10
657,재밌다 그냥 너무 재밌다 ,10
658,"컨셉, 영상미 등등 초반까지는 최근 본 극장판중에 제일 좋았으나 중반부터 슬슬 난잡해지더니 후반부에 대난장 억지 감동파티로 마무리됨... 아쉽다. ",6
659,너무 엉덩이 투성이라서 당황스러워요 ,10
660,울면서 웃어보고 싶다면..그리고 본인이 고민이 많아 힘든 청소년이라면 말할 것도 없이 보라고 추천해주고 싶은 극장판이다. ,10
661,청춘이니까.모두들 자신만의 청춘이 있으니까. ,10
662,마지막에 다 같이 뛸때 어른제국 끝부분 장면과 겹쳐보이면서 감동적인게 최근 짱구 극장판 중에 유치하지도 않고 감동적인 정말 괜찮은 작품. ,7
663,생각 없이 들어갔다 감동을… ,10
664,이건 어른들 영화예요...진짜 마지막에는 울뻔했어요 ㅠㅠㅠ ,10
665,청춘은 파이팅.... ,10
666,요즘같이 극심한 영화관 침체기에 짱구 극장판 역대 관객수 기록을 세운 작품입니다. 그것만으로도 볼 이유는 충분합니다. 지금이라도 늦지 않았으니 꼭 관람 추천드립니다. ,10
667,재미도 있고 감동도 있고 메시지도 있구ㅠㅠ 간만에 타겟층을 골고루 노린 듯한 수작 극장판ㅠㅠ 교복 입은 애기들도 얼마나 귀엽던지ㅠㅠ?그저 청춘! 당연 최근에 나온 극장판 중에서는 1위였다고 봅니다.(하지만 개인적으로...,10
668,청춘과 인생을 바라볼 수 있는 극장판이었음 ㄹㅇㅜㅜ 짱구한태 한수 또 배웠다 ,9
669,"철수와 짱구의 우정을 느낄 수 있는 영화청춘에 대해 다시금 생각해보고, 곁에 있는 친구들의 소중함을 깨달을 수 있었다또한 마지막 부분에는 극장에 있는 대부분의 사람들이 함박웃음을 짓거나 웃음을 터트릴 정도로 유머 포...",10
670,,10
671,30대 후반 애아빠인데 지금까지 짱구는못말려극장판 많이 봤는데 역대급인것 같네요!!아이랑 같이 정말 정말 재밌게 봤고 감동적인 장면도 나오고 정말 후회없는선택이였습니다! ,10
672,짱구 극장판은 다 보는편인데 하나하나 볼때마다 진짜 와 표현을 어떻게 해야하지 너무 좋은 조언같은걸 알려주는거 같기도 하고 이번 극장판에서 짱구랑 철수의 대화를 보면 짱구는 지금을 생각한다고였나 했는데 진짜 감명 깊...,10
673,아들:아이들의상상이 좋았습니다. ,9
674,스토리는 전형적인 짱구 극장판이야기임. 짱구는 여전히 귀여움. 성우분들 연기는 뭐 언제나처럼 좋았음. 그런데 삼삼이 목소리 나올 때마다 몰입이 깨짐. 그게 좀 많이 아쉬움. ,7
675,"끝없는 짱구의 진화, 명작의 감동 ",10
676,현실성있는 감동이라 더 좋았어요다들 꼭 보세요 ,10
677,"오랜만에 재밌게 봤다…요즘에 나오는 짱구극장판은 옛날 극장판을 따라가지 못해 재미가 없어서 별로 기대 안했는데 기대 이상 재밌다ㅎㅎ감동, 명언.. 크… ",9
678,나에게 꼭 필요한 영화. 청춘이면 꼭 봐야하는 영화 ,10
679,되게 억지로 짜 맞추려는 개연성과 억지로 감동적인 느낌을 끌어올리려는 느낌 ㅜㅜ짱구 덕후인데 이번 극장판은 좀 실망 ,4
680,짱구 너무 귀엽네요 예전생각 많이 나네요 동심의 세계 ,8
681,그나마 덜 위험하구 편히 볼수 있는 ,7
682,짱구 극장판만보면 눈물이 납니다ㅠㅠ ,10
683,짱구 인생 애니 ㅜㅜㅜㅜ진짜 재밌음 ,10
684,대사들 하나하나가 마음에 드네요.... 짱구 최근 극장판 중에서는 제일 재밌음 ,10
685,성인 아이 할꺼 없이 재밌게 볼 수 있는 영화였다 ,10
686,"청춘,,, 너무나 감동이랄까,,, ",10
687,ㅠㅠㅠㅠ너무 재밌어요!! 마지막에 감동의 눈물이 주룩주룩 ㅠㅠ  ㅋㅋㅋ아 짱구 사릉해 짱구짱구 사릉해!! ,10
688,,10
689,웃기고 감동적인 짱구만이 줄수있는 스토리 ,10
690,역대급 극장판의 등장! ,10
691,얘네는 왜케 덩이를 좋아하냐 ,6
692,정말 재밌게 봤습니다. ,10
693,떡잎방범대 포에버!!!! ,10
694,짱구가 옛날에 조금 선정적(?)인 개그로 다른애니에서 볼 수 없던 유머코드들이 있어서 좋았는데 지금은 검열이 심해져서 옛날짱구의 재미가 많이 없어졌다고 생각했다. 하지만 전작과 이번 짱구 극장판을 보며 짱구 극장판의...,10
695,"말모,, 역시 믿고 보는 짱구 극장판이에요. 심금을 울립니다... ",10
696,아이들과 봤는데엄청 좋아해요^^ 반전의 재미까지 ,10
697,아이들과 봤는데엄청 좋아해요^^ 반전의 재미까지 ,10
698,ai가 청춘이란 뭐지 묻는씬에서제각기 청춘에대한 정의를 얘기할때 정말 눈물이 줄줄 나더라고요 ,10
699,안봤지만 재미있어보여요 ,10
700,역시 꿀잼 두말할것 없이 어른영화 ,10
701,아이가 너무 재밌어했어요~~ ,10
702,짱구 역시 너무 감동이에요ㅠㅠ ,10
703,,10
704,혼자 아무생각없이 봤다가 후반에 질질울고 검색해보니 다들 같은 마음이네요 ㅠㅠ 다들 화이팅 ,10
705,재밌음. 강력히 추천합니다. ,10
706,각자 저마다의 청춘이 있다 ,10
707,너무 감동 적이고 스토리도 재미있다 ,10
708,"후반부에 감동이 휘몰아쳐서 마스크 안으로 눈물 훔쳤어요,, 짱구 웃기고 감동적이고 귀엽고 다 해,, 30살 넘어서도 극장판은 영화관에서 볼게요 ",10
709,극장판과 티비판의 내용이 이어져서 좋아요. 철수가 사랍초 가는 내용~ ,10
710,,10
711,재미가 있는 작품이었지 감동이 있는 작품은 아니었음 ,6
712,역시 짱구 어른이 된 지금도 짱구 극장판 보면서또 응원받고 위로받네요 ㅠㅠ 파이팅! ,10
713,슈퍼앨리트철수가나다 ,8
714,이게 명작이지 (진정한 1위) ,10
715,청춘은 ㅠㅠ 미스테리 !!! ,10
716,,9
717,마라톤에서 너무 재밌다!!! 흑덩귀가 유일등이라는 사실에 반전이 있고 스릴이 넘쳤다 굳! ,10
718,짱구 극장판은 생각을 많이 하게되서 좋음 ,10
719,정말 재밌게 봤어요 역시 믿고보는 짱구.. ,10
720,역시 존잼 점점 퀄리티 있어지고 청춘..  좋다.. ,10
721,"이 시대 청춘에게 전하는 따뜻한 위로 잘 받았습니다. 어떤 모습으로 남을지라도, 남들이 어떻게 본다하더라도 나는 나예요. 짱구처럼 청춘을 즐기며 살고싶어요. ",8
722,스토리가 매우 재밌고요즘 나온 짱구중 가장 재미있었다 ,10
723,진짜 감동 성인이봐도 너무재밌었어요 ,10
724,짱구엄마아빠가 해주는 말 너무 감동..짱구 극장판은 항상 최고야... 떡잎마을방범대 포에버!!!! ,10
725,정말 명작입니다 역시 짱구 이거 보세요 저 이거 보고 수학 100점 맞음 강추입니다 ,10
726,진짜 계속 생각나서 짜증남 너무 재밌었음 ㅠㅠ ,10
727,초반부는 좀 유치한감이 없지않아있는데 후반부는 재밌고 감동적이고해서 눈물이 줄줄 나오더라구요 너무 재밌게 봤습니다~ 또 보고싶어요! ,10
728,아주 재미있습니다.아이와 함께 보기에 좋네요. ,10
729,힐링 영화 ,10
730,질주 엄청 웃김 ㅋㅋㅋ 짱구 연출 중에 가장 웃김 ,10
731,진짜 최고였어요!!! ,10
732,짱구 연기 대박 늘었네요 다음이 기대되는 배우 ㄷ ㄷ 항상 응원합니다~~~ ,10
733,정말 최고에요ㅜㅜ 짱구 정말 좋아하는데 여태본 극장판중에 가장 인상깊고 기억에 남았어요 친구랑 보러갔는데 친구는 짱구 그저그랬는데 생각보다 더 엄청재밌다고 그랬어요! 전혀 돈아깝지 않아요 오펀 천사의비밀 2보려다가 ...,10
734,,10
735,소소하게 웃긴 짱구!! 너무 웃겼다 ,9
736,역대 극장판 중 제일 재밌음 ! ,10
737,짱구 귀여웡 훈이가 이번엔 좀 갠찮음 ,8
738,,10
739,"청춘은 지나가지만 없어지진 않는다,부모에게 부끄러운 자식은 없다 ",10
740,친구들이랑 엄청재밌게봄 ,10
741,감동적이면서도 재밌는요소가있는 영화! ,10
742,"너무 재미있었어요, 애인이랑 함께 가세요 ^^~~ ",10
743,"여자친구랑 같이 보러갔는데, 눈물 참느라 혼났습니다. 웃길땐 확실히 웃겨주고, 감동이 있었던. 그리고 울컥하는 대사들이 참 많았던거 같아요. 간만에 행복해지는 영화봐서 좋았습니다! ",10
