,Review,Rank
0,"짱구 극장판 중에 제일 재밌었음…… 낙서왕국 N차 뛰었었는데 그거보다 더 재밌었어요 ㅠㅠㅠ 루즈한 장면 하나도 없고, 개연성도 좋아요… 쉴 새 없이 웃긴데 쉴 새 없이 감동먹어서 울게 됩니다 ㅠㅠ 어렸을 때 짱구 보...",10
1,이 시대를 살아가는 철수들에게 보내는 짱구의 위로메시지!! ,10
2,후반이 진짜 웃긴데 괜히 눈물남 넘 재밌었다 ,10
3,"짱구 극장판 중에서 개인적으로 가장 인상 깊었어요! 청춘이 뭔지 다시금 생각하게 됐고, 후반부에서 시간이 흘러 자주 못보는 소중한 친구들이 생각나서 눈물 찔끔했어요ㅠㅠ ",10
4,비상이 많이 걸립니다...하 특히나 짱구 엄마가 몰래 챙겨준 초코비는..ㅠ 아직도 초코비에 묻어나는 짱구 엄마의 사랑이 자꾸만 생각나서 비상 걸려요 ,10
5,청춘은 무엇이라 정의할순 없지만 본인 스스로 만들어가는 과정을 다시 느끼게해준 영화.떡잎마을방범대 포에버 ,9
6,보면서 혼모노 됐음 극장에서 울었음 그냥 후반부의 많은 말들이 소름끼치게 눈물나게 만듦 근데 연출이 겁나 웃겨서 울다 웃고를 반복하며 나의 엉덩이에 뿔이 솟아나버리다. ,10
7,짱구에서 청춘을 느낄 줄은 몰랐다 ,8
8,중3인데 최근 공부 관련 스트레스와 공부 집착이 좀 심했는데 철수를 보면서 제 모습과 비슷하다구 생각했고ㅠㅠㅠ 막  학교 사람들이 싸움은 불필요한것이다 이렇게 말했고 엘리트는 쓸데없는것들을 하지않는다 이런게 있었는데...,10
9,떡잎마을방범대 팬이라면 봐야한다.나의 과거를 추억하며 보러온 짱구에는 현재와 미래가 있었다. ,10
10,짱구는 어른이 되어야지만 온전히 감동을 느낄 수 있다. ,10
11,정말 나이 25먹고 눈물 펑펑흘리디 왔습니다 ㅠㅠㅠ의리주먹빱… 짱구.. 그리고 철수의 우정과 사랑…모성애..당신의 청춘은 언제부터일까요… 전.. 지금입니다 ,10
12,애들이랑 봤는데 청춘에 대해 한마디씩 할때 왜 눈물이 흐르는지..최고네요 ,10
13,철학이있노 ,8
14,올해 개봉한 영화 싹 다 봤는데 짱구가 에이스일 줄이야 지금 한참 진로 고민으로 질풍노도 시기인 23살인데 스토리 너무 공감돼서 뒷부분은 눈물 질질 났음 뭔데 짱구가 나한테 위로가 되는건지... 평점쓰려고 들어왔는데...,8
15,지금을 잘 반영한 짱구다 극장에서 보는 건 처음인데 만족스럽다 ,8
16,짱구 극장판중 역대 최고라 생각합니다 ,10
17,"나이가 들어도 친구들과 흩어지기 싫었던, 평생을 함께 하고 싶었던, 떡잎 마을 방범대의 이야기 ",10
18,내 나이 21 언제 짱구가 질릴까 이번 극장판도 레전드 ,10
19,짱구? 애니? 그거 애들이나 보는거 아냐? 하는 편견을 갖고 이 영화를 안보면 후회함. 기대 이상의 재미와 감동까지 갖춘 이제껏 나온 짱구 극장판 중 단연 최고라 평가하고 싶다 ,10
20,앞에선 웃으면서 보다가 마지막 마라톤 장면에서 진심으로 뭉클했다 ,10
21,"짱구와 함께한지 어느덧 20년 즈음. 유치해 보일줄만 알았던 것들도 모두 청춘이고 추억이었다. 일전의 사건, 사고들이 모여 마지막에 터지면서 주는 감동이 있던 영화. 그리고 나이 들어보니 짱구 가족들 한마디, 한 마...",8
22,"어른 제국이 추억, 과거, 부모님에 대한 그리움과 감동을 안겨주었다면 이번 극장판은 청춘과 우정, 사랑에 대한 이야기를 아름답고 감동적이면서도 짱구스럽게 풀어냈습니다. 짱구와 함께하면 나도 늘 청춘일 거 같아요. 고...",10
23,영화 보면서 안 운 지 10년은 된 거 같은데 캐릭터들이 청춘에 대해 각자 정의 내릴 때 눈물 날 뻔 했음. 나에겐 청춘이 뭘까. ,8
24,나루토와사스케가싸우는것같았다!!! ,10
25,철수의 순수한 마음이 돋보였습니다. ,8
26,여태까지 봤던 짱구 극장판 중에 최고라고 해도 과언이 아닌거 같아요 어른이 봐도 유치하지 않고 너무 재미 있었어요 ,10
27,짱구 극장판이 낙서왕국을 기점으로 다시 점점 위상을 회복하려고 하는 듯한 영화. ,8
28,짱구는 배신하지 않는다 ,10
29,청춘은~~ 할 때 왜 눈물이 나올까 ,10
30,"삶을 살아가며 내가 중요하게 생각하는 가치가 틀리지 않았다는 걸, 앞으로도 변치 말라고 응원해준 다섯 명의 꼬마들 ",10
31,"떡탐아리 , 청춘 파이팅! 모두에게 청춘의 의미가 다르다는 것을 또 한 번 느꼈습니다. 꽤 뭉클하고 감명깊어요 ",8
32,20기 시리즈의 마무리를 제대로 지은 듯ㅠㅠ 진짜 역대급이었어요. 역시 명불허전 짱구!!ㅠㅠ ,10
33,이게 짱구 극장판이지 ㅠㅠ ,10
34,"짱구 극장판은 평이 좋아서 기대했는데, 기대만큼 재밌었어요-넘 웃겼어ㅎㅎ 훈이 폭주족 ㅠㅠ 개귀엽 ㅎㅎㅎ웃음과 감동이 있어서 넘 좋았어요.마지막에 눈물 찔끔. 아이디어가 재밌어서 좋아요. ",10
35,눈물 찡했어요 이런 만화 영화는 어른 시선에서 보는 게 더 와닿는 느낌 ,8
36,청춘이라는 주제를 아이들의 관점으로 볼 수 있게 만든 영화 같음 ㅠㅠ 하지만 성인이 보고 눈물 줄줄 흘리게 되는 영화 ,10
37,짱구 극장판 개봉하면 무조건 영화관가서 보는 1인 입니다!!! 매번 너무 재밌게 보고있고 다른사람들은 잘 모르겠지만 저는 이유없이 눈물도 나기도 했고 웃기도 잘 웃으면서 대만족 하고 나왔어요 ,10
38,어른제국만큼은 아니지만 마지막 장면만큼은 울컥하고 최고였다 역시 짱구... 영화 보고 나서 청춘인 지금을 걱정만 하지말고 충분히 즐겨야겠다고 생각했다 ,10
39,믿고보세요 청춘은 아직 끝나지 않았다.. ,10
40,진짜 짱구는 내 평생의 친구일듯.. 사랑해 짱구야ㅠㅠㅠㅠ ,10
41,짱구보다가 감동 먹을 거라고는 상상도 못 했건만 ,9
42,떡잎마을 방범대 파이어ㅜㅜ!! ,10
43,근래 최고로 잘만든 짱구 극장판 ,10
44,떡잎마을방범대를 좋아하는 사람들에겐 정말.. 이번 극장판이 최고라고 봅니다 ㅠㅠㅠ 너무 감동적이었어요.. ,10
45,떡잎마을 방범대 청춘 파이팅!!!!상영관에 있는 아이들은 웃고 어른들은 우는 기묘한 영화진짜재밌고감동적 ,10
46,재밌는데 너무 메시지가 직설적임 대사로 다 나옴 물론 아이들도 봐야 하니 이해를 돕기 위한 거겠죠 ,9
47,짱구로 인생을 배웠습니다 ,10
48,근래에 만든 극장판 중 퀄리티가 좋습니다. ,9
49,"어른제국의 역습과는 또 다른 의미에서의 걸작, 레전드 그 자체였음 ",10
50,짱구 극장판중에 제일 재밋엇어요 ,10
51,"의미 전달은 직접적이지만 그만큼 감동이 컸던 것 같아요... 청춘은 고독, 우정, 의리, 반짝반짝, 콤플렉스, 청춘은 미스터리,, 사람마다의 청춘은 모두 다르고 알 수 없는 것 투성이지만 그럼에도 청춘이다. 실패해도...",10
52,"원래도 짱구를 사랑하는 팬이지만,오랜만에 마음 뭉클하고 감동적인 극장판을 본 것 같아서,더 기분이 좋고 만족합니다.영화관에서 봤는데 집에서 추가로 유료 결제해서 또 볼 생각있어요. ",10
53,웃다가 눈물이 났어요;;인생 코미디영화 됐습니다평점 9점대길래 어른들이 의리로 평점 휴하게 줬나 생각했는데 다들 진심을 다해 준 별점이었네요ㅠㅠㅠㅠ ,10
54,짱구는 마음이 엘리트에요 ,9
55,이시대를 살아가는 청소년~ 청년들에게 전하는 아름다운 메시지 ,10
56,정말 재밌고 마지막에 학생회장 얼굴이 웃겼어요ㅋㅋ ,10
57,,10
58,짱구 극장판 보다가 운 건 어른제국의 역습 이후로 처음... ㅠ ,10
59,이게 청춘이지 ,9
60,우리 인생에서 놓치고 있던 감정들을 함께 찾아준 영화 ,10
61,괜찮다는 평을 듣고 기대하며 봤으나 뇌가 엉덩이에 지배된 짱구를 보며 슬펐다 ,6
62,볼만합니다 근데 그렇게 크게 좋진 않았어요 ,6
63,8살짜리 동생 보여줄려고 같이 간 고3이에요. 별로 재미 없을 줄 알았는데 너무 감동적이어서 눈물이 나더라구요. 너무 늦게 실기를 준비하는 입장이다보니 학교에서 눈초리를 많이 받았어요. 근데 오늘 짱구에서 노력하는 ...,10
64,짱구 시리즈 중에서 가장 재미있게 관람했습니다 ,10
65,찡구극장판 역대 2번째로 재밌음 ,9
66,후반이 진짜 웃겼고 괜히 눈물남 ,10
67,성인이되고 짱구를 보러갈때 창피함을 조금느꼇지만 짱구영화를 보고 성인이되서 이영화를 보게된게 너무 감사하다 정말 행복했다 또 다시 이런영화를 만날수있을까? ,10
68,약 빨고 만든 게 틀림없다는 생각이 들 정도로 엉뚱하면서도 유쾌했던ㅋㅋㅋ 후반부에서 빵빵 터지는 유머코드에 극장에 있던 모두가 소리 내어 웃었다. 스크린 속 짱구가 건네는 청춘에 대한 이야기가 너무나도 마음에 와닿았...,10
69,너무 재미있었어요! 짱구 짱 ,10
70,단순한 애니메이션이 아니라 철학과 감동이 공존하는 잘만들어진 작품이라고 불러워야 합니다! ,9
71,청춘은...ㅜㅜ ,9
72,짱구 극장판에서 청춘의 고뇌와 희망을 느낄 줄이야 ,8
73,청춘이란 무엇인가 생각하게 되는 영화 ,8
74,짱구인데.. 무슨 뭐 .. 말이 필요합니까 무조건 10점.. ,10
75,기분 복잡하고 이상할때 보러 갔는데 재밌게 보고왔습니다! ,10
76,재밌음... 후반부 개웃김 ,8
77,경쟁사회의 단면을 짱구특유의 웃음을 섞어 전달해서 웃다가 울다가 했네요 ㅎㅎ ,10
78,짱구 영화관에서 본 건 처음인데 민족스러웠습니다. ,10
79,잊고 있던 나의 청춘에 대해 다시금 생각하게 만들어준 영화. ,10
80,짱구 극장판은 믿고본다 ,9
81,너무 재밌어요 짱국 극장판 중에서도 너무너무 재밌습니다 추천꾸욱 ,10
82,왜 인기있는줄 알겠네요 짱구 어렸을때 보던 그 재미 그대로입니다. 최고 ,10
83,짱구보고 청춘 힐링을 느낄줄이야 ,10
84,짱구가 성장하네ㅜㅜ ,7
85,짱구 귀여워요 은근 몰입되네여 ,10
86,5살딸과 재미있게봤어요 ,10
87,으헝헝 으헝헝 ,9
88,친구들이랑 같이 보다가 오열쇼함 짱구처럼 살자 ,9
89,다섯살 아이들이 청춘을 외치며 달리는데... 아 감동!! ,10
90,초반에는 살짝 지루하였지만 후반부에 갈수록 정말 뭉클해지는 감동이였어요. 관람객 추이가 20대가 많은데 그만큼 청춘에 대해 잘 표현되어 있다고 생각합니다!! 넘어져도 고독해도 행복해도 다 청춘이라는 마지막 의미가 너...,10
91,너무 재미있게봤어요 ㅋㅋ 웃음포인트가 여러가지가있어서 어른들도 재미있게 보실거에요 ㅎㅎ 추천합니다! ,10
92,요새 감성에 맞게 센스있는 내용. (업그레이드) ,9
93,"짱구에는 휴먼, 감동, 우정, 사랑, 반전, 스릴 모든 장르가 다 있습니다. 정말 재밌게 봤습니다. ",10
94,초반부는 성인이 보기에 다소 유치한데 후반부로 갈수록 감동이 휘몰아쳐요 ,10
95,아이랑 같이 봤는데 제가 더 재밌게 봤어요 추천합니다 ,10
96,짱구영화는 시끌벅적한게 좋습니다 ,8
97,갖고 있는 메시지가 너무 좋았어요 ,8
98,특히 짱구와 철수의 우정의 돈독함을 느낄 수 있음...유치하기도 하면서 감동적인 이야기 ,10
99,청춘은 지금 청춘은 우정 청춘은 컴플렉스 ㅠㅠㅠ짱구와 철수와 친구들의 우정이 돋보여서 너무 감동이었고 은질주의 성장과정도 너무 감동적이었어요! ,10
100,"어른제국급을 기대했는데 기대한만큼은 아니지만, 잔잔한 감동이 있다. 감동과는 별개로 범인을 찾는 추리 과정이 정말로 재미있었다. ",8
101,짱구는 언제나 재밌습니다. 아이와 함께 재미있게 잘 보고 왔습니다. ,10
102,짱구는 사랑입니다. 너무 귀여워요~ ,9
103,짱구 오랜만에 봤는데 좋았어요. 전달하고자 하는 메세지 뚜렷해서 좋았고 어른도 감명받았다는ㅠㅠ 짱구 보고 위로 받았어요! 애들이 날 울리네..ㅠㅠㅠ ,10
104,감동적이고 재밌었어요 ,9
105,짱구 이야기중 제일 재밌어요 ,8
106,초반부는 살작 진부했는데 아무래도 내가 나이가 들어버려서 그런지 느끼는 진부함인거 같다. 막판으로 갈수록 너무 웃기고 가슴이 벅차오르는면서혼자 눈물을 훔쳤다. 단순하고 순수한것에서 인생을 깨닳고 소중함을 느끼게 하는...,10
107,"로봇아빠 이후 극장판은 거를 타선이 없었는데, 이건 역대 탑5에 충분히 들어 갈 만한 영화다! ",10
108,청춘의 여러 의미를 각각 캐릭터에 녹여 우리에게 청춘의 의미를 전달하였고 점점 고조되는 절정에 모든 것들을 쏟아내어 그 시절 우리의 청춘을 떠올리게 하였다. 서정적이며 부드럽고 따스한 햇살 같은 영상미로 전달하고 싶...,10
109,청춘은 미스터리 라는 말이 가슴에 박혔네요 ,10
110,AI 시대에 여전히 감성이 필요하다는 주제의식이 돋보인다. 아프고 성장하는 모든 청춘은 AI가 정의할 순 없다. 이제는 초등학교를 바라봐야 하는 철수의 고민은 꽤나 감동적이다. 단순한 스토리에 웃고 울컥하는 걸 보니...,10
111,정말 재미있게 봤습니다추억에 젖었어요 ,10
112,아이들이 미니언즈보다 재미있다고 하네요~ ,10
113,이게 진짜 엉덩이 탐정이지 ,8
114,"그저 희희낙락 하고 마는 것이 아닌, 확실히 어른과 아이 모두가 보고 즐기기 좋은 캐릭터 짱구 시리즈! ",8
115,"과거의 나에겐 위로를, 현재의 나에겐 여유를 준 영화 ",10
116,짱구 극장판중에서 역대급 뽑아냈다고 생각. 짱구 극장판다운 유머요소가 너무 재밌었음 ,10
117,철수 너란 녀석은 진짜 ,10
118,이번 극장판 너무 좋았다 11울컥하는 부분들도 많았고 짱구는 너무 사랑스러웠다. ,10
119,짱구를 극장에서 보는 건 처음이었는데 너무 재미있었어요짱구 나 죽을 때까지 안 끝났으면... ,10
120,어린시절 보았던 어른제국을 보면서 어른입장을 생각을 해보았지만 완전히 이해하지 못한 방면 나이가 들어 이번편을 보면서 슬프면서 웃었다 청춘이었다 ,10
121,"애들 성화에 보러갔는데, 엄마, 아빠가  재미있게 보면서 반성도하고 감동도 받고 나왔네요. 초등학생 키우는 가족영화로 추천합니다! ",10
122,"오랜만에 극장가서 본 짱구 극장판이었는데, 너무 재밌었습니다. ",9
123,"진짜 어른제국이랑 비교하면서 까는 사람들 있는데, 그 사람들 의견 하나도 안궁금함.나의 청춘을 되돌아볼 수있었고, 가슴이 뛰는데.. 울컥해서 후반에는 계속 눈물이 났음다 훌륭한 작품이고.. 그냥 또 보고싶다 ",10
124,ㅜㅜ 짱구귀여움 재밌다! ,10
125,역시 클리셰는 괜히 클리셰가 아니다 ,8
126,애들이랑 보여주려고 선택한 만화안데 스토리 너무 빈약하고 연결성도 없고 너무 재미가 없네요..평점 다 알바생인듯요 ,1
127,떡잎마을방범대 파이어였다 ,10
128,애들 철 들었어요 ,10
129,최근 몇년간의 짱구 극장판 중에서 제일 재밌었어요! ,10
130,진짜 진짜 진짜 진짜 정말 정말 정말 정말 재밌어요. 진짜 웃기고 감동적이고 극장판중에 역대급 재밌었음. ,10
131,좋았다 이번 거 ㅋㅋ 재밌었습니다 ,10
132,와 진짜 역대급 너무 재밌음 소름 진씸 레알 ,10
133,와...오랜만에 진짜 정말 재미있게 본거 같아요!!청춘이라는 주제로 감동과 공감을 주는 부분이 많았어요!!정말 짱구 극장판 좋아하시는 분들 진짜 강력추천!! ,10
134,짱구 극장판 중에서 영화관 가서 직접 본 건 이게 처음이에요ㅠ 정말 후회 안합니다 꼭 봐야 할 영화! ,10
135,짱구 극장판은 처음이었는데 재밌었어요 ,7
136,어른들은 몰라요. 아무것도 몰라요. ,7
137,짱구와 떡잎방범대의 우정을 좋아했다면 백퍼센트 만족할것이다! ,10
138,역대급 극장판의 탄생. ,10
139,맹구 넘 귀엽다 짱구 극장판은 앞으로 계속 챙겨볼듯 ,10
140,"청춘은 특별한게 청춘이 아니라, 모든 좋은 추억들이 청춘이라는것을.. 모든 고난까지도, 혼자 헤쳐가는 것은 아닐테니까 ",10
141,예전작품보다는 살짝 낮지만 볼만했어요~ ,8
142,짱구에서 추리물이 나오다니 재미있었어요. 떡잎방범대 친구들 귀여워요 ,10
143,짱구 귀여워요… ,10
144,내 인생 최고의 영화 마지막 엔딩곡  듣고 죽고싶었다 ,10
145,진짜 대박 말이 필요없음 매번 감동 ,10
146,"영화관에서 보았다는 것 자체가 영광인 수작! 너무너무 재미있고 감동적이며 내 마음의 짱구 극장판 존잼 리스트 1위를 단번에 달성했다. 캐릭터도 너무 잘 살리고 전하고자 하는 메시지도 재미있게 잘 담았다. 보다가 중,...",10
147,너무 재밌었고 다음에 또 보고싶은 영화ㅠㅠ짱구랑 철수 우정 이야기 넘 감동!! ,10
148,"짱철이 주인공인 극장판인데 당연히 재밌을 수밖에 없죠 ㅠㅠ 2n살이지만 짱구는 언제나 재밌어서 극장판은 매일 봐요 특히 이번 극장판은 재미, 웃음, 감동, 교훈 모두 다 잡아서 또 보고싶다는 생각이 드네요 ",10
149,"제가 봤던 짱구 극장판중에 단연 최고의 작품입체적인 캐릭터들이 만들어 나가는, 다양하지만 하나의 주제 '청춘'어른들에게 강추합니다 ",10
150,짱구는 못말려 >< ,10
151,진짜 짱구 철수 우정 ,10
152,짱구엄빠가 짱구 마라톤 뛸때 웃긴멘트와 너무 좋은 말씀해주셔서 너무 감동스러웠다 짱구아빠: “청춘은 지금 이 순간” 영화 끝은 좀 흐릿하면서 허무했다 ”너가 스파게티빵에 스파게티만 다 먹어버리면 어떻게!!“ 끄읏- ,8
153,프리미어로 먼저 보길 잘했네요 마지막 20분이 짱구 극장판 시리즈 중에서도 평생 기억에 남을 명장면의 향연이 펼쳐졌습니다 ,10
154,잘 웃고 재미있게 보다가 후반에 뜬금없이 눈물 날 뻔 했습니다. ,9
155,수능끝나고 주말에 보면서 계속 울었다우리에게 청춘은 무엇일까 ,10
156,재밌다는 평이 많아서 봤는데 재밌었다 짱구 극장판 본적없는데 만족 ,9
157,연출과 작화는 정말 좋았습니다만 엉덩이 어필이 상당히 심합니다. 번역하신 분이 꽤나 고생하셨을 만한 일본 드립들이 많이 있는 것 같습니다. 그리고 사실 청춘에 대한 개연성은 그닥... 청춘에 관한 언급이 처음부터 잔...,9
158,짱구 최근 극장판중 최고!! 너무너무 재미있게 관람했습니다. 액션가면과 부리부리마신의 비중이 조금 아쉬웠지만 새로운 짱구 극장판을 볼수 있어서 너무 좋았어요 ,10
159,"최근에 본 짱구 극장판 중에 가장 재밌게 봤음. 감동적이면서도 신선한 스토리.작년 짱구 극장판보면 핸더랜드나 어른제국의 역습같은 스토리는 나오기 힘들겠다고 생각했는데, 옛날 극장판 정도는 아니더라도 정말 괜찮게 뽑은...",10
160,재밌어요 후반부에 개인적으로는 엥? 싶은 결말이었는데 중간중간 너무 스릴 넘쳐요 ,9
161,괜찮긴 했는데 개인적으로는 낙서왕국이 더 좋아요....스토리 자체가 너무 엉덩이 엉덩이 이러니까 짱구니까 분명 당연한건데도 이상하게 중간에 보다가 갑자기 현타왔거든요..ㅋㅋㅋ 이러나 저러나 추리도 재밌게 하고 마지막...,9
162,역시 믿고보는 짱구 영상미가 너무 좋았어요 ,10
163,짱구를 보며 울컥하게 되는 나를 본다. ,8
164,배경을 초등부~고등부까지 모두 겸비된 사립합교로 옮기다보니 등장인물 소개에 정신이 없는 초반부.. 하지만 이 모든 캐릭터들이 떡잎마을 방범대와 얽히고 섥히면서 눈물없이 볼 수 없는 감동적인 클라이맥스를~~ 당신에게 ...,7
165,"청춘이란 무엇인가, 한 번쯤 무모한 그 무언가를 위해 기꺼이 땀 흘려 보는 것임을 느끼게 한 영화 ",10
166,매력적인이야기! 좋은소재! ,9
167,다 좋았습니다 아쉬운게 없었어요 ,10
168,어린 짱구들이 어른들에게 주는 감동. ,7
169,"끝나고 보니 눈물을 흘리고 있었지만 입은 웃고 있었다. 울고 있는데도, 눈물이 계속 흐르고 있었는데도, 나는 웃을수 있어서 다행이라고 생각했다. ",10
170,짱구를 큰 스크린으로 보는 즐거움 ,6
171,같이 본 아이들은 웃는데 어른인 나는 울게되는 영화. 마음의 준비도 못했는데 이렇게 울리지 마요 ,7
172,보기전엔 몰랐지..내가 짱구를 보면서 울줄은ㅠㅜㅠ 훈이 캐릭터를 잘 살려줘서 너무좋았어유 ,10
173,귀여워요 재미있게 보고 왔습니다! ,9
174,어릴때부터 봐왔던 짱구는 커가면서 느껴지는 부분이 많은 것 같다. ,9
175,짱구 극장판 진짜로 간만에 재밌게 보네요 ㅎㅎ철수 오늘 영화로 다시 봤습니다. ㅋ ,10
176,무한경쟁을 위트와 풍자로 꼬집었군요 ㅋ ,10
177,행복을 주는 짱구와 방범대 친구들 ,10
178,훈발놈 극혐 훈발놈 진짜 역겹다 ,10
179,짱구는 역시 정말 못말려~ ,9
180,다커버려서 잊어버렸던 의리와 청춘을 다시 상기시키게 되는 영화. 나는 짱구와 철수처럼 지지고 볶아도 싸우고 다시 화해하고 단단하게 옆에 있을 친구가 있나 하고 다시 생각하게 된다 ,10
181,스토리 기승전결도 탄탄하고 상당히 몰입감 있었다 중간중간에 어이없이 훅 치고 들어오는 대사들이 가슴을 찌르는 명대사들이 간혹 있었다. 연출도 좋고 결말도 훌륭하다. 범인은 사실 예상하지 못했다. 짱구극장판 시리즈중에...,10
182,"청춘이라는 주제를 고리타분하게 전달하지 않고 재미와 감동, 추리 등의 요소를 갖가지 섞어서 관객들에게 감동을 선사한 명작이고 개인적으로 어른제국의 역습이랑 거의 맞먹는다고 생각한다. ",10
183,초반부에 귀여워서 웃다가 후반부에 눈물 펑펑 나왔다 지나간 시간에 후회스러운 일들도 즐거운 일들도 모두 청춘이라며 따뜻하게 위로해주는 기분이었다. 짱구 최고! ,10
184,진짜 짱구 극장판은 말해뭐해…?? ,10
185,오랜만에 짱구영화 ㅋㅋ 귀여웠당 ,10
186,생각보다 재미있었어요 ,9
187,재밌게 봤어요 극장판중 가장 재밌어요 ,9
188,나도 모르게 집중해서 보게만드는 매력이 있었다 ,10
189,역시 떡잎마을방범대 얘기가 제일 감동적이다ㅠ ,10
190,개노잼인데 뭐지 돈아까웠음 ,4
191,철수 진짜 귀여움 ㅠㅠ... 애기들 우정에 내가 눈물 날 뻔 함... ㅠ... ,10
192,친구 울엇습니다. 솔직히 신혼여행 정말 별로 였는데 이건 진짜 와 ,10
193,짱구가 없어지면 너무 우울할것 같다 ,10
194,마지막에 철수랑 짱구 마라톤으로 경쟁 하면서 나누는 이야기 괜히 울컥하게 만든 영화.. 진짜 재밌었음 ,10
195,감동은ㅋㅋㅋ 그냥 개웃겨서 한참 웃다가롬 ,10
196,34살 아저씨입니다 이 영화 한편에 우리의 인생이 담겨져있네요.. 만화를 진짜 오랜만에 보는데 아 너무재미있었어요 보신분은 알겠지? 청춘!! ,10
197,어른이 더 재밌게보는 짱구 ,10
198,청춘이란!!! ,10
199,,7
200,청춘은 화이팅~~~! ,10
201,청춘은 화이팅~~~! ,10
202,최고입니다 꼭보세요 눈물좔좔 흘리게 됨 ,10
203,캐릭터가 모두 매력적이었어요 극장에서 꼭 보시길!! ,10
204,봤던 짱구중 가장 웃기고 가장 재밌었어요!! ,10
205,진짜 처음부터 마지막까지 웃긴 장면 수도없이 나왔지만 보면서 울 뻔했음.. 뭔가 되게 지금 학생들의 현실을 보여주는 영화였고 보면서 되게 철수가 밉기도 했지만 너무 안타깝고 불쌍했음 친구는 노잼이라지만 보면서 울 뻔...,10
206,중간에 살짝 루즈해지지만 그래도 참고 볼만해요 중간에 짱구가 마라톤 뛸때 신형만과 봉미선의 말이 감동적이였어요! 다시 볼 의향 있습니다 ,10
207,너무 감동적이예요 ,10
208,역시 짱구 극장판은 믿고봅니다 ,10
209,중반부까지는 그냥 별 생각없이 봤지만 마지막에 때려박는 감동을 주는 대사들 ,8
210,33 개잘생김 ㅋ 오진디 ,10
211,좋아하는 애랑 보러 갔는데 그애랑 보는 마지막 영화였네요… ,10
212,"이번편은 아이와 어른 모두가 재밌게 볼 수 있는 것 같네요. 아이들의 입장에선 재미를 느끼고, 어른들은 청춘에 대해 다시금 떠올리게만드는 것 같아 좋았습니다. 나이에 상관없이 좋은 영화인 것 같아요. 청바지~! ",10
213,청춘의 의미가 담긴 철학이 있는 영화!짱구 극장판은 실망시키지 않는다. ,10
214,짱구 극장판 시리즈의 화려한 부활 ,10
