,Review,Rank
695,가슴 몽골몽골해져요 재밌어요 ,10
696,난 재미잇엇는데 사실 얼굴 보는 맛으로 봣지만..여진구배우님... 연기 짱짱 ,10
697,한번쯤 볼만함 한번 더 보고싶기도 ,8
698,클래식한 느낌의 판타지 로맨스 드라마 재미있었습니다! ,10
699,재밌엉ㅅ요요용용요용용요용 ,10
700,배우님들 연기랑 ost가 너무 마음에 드네요~ ,10
701,한국 영화사의 오점.. ,1
702,여진구의 연기는 날로 늘어가네요~ 조이현 넘넘 이쁘고 귀엽고 연기도 좋고~90년대 음악이 영화와 조화를 이룬다~! ,10
703,저는 부모님과 함께 봤는데엄마가 엄청 좋아하시더라구요ㅠㅠ이거 뭔가 친구들보다는 가족과 함께 보는걸 추천드려요! ,10
704,배우들간의 합이 너무 좋고 속도감있게 흘러가 2시간이 지루하지 않았어요 ,10
705,동감 너무 추천합니다!! ,10
706,"올해 처음을 로맨스 영화 봤는데 즐겁게 관람했어요~특히, 99년도 장면의 경우 옛날 생각도 나고 뭔가 가슴이 뭉클한 기분?전반적으로 예상 가능한 시라니오였지만, 그럼에도 재밌었습니다~! ",10
707,원작에 비해 아쉽긴하지만 잘봤어요 ,10
708,,10
709,너무잘봤어요^^김혜윤 짱~~!! ,10
710,상당히 재밌게 봤는데 내용이 아쉬움 ,9
711,첫사랑이 생각나는 영화 ,10
712,10점짜리 영화는 아니었지만 오랫만에 힐링되는 느낌을 받았습니다.  영화를 보면서 정말 오랫만에 편안했습니다. 재미있게 잘 봤습니다. ,10
713,엄청 기대를 하고 봐서 그런지 더 재밌게 본거 같아요! 리메이크 된거라고 들었는데 원작이 어땠는지 모르겠지만 정말 재밌게 봤습니다! ,10
714,공감하면서 잘 봤습니다. ,10
715,결말이 좀 짠하긴 했지만... 마음이 몽글몽글해지는 좋은 영화입니다ㅠㅠ 결말 꼭 그랬어야만 했니...? 영화가 끝나니 용이와 귀여운 목만이가 생각나네요... 한번 더 보러갈 예정입니다!!! 그땐 더 더 집중해서 봐야...,10
716,그 시절을 느끼진 못했지만 그 시절의 풋풋한 사랑이야기를 담았고 마음이 몽글몽글해진다.하지만 영화를 다 보고 나면 영화 속 인물인 김용이 너무 안타까워 보여 마음이 좋진 않았던 영화...하지만 나중에 넷플릭스나 웨이...,10
717,예상을 했던 각본과는 조금 다른 느낌으로 흘러가서 재미있었고 단순하지만 생각 이상으로 재밌던 거 같아요 원작을 보지 않았고 현실 세계에서는 불가능한 일이지만 영화에 대해서 몰입도가 높았고 정말 재미있게 봤어요! 재밌...,10
718,전 원작 안보고 봤는데 재밌어요! ,10
719,원작을 보지 않았지만 첫사랑의 설레임과 이별  나름대로  애틋한 사랑이어서 가슴 찡 했지만 재미었다 누군가를 진심으로 사랑을 해본적 있는가 라는 것을 보여주는거 같아 좋았다 ,8
720,왜이게 평점이 낮은지 모르겠어요예상치못한 전개 은근 반전이있는 영화...웃음 포인트도 있고 다만 출연진들이 개인적으로 조금 아쉬운.. 오랜만에 멜로 영화보니 마음이 몽글몽글 해지네요... 마지막에 나오는 노래도 영화...,10
721,조이현 여진구 데리고 이렇게 만들기도 어려울 듯 ,1
722,나인우 배우가 대사 칠 때마다 넘 못해서 흐름 끊김… 영화는 그냥 기대 안 하고 보기 좋을 정도 ,6
723,스토리가 진짜 넘 좋아여!!! 진짜 감동해소 울었어요 ㅠㅠ 여진구 연기 짱 잘해요 ,10
724,재미있는 소재 감독 연출 너무 별로여진구보려고 왔다가... 진짜 여기까지가 끝인가보다 ,2
725,재미있게 잘 봤어요!! ㅎㅎ ,10
726,진짜 좋았는데 용이가 너무 불쌍하고 김무늬가 악연인 느낌…… 김혜윤 여진구 잘 어울리더라 드라마 하나 찍어 줬으면 좋겠다! ,10
727,스토리의 반전기대됩니다^^ ,10
728,,10
729,몽글몽글하다는 단어를 가장 잘 설명한 영화ㅠㅠ 풋풋하고 설레고 귀엽고 예쁘고 다함.. 반전에서 결말까지는 눈물닦아가면서 봤어요ㅠㅠ 강추강추 ,10
730,너무재미있었습니다 감사합니다! ,10
731,"원작도 봤는데, 너무 재미있었어요! ",10
732,캬  풋풋한 감성을 오랜만에 느낄수 있어 좋았습니나^^ ,10
733,40대에 오랜만에  느끼는  20대때  감성이였습니다.간질간질하고  입꼬리가  올라가네요  울  아들들이  그럴까  하고   감정이입이 되기도하구요 ,10
734,보길 잘했네요  마음이가는대로 라는 대사를 보고 저도 그렇게 하기로 했습니다 ,10
735,,10
736,원작을 안봐서인지 난 재밌게봄 ,8
737,아름답고 찬란하고 또 잔잔하지만서도 깊은 울림과 좋은 메세지를 던지는 영화. ,10
738,영화보는눈이 높으시다면 다소 유치하게 느껴지실수도있는데 저는 중간이후부터 집중하면서 되게 감명깊게 봤습니다....후반에는 눈물이 주륵주륵..영화관에서 보시기를 추천드려요 ,10
739,정말 재밌어요 추천!! ,10
740,재밌는데 평가가 왜그럼..? ,10
741,,10
742,"생각보다 별로였어요.오글거린다, 유치하다는 평이 있던데 그걸 넘어서 뭔가 어색한 느낌이랄까요..전 영화 끝나기 전에 노란 우산 가져다주는 장면이 제일 좋았네요 ",6
743,무난하게 보기 괜찮았어요. ,7
744,원작 안 봐서 재밌게 봤습니다 ,7
745,ost 선곡이 진짜 너무 좋아요. 거기에 어릴 때 보던 익숙한 풍경들도 많이 보여서 생각보다 더 재밌기도 했고 여진구 진짜 잘생겼다 ,10
746,OST가 잔잔하니 넘 좋아요 나중에 또 찾아서 듣고싶음! 여진구도 아주 잘생김 :D ,10
747,10대 여성이 연기가 뛰어난 영화라고 하면 보통 배우 팬들만 고평가한거임 ,2
748,힘든 시대에 2000년의 원작 동감에 대한 향수를 불러 일으킨다. 설정이 매끄럽지 못한 부분이 있지만 향수 하나로 충분한 작품이다.★ 김혜윤 발견! ,8
749,처음엔 오글거려서 별로였고 중간부턴 흥미진진하고 재밌게 봤어요! ,7
750,좀 오글거리는 대사들이 있긴한데 걍 볼만은 함 ,7
751,무난하게 좋은 영화인듯 ,7
752,99에서 21년 사이에 일어나는 일이라서 너무 좋네요. 그리고 아침 9시에 봤는데 인기가 없나 재미가 없나 혼자 봤지만 vip되는 기분이 났어요. 혼자 막 떠들고 꽁녕꽁냥해서 너무너무 좋아요. 전 너무 공감이 되서 ...,10
753,스토리가 좀 아쉬워요 ,7
754,옛날 영화를 우려 먹으려면 잘 우려야 하는 것이다. ,5
755,원작 좋다고 생각한 적 없었는데 왜 좋았는지 알게 됨 ,5
756,"살면서 본 영화 중 가장 별로인 영화. 연출, 스토리 너무 작위적이고 너무 신파가 심함. 헛웃음이 나올정도. 여기까지가~ 음악 나오는데 개그물인가 싶었음. 돈, 시간 아깝다(1점도 아까움) ",1
757,그 마지막 부분 부금이랑 잘 안맞아여 오히려 웃겼어요 ,1
758,상영 한지 30분만에  뛰쳐나왔어요^^ 도저히 못 견디겠더라고요;; 무지개 반사 찌찌뽕 하이루 방가방가 유치하구 우습죠? 저것들 실제 배우들 대사임 ,1
759,재밌게 봤습니다 또 보고싶네요 ,10
760,몽글몽글한 로맨스영화 너무 오랜만ㅠㅠ빠르게 흘러가는 요즘시대에 낭만 찾아러 간느낌 ,10
761,요즘 대세배우들이 뭉쳤다기에 꼭 봐야겠다 생각했어요 웃다 울다 감동받았어요 로맨스영화 좋아하지만 또 보고 싶은 건 처음이에요 혼자 보는 것보다 친구나 연인과 함께 보면 좋을 것 같아요 ,10
762,"헐,, 생각보다 평점이 낮은데 제가 원작을 안봐서 그런건지 전혀 아쉽지는 않았고 친구들 8명이랑 다 같이 봤는데 진짜 8명 다 울었던..ㅋㅋ저는 그중에서도 진짜 오열했던..ㅋㅋㅋㅋ완전 공감되는 첫사랑 이야기 였습니다...",10
763,보다가 저는 자고 일행은 나갔어요;; ,1
764,완전 쩔어 쩔어 쩔어요!! ,2
765,,7
766,여진구 진짜 미쳤다 목소리 톤이 사람 제일 미치게 하는듯 동감 너무 잘봤습니다 여진구 화이팅 앞으로도 응원할게요 ,10
767,재밌어요그리고 여진구 배우님도 너무 잘생겼어요 ,7
768,풋풋하고 귀여웠어용 꿀잼 ,10
769,후유증이 남는 영화너무 재밌었어요! ,10
770,처음엔 김용이  너무 웃겨서 좋았고 조이현은 너무 예쁘고  그래서 한번더 볼 예정입니다 ,10
771,원작의 열혈팬이다. 그래서 기대를 많이 내려놓고 보러 갔는데^^ 그에 비해서는 선방한 리메이크작 이었다. 앞으로 한국 로맨스 영화가 부흥하기를 바라게 된다. 여진구 조이현의 순수한 연기란. ,9
772,"무난했음, 1점짜리 영화까지는 아님 ",8
773,감동적인 부분이 많아서 울면서 봤어요 ,10
774,믿고 보는 여진구 믿고 보는 여진구 ,10
775,영화 제목: 첫사랑이 거북이만 두고 사라져버렸다 ,6
776,로맨스 장르를 비선호 하는 입장으로써 기대 안하고 봤는데 의외로 재밌게 본 영화 ,10
777,너무어무 재밌었어요 약간의 오글거림이 있었지만 결말도 괜찮은 결말인 것 같아요 ,10
778,"옛날에 살진 않았지만 이 영화로 옛날 향수를 느끼는 신비한 경험을 하였고,영화를 다본 후에 여운이 엄청남아 감동스러웠던 영화였다 ",10
779,김광진의 편지가 깔릴 때는 헛웃음만 ,5
780,싱그러운 연기가 아니라 징그러움. ,2
781,엥 전개가 진짜 이상함 코미디영환줄 ,2
782,진짜 오랜만에 보러간 영화였는데 너무너무 재밌게 잘 봤고 스토리 구성이 진짜 재밌었어용! ,10
783,사람 기분좋아지게 하는 영화 ,10
784,가볍게 보기 너무 좋고 연기를 진짜 잘하네요.. ,10
785,원작을 전날에 보고 이걸 봤는데... 원작이 훨씬 나음 원작에서 두 시간대의 차이를 표현하는 방법은 당시의 정치적 사건들이었지만 리메이크작에서는 그저 유치한 유행어의 남발 뿐..리메이크의 이유가 궁금해진다.. ,3
786,"가을, 겨울 쌀쌀한 날씨에 따듯하게 보기 좋은 영화같아요:) 영상미도 좋고 몽골몽골해지는 영화입니다! 구멍 없는 배우님들의 연기 덕분에 영화를 집중하는데 몰입감이 더 좋았던것같아요! 여진구 화이팅 ",10
787,하이루 방가방가와 오글거림의 대폭발 ,5
788,재밌는 영화 잘 봤습니다 ,6
789,"내 옆에 너는 없지만, 내 마음속엔 네가 항상 있지. ",8
790,그럭저럭 재밋게 봤어요 ,6
791,잘 보고 갑니다감사합니다 ,5
792,진구선배 잘 자라주었구나..! 믿고 있었다구..! ,6
793,중간중간에 지루해서 졸았어요기대를 너무 많이 했나.. 난 잘 모르겠음 ,4
794,조이현배우 연기가 좋았다 ,10
795,,1
796,21세기 최악의 영화 탑3 ,1
797,진짜 인생 영화를 찾은거 같아요.정말 꼭 한 번은 보세요 ,10
798,연출이 정말 최고였어요!!! ,10
799,또 보고싶고 너무 재밌음 ,10
800,그저 이런 대본을 연기하신 배우분들께 박수를.. ,3
801,스토리는 좋은데 초반에 엄청 재미없어서 잘뻔했고 결말이 넘 찝찝함 예고편 보고 여진구랑 조이현의 로맨스 기대했는데 생각한거랑 너무 다르니까 허무하고 현타 옴... ,5
802,"원작을 본적은 없지만 간만에 깊은 여운이 남았던 영화였습니다. 일단 배우들 비주얼도 탑급이었고, 스토리가 특히 진짜.. 그 관계성 맛집이라고 해야될까요? 좀 소름..ㄷㄷ진짜 막판에 눈물 고일정도였어요..아 근데 다만...",9
803,하 진짜 돌겠다...거북이 귀엽다말고는 없다 ,4
804,?????????????????? ,10
805,딱 지금 시즌에 보기 좋은 영화인 것 같습니당 ,10
806,방금 보고 왔는데 잼있네요. 99~2000시대를 기억하시는 분들이라면 더욱 잼있게 보실거라 예상해 봅니다. 젊은 배우분들이 다들 연기를 찰떡처럼해서 더 몰입되고 보는 맛이 있었네요. 넷플릭스 같은 쨍한 화질이었으면 ...,10
807,여자친구있는 나는 정말 재미있었당 ㅎㅎ ,10
808,,10
809,몽글몽글로 시작해서 뭉게구름으로 ,7
810,감동적인영화동감 ,9
811,극장에서 잘뻔한건 처음.. ,1
812,너무너무너무 달달하니 좋네요 ㅎㅎ ,10
813,같지만 다른영화로 보이기 위한모든 선택들이 안타까웠다 ,10
814,청춘 로맨스로 킬링타임 영화 ,6
815,오랜만에 두근두근 설렘을 느꼈던 영화 ,10
816,유치한 게 레트로인 줄 착각한 결과 ,2
817,조금 유치한 부분은 있으나 재밌어요!원작을 안 봐서 그런지 기대 이상으로 재밌게 봤습니다 ,10
818,몽글몽글 청춘 영화 오랜만에 느껴서 기분이 좋습니다 :) ,10
819,"생각보다 지루했습니다,,, ",4
820,2022 .11.16 개봉 ,4
821,약간 후반부에서 여진구가 연애혁명 공주영처럼 되어가는 것을 볼 수 있음 생각과는 다르게 스토리가 흘러갔지만 보다보면 예측 가능했음 ,10
822,원래 여자친구가 로맨스를 좋아하고 저는 액션을 좋아하는데 같이 가서 봤는데도 재밌게 봤습니다 ㅎㅎ ,10
823,배우들이 연기를 너무 잘해서 시간 가는줄 모르고 재밌게 봤네요! 영화 후반으로 가면 갈수록 몰입도가 더욱 높아져서 지루하지 않게 잘 봤습니다! ,10
824,좀 오글거리지만 볼만했어요 ,8
825,풋풋한 청춘의 감정을 느낄수 있어서 좋았다 ,10
826,"원작 영화를 보지는 않았지만, 그냥저냥 볼만했던 것 같습니다. 가볍게 볼 수 있는 영화~ㅎㅎ ",6
827,배우들은 잘한거같지만 역시 원작이 나음 ,6
828,간만에.. 쳐 울었네..ㅜㅜ ,10
829,오랜만에 기분 좋게 영화관 데이트했네요 영화는 그냥 무난하고 귀여운 청춘물이고 원작이 어떤진 모르겠지만 엄청 막 와 대박 이런건 아닌데 1점 줄 정도는 확실히 아님 OST 츄 고백 집 가는길에 계속 듣는중 ㅋㅋ ,10
830,여진구 진짜 잘 생겼다!! ,10
831,용만이가 주인 찾아가는 진돗개냐? ,4
832,그냥 저냥 그냥 저냥 그냥 저냥 ,7
833,,10
834,개꿀잼 2022년 최고의 영화. 아니? 21세기 최고영화 ,10
835,리메이크 영화지만 색다른 감동과 영상미가 돋보여서 너무 좋았습니다..가족이나 연인..친구 누구와 보아도 좋은 영화입니다. ,10
836,마음이 뜨거워지는 영화네요. 중간이후부터 마음을 부여잡고 관람하였습니다. 원작도 좋았지만 리메이크도 좋네요. 여진구!! 널 그냥 내가 가지면 안될까?? 내게로 와~^^ 아 그리고 OST도 넘 좋아요. ,10
837,나의 기억 속 청춘이란? 김 용.너를 사랑한 순간을 잊을 수 없고 다시 돌아간다 해도 너를 사랑할꺼야. ,10
838,마음 안이 몽글몽글… 또 다른 영화 ‘동감’이 찬생했네요. ,10
839,스토리가 전혀 이해되지 않고 여진구 배우의 열연과 착잡함만이 기억에 남을듯함 ,3
840,웹드라마 같음 연기를잘해도 안되는작품이있다 ,1
841,X세대가 MZ세대에게 보내는 선물 같은 영화 ,10
842,재미있게 봤어요 간단하게 보기 좋네요. ,10
843,ost 도 너무 좋았고 여진구님 연기력이 너무 좋아서 시간가는줄 모르고 봤습니다!영상미도 좋고 올해 본 영화중 최고였습니다! ,10
844,영화가 시작되면 몰입도 최고 중간중간 울컥하면서 교훈과 더불어 영화 추천입니다~~ ,10
845,재미있게 봤습니다!! ,8
846,조금 지루한데.. 김하늘 유지태의 원작을 보고 싶다는 생각이 드네요! ,5
847,그냥 뭐하나 정리된게 없음 그냥 난국임 ,2
848,오글 거려서 못보겠어요 ,2
849,조이현 좋아해서 봤는데 와 진짜 재미없다… 이렇게 재미없는 영화는 또 오랜만이네. ,2
850,00학번입니다 정말 재미없네요 ,1
851,안하느니만 못한 리메이크는 낭비다 ,4
852,목만이 너무 팬이에요 목만이 짱 ,7
853,핵노잼 보지마요ㅜ ㅜ .... ,1
854,진짜 재밌네요 제발 보세요 제발요 그냥 제발 봐주세요 제발(나만 당할 순 없지 후후훗) ,2
855,안타깝지만 어색하고 연기를 잘 못하는 배우들이 있어 공감이 잘 안됐어요 ,4
856,원작을 말아먹었네요... 시간 낭비.... 원작을 애정하는 입장에서 분노가 치미네요. ,1
857,김혜윤 연기 좋더라 99년도 느낌 물씬 ,8
858,,10
859,"잔잔하지만 아름다운 영화,  정말 좋으네요. 힐링됩니다. ",10
860,원작까지 보고 싶어지는 마음 따듯한 영화. ,10
861,"평점이 왜 안좋은지는 모르겠지만, 원작을 안 본 입장에서 되게 재밌게 잘 봤어요. 괜히 대학교 때 여자친구가 떠오르네요ㅠ ",9
862,"삶이 무기력해지게 항상 반복되는 삶의 연속으로 지쳐있을때 마치 내가 나의 일생이 이야기가 지나가는 행인1 이라는 역할의 연속된 삶에서 한번쯤은 그 역할이 내가 착각했을지도모른다는 생각을 일깨우고 가르쳐주는 영화, 내...",8
863,"이십대를 돌아 본 영화 였고, 많이 사랑했던 사람을 떠올리는 그런 영화였다. 좋았다! ",9
864,"그당시 영화를 봤던사람에겐 충분한 선물같은 영화구성,결말을 떠나서 그때로의 시간 여행을 할수 있었던걸로 충분한 영화 ",10
865,둘이 사랑하는거 같지도 않았고 뭐이리 전개가 빠르냐 ㅋㅋ 여자애는 왜이리 그 남자랑 붙어있는거야 ㅋㅋㅋ 영화가 뜬구름만 계속 잡는거 같고.. 조이현은 하는게 없어보이고 ..  여진구도 이제 이런 역할 안해야 하지 않...,1
866,뭔 내용이여.. 시공간을 뛰어넘는 질투 ,2
867,감성적인 멜로드라마 영화인데 어떠한 감흥도 감동도 없는 영화?연기한다기보다는 대본읽는 느낌 ,6
868,2000년도 00학번으로서  응팔보다도 그 시대 재연이 엉망인 영화 너무 아쉽다 이 좋은 영화를 이리 ㅠ ,3
869,걍 다 모르겠고 남주 인사할때 유행어 일부로 쓰는거 거슬리고 남주가  ㅈㄴ 불쌍하기만 함.. 조이현팬이라 봤는데 .. 걍 모든 면이 아쉬울뿐.. ,2
870,"영화, 그게 돈이 됩니까?이래 만들면 관람객에게 도움이 됩니까? ",5
871,세상에...이게 무슨 전개죠...개연성도 감동도 아무것도 없네요... ,1
872,전개가 말이안되는와중에 급해서 몰입이 안되네요 아쉽습니다 ,2
873,이기이기 퀄리티가 오지게 떨어지노. 왜 갑자기 헤어지는거야? 의처증 때문에??진짜 쒯덜....0점은 안돼서 1점도 아깝다. ,1
874,결말이 최악이네요뭘 말하려는건지 알수가없음 ㅋㅋㅋㅋ ,2
875,"은영아, 이게 뭐하자는 플레이냐? 요즘 대학생이 너무 20년 전 컨셉 아니냐?방가방가는 인터넷 용어잖니, 그걸 누가 현실에서 썼더냐. ",5
876,굳이 뭐하러 이걸 리메이크 한거지?? ,4
877,만드셔서 수고많았습니다.. 여배우들 라인업 약하네요..그리고 원작이 너무 수준높아서 시도는 좋았지만진짜 집중하기 힘들었습니다 억지로 보았습니다ㅜ ,2
878,하..ㅠㅠ 진짜루이건아니잖아요 ,1
879,뭐지? 원작을 다시 봐야겠구나 ,2
880,그냥 김용(여진구)만 불쌍한 영화 용이랑 사귀는거 알면서 은성이 굳이 옆에 가서 앉고 굳이 머리에 뭐가 묻었던지 아니던지 만지고 또 거북이 찾았을때도 왜 우산 같이씀? 2개로 따로 쓰면 되는데 그리고 무늬때매 떠난거...,4
881,진짜 진구야 너 혼자 애썼다! 99학번 꿈많은 여자애가 21년에 21살 애가 있다는 설정이라니.. 너무 한거 아니냐 ,1
882,아니 원작 반의 반도 못 따라오는 연출 뭐냐 ,4
883,이게 모냐????  3배속 빠르기로 봐도 이해되는 영화 ,1
884,와 원작 모르면 재미있게 볼수있을듯 눈물나올뻔했습니다 개인적으로 오늘밤 세계에서 이 사랑이 사라진다해도 보다 감동적이었어요 ,10
885,첨엔 기대했는데 너무너무지겨워서 끝엔 딴짓하며 보는둥 마는둥...진짜실망이에요ㅠ그리고 캐스팅도 여진구님빼고 별로여서 집중이 안되었어...하 ,4
886,… 로맨스 영화 정말 좋아하는데 정말 별로인 거 같아요..!!! ,1
887,처음 풋풋한 느낌이 좋았는데 사랑이 막 시작하려다 억지설정으로 끝나버렸다 무슨 이런 세밀하지 않은 감정묘사가 있는지.... 중요한 무언가를 모두 편집하고 만든 느낌 ,4
888,배경이99년인데 복장은 80년대네요쓰는용어도 ㅡㅡ 98학년도 헐은씁니다 여자머리는 달려라 하니인가요?ㅡㅡ초딩…캔모아라니…ㅡㅡ ,2
889,진짜 감정없이봄 재미없고 유치함 ,1
890,여진구 잘생겼다.여진구 연기 잘한다.끝 ,2
891,시나리오 누가 썼는지..참.. 시대를 역행하네.. 동감 원작에 누를 끼치는구나.. 시간이 아까운 영화..  개연성은 개나줘 ,4
892,내 인생 최악의 영화 만들다 만 거 같은 느낌 ,1
893,정말 어이없는 스토리남의 사랑 다 망쳐서 인생 망쳐놓고저 결말에 웃는 모습 뭐지? ,2
894,연출 사망. 출연배우 커리어 망치려고 제작한 듯. 오글거려서 눈이 없어져버렸어요! ,2
895,원작의 순수함을 완전 망쳐놓은 찌질한 영화였다.꼭 남주를 그렇게 찌질하게 만들어야만 했나? ,4
896,유지태와 김하늘의 그 섬세한 느낌이 잘 안드러나넹 아쉽다. ,6
897,알맹이 쏙 뺀 바바나 껍질을 들고 있는...이걸 계속 들고 있어야 하나?혹시 조금이라도 알맹이가 있진 않을까?없다 ,2
898,김용은 이용당했다.ㅤ ,2
899,좋은 작품을 이렇게 망쳐놓기도 쉽지 않은데.. ,2
900,영화 다 잘 보는데 이번엔 돈이 아까웠어요… ,3
901,좋은 배우로 이런 연출을 하다니 어이기 없네 ,1
902,노래는 좋더라구요. ,9
903,혜윤이 때메 봤습니다만... 이건 원작을 안봐도 이렇게 만들면 안되지 라는 댓글에 백퍼 공감하고 갑니다 진짜 유지태씨하고 김하늘씨가 울겠네 ,2
904,최고입니다~ 완죤 감동 ,10
905,연출이 많이 아쉬웠지만 배우들의 연기에는 아쉬움이 없다. ,8
906,원작파괴. 억지 신파. 기괴한 대사. 뻔한 연출. ,4
907,"원작 완전 훼손 .,건들지말지 ",1
908,하...원작을 망쳐놨어ㅡㅡ ,1
909,없는 것 : 재미 감동 연기력 연출있는 것 : 유치 실망감 ,2
910,정말 너무하네. 원작을 떠나서 너무 개연성이 없네. 2022년에 HAM으로 99년 사람이랑 통신을 하는데 그냥 무덤덤하질 않나. 배우들 연기력이 아니라 그냥 대본 자체가 어이가 없음. 진짜 좋아하는 배우들인데 너무 ...,1
911,시간여행? 죽이고싶다 ,1
912,원작 동감과 건축학 개론 사이에서 길을 잃고 흐지부지 끝나는 영화 ,1
913,충분히 옛날 감성을 느낄수 있는... ,10
914,연기자의 연기는 풋풋하고 좋으나 도무지 스토리 흐름이 공감되기 어렵고 원작의 감동포인트를 잘 살리지 못함 ,4
915,원작의 낭만과 분위기는 없지만 믿고 보는 배우 여진구가 연기를 잘 해서 볼만했음. ,8
916,대학시절 생각나게  하는  영화..인생에서  제일  행복했던 시절이  대학교 였네요. ,9
917,,10
918,2000년 동감을 추억함.진구 연기 좋음 ,8
919,대학 다닐때를 돌아볼 수 있어 좋아요. ,10
920,거북이 잃어버린 뒤 찾았을 때 울컥 ,10
921,근래본 영화중 최고입니다 감동적이고 풋풋한 영화입니다 ,10
922,재밌어요.그때에 동감이랑 지금은 당연히 틀리겠죠. ,10
923,여진구 연기에 눈물이 왈칵했네요원작이 있는지 몰랐던 저로서는재밌게 봤기도했지만여진구라는 배우를 다시 보는계기가 됬네요 평점이   이정도로 낮은게 이해가되지않네요 ,10
924,98학번인 제게는 아련한 추억이 생각나 좋았습니다. 낭만이 있던 그때 ,8
925,배우분들도 연기를 너무 잘해서 몰입 잘 되고 전개가 신선해서 재밌네요 ,10
926,리메이크니깐 관계 설정을 다르게 맺었으면 어땠을까.미래와 과거지만 김용과 무늬 사이에서는 충분히 애틋한 감정선이 생길 수 있는 여지가 있음.심지어 시간이 흐른 미래에는 만날 수도 있음.은성한솔의 딸이 아닌 아예 다른...,1
927,재밌었다! 평점이 좀 낮길래 기대안했는데 괜찮았다~~ 여진구가 멱살잡고 끌고간건 인정 ㅋㅋ 남주가 넘 잘생겨서 여주 미모가 밀렸다.ㅋ ,10
928,감성만 가져오길 바랬으나.... ,4
929,영화참 여운도 안남고 연출력도 떨어지고 너의결혼식도 그렇고 손예진 클래식에 한참 못미치네. 여운이란게 하나도 안남냐. 뭔가 반전이라는거도 하나도 없고 생뚱맞은 전개에 스토리도 너무 부실하고.스토리를 만들어 낼게 그리...,1
930,"아.... 정말, OO.... 성의가 없어, 성의가!!!! ",1
931,원작 안봤는데도 실망 그잡채.. ,2
