,Review,Rank
650,"남자친구 생일 기념으로 예매해서 봤는데요,,, 진짜 남자친구한테 미안할 정도의 스토립니다.. 댓글 알바에 속지 마세요 잔인을 떠나서 개연성도 없고 알고 있던 내용이 아니에요 이런 장르의 영화는 진짜 마녀에서 그쳤어야...",1
651,"영화를 보면서 실소를 금할 수 없었음. 영화감독의 연출력이 너무 부족함 총알 다 떨어질때까지 허공에 총질해대는거 하며, 동료들 죽어나가는거 옆에 서서 팝콘먹으면서 죽을차례 기다리는 형사, 범죄자들이 정말 너무 웃겼음...",4
652,"진짜 이런 영화 왜 만들어요,??ㅠㅠ ",1
653,내용도 별로 없고 처음부터 끝까지 사람 죽이는 장면만 나옴. ,1
654,잔인한거 싫어요 만들지 말아주세요 요즘 한국 영화 드라마 왜 점점 기분 나쁘고 자극적인거만 많아져요? 유쾌한 영화를 많이 만들어주세요 ,1
655,레알 재미없음스토리 없음연기력 초반만 있다가 과해짐옛날 파워레인저 보는 느낌 ,2
656,"1. 초반과 후반 영화는 완전히 다른 영화임     2. 주연이 누구인지, 스토리가 무엇인지 마지막에 알 수 있음     3. 오로지 자극을 위한 영화, 탄탄한 스토리 없이 자극적인 내용만 집어 넣음 (심약주의)  ...",1
657,"황당무계한 스토리, 긴장감 없는 연출, 그리고 연기 잘한다는 댓글이 있는데 진심 이게 연기 잘하는 건가?서인국 새롭긴 했지만 나 쏀케야!! 너무 의식하는 거 같아 오글거리고여주랑 남주는 어떤 상황에서도 표정이 변화가...",2
658,영화 예고편에 속았다. 돈 아까움 ㅡㅡ ,1
659,나만당할수없지 ㅠㅠ 이감독 존경했는데 실망이네 마녀 남자버전이네 다음 다음까지만들려고???이영화보려고 졸라 기다린 내 자신이 밉다 ,1
660,진심으로 초반 30분은 정말 너무 재미있고 흥미진진하고 잔인하다가 그 후부터 이게뭐지 스토리 전개 연결도 안되고 유치한게 나머지 시간동안 연결됩니다. 30분을 위해서 90분들 버리실거면 보셔도 무관... 돈이 아깝단...,1
661,영화 보는 매 순간마다 너무 당황스럽고 중간 쯤부터는 짜증이 나더입니다.. ,1
662,한줄 요약.성동일 영화 내 대사[늑대사냥 유치하기는..] ,2
663,잘만든 영화를 알아서 망쳐버리는 영화영화의 여러 범죄자가 나오는데 그중에서 최고는 김홍선이다 ,1
664,2022년 최악의 영화 늑대사냥 ,2
665,검증된 주연급 조연급 배우들요즘뜨는 신예 유망주 대거 캐스팅제2의 마녀  만들고 싶었던거 같은데ㅋㅋㅋ캐스팅 만큼은 올스타그러나 22년판 7광구급 쓰레기영화절대 돈 주고 보지말고곧 티비로 뜰꺼같으니 불법 경로로 공짜로...,1
666,서인국이 주인공인줄 알고 봤는데 아님..30분 지나서 갑자기 스토리가 산으로감.. 지하에 눈없는놈 나타나기 전까지는 볼만함. 그놈이 나오고 부터 극장을 나오고 싶어짐.. 햐.. 아까운 내돈... ,2
667,재밌게 보는 분들도 있지만대부분의 사람들이 싫어할듯.. ,2
668,진짜 잔인하긴 함.. 말 그대로 피 터지는 영화..중간부터 반전 나오면서 장르가 바껴서 지루하지 않음 프리퀄 시퀄까지 잘 만들면 나름 괜찮은 시리즈물로 남을 수 있을 듯 배우들 연기는 진짜 장난 아님.. 서인국 눈빛...,10
669,진짜 당황스러운 영화.. 내 시간.... ,1
670,별루에요 피만 튀겨요 ,1
671,"진짜로 보실 분들은 대략 스포확인하고 가도 되실 듯..  딴 영화보려고 갔다가 포스터에 끌려 바꿔봤는데 밥맛 뚝 떨어진것은 물론 기분 정말 뭐 돼서 그냥 집으로 옴(잔혹함이 마녀1,2랑 악마를 보았다 등과는 비교도 ...",2
672,너무 잔인해요ㅠ.  보지마셈 ,1
673,이게뭐노...라는 생각만 계속 들게해주는 영화 ,4
674,...돈이 많고 시간도 많아서 헛되이 써보고 싶다하면 추천합니다... 사람만 터지나요 내 돈도 속도 터집니다... ,1
675,결론부터 말하자면 안보는거 추천; 영화 끝나자마자 할말을 잃음 이유는 너무 어이가 없어서; 배우들이 너무 아깝고 2탄을 이어가기 위해서 이렇게 끝냈나 최대한 긍정적이게 생각해보려고 해도 이해가 안되는 영화; 배우들이...,1
676,서인국이 아깝다…요리로 따지자면 좋은 재료를 줘도 쓰레기로 만드는 쉐프 같은 느낌 ,1
677,이거 10점 주는새끼들은 정신 나갔냐? ,1
678,낚임... 느와르 기대하지마세요 ,1
679,서인국씨는 그저 이레즈미에 섹시함을 더해서 그저 마케팅 홍보수단이였고 갈수록난해해지는 스토리라인에 뜬금없는 SF호러로 장르전환… 집중해서 보기 힘들고 누가 주연인지 조연인지 모르겠는 역할배정… 그저 자극만을 위해 만...,1
680,"뇌빼고 보는 영화입니다...  연출 스토리전개는 아쉽고 배우들 연기는 볼만했네요 특히 서인국이 연기는 맛깔나게 하네요!딱 비상선언 느낌이라해야하나? 스토리 연출 다 별로인건 같은데, 장르특성상 하루종일 싸우고 피튀는...",2
681,"차라리 범죄 스릴러였으면 재밌게라도 봤을텐데, 갑자기 슈퍼맨 나와서 잔인하게 죽이는게 전부인 영화.. 개연성이고 전개고 연출이고 다 망했다 봅니다. ",1
682,1점도주기 아까운영화 ,1
683,"꽁짜표라 돈은 안 아까운데, 시간이 너무 아까움. 영화보면서 짜증나가기 쉽지 않은데,,, ",1
684,서인국 연기 미쳤음  잔인하지만  시간순삭 ,10
685,서인국 때매 0점 주려다가 2점 줌.. ,2
686,서인국으로 충분했을듯 ,3
687,그냥 개연성 1도없는 노잼영화임 프랑켄이 사람 온도보고 파악한다고 했는데 냉동실에서 여자 얼굴에 손까지 대보고 그냥 간다? ㅋㅋㅋㅋ 재밌네요 참 ,1
688,범죄자를 인도한다더니 갑자기 로보캅나와서 다죽임 ,1
689,그냥 범죄물로 쭉 가지 중간부터 마녀1 따라가네 ,1
690,최애 서인국님.. 하아.. 긴말하지 않을게요.. 너무 했어요.. 좋은 배우분들을 가지고.. 왜 피만 튀어요.. ,4
691,우리영화 잔인하다고 자랑만하는 느낌내용도 전개도 전혀없음 너무실망적 ,2
692,서인국 연기 변신에 놀랐어요. 영화도 짜임새 있게 만들어졌고 다들 연기력도 출중하고 너무 재미있게 보고 왔어요. 안 보신 분들 꼭 보세요!! ,10
693,예고편이 전부가 아닙니다 처음 보는 전개 방식으로 끝까지 몰입도 넘치게 이끌어가네요. 잔인한건 기억도 안 나요 ,10
694,진짜 미친것같아 감독이 역대급 잔인함 인정... ,10
695,한국영화의 발전 놀라움 스토리도 좋고 세계관 확장도 기대됨 특히 서인국 연기 무엇 연기 잘하는 것 알고 있었지만 이런역할까지 잘해 ㅎㄷㄷ ,10
696,홍보영상들에 낚여서 돈 주고 본 내 잘못 ,1
697,사냥당한건 바로 우리의 시간! ,4
698,진짜 드릅게 재미없다 고어함만 한가득 담은 영화 예고편 보고 재밌겠다~한사람들 극장가서 무슨표정 지었을지는 뻔히 보인다 . ,1
699,소리는 너무 날카롭게 시끄럽고 뭐 손만 닿으면 눈코입에서 피가 다 튀어나옴 개연성도 없고 그냥 사람 신경 날카롭게 만드는 방법만 연구해서 만들어 놓은 것 같음 영화 다 끝나고 나와서 구역질나오고 신경 예민해서져서 사...,1
700,무슨 생각으로 만든건지 모르겠지만 구라가 아니고 용가리가 더 재밌음 ,1
701,김홍선 감독. 영화 '변신' 보고 꼭 기억해야 겠다고 다짐 했었지. 걸러야지... ,2
702,두시간동안 영화관 앉아서 고문당함.. 이정도면 감독도 출연한 배우들도 정상으로 안보임…. 무슨 피로 분수쇼를 하고 누가 주인공인지도 모르겠고 다음부턴 여기 나온 배우들 주연으로 나온 작품들은 믿고 거릅니다. 이거 보...,1
703,"이럴 거면 서인국으로 왜 홍보하는 거임,,,서인국 보려고 갔는데 정신만 피폐해짐 ",1
704,최악인데?고어?sf?액션?스토리?뭐 하나 제대로 된게 없어그냥 쑤시고 터트리고 쏘고끝최고의 낚시제대로 낚인 나아 돈 아까워(감상포인트 추천해달라는데추천할게 없는데 꼭 눌러야 하나뭐 눌러야 하나) ,1
705,열받아서 술먹구 있습니다.ㅜㅜ ,1
706,저기 진짜 이영화 재밌다고 한사람이 누군가요..? 내용도 없고 2시간 중 스토리는 10분정도 밖에 안되고 그리고 저 배우들 데려다가 다 죽일거면 서인국인 왜 앞에다가 세워놓고 주인공인척 광고 때린지도.... 서인국 ...,1
707,"배경이 참신해서 조조 영화로 봤는데, 초반만 재미있지 배우들의 연기와 스토리가 너무 재미없고 잔인한 부분만 너무 강조하네요 ",1
708,뭐하는짓이냐 이분들 데릭?ㄷ ,1
709,저는 진짜 볼만 했습니다 예고편이 전부가 아닙니다 큰 반전을 숨기고 장착 해놓고 중후반에 제대로 터짐 제목 그대로니까 보실때 참고 하세요 이 영화는 완성도가 높으니까 강력 추천 합니다!  개인적으로 마녀랑 비슷하지만...,8
710,졸릴 틈이 없다 잔인하기로 최고 ,10
711,꼭보세요 두번 보세요 전율이 흐릅니다. ,10
712,꼭꼭 보세요!!  극장가서 보세요!! ,10
713,마녀 번외 영화인거같음.. 스토리짜임새는 상당히아쉽고 서인국 연기빼면 기억남는게 크게없습니다ㅜ ,4
714,알바들 열심히들 산다.. 오래 살아라영화가 서바이벌도 아니고 반전도 아니고 걍 토마토 2시간 내내 터지는 것만 보다가 왔는데액션이 화려한 것도 아닌데다가 타격에 비해 소리만 커서 쾌감이 1도 없음그냥 잔인하거나 더러...,1
715,이거는 대체 무슨 내용임 ,1
716,차라리 초반 전개를 이어가는게 좋았을 것 같은데;; 쓸데없이 세계관 넓히시네요…2편은 아무도 안 볼 것같아요!^^ ‘그’의 등장부터 그냥 영화관 나가고 싶었는데 동행이 있어서 참았어요…다들 예고편에 속지 마시고 돈아...,1
717,액션영화?! 그냥 80년대. 괴물영화.. 예고편에 속았음. 차라리 범죄자vs형사vs또다른 범죄자 이렇게만들던가. 장난하나 ,1
718,개낚였다 초반30분이 전부다..연기말곤 볼게 없음. ,1
719,서인국님이 이정도라니.. 기대이상이고그냥 모든게 기대이상의 작품.제발 알바들 ㄲㅈ라 역겹다.. ,10
720,"영상미와 전개는 볼만합니다.우리나라에서 이렇게 잔인한 영화도 처음인 것 같고, 배우들 연기도 뛰어납니다.마지막 마무리 설정은 좀 아쉽네여. ",8
721,서인국 더줘 ,6
722,혼란스러워... ,2
723,보기 좀 힘들었어요.. ,4
724,너무 고어한 감이 심하기도 하고김다미님 주연작인 마녀를 떠오르게하네요 ,5
725,이런 x같은 영화말고 아바타 리마스터링이나 극장 늘려라 ,4
726,중간에 나왔다. 아 내 시간...돈...프랑켄슈타인이 왠말...? ,2
727,아...이 감독의 전작들을 확인하고 이 영화를 봤어야 했는데... ,1
728,에잇 봤음 큰일 날뻔했다 ,3
729,초반의 긴장감과 연출은 좋았음 중반부터 장르가 달라져서 실망 ,6
730,마녀 + 바이오하자드 + 범죄 ,3
731,잔인한 것을 안 좋아하는데... ,2
732,남자판 마녀 ,1
733,초반이 재밌음 ,6
734,장르물에 충실한 쏘쏘한영화중간중간 약간의 설명충이 아쉽 ,8
735,"아...할 말을 잃어버리게 만드는 영화네요. 왜 자꾸만 영화 ""마녀""의 그림자가 떠오르는지... ",5
736,ㅤ ,4
737,고어 요소가 강해서 안맞는 분들은 안보는걸 추천드립니다 ,6
738,마녀 남자버전인줄... 잔인하고 피흘림이 너무 과하다 ㅠㅠ ,4
739,그래도 참신한 시도.. ,6
740,초반에는 진짜 쫄렸는데 등장 후에는 그냥 맘편히 봄. 기대했던 내용은 아니었지만 판타지도 좋아해서.. 재밌게는 봤음^^ ,10
741,일본영화에서 보던 고어물을 한국에서 보다니 굿굿 ,8
742,나만 재밌냐?2 꼭 나오길. ,10
743,2탄 기대된다 ,10
744,한국에서 이런 영화가 만들어 지다니 다른 관점 과 시각으로 봐야 이 영화의 대단함을 알지 ,10
745,엄청재밌습니다 가족과같이보기 좋은영화입니다. 서로를위한 희생연기 아주잘봤습니다. 눈물이 앞을 가릴정도로 너무감동적이였습니다. ,10
746,너무 무서워 ㅠㅠ 연기도 무서워 ,8
747,재미있는데 왜 평점이 낮은거지..?피가 많이 나오긴 하지만 실제처럼 잘 표현 한 듯배우들도 좋고 다들 좀 빨리 죽어서 아쉬움 ,10
748,스포와 다른 장면이어서 오히려 반전 & 볼만 한데 평점이 왜이렇게 낮은지.... ,10
749,고어물 좋아해서 잘봤음. 졸린상태로보기시작했다가 끝까지 집중해서 봄. 서인국인지 알고 보는데도 아닌줄 알았다는.  평점 왜 일케 낮은겨?! ㅋ ,8
750,하..변신감독인걸..몰랐네...욕하고 싶은데 변신때 욕을 오지게해서.. ,1
751,범죄도시로 시작해서 마녀로끝나는 이상한장르 ,5
752,별점 이정도 낮을 이유가 없는데. 일단 스토리가 초반 시작 예상하고 너무 달라서 반전. 하지만 중간부터 개연성은 쭉 이어지는데? 잔인해서 싫다? 지금까지 어설펐던 한국 영화보다 100% 나음. 모든 장면 상당히 자연...,10
753,남자 마녀! 저는 2편 기대해요. ,10
754,감독이 정신감정 받아봐야 할꺼 같음 ,2
755,ㅋㅋㅋ 감독 지 젓꼴리는대로 만든영화 투자자가 불쌍하다. 2편 ㅋㅋㅋ 나오겠냐. ,1
756,아 진짜 할말이없다... 배안에서 벌어지는 죄수와 경찰들의 스릴넘치는 첩보액션물인줄 알았는데 이게 뭐야 아 그냥 전부 이상해 총도 안쏘는 경찰도 답답하고 효과음도 게임에서 들어본 소리들이고 너무 재미없어 진짜 싫어 ...,1
757,이래저래 난 완전 내스타일영화. 후속편 빨리나왔으면 ,10
758,"1시간 20분보고 짜증나서 꺼버림..연출...쓰레기, 스토리 쓰레기...극장에서 돈주고 보신분들...명복을 빕니다...어떤점이 좋았나요? 를 묻지말고 어떤부분이 부족했나요를 물어야지요...감상포인트 강제로 하나 올렸...",1
759,아까울 배우가 잇나? 딱 믿거라인인데 ㅋ ,3
760,호주에서 본 한국인 입니다. 영상미 스토리 연기 다 완벽합니다. 시즌2가 벌써 기대되네요. ,10
761,이 영화보는거보다 가위한번 눌리는게 더 재밌음 ,2
762,최악이어서 후기 남깁니다 ,2
763,너무 재밌어요ㅎㅎㅎ! ,10
764,그 인간병긴지 뭔지 내보내지말고 그냥 서인국 패거리vs경찰로 잔인한연출 이어가면서 그대로끝났으면 좋았을걸 뭔 이상한걸 중간부터 만들어서 영화를 다 망쳐놓냐갠적으로 잔인한액션 좋아해서 내용이 어떻든 서인국이 악역으로 ...,2
765,역겹다.감독은 인체 단면 성애자인가 싶을 정도.스토리는 텅 비어 있고보여주기에만 급급한데그마저도 더럽고 추악해서이걸 영화라고 내놓고 마켓팅하는감독이 혐오스러울 정도별점 0이 없는게 한탄스럽고감동포인트 눌러야 등록이 ...,1
766,"이영화, 나만 당할수 없지 ",1
767,개노답 ㅋㅋ 이거 볼바에 그냥 집에서 발닦규잔다 ,1
768,진심으로 싫어하는사람에게 추천하고싶은 영화 ,1
769,질질 끌지않는 스토리전개. 잔인함과 한국영화 같지 않은 새로운 시도 좋았음. 서인국 악역연기 훌륭함. 2편 나오면 볼겁니다. ,10
770,진짜 최고 재밌어요 꼭 보세요 범도 이겨버림 ,10
771,배우들 다 연기 엄청 남... 특히 서인국은 소름돋음 ,10
772,서인국땜에본건데... ,10
773,"본편보다 후속작이 기대가 되는 1인 입니다ㅠ예고편과 예상시나리오 자체가 다른건 맞지만, 영화자체로써는 너무 흥미롭고 재미있습니다. 후속과 세계관이 너무 궁금해지는데 평점이 엉망이라ㅠㅠ나올지...ㅠㅠ ",10
774,서인국이 주인공인줄 알고 봤다가 실망한 부류들이 영화 재미없다고 평가절하되어  평점테러당함.사실영화는 재미없다고 볼수없고 엄청 잘만든영화취향의 문제.영화개봉 마케팅을 잘못해서 폭망. ,8
775,생각보다 정말 재밌고 스토리도 탄탄해요. 특히 이런 장르에서 로맨스가 쉽지않은데 정말 감동적이었어요.다들 별점에 속지마시고 꼭 보세요. ,10
776,잔인한건 둘째치고 반인륜적인 영화인듯.. ,1
777,내가 진짜 이런거 안쓰는데 스토리라인 진짜 너무한거 아닙니까? 극장에서 나오면서 나만 이상한가 싶어 주변사람들 반응보니 다들 어리둥절하고 대체 뭐야 광고랑 비슷하게 가다가 중간부터 뭐 이런 말도안되는 스토리 전개가 ...,2
778,"와 진짜..7광구,물괴,여곡성이 명작임을 느끼게 만드는 영화가 나올줄이야.. ",1
779,이건 뭔 호러물도 아니고 너무 쌩뚱맞네요 ,1
780,너무 쓸데없이 잔인해요 ,2
781,무슨 생각으로 만든건지? ,1
782,비상선언이 선녀 같아 보이는 올해 극장 최악의 영화... ,2
783,나만 당할 수 없다 ~~~~ ,1
784,ㅡ경찰.범죄자들ㅡ기관총.총..난사하면 금방 제압 가능ㅡ왜 지켜보다 죽는지ㅡ ,6
785,명분있는 유혈 낭자속에 자연스럽지 못한 장르 태세전환 ,6
786,늑대사냥의 늑대가 바뀌는 순간 재미가 떨어짐....걸음소리 무슨 로보캅 걷는 것 마냥 탕탕 소리 나는 것도 좀... 오글 ㅠ ,1
787,처음에는 범죄물  30분뒤 이능물   보지마세요 돈아까워요 ,1
788,영화가아니라 고문이다 ,1
789,초반은 심심한 내용이다  중간부터  괴물나오면서 부터 심장쫄깃한 내용 짱^^ 너무 평점낮아 의화함.. 완전 재미있었어요..10점 만점 주고 싶은데 쫌 잔혹장면있어 9점~ ,9
790,끝까지 가네. 역시 쾌감의 극치킬링 타임용인간본성의 그 마지막까지 공포감을 느껴보고 싶다면 ,10
791,아무기대 안하고 봤는데.. 이건 정말 우리나라에서 이런 작품이 나올수 있는것이 놀랍고. 배안에서만 일어나는 협소한 이야기 인줄 알았는데 세계관이 나름 존재하는 큰 스토리가 있다는것이 또 놀라웠다. 고어함을 좋아한다면...,10
792,호불호 심할듯한데 재밌네요 ,10
793,이제 까지 없던 스토리흥미진진 ,10
794,공조도 그렇고 이것도그렇고 처음스토리 쭉갔으면 괜찮았을탠데.. 공조는 억지 코믹요소 이거는 갑분크리쳐물ㅋㅋ 아쉽다 ,6
795,"저는 제가 일했던 곳에서 참여했던 작품이라 촬영 시기 때부터 이미 스포를 당하고 영화를 봤습니다. 결론부터 말하자면 한국에서 볼 수 없었던 수위와 서스펜스, 고어 장르를 이런 상업 작품에서 시도한 것에 대해서 정말로...",4
796,예고로 서인국을 너무 전면에 내세워서 기대하게 만들고! 정작 영화는... 배신감...내용은 막 나쁘진 않은데 배신감에....ㅂㄷㅂㄷ글구 후속작을 위한 떡밥을 너무 던져놔서 후속작이 나온다믄 다행인데 안나오면...망?...,8
797,서인국 악역도 잘하는 배우였구나…! 새삼 느낀 영화 ,8
798,내가 짖짜 웬만해서는 평가를 안 하는데 이거는  사람이 보라고 만든 영화가 아니다; 볼 생각 있으시면 그 돈으로 마라탕이나 사먹으세요 ,1
799,조선 선비들이많아서  잔인하다고 별점테러하는거같음.한국에서 새로운 시도로 다양한 sf를 제작한다고 생각함. 통쾌하고 시원시원하고 망설임이 없는 영화임. 한국영화가 한단계 발전하여 다양한 스토리가 나올수있는 시기라고 ...,10
800,진짜 이렇게 재미없는 영화는 처음임;;ㅋㅋ돈주고 보기 너무너무 아까움스토리도 없고 누가 주인공이여 ,1
801,쓸데없이 잔인하고 그냥재미없어요 ,1
802,"터미네이터의 한국판 슬래셔 무비인가? 허나 터미네이터는 미래묵시록이란 근사한 서사라도 있지, 이건 그냥 개연성도 없이 시종일관 죽이기만 해 .. ㅠㅠ 그냥 죽여... 계속 죽여 ",6
803,마녀시리즈 신세계 다악구 존윅 쏘! 마니아입니다.잔인 하다 생각못함.스토리 툭툭 튀어나오는게 볼만함 ,10
804,중간에 나갈까 생각든 영화는 처음임 ,1
805,무슨 내용인지 전혀 .. ,2
806,이게 도대체 무슨 영화야 아 진짜 이걸 돈주고 보다니 ,1
807,이런 배우들을 가지고 이런 영화를 만들수있다니... ,1
808,잔인하지만 전혀생각지도 못한 스토리.. ,10
809,내용이 산으로가네.. ,2
810,와..진짜..쓰레기영화 공익을 위해 씁니다 ,1
811,개낚였네ㅅㅂ...아 잠이나잘껄 ,2
812,나만 당할 수 없지 않아요? ,10
813,"마녀 아류 같은 느낌, 액션에서 급 호러로 ㅋㅋ 고구마가 없어서 피만 좀 줄였어도 별 더줄수 있었는데... ",6
814,"최귀화 배우 사람인데 걸을때마다 바닥이 쿵쿵 울림  개웃김 ㅋㅋ 최귀화씨가 철문을 주먹이나 발로 차면 찌그러지거나 부숴지는데, 형사 팀장이 물어버리니까 팔이 떨어져 나감 ㅋㅋ이 영화는 공포스릴러물이지만  극장을 나올...",10
815,배우들 연기 보러 가는 수준. 어느 배우를 좋아하든 오래 못 볼 테니 보일 때 자세히 담아두길. ,1
816,"티켓값으로 그냥 집에서 넷플릭스나 이런데 올라와있는 다른영화 결제하고 보는게 이득, 1원도 아까움 ",2
817,서인쿡이 노래만 해라 진심 안타깝다 대본 고르는 수준히 별루다 ,2
818,비추비추비추비추비추비추 ,1
819,별0개는없냐 ㅡㅡ... ,1
820,14000원주고 본게 진짜 ㅈㄴ억울하다 ,1
821,최악의 영화 더러워서 보기 역함 ,2
822,보다가 중간에 나오고싶은 영화 이런영화 왜만든건지  감동도 재미도 없고 걍 자극적인것만 넣고싶다는게 보임 ,2
823,"그냥 잔인하기만 하고 너무 재미없었어요ㅠㅠ죽을 때 피 뿜어내는 부분에서 소리, 모습이 너무 잔인해서 짜증났어요ㅠㅠ ",1
824,초반구도는괜찮은데..... ,1
825,장난하나… 보지마세요 ,1
826,팝콘 맛있게 먹다가 먹기싫어진다.진짜진짜 심신이 미약하거나 심장병 있으신분은 관람을 하지않는게 좋아요..라고 말해줘야 하는 영화다. 서인국 살인전과자로 나오는데...그게 아무것도 아닌것 처럼 느껴진다.근데...더 무...,2
827,갑자기 괴물이 왜나와..? ,1
828,너무 스토리 개연성도 토막토막 이어지는 부분도 없고 오랜만에 기대한 영화였는데 초반에 그렇게 진행되고 끝났을때 다들 엥?인 느낌이 들정도로 전달하려는 내용이 뭔지도 모르겠어요거기다가 효과음 총소리같은거 너무 강조해놔...,1
829,이걸 영화라고 낸 겁니까?감상포인트라곤 배우밖에 없는 망작 ,1
830,리뷰읽으면 영화 끝나요 ,1
831,평점이 1점이 과함 진짜 맛있는 밥 먹으셈 죽을뻔함 ,1
832,내 나이 사십평생 본 영화중 제일 OOO기 ,1
833,서인국 오줌싸면서 담배피는 장면까진 명작이었다ㅋㅋ ,4
834,적당히해라 진짜 무슨 영화를 보여줄려는거임?? 다 죽이고 멀하자는거??보고있는데 토나오고 한번도 영화 후기 안썻는데 나처럼 피해보는 사람없길바란다 출연진 보고 영화 보지마라 영화 끝나구 앞뒤옆사람들 싹다 하는말이 토...,1
835,하아..정말 평점 안남기는데 이런 쓰레기 영화를 돈주고 봤다니…열 받네요 ㅋ별점 1개도 아까운 영화….. ,1
836,인생최악의영화진짜 내가 만들어도 이것보단 잘만들겠다 ,1
837,클레멘타인을 본 사람들의 마음이 이랬을까 ,1
838,아 내 돈 ㅠㅠ 흐엉엉 흐엉엉 흐엉엉 ,1
839,진짜 이런 영화에 시간이랑 돈 투자한 게 아까워서 미칠지경이에요 인생에서 최악의 두시간이였음; 후기 안보고 본 내 잘못이지 ,1
840,2편 만들지마라 진짜로 ,1
841,피만보다나왔어요..식후영화추천드려여..밥맛뚝떨어졌습니다. ,4
842,"이 영화는 근데 뭔내용인지 아예모르고 가면 재밌음 근데 이미 죄수들을 다룰 내용이라고 생각하고 어느정도 예상을 하고갔는데 딴영화 본느낌임,, 너무 예고편을 죄수들한테만 맞추다보니.. ",6
843,"이 영화는 진짜 제 인생에서 처음이자 마지막으로 기억에 남을 영화입니다.예고편에는 없는, 영화를 봐야지만 알 수 있는 신선한 내용, 영화를 보지 않으면 알 수 없는 참신한 반전.모두들 이 영화를 꼭! 보셨으면 좋겠습...",10
844,많이 잔인하기는  했지만 남자판 마녀 같은느낌이였어요~ 전 재밌게 봤습니다 ,10
845,움 만18세 관점으로 봤을때는 일단 절대 어린친구들 보지 마세요 .. 정말 수위 역대급입니다 그리고 흔한 클ㄹ쉐 없고 반전도 있고 좋습니다 네 보고 친구들고ㅓ 나와서 거울 보니까 전부다 얼굴이 하얗게 질렸어요 ,8
