,Review,Rank
678,공포성은 생각보다 별루고 유치한 장면들이 있음. 감독이 감독이라 이블데드 감성..완다가 이정도라고? 싶었음그래도 생각보단 재밌던영화 ,10
679,"마블 영화 기본으로 2-3번은 봤는데 이번엔 안 볼 듯. 공포, 호러, 좀비같은 영화를 싫어하고 잘 못 보는 사람이라 보면서 조금 힘들었다. ",7
680,"중간중간 진짜 너무 놀랐음 생각보단 별로,,, ",8
681,너무 기대 했나봐... ,5
682,영상미 cg 미쳤음 영화관에서 봐야함 ,10
683,2번 봐야겠다..영상미도 너무 좋고 다 만족 ,10
684,너무 재밌게 봤습니다완다 행복하자 ,10
685,영화가 아니라 영화관이 대혼돈이다 ,10
686,"스토리보면 별의별거 다 넣으려고 해서 진짜 대환장 파티인데 그런거 치곤 전개는 깔끔한 편이라 생각함. 요즘 멀티버스 때문인지, 디플 서비스 이후로 덕지덕지 붙는 설정 때문에 그런지 모르겠지만, 마블이 요즘 러닝타임에...",8
687,다음 단계를 위한 발판! 매니악해져 가는 마블이라 더 좋아요. ,10
688,"영상미가 좋았어용. 잘 봤습니당, ",8
689,적당한 공포를 가미해 만든 마블 스타일의 변주 ,10
690,b급 영화에 가까웠음. ,5
691,디즈니플러스로 마블거 다 본 사람으로서 스토리 너무 재밌었고 호러부분이 위트있고 신선해서 대혼돈의 멀티버스 다웠음 매우 흥미롭고 즐겁게 관람하고 옴 ,10
692,"샘레이미감독의 인감도장과같은 작품...그의전작들의냄세가 매우 진하다.개인적으로""드레그미투헬""이 많이생각났다. 하지만,그보다 10이상재미있는 작품이다. 영화관람전 마블드라마 [완다비전]과[왓이프]는 필견...",9
693,"액션씬은 느려서 지루하고스토리가 별론지 연출이 별론지 조금 유치했음...완다의 서사가 이해안된다고는 하는데그건 별로 신경 안쓰임 그것보다 신경쓰이는 것들이 더 많음...그리고 반복되는 것같은 장면들이 신경이 쓰였다,...",4
694,평점낮아보이던데 부모님도 재밌어하시고 재밌었습니다 ,10
695,닥터 매드니스 이상한 멀티버스 ,7
696,영상미 하나는 볼 만 하다 ,10
697,생각보다 무섭네 ㅋㅋ 역시 믿고 보는 마블 ,10
698,호불호는 갈리겠지만 나는 존잼이었음 ,10
699,미쳤다 진짜 지린다 기저귀 차고 보세요 ,10
700,"괜찮은 편이다. 그런데 영화만 보던 사람은 좀 이해 안 될 부분이 있다.영화만 보던 사람은 드라마 완다비전, 로키, 왓이프 정도는 봐야 더 재미를 느낄 것 같다. ",10
701,기대를 너무 많이 했나봅니다.완다의 연기는 너무 좋았습니다. ,5
702,역시 샘 레이미ㅠㅠ 닥스 기대한 것보다 더 존잼이다ㅠㅠㅠ 배우들 연기 다 미쳤다구ㅠㅠㅠㅠ ,10
703,"스파이더맨을 보고 너무 기대를 해서 실망한걸 수 도있지만, 너무 많은 내용을 2시간내로 넣다보니 많이 난잡하다군요 영화3편을 본기분입니다. 마블 드라마 다 봣는데도 그런데 안본사람들은 앞부분을 이해는 할런지.. 너무...",6
704,와 역대급 너무 재미있는데 완다의 감정 개느껴짐 완다비전 무족건 봐야함 ,10
705,샘 레이미식 싼마이 연출이 영 별로다. ,4
706,"완다비전시리즈는 꼭 보고 가시는걸 추천드립니다, 정말 오랜만에 재미있게 본 영화네요 :)볼거리도 많고 등장인물들도 반가운 사람들이 많아서 한번 더 볼 예정입니다. 강추!! ",10
707,눈은 즐거운데 스토리가 아쉽다 캐릭터 활용도아쉽고..완다의 연기는 완벽 하지만 음표싸움이랑 마지막 차베즈가 뜬금각성해서 주먹을 날리며 뿌듯해하는 모습을 보고 이게먼가했다 특히 흑화닥스 기대했는데 보여준게너무없고 쿠키...,7
708,토르4 보고 오니 이 영화는 잘 만든 편이었다. ,8
709,더이상 볼일 없는 마블 ,6
710,다시보라면안봄 ,6
711,마블 몰락의 OO점 ,2
712,극장판 완다비전 : 스칼렛 위치 완다 (feat. 닥터 스트레인지) ,5
713,꽤나 재미있게 봤지만 생각보다 공포와 잔인함의 비중이 높았다. ,8
714,일루미나티는 팬들을 위한 선물보단 캐릭터 남용에 가까웠다. ,5
715,스트레인지와 완다 스토리가 흥미로움 ,8
716,진짜 역대급으로 재미없었습니다. 인생의 두시간을 아끼세요. 마블은 정말 갈수록 수준 떨어지고 팬서비스 마냥 깜짝 등장인물 넣고 오래된 명대사 넣는거… 그거 충분히 우려먹어서 이제 그런거 하면 항마력 딸립니다. 영화 ...,1
717,마블...왜이래진짜로...정신차려... ,1
718,영화를 뭐 이따구로 만들어놨냐... 재미고 나발이고 진짜 돈처바른 쓰레기 ,1
719,꺅 ,10
720,멋있는 장면이 많아서 볼거리가 많아요 ,8
721,영화 주인공은 닥터 스트레인지였지만 완다의 비중이 너무 컸다. 기존 마블 영화에 등장했던 닥터 스트레인지의 다양한 마법 적인 연출을 너무 기대했었는지 다소 밋밋해서 아쉬웠다. ,7
722,"2시간 영화지만 너무 많은 스토리가 쏟아져 체감은 2시간이 훌쩍 넘는 느낌. 심플한 플롯에 할말이 많아서 다소 산만했지만, 망작은 절대아님. 그저 코로나 시대에 우리의 기대와 눈이 높아졌을뿐. ",7
723,졸다가 보다가 혼돈의 영화 관람 ,6
724,그냥 그랬던 밋밋한 영화 ,6
725,마블 광팬이 아니라면 조금 난해한 영화 ,8
726,기존의 마블 영화보다는 다소 산만했던 것 같습니다.. ,7
727,세계관이 넓어지고 전편 완다비전을 보지않았다면 완다 갑자기 능력치 업되서 빌런된 상황을 정확히 이해 못할지도.. 하지만 잘 모르고보아도 선악의 구도가 확실한 마블은 그냥 재밌지 ,8
728,완다가 다했다 2번 봤는데 너무 재밌게 봤고 앞으로 한번 더 볼 생각임 ,10
729,"뭔가 유치한 부분도 있고, 장르 파괴 부분도 있어서 보는 중간중간에 어이없어서 피식거렸는데, 다 보고나니, ""재밌었다!!""라고 외치게 되는 영화 ",8
730,전 완다비전 보고 나서 봐서 그런지 연결이 되서 너무 재밌었어요. 볼거리 많고 믿고 보는 닥터 스트레인지! ,10
731,"전보다 더 라이트한 팬들을 배제하고 만든 듯한 MCU드라마, 영화, 모든 시리즈를 챙겨보지 않은 자는 즐기기 어렵다 ",7
732,호불호가 많이갈릴듯 ,7
733,"완다비전 시즌2라고 할 정도로 완다가 주인공 스러운 영화, 아무래도 멀티버스를 도입하니 스토리는 점점 안드로메다로 향하게되어, 마블 페이스1의 탄탄한 느낌은 희석이 되어 아쉽습니다. ",6
734,1편의 액션씬은 사라지고 피아노를 연주함 ,8
735,평점이 좀 그래서 걱정했는데 전 너무 재밌게 봤어요 ,10
736,너무재밌음 근데 12세오바인듯 ,10
737,나는 최고로 좋았다 다음 작품도 기대된다 ,10
738,뭔가 아쉬워요… 닥스답게 영상미는 좋앗습니다 ,7
739,주인공 두 배우의 연기가 눈부셨습니다. 시간 순삭~! ,10
740,"전체적인 스토리나 흐름, 영상미 등 다 좋은데,, 영화 흐름에 맞지않은 억지 공포 분위기 연출이나 유치한 연출(음표…)만 빼면 전체적으로 재밌었음.+ 초반에 완다비전 관련 내용을 좀 더 요약해서 풀어줬으면 마블 스토...",7
741,전 나쁘지 않았어요. 완다비전을 보지 않고 봤지만 스토리도 이해되었고 재미있었어요 ,8
742,공포영화를 만들려면 공포영화를 만들던가.. 히어로 영화를 만들려면 히어로 영화를 만들던가.. 하나만 했어야했다. 콜라에 사이다 섞으면 맛없는 것처럼 이도저도 아니어서 재미없음. ,1
743,다음작이 기대가 되지는 않는다. ,6
744,마블은 이제 아닌듯 ,6
745,확실하게 망해가는 마블...이젠 영화관에서 돈 주고 보기 아까울 정도...디즈니+에 올라와도 이거 볼시 간에 엔드게임 한번 더 보게 되는 영화 ,1
746,우리 완다 좀 행복하게 좀 해주면 안되냐고 쫌! 완다비전 보고나서 보니까 초반부터 울컥하넹. ,8
747,재미있어요. 잘 봤습니다. ,10
748,닥터스트레인지 세계관 완전 재밌구 좋아요~~!! 속편도 계속 나왔으면 ,10
749,"마블을 가볍게 즐기는 사람들에게는 불친절한 영화였고,마블을 제대로 즐기는 사람들에게도 평이 갈릴 영화였다. ",7
750,감독의 색깔이 뚜렷한 영화였다. 개인적으로는 극호. ,8
751,올슨의 엄마연기는 세계제일~~ ,10
752,"멀티버스 덕에 한층 스토리가 흥미진진하고, 다채로운 볼거리로 보는 내내 즐거웠습니다. 무엇보다 기다리던 영화를 보게 되어서 너무 좋았습니다^^ ",10
753,닥터 스트레인지가 아니라 스칼렛 위치로 이름 바꿔야 함 큰 기대 없이 보면 볼 만하지만 기존 마블 팬들에게는 다소 실망스러움... ,7
754,마블 계속 봐야하나 싶은.. ,8
755,다른 어딘가의 완다가 아닌 616의 완다가 행복했으면 좋겠다. ,10
756,완다비전으로 영화제목 변경해야할듯 ,6
757,완다 너무 슬퍼 ㅠㅠ 완다비전보고 이거 보니까 영화 너무 재미있음 ,10
758,옛날 스타일 ,5
759,그냥 미쳤단는 말밖엔.. ,10
760,니들 이래도 디즈니플러스 결제안할래? ,7
761,일단 15세관람가여야 맞을 것 같다 평소 마을과는 달리 다소 잔인한 편 아쉬움이 남는다는 말들이 나오는 데 동의하긴 하지만 그래도 재밌었다 ,10
762,"마블에 대한 기대치만큼은 아니었지만, 무난하게 재밌는 작품이었습니다.. 다만 12세가 맞나 싶을 정도로 약간은 잔혹한 장면이 있네요.. ",8
763,완다비전은 꼭 먼저 보고 보세요!! ,7
764,"끝없이 균열되는 차원과 뒤엉킨 시공간의 멀티버스가 열리며 오랜 동료들, 그리고 차원을 넘어 들어온 새로운 존재들을 맞닥뜨리게 된 닥터 스트레인지. 대혼돈 속, 그는 예상치 못한 극한의 적과 맞서 싸워야만 한다. ",10
765,,10
766,배우들 연기가 돋보이는 영화 ,10
767,너무 기대했나? 재밌긴 재밌었어요근데 기대를 너무 했는지 살짝 아쉽긴 해요 ,7
768,여자가 한을 품으면 오뉴월에도 서리가 내린다. ,8
769,내 닥스는 이러지 않았는데 ,5
770,씨지없는버전 생각하면..연기에 박수를 드려여 ,7
771,닥터 스트레인지 1 때 연출이 그리워요.. ,7
772,"20년 간 누적된 액션의 역치가 너무 높아져버렸다. 가디언즈 오브 갤럭시의 코믹이나 닥터 스트레인지의 색다른 마법이 그 대안이었는데, CG 장난같은 마법 싸움이나 40년 전 전설의 고향 수준의 추적씬은 극장을 뛰쳐나...",1
773,개인적으로 스파이더맨 노웨이홈 보다 훨씬 재밌게 봤네요 좀더 공포스러웠으면 좋았겠지만 ,10
774,완다 최애인 사람은 걍... 슬퍼서 죽고 싶었음 .... 완다비전 드라마 보고 안보고에 따라서 영화볼때 이해도랑 몰입도가 확 달라질ㄹ듯.. ,7
775,와 닥터스트레인지다~~하고 보러온 잼민이들이 식겁하고 돌아갈 샘레이미의 멀티버스 ,8
776,음표 공격빼고는 다 괜찮았다 ,8
777,멀티버스의 빌드업으로만 만족해야 했던 아쉬운 영화 ,6
778,샘 레이미의 영화를 하면서 닥터의 매력은 낮아졌다 ,7
779,"감독특성답게 연출방식은 B급 호러 무비의 방식을 많이 차용하였고(호불호 확실할듯), 전체적인 톤도 2000년대 초반 영화들의 톤을 사용하고 있음. 이점들 때문에 기존 MCU영화와 이질감이 드는 것이 사실.완다비전의 ...",8
780,실망과 감탄이 공존 ,6
781,옆자리 여자분이 새가슴이셨는지 계속 소스라치게 놀라서 의도치않게 4D관람하게됨놀래키는 장면이 몇 부분 있는데 저는 하나도 안놀랏습니다 사바사인듯 MCU 팬이엇어서 전 재밌게 봣습니다... 완다 넘 안쓰러웠음 ,10
782,영화 보기전 공부해야할것들이 너무 많네요 ㅠ ,7
783,완다비전 보고 오면 더 좋을 것 같네요. ,8
784,뭐… 완다비전 안봤으면 완다가 싸패처럼 보이기는 하겠다 ㅋㅋ ,8
785,완다비전 보고 간 나를 셀프칭찬합니다 ,7
786, 너무재미있어요ㅋㅋㅋㅋ ,10
787,완다비전 보고 안 보고의 차이가 확실히 날 것 같다. 완다의 감정선을 이해하기 위해서라도 추천! ,10
788,영화를 이해하기 위해선 봐야하는 영화나 드라마가 너무 많았다... ,3
789,닥스때문에 마블 영화들이 더 좋아졌어요.. 다음편 언제나올련지 ㅠㅠ ,10
790,닥터스트레인지 너무너무 사랑해!! 보고 또 보고 계속 봐야지!! ,10
791,멀티버스의 시작을 잘한 영화 ,8
792,재밌네요   완다비전 드라마 줄거리는 꼭 알고 보면 좋음!! ,10
793,연출이 심각한 상황에서 유치한 듯하게 표현해서 너무 이상함을 느낌뭔가 뭔가 부족하다고 느껴짐1편과는 분위기나 스타일이 너무 바뀌어서별로라고 생각됨꼭 다른 영화처럼 느껴짐2번째 쿠키는 정말이지 실망스러움헛웃음 내면서 ...,2
794,재밌긴한데 감독이 욕심만 좀 덜부렸으면 더 좋앗을듯... ,8
795,기대만큼 재밌지는 않아요.빨리 토르가 나왔으면 합니다 ,7
796,나는 너무 재밌게 봄!!!왓이프도 보고 갈걸 ㅠ대환장의 멀티버스였지만 역시 믿고보는 마블임!!! 오이오빠 미모는 왜 점점 더 빛을 발하는가.. 연기 좋고 다 좋고~~!!완다 꼭 행복하자... 아픈손가락 같은 캐릭터 ...,10
797,이정도면 극장에서 스트레스 날릴 수 있음!!! ,9
798,진짜 대혼돈이지만 재밌긴 하다 ,8
799,마블에선 보기힘들었던 공포물 연출 신선했어요 이번 닥스 잘 뽑힌거 같네요 ㅎㅎ ,10
800,"영상미는 좋다. 주인공은 다른사람, 시점은 닥터스트레인지. ",4
801,점점 예습이 많이 필요한 마블 유니버스 어디까지 가려나 ,6
802,디즈니 플러스를 구독하지 않아서 놓친 부분이 많았던 것 같습니다. 그래서 그런지 여러 설정들이 크게 와닿지 않았는데요. 마블 유니버스를 충실한 팬이라면 다르게 보셨을 것 같습니다. ,7
803,진작 완다가 각성했으면 타노스도 못 비볐다... ,9
804,기대를 넘 많이 했던걸까... ,1
805,마블이 품은 호러 장르. 무섭다그래서 걱정했는데 너무 재밌었음!! 강추강추 ,10
806,너무 재밌게봄 원래 닥터스트레인지는 이런맛임 약간 가볍지만 풍부한 그런 ,10
807,개인적으로 너무 재밌게 봤음 ,10
808,역시 샘 레이미 감독답게 분위기는 공포 영화임 완다비전 왓이프 노웨이홈 닥스1 보고가야 더 재밌게 볼 수 있음 꼭 IMAX로 보셈 ,10
809,"평점 별로이길래 걱정했는데 재미 짱. 호러물이라 해서 걱정했는데 호러,공포 절대 못보는 저한테도 문제 없었어요. 그리고 두번째 쿠키 보세요. 안보면 후회... ",9
810,재미있었음.  완다비전을 보고.  왓 이프 를 보고나이야 따라갈 수 있는 스토리 전개입니다. ,10
811,세계관 ㄹㅇ 찢었다 ㅠ 마블과 샘 레이미의 만남이란.. 진자 절로 무릎꿇게돼 샘 레이미에게 박수를 ㅠ 연출 개도라방스임 ㅠ ,10
812,' 대혼돈 '의 멀티버스 ,2
813,"닥스도, 완다도.. 제발 행복했으면 좋겠어 ㅠ 오타쿠 심장 찢어진다고요~ 아이맥스로 보니까 개안하는 너낌 4dx 얼른 예매갈겨야지 ",10
814,"볼만은 한데 완다비전,왓이프는 못봐도 큰 지장없고 그냥 쟤가 저리쌨었나? 느낄정도고 로키랑 완다비전 왓이프 다봤는데 그다지 감흥이 없음. ",6
815,완다비전으로 빌드업 싹해놓고닥터스트레인지로 쌍으로 말아먹음이터널스가 서사가많아서 망했다면이건 서사가  아니 개연성이 없어서 망함 ,6
816,핵노잼이야 진짜 대실망했다 연출 ,2
817,개인적으로 왜 평점테러 당하는지 모르겠어요.마블 쭉 본 사람으로써 만족스러웠어요오이오빠 넘 잘생겼어요… ,10
818,"호러 영화로 유명한 감독과 마블의 만남이 신선했다. 좀비영화인듯 무서웠고, 주인공도 스칼렛위치같음. ",8
819,닥스 1편 분위기가 훨씬 개취지만 2편도 나름대로 개성있고 재밌었음 ,8
820,완다를 다 알아야 재밌다고 하지만 나름 재밌었음 ,8
821,어벤져스끼리 스톤가지고 삐용삐용 거리면서 놀 때가 좋았지. ,2
822,아빠가 없이 엄마만 둘인 세계관 속에서나 만들어질 영화 ,1
823,"한국인은 마블영화에 너무 관대하다. 난잡하고 어지러운 스토리와 캐릭터들+완다비전이라는 높은 진입장벽+설명충이 되어버린 등장인물들, 그때그때 임기응변식으로 전개에 필요한 설정들이 난무하는 느낌. 그나마 연기나 결말, ...",2
824,핵노잼.. 보다가 못참고 끔 ,2
825,도움되시라고별점기재합니다.  이건 폭망입니다 평가좋은건 전부 일바인듯..   마블 최대폭망같아요.... ,2
826,최악이다.. 유치하고 디즈니가 만든 페미 스트레인지.. ,1
827,영화 도중에 진짜 잠들어서 멀티버스를 경험함 ,4
828,조때씀... 마블 주식 빨리 팔아야 할 듯... ,2
829,내 아까운 시간 마블도 망했다 ,2
830,생각보단 괜찮았는데 보는 내내 뭔가 웃겼음 ,6
831,깔거 진짜 많은데 아메리카 뭐시기 연기력이 젤 문제임. 톰스파 시리즈 출연진도 초창기에 연기 진짜 못한다 생각했는데 이정도 발연기는 아니었음 ,1
832,완다비전 드라마를 안보고 가면 조금 이해못할 내용이 있는 불친절함이 있다. 하지만 마블답게 화려한 영상들과 액션을 보는 즐거움이 그 불친절함을 잊게 만든다. ,8
833,기대했던거보다는 별로였어요 ㅎㅎ ,7
834,재밌음. 머리 비우고 보면 좋음 ,10
835,뭐하는건지.. 싶습니다 ,7
836,재미 있는 듯 재미 없다. ,7
837,주위에서 다들 별로라고 해서 기대 안하고 봤는데 너무 재미있었고 또 볼 예정 ,10
838,"완다의 슬픔이 완벽히 느껴졌음. 연기, 연출 모두 좋았음. ",9
839,닥터는 어디가고 호러가. 잘생김을 연기하다 잘생겨져버린 그분. ,6
840,화려한 영상은 정말 좋으나 쓸데없이 놀래키는 장면이 좀 짜증나네요 ,7
841,저는 완다비전을 보고 난 후에 봐서 그런지 맴찢하는 영화였어요 개인적으로 어벤져스 때부터 완다의 서사가 너무 좋아요 완다는 저를 찡하게 해요 이 영화는 개인적으로 닥터스트레인지 보다는 스칼렛위치의 영화라고 생각들어요...,9
842,"완다비전 보고 간 사람이라면,,우리 완다가 불쌍해서 눈물 좍좍흘릴 수밖에 없었다. 완다가 악역으로 등장하긴 했지만, 완다의 감정에 계속 이입하게 되더라. 화려한 액션과 아메리카의 당참이 더해져 재미있게 봤다! 근데 ...",10
843,호러가 섞여있다고 해서 '걱정했는데 너무 무겁지도 않고 스토리도 괜찮았습니다! 역시 믿고 보는 마블이네요 ,10
844,"뭔가 허무한, 추천은 음.. 오랜만에 마블이라 반가운 정도!! ",6
845,"생각보다 재미있었고, 배우들이 뭐 워낙 노련하니까 괜찮았는데진짜 음표 싸움은 좀 너무했다 싶었음.. ",7
846,"이게,, 맞나? ",5
847,솔직히 기대이하였다. 전작과 너무 다른 모습이라 괴리가 느껴지는 영화였고 샘 레이미는 너무 본인 스타일을 보여주려고 한거 같다. ,6
848,"재밌긴했는데 기대만큼은 별로,,? ",7
849,제목을 스칼렛 위치로 바꿔야.... ,8
850,디플 구독 강제되는게 참 별로입니다. ,6
851,아..우리 완다 좀 그냥 나둬라...ㅠ ,9
852,"샘 레이미 영화로써는 좋은데, 마블 영화로써는 흠... ",7
853,약간 액션이 좀 촌스러움 ,7
854,닥터 스트레인지 : 대환장의 멀티버스 ,7
855,완다 급발진... 드라마 안봤더니 알수가 없네ㅠㅠ ,6
856,닥스 왜자꾸 너프하냐... ,7
857,호러인줄 모르고 봤다가 무서워서 조금 쫄았네 ,8
858,그럭저럭 볼만한데 1편이 더 재밌긴 하네요 ,8
859,그래도 멀티버스로 가는 그 장면 다시 보고 싶다 ,7
860,기대하지 않고 보면 영상미로 눈의 즐거읨을 느낄수 있습니다. ,8
861,액션 영상 영상미까짐 모두 좋지만 진짜 유치..함 ,7
862,기대를 많이 하면 실망도 큰법 ,6
863,마블에서 그동안 보지못했던 색다른 연출 시도가 돋보이는 영화 ,10
864,"호불호가 확실한 영화, 즐겁게 볼 수 있지만 모두가 다같이 즐기기는 어렵다 ",8
865,멀티버스의 주인공인 새로운 캐릭터가 너무 답답할 뿐이고.... ,7
866,에휴 돈아깝다.... ,2
867,기대보다는 대혼돈이 없음 ,8
868,마블의 매력은 그럴듯하게 빠져드는 유치함인데 이번에는 가도 너무 감.킬링타임으로는 볼만합니다. 좋은 영상미인데 뭔가가 이상함 ,6
869,완다비전에서 희생은 뭐였는가... ,7
870,25년 살면서 본 영화 중 손에꼽히는 기분나쁜 기괴한 영화.. 너무 실망했어요 ,1
871,멀티버스에 올라타도 운명은 크게 변하지 않는다는 걸 깨닫게 됨... ,9
872,재밌다... 근데 완다 역시 세계관 최강자 ,10
873,깜짝 놀랐습니다 ,7
874,"볼거리는 화려하고, 스토리 개연성은 ?이 떠오르는 영화였습니다 ",7
875,이제 마블 접어야겠다 넘우려먹었네 ,2
876,마블영화 보고 이렇게 재미 없어서 헛웃음 나온건 이번이 처음 ,1
877,마블은 이제 끝났구나 싶은걸 너무나도 잘 보여준 영화.. 호러물인척 하는 졸작 ,1
878,하아.... 진심 최악입니다....마블도 슬슬 망해가는듯ㅠ ,1
879,대환장의 메타버스..안본눈삽니다..현실 멀티 유니버스가있다면 보지말라고할거임 . 화려한 출연진들 모아놓고 케릭터 밸런스 망쳐놓은거보고 DC랑다를바없다생각함. 아무리 유니버스라고해도 힘의 밸런스를 이렇게 망칠이유가있나...,4
880,기대는 하고 보지 말 것. 이번은 마블 유니버스의 충성심으로 보는 거나 다름 없음. 그리고 쿠키는 2개 그중 첫번째 쿠키는 꼭 볼 것. 다음에 나올 새로운 인물이 등장함. 두번째 쿠키는 안 봐도 그만 ,7
881,진짜 대혼돈이기는 하다 ,5
882,전작에 비해 확 다크해져서 공포영화수준. 1편기대하고 애들과 볼여줄꺼면 주의해야할거 같아요. 완다는 역시최고고 앞으로 멀티버스가 기대됩니다 ,8
883,요새 마블 작품을 보면 한숨만 나온다. 1편만큼만 나왔어도 좋았는데 말이지.- ,6
884,스토리가 점점 약해지는 걸 느낍니다 ,7
885,그로테스크함은 마음에 들었지만 닥스가 넘 약해ㅠㅠ 제발 좀 괜찮은 마법 액션씬좀 많이 넣어줘유 ,6
886,망토가 제일 멋있었다 ,7
887,안타까운 스토리 ,7
888,1편 진짜 재밌었는데 2편은 호러물... 피칠갑한 완다의 추적은 공포 ,5
889,이게 뭐지..? 내가알던 마블은 아닌데... ,4
890,어정쩡한 호러에 연기못하는 아이돌을 보는것같은 챠베즈.. ,6
891,샘레이미감독 싸라있네~ 극호. ,10
892,마블팬으로서 영상 연출 스토리 꽤 좋았습니다! ,9
893,압도적인 CG에 놀랐습니다. ,10
894,마즐 시리즈 중 닥스에 바라는 액션과 영상미가 있는데 그 그림이 안 나옴. 앞으로도 이런 방향이라면 닥스에게 이별을 고할 것이다... ,6
895,그냥 아이언맨과 캡틴이 너무 그리웠다... ,7
896,배우들의 연기가 너무 인상깊었습니다. ,10
897,"연출, 영상미 좋음. 완다비전 안봤을 시 초반 스토리 이해하기 어려울수 있음. ",8
898,마블 세계관 알면 개꿀잼 ,10
899,그냥저냥 시간때울만한 이야기 멀티버스 그만zzz ㅠ ,7
900,진짜 베네딕트 너무 멋있는데 음표 개띠용이었음 ㅋ  ㅋㅋ ,10
901,향후 마블의 멀티버스 세계관이 기다려지네요 ,10
902,영상미는 정말 좋았지만 이건 완다의 멀티버스....ㅠ ,8
903,"전작보다 더 재미있고, 후속편도 기대되네요~ ",10
904,오우?! 코믹함이 한스푼 들어간 호러장르라니... 너무 좋은데?! 무엇보다 완다가 너무너무 이쁨! 완다랑 닥스의 미모랑 연기력에 눈호강! ,8
905,우리 완다 내버려두라고 ㅠ ,8
906,"확실히 감독이 공포 전공이라 쫄깃한 맛에 재밌게 봤음음표 전투씬은 영화 전반적으로 공포,스릴 장르를 자주 쓰다 보니 살짝 경직된 감이 있어 두 인물이 주변 환경에 의해 즉흥에서 나았다는 명분으로 코믹(?)을 섞어가는...",8
907,스칼렛 위치 : 대혼돈의 멀티버스 ,5
908,저는 너무 재미있게 봤어요 ,9
909,기대 안하고 갔는데 슴슴한듯 자극적인 맛이 있는 영화였음. 생각보다는 재밌게봤지만 음.. 각본이 좋아서 재밌었다기 보다 배우들이 연기를 잘했고 보이는 시각적 효과가 화려해서 즐거웠다는 느낌. ,8
910,기대했던 것 만큼 화려한 액션신도 없고 닥스는 너무 너프됨 좀 아쉬운 영화 ,8
911,음표씬 빼면 볼만했어요.... ,9
