,Review,Rank
644,이정재 감독의 성공적인 입봉 ,7
645,기생충 과 같은 레전더리등급 영화입니다 대충 어느정도 대한민국의 아픈 역사를 알아야지 이해가 가능하고 역사를 알더라도 아이큐 낮으면 이해 못하는 영화 서로 빌런인지 알았지만 국가가 최종보스 빌런 ^^ ,10
646,감정선이 꽁꽁 숨겨져있지만 다시보면 굉장히 잘 짜여져있음. n차 관람하면 더 좋은 영화 ,8
647,몰입감과 배우들의 연기 너무 좋았어요 ,10
648,시간 가는줄 모르고 봤습니다 ,10
649,최근 나온 영화들보다 몇 배는 재밌는 것 같습니다. ,10
650,엔딩크레딧 내려오며 숨을 쉬면서 '와' 라는 말 밖에... ,10
651, 이 영화에 얼마나 많은 노력을 기울였는지 알 수 있음 ,8
652,엄마랑 재밋게 잘 봤습니다 엄마가 좋아하시네요 ,8
653,,10
654,영화 잘 보고 왔어요. 최근에 본 영화 중에 최고입니다. 추천해요. ,10
655,소문난 잔치에 먹을 것 기대이상으로 많았다 ,10
656,생각보다 이정재가 영화를 잘만드는것 같습니다 ,10
657,근래 개봉한 영화중 탑건에 이어 강추합니다 ,8
658,재미있게 잘봤습니다 ,9
659,제 점수는 10점입니다. ,10
660,별 기대 없이 보러 갔는데 이정재의 다음 영화도 기대하게 됐다 ,10
661,이정재배우의 감독 데뷔작.. 데뷔작 치고 완성도 높은 영화였다. 재밌다 ,8
662,이정재 감독님 영화 또 만들어주세요 ,9
663,실재로 있었던 사실은 아니지만이런영화가 나올수도있다는...실재 역사가 비극처럼느껴짐 감독으로서  첫 작품이라고 느낄 수없는 엄청난영화를봄 강추 ,10
664,첫 작품이라는 것이 믿기지 않을 만큼 훌륭한 감독 이정재. ,8
665,오랜만에 본 재미있는 액션영화에요~ ,7
666,비상선언은 비교하지 못할 영화네요~ 이정재씨 영화 잘만들었습니다. 실제사건을 적당히 잘 섞어 현실감도 있었고요~ 카메오 찾는 재미도 쏠쏠 하네요 ,9
667,영화 좋았습니다. 대사가 잘 안들리는게 조금 아쉽네요. ,9
668,한국영화 정말 잘 만드는것 같아요^^☆☆☆ ,10
669,배우들 연기도 반전도 다 좋았음 ,10
670,이정재 정우성 호흡이 잘맞음. 보면서 계속 어떻게될지 누가문제일지 싶어서 재밋음 ,10
671,끊임없이 몰아치는 긴장감이 좋았어요.잠깐 정신팔면 못 따라갈수도...대사가 잘 안 들리는건 아쉬웠습니다. ,9
672,최근 개봉한 영화중 가장 재밌게봤음 이정재의 또 다른 재능 발견 ,8
673,대본도 쫀쫀하고 진짜 재미있었음. ,9
674,인상깊었어요 추천합니다 ,9
675,와 데뷔작이 맞나 싶을정도로 재밌게 봤습니다 ,9
676,감독과 연기자 두 가지 타이틀을 완벽하게 해 낸 이정재의 선방에 박수를! 기대했던 것보다 촘촘하게 이어가는 스토리와 연출이 꽤 훌륭했다. 아쉬운 점이라면 역시나 한국영화의 고질병인 대사가 묻히는 부분이 꽤 있었다는 ...,8
677,음향에 지루함이 없어 스피드하게 시간가는줄 모르고본거같아요 마지막장면 어디서 많이봤더니 내용이 얼추 이해갔어요 다음작품도 기대되요 ,8
678,"감독이 이정재라서 기대안했는데, 앞으로는 이정재가 감독하면 기대할 듯 ",10
679,올 여름 최고의 한국 영화 ,10
680,재밌게 봤습니다. 스토리가 촘촘하고 진행에 의문가는 부분이 없어서 제대로 몰입했던 것 같습니다. 모든 내용을 알고보면 다르게 보일 장면들이 있어서 다시 한 번 더 보고 싶네요. ,8
681,이정재 감독님 너무 멋진 영화를 만드셨네요 ,10
682,솔직히 재밋음. 끝까지.. ㅎㅎ 이정재 감독 수준이 이정도라니. ,10
683,최근에 본 영화중에 젤 재밌게 봤어요. 화장실 가면 안될 영화 ,10
684,"배우들 연기 좋고, 스토리 좋고, 이정재 첫 감독작품으로 사고한번 제대로 칠듯! ",10
685,2번 보면 더 재밌게 볼 수 있는 영화 ,9
686,이걸 이정재 님이 만들었다구요?  다음편 빨리 만드세요(?) ,7
687,내용구성이 좋았음. 실제 사건을 각색한부분도 있지만 결과적으로는 아예 새로운 내용을 만들었기에 보기좋았었던같음. 배우들 연기도 좋았음. ,9
688,재미있어요. 한순간도 눈을 떼? 수가 없었어요. ,9
689,그냥 유명한 영화들 어디서 본듯한 장면들 짜집기한 수준의 연출 ,5
690,"두 마리 토끼를 모두 잡는 게 힘들다고 했던가. 배우 이정재는 한 번에 서너 개의 도전 과제를 성공적으로 해냈다. 배우 명성에 금 가지 않는 연출, 제작, 연기 그리고 23년 만에 한 스크린 위에 등장하는 절친 정우...",10
691,팝콘 사갔는데 몰입하면서 보느라 다 먹지도 못했네요. 몰입감 쩔고 올 해 한국영화 중에서 범죄도시2 이후로 재밌게 본 영화였어요. ,10
692,올해 최고의 영화. 이게 감독 데뷔작이라고 믿기질 않네요. ,10
693,집중해서 잘 봤습니다. 또 봐도 좋을 거 같아요. ,10
694,킬링타임용 액션영화가 전혀아니다. 보다보면 의외로 생각해 보게 되는 지점이 많다. 헤어질결심 같이 말이다.아마 근 10년 이내 최고의 한국 액션 영화 아닐까 단언해본다. 액션이 대량 나오는 픽션역사극 정도가 적절해 ...,10
695,실제와 허구를 잘 섞었다 ,10
696,대통령을 제거하라 지금 바로~! 멧돼지도 같이 제거하자 제발첫 영화로 이정도를 뽑아낸건 정말 강추 ,10
697,진짜 재밌게 봤어요 ,10
698,너무 평점 알바들이 득실거리는데 그냥 평작수준 ,8
699,북조선영화 보는 줄 알았음 ,2
700,솔직히 별로다 ㅡㅡ 내용이 중구난방 볼거라곤 총쏘는 액션신 뿐 ,1
701,내용에 전달이 배우들에 대사에 의존하는데 감정이 격해지거나 빠르게 전달하는 과정에서 관객들에게 전달력이 부족하다. 영화에대한 전반적인 내용을 이해를 하고 관람하는 것을 추천한다 ,7
702,결국엔 북한 미화 빨갱이 영화 ,1
703,처음으로 영화보다가 중간에 나왔습니다.1. 영화가 짜임새가 없습니다. 지 꼴리는 대로 내용을 슝슝 보내는데 재미도 없고 서사도 얇아서 캐릭터에게 감정이입도 안되고 보는 재미도 역시 없습니다. 특히 학생들이 술집에서 ...,1
704,그냥 좌파영화 지겨워죽는줄 ,1
705,영화보다 나옴 전두환 아웅산수지사건을 모티브로 만든거같은데 북한의 테러를 정당화한게 불쾌함 대놓고 간첩과 국내 민주화세력의 좌우합작 대통령 킬한다는게 너무 소름 끼친다 아무리 싫어하는 미워하는 대통령이여도간첩과 손잡...,1
706,공짜로 봐서 돈낭비는 안하고 시간낭비만 함 ,1
707,분명 한국어로 대화하고 있긴 한데 영화 내내 뭐라는지 잘 안들림.. 계속 화내고 소리지르고 총만 쏴댄다 편집도 너무 왔다갔다 장면 전환도 너무 잦아서 집중이 잘 안됐음 미술감독 섭외를 참 잘했다는 생각은 많이 들더라...,4
708,기대했던 것보다 더 흥미로웠어요. 잘 보긴 했지만 대사가 너무 안들렸어요 한국영화도 자막좀.. ,8
709,이왜8점대? 대체? 응? ,1
710,개연성 ㅈ도 없고 그냥 씹노잼. 이게 평점이 공조보다 높은거 진짜 말도 안된다. 차라리 저 육사오가 나을 수준. ,1
711,영화는 너무 재밌는데 한국어 자막 필요합니다 뭐라는지 안들림 ,8
712,와 이게 입봉작이라고? 근데 그 감독이 이정재라고? 와우.. 이정재는 연기가 아니라 영화를 잘하는거였네. 헌트는 2차부터가 찐이다 ,10
713,역겨운 두 좌파가 만든 종북 반미 영화;; ,1
714,진짜 다들 연기를 징그럽게 잘함 ,8
715,이정재 감독의 이유있는 연출데뷔 ,10
716,이정재 감독으로 인정 받아 마땅한 영화 ,9
717,이정재 감독의 첫 연출작! 웬만한 상업영화 감독보다 훨씬 더 좋은 연출력을 가졌음.이야기에 생긴 빈틈은 배우 이정재와 정우성 그리고 함께하는 배우들의 연기력이 충분히 메워준다! ,9
718,액션 연출이 멋졌어요.스토리가 신선하진 않았지만 배우들의 연기와 까메오 등장 등의 요소가 흥미로워 재밋게 봤습니다. ,7
719,누가 동림인지..동기는 다르지만 목적은 같은 둘....그 놈이 잘못했네.... ,10
720,음.... 다들 알바인가요? ,1
721,80년 초반을 잘 보여주는 영화. 기대 이상의 이정재 감독. 소리가 잘 안 들린다. ,9
722,진짜 재미 없음. 시간 아까움 ,1
723,,4
724,이제는 피곤한 남산 이야기? 아직도 치열한 남산 이야기!! ,10
725,이정재 배우가 감독까지 이리 잘 할 줄 몰랐네요. 돌비 시네마에서 봐서 그런지 액션 사운드 모두 현장감 느껴져서 좋았어요 ,10
726,박평호는 휘어질지언정 부러지지 않는다 김정도는 부러질지언정 휘어지지 않는다 ,8
727,이정재배우의 첫 연출작인데 대단하다고 생각함. 특출배우들 찾는 재미도 있고 좋아요. ,8
728,정우성이 잘생겼고 이정재가 연기를 잘해요. ,8
729,80년대 시대를 지낸 세대라면 두인물간의 복잡한 전개라도 몰입도 높은 긴장감있는 영화다.특히 카메오 보고 찾는 재미가 최고이다. ,8
730,감독으로서의 이정재도 기대에 부응한 작품 ,10
731,워싱턴 몰아치고 도쿄 몰아치고 방콕 몰아치고 시원하다. ,8
732,원스 어폰 어 타임 인 코리아 ,8
733,잘봤어요 ,10
734,졸 재미없어요 고윤정성괴미인 나오는거 돈아까움 ,1
735,"시나리오가 꽤나 공들인게 티가 났고, 잘 만든 수작 ",8
736,자막만 있었으면 아주 완벽했음 ! ,8
737,눈도 즐거웠지만 이정재님 대단하십니다 ,10
738,처음부터 끝까지 몰입도 짱^^ ,10
739,감독 이정재의 차기작이 기대된다 ,7
740,"실존했을 것만 같은 두 남자를 통해, 암흑했던 1980년대를 뒤돌아 본다 ",10
741,이정재 대단합니다 감독으로서의 활약상 기대해봅니다 ,10
742,오 기대도 안했는데 잼씀!!! ,10
743,"평점 남긴 관객들에게 정말 고마운점은 깜짝 등장하는, 그러나 존재감은 쩌는 어떤 영화 팀들의 등장을 스포하지 않은 것이다. 보면서 계속 어?어~엥??당신까지?하면서 봤네요^^ ",10
744,픽션과 역사를 넘나드는 배우이자 감독 이정재의 센스와 재능을 보여주는 올 여름 최고의 영화 ,10
745,기대이상 이었습니다이정재감독이 기대되네요 ,9
746,이정재... 이 작품을 보니 확신이 든다! 드라마 쪽에 더 두각을 나타낼 인물이라고... 그의 차기작이 너무나도 기대된다^0^ ,7
747,,10
748,이정재 감독으로서의 재발견. 80년대의 시대적 아픔을 공감할 수 있는 세대에게는 꽤 괜찮을 정치적 영화. ,7
749,이정재님 연기 넘 멋찝니다. 지루할틈없이 재미있게봤습니다. ,10
750,첫 영화라는게 믿기지가 않음 ,8
751,"감독으로서 첫 작품이라는 게 믿어지지 않을 만큼 완성도가 훌륭한 첩보물 영화였습니다. 처음 볼 때와 두 번째 볼 때의 감상이 달라지는 장면, 대사, 인물이 있어서 여러번 보며 영화를 곱씹는 재미가 있었습니다. 딱 하...",9
752,정말 잘만든 영화고 자막이 있었으면 더 좋았을 것 같음 ,9
753,나는 그 무엇도 믿지 않기로 하였다. ,8
754,스토리는 재미있으나 대사가 너무 안 들림 ,8
755,올해 텐트폴의 승리자 긴장감넘치는 연출이 좋다 ,8
756,최근 본 영화 중 단연 최고! 정우성과 이정재의 비쥬얼과 연기 모두 탁월! 의심의 끈이 영화끝까지 이어지는 팽팽한 긴장감! 조연 및 카메오의 캐스팅 또한 탁월. 강추합니다! ,10
757,"지루할 틈이 없이 계속 밀어붙이는 영화라 재미있게 볼 수 있는 영화입니다.하지만 생각보다 플롯이 좀 복잡합니다. 남북 관계 이야기는 다른 분들의 말처럼 쉬리가 떠올랐고, 총격적인 볼만했습니다. 다만, 이정재나 정우성...",8
758,이정재 정우성 둘다 볼수 있어서 좋았어요. ,10
759,오랜만에 정말 볼만한 한국형 첩보 액션물입니다. 정말 재밌게 봤고 숨어있는 복선을 찾기 위해 n차 관람 의사 있을만큼 추천합니다!! ,10
760,"이정재 감독님의 첫 데뷔작이라는게 너무 놀라울만큼 잘봤어요!!총격신도 박진감,긴장감너무 좋았네요^^ ",10
761,눈이 몹시 즐거웠네요.몰아치는 스타일 좋아해서 잼나게 봤어요.카메오보는 재미도 쏠쏠~~동생이 김남길이 언제 나왔냐고 해서 깜놀ㅋ ,9
762,액션장면이 많지는 않지만 한시라도 눈을 떼면흐름을 잃어버릴 수 잇습니다...많은 배우들을 볼 수 잇어서 좋앗습니다! ,10
763,적당히 추리해가면서 보는 맛이 있는 영화이다피곤할때는 피하시길 ,8
764,첫 작품이 이정도라면 다음 작품은... ,7
765,"기대했던 것보다 훨씬 재밌네요.스토리도, 연출도, 유명한 배우님들의 대거 우정출연도 즐거웠어요.지루할 틈이 없었습니다. 앞으로도 쭈욱~ 응원할게요!! ;) ",10
766,역사적 사건들을 기반으로 적당히 상상력을 가미해서 재밌는 결과물을 만듬 ,9
767,"스파이액션스릴러다운 박력있는 액션, 스피디한 전개에 인류애라는 메시지가 슬그머니 스며든다 ",10
768,무난무난... 근데 대사 알아듣기가 어려웠습니다 ,8
769,이정재 감독 입봉작! 재미있어요 ,6
770,,10
771,,10
772,시작부터 끝날때까지 긴장감을 주는 영화였네요재밌게 봤습니다 ,10
773,완벽하지는 않지만 야심찬 데뷔작. 액션 연출 하나만큼은 훌륭하다. ,6
774,진짜 너무 재미있어요 ,10
775,"영화 시작부터 끝까지 긴장감을 놓칠수 없었음,,,올 여름 영화중에 가장 인상깊은 영화였다,,꿀잼 ",10
776,정우성 배우에 대한 애정필터가 듬뿍 담긴 이정재 감독의 열혈 연출! 두 분이 함께하니 시너지가 폭발하네요! ,10
777,"정말 재미있게 잘 봤습니다. 두 배우를 비롯 모든 배우들의 연기도 좋았고, 역사적 사건에 대해선 자세히 몰랐지만, 공부하고 가서 다시 한 번 더 보고 싶어요. 두 주연 배우 중 누가 스파인지 계속 의심하게 되고, 둘...",9
778,반전과 반전이 있는 영화예요연기력도좋고 눈호강은 별책부록 ,10
779,잼써요 이정재 스ㅓㅇ우성 ,10
780,나름 재미있게 관람했네요~^^ ,9
781,죄근 본 한국영화중에서 가장 좋았습니다. 물론 뒷맛이 씁쓸하지만 배우들의 연기도 훌륭하고 첫 연출작인데도 연출도 좋았습니다.정우성 이정재 모두 좋아하는 배우인지라 더욱더 좋았습니다. ,9
782,이정재는 정말 다재다능하네요~~ ,8
783,80년대 한국의 현대사를 적절하게 변주해 긴장감 있는 첩보액션을 완성해냄. 특히 총격씬들 사운드와 연출이 시원해서 좋았다. ,7
784,좋았어요 올 여름은 이걸로 끝내자~ ,10
785,배우 출신 감독의 첫 영화라는 생각은 싹 사라지는 시간이었어요크게 빠지는 것 없이 연출까지도 좋았습니다!! ,10
786,마지막 장면의 여운이... ,9
787,올해 가장 볼만한 한국 상업영화 ,7
788,정우성 이정재 우정인지 대결인지..그들의 은밀한 첩보활동의 대결.. ,10
789,빈말이 아니라 이게 감독 데뷔작이라니... 배우 출신 감독이라 그런지 배우들 얼굴 쓰는 법을 너무 잘 알고 계심 ,8
790,신파와 로맨스를 뺀것이 신의 한수 였던것 같아요 ,8
791,"일천구백팔십삼년, 방콕 다녀와서 두발. 구멍이 두개지요. ",9
792,기대했던 작품이었던만큼 정말 재밌게 관람했습니다. ,10
793,첫 감독 연출작인데도 잘뽑힌 영화. 넘 괜찮게 봤다 ,8
794,너무 재밌고 눈을 뗄 수 없음 ,10
795,이정재 감독의 작품 너무 재미있게 봤습니다. 올해 들어 본 영화 중 손에 꼽을 정도였습니다. 다른 분들도 꼭 보시기 바랍니다. ,10
796,자루하지 않게 관람했어요~ ,8
797,재밌어요! 역사적 배경지식이 없어도 즐길 수 있는 영화 ,10
798,강추강추강추!! ,10
799,생각보다 재밌게봤어요 ,8
800,진짜 재미있게 봤습니다.꼭 보시길 추천합니다~!! ,10
801,근현대사를 많이 알아야 재미있고 자막이 좀 필요한 장면이 있었던 게 아쉬움 ,8
802,신인감독상 수상 (미리) 축하드립니다. ,8
803,헌트 잘 봤습니다 이 정도면 차기작도 기대되네요 ,8
804,이정재 감독표 액션영화! 꿀잼!! ,10
805,시간 가는 줄 모르고 봄. 가끔 대사 잘 안들리는 거 빼고 다 좋았다 ,10
806,김윤석의 미성년에 이어 또 한번 놀랍다 ,7
807,2시간이 1시간처럼 느껴졌다. 지루할 틈이 없음 ,9
808,감독 이정재도 매력적이다. ,9
809,모티브가 된 사건들에 상상이 가미된 부분은 좋았는데 대사가 안들리는 지점들이 꽤... ,10
810,흥미진진하고 재밌게 잘 봤습니다 ㅎㅎ ,10
811,이정재님이 수년간에 걸쳐 직접 각본하고 스스로 연출한 2시간 넘는 시간. 재미없던 시간이 없었어요. 이 깊은 재미를 위해 정말 고생 많으셨어요. 올해 한국 영화중 제일 재미있게 봤습니다. ,8
812,기대없이 봤는데 연기와 연출이 생각보다 좋았고 까메오들도 깨알잼 ,8
813,꽤나 재밌었습니다 관객들에게 등장인물의 정체를 숨겨서 만들어지는 긴장감이 일품이었습니다. 다만 영화에 정치색이 들어가는 것을 싫어하는 분들에게는 거부감이 들 수도 있을 것 같습니다 ,7
814,긴장감을 팽팽하게 당겨놓은 상태로 관객을 쥐락펴락하는 능수능란한 연출과 각본이 돋보인다.감독데뷔작이라고 보기엔 뛰어난 완성도 ,8
815,유명한 배우들의 훌륭한 연기력으로도 커버가 안되는 특색없는 연출과 새로울 것 없는 스토리... ,4
816,이정재의 완벽한 감독 데뷔작 여름 빅4중 최고 ,9
817,훌륭하고 군더더기 없는 영화. ,10
818,"군더더기 없는 칼같고 빠른 연출, 클리셰는 적고 신파도 없다시피. 뜨거우면서 차갑다 ",10
819,그 놈 참... 당신은 죽었지만 역사는 당신을 영원히 심판할 거에요. ,8
820,1점 주려다가 정우성 배우가 잘생겨서 2점 줍니다 ,2
821,이정재 천재인가.. 대사가 잘 안들릴 때 빼고 진짜 완벽했다 역시 30년 경력은 절대 무시못한다 ,10
822,이정재씨 무서운 사람이었구나..올해 본 한국 영화 중에 단연 최고! ,8
823,"정치가 왜 중요한지, 우리는 무엇을 위해서 투표하는지, 첫 작품에 너무 많은 걸 선물해준 이정재감독에 감사. ",9
824,아주 시의적절한 영화입니다!! 영화관에서 보세요! 놓치면 님 손해 ㅋㅋㅋ ,10
825,그안에 소재가 독특했어요 전혀생각치도 못했네요. 추천합니다 ,9
826,올여름 텐트폴 한국영화 빅 4중 단연 최고~~이정재감독의 차기작이 벌써부터 기대된다~~ ,8
827,겉멋만 잔뜩들고 인맥으로 주연급배우들이 쓸데없이 까메오로 나옴 ,1
828,"무슨 의도로 영화를 만들고 싶었는지 이해 할려고 노력 해봤지만 도무지 어떤 영화를 만들려 했는지 모르겠다,반전을 줄려다 보니,캐릭터 간의 관계가 너무 꼬여버렸고,나중엔 여운 조차 남지 않는다 ",6
829,이해 할 수 없는 평점들. 영화 내내 배경 음막들만이 초조함과 긴장을 강요한 느낌. 진짜 이건 아니지 않나? ,2
830,제미가 없음 대사가 안들림 ,2
831,예상치 못한 까메오들이 많이 나와서 놀랬어요ㅋㅋ ,7
832,올해본 최악의 노잼 영화 돈과 시간 아끼세요...내용이해가 안되고 전개도 이상함 ,1
833,역대급 재미없었다 자막 필요햇다 ,1
834,평점 왜 좋아요 ..??노잼ㅠ ,1
835,간첩들 신분세탁하는 영화가 뭐가 재밌다는 거지 ,1
836,할말이 없네...하.. ,1
837,와 정말 별로네요.. 스토리 전개도 점점 산으로 가고 결말은 황당쓰.. ,1
838,"초반 정우성의 발음이 뭔소린지 잘 안들림 영화 몰입에 방해가 되고 스토리를 이해하기 어렵게 됨, 발음을 정확히 했으면 한다…. 한국말하는 미국인도 뭔말인지 듣기어려움 그냥 영어로 하고 자막처리 하던지… 이야기를 쉽게...",1
839,평점 돈주고 사서 사기치지마세요...너무 최악이자나요..아 진짜 짜증나 내 영화값..내놔요 너무 심각해.. ,1
840,2022년에 보기엔 좀 ,1
841,돈이 좀 아까운 영화 .. ,4
842,다 재미있다는 평인데 난 엄청 지루하고 그냥 내용이 갈수록 별로 ,2
843,솔직히 그냥 그렇고  여전히  정우성은 연기 못 함.   괜히  이정재한테 묻어가지 않았으면 좋겠음 ,1
844,뿡이다 개잼업따 진짜최악임 웩웩 ,1
845,후기에 이끌려 보러 갔는데 누가 신세계급이라 했냐 그거에 설랬는데 하도 재미없어서 중간에 나와서 마라탕 먹음 급발진 지려요 보지마세요 ,1
846,서로 잡고 잡히다가 밝혀지는 진실 ,9
847,"와..,  정치색 진한 영화 ",1
848,좌빨 영화를 만들어 놨네 ,1
849,재밌다고 하는사람들 다 알바인듯 보지마세요 재미없음 ,2
850,요즘 들어 느끼는 점은 갈수록 한국 영화 대사가 안 들린다는 점. 이정재도 심각하고 특히 허성태는 최악. 대사를 유추해서 봄. 자국 영화 보면서 자막이 간절해지는 시대가 올 줄이야.. ,1
851,걍 재미없음 내 친구 옆에서 겁나 잘 잠 ,1
852,대사가 잘 안들림 ,8
853,영화는 잘 만들었으나 재미는 그닥 ,6
854,"흥미로운 초반, 격정적인 중반, 애매한 후반 ",6
855,한국 영화도 자막 달아줬으면 ,9
856,헌트 토욜인데 극장자리 많이 남아서 놀랐는데 평점 높아서 더 놀랐음 ,1
857,"이걸 영화라고 만들다니... 개연성이라고는 전혀 없고, 정우성하고 놀더니 이정재가 이상해진 것 같다 ",1
858,언제까지 민주화운동 팔이하냐? 스토리 개연성 이런거 하나없고 그냥 518 전두환팔이 이정재 정우성 멋있다 끝 ,1
859,,6
860,초중반부 스토리 따라가기가 벅차다 ,7
861,감독이 제일 고생하는 영화 ,8
862,재밌었어요 기대안하고 봤는데 제일 만족했어요 ,10
863,쉴틈없이 몰아치는 스토리텔링과 인물들 사이에서 휩쓸려버린 나 ,7
864,재밌습니다 멋진 신입감독 발견 ,10
865,댓글 알바 너무 극심하네요 이렇게 조작질 하는데 제대로된 영화평가가 이뤄지겠어요? ,1
866,두 배우님들의 찐한 눈빛 연기에 만족했구요~ 다만 누군가는 너무 편안하게 가서 그게 찜찜하네여이제는 이정재 감독님! ,10
867,난 둘 중 어느 쪽에 가까울까 ,6
868,빨갱이가 빨갱이 한 영화 ,1
869, ☆☆☆평균 별점 믿지마세요☆☆☆영화 전개가 이렇게 난잡할 수가 없음.. 장면의 연결성이 너무 떨어지다보니까 자연스럽게 재미도 없음  그리고 대사가 잘 안들림.. 한국영화인데 자막이 필요하다고 생각들 정도...그리고...,1
870,기대를 너무 많이했나 생각보다 너무너무 지루했음... 스토리는 엉성해도 재미라도 있었으면 좋았을텐데 이건 재미도 없고 감동도 없고 스토리도 엉성하고.. 이정재 감독 데뷔작이라 그런건지 전반적으로 작품성이 많이 떨어지...,1
871,재밌어요! 이정재씨 연출 진짜 잘하시네요이정재 정우성 둘이 케미가 넘 좋아요 ,6
872,진짜 재밌어요 ,10
873,밀도높은 감정씬과 액션이 정신없이 몰아치는 수작. 잘 짜였지만 템포가 높아서 집중하지 않으면 이해하기 힘들수도 있다는게 유일한 단점. ,9
874,기대이상이었어요 잘봤습니다 ,9
875,최근에 본 영화들 중 제일 깔끔한 영화 ,10
876,한없이 꼬아대지만 한없이 뇌절하지도 않는 ,7
877,시간 가는줄 모르고 봄 ,10
878,반전의 반전의 반전.. 신선했다 ,8
879,액션이 ‘즐겁다’임 ,9
880,기대했던 것 보다 재미있었습니다. 좋은 작품 감사히 봤습니다. ,8
881,두남자의 얼굴합 예술입니다....멋있어요.... ,10
882,"기대이상, 이정재배우님~ 감독 대뷔 성공적~! ",9
883,"처음시작부터 사건의 전말이 밝혀지기 전까지 계속해서 의심을 하게 만들어 긴장의 끈을 놓지 못했습니다. 연출도 물론 좋았지만, 이번 영화에서는 정우성 배우의 연기와 잘 짜여진 이야기가 너무너무 좋았다고 생각합니다. 최...",9
884,앞으로 연출 많이 해주세요 ,10
885,상상에 상상을 더하니 어머 깜짝놀랄만한 잘빠진 첩보액션물의 탄생이 반갑다 ,7
886,유명배우를 활용한 OOO기영화. 자신의 정의를 위해 나라에 대한 무지함이 그대로 나타나고 잇고 내로남불의 극치인듯.좌파성향이 심각하게 녹아있는 영화. ,1
