,Review,Rank
410,이정재 감독의 첫 영화임에도 높은 몰입도와 화려한 게스트로 눈이 즐거웠습니다. 스토리는 역사적인 사건들을 적절히 믹스해 반전의 반전의 반전이 있어 흥미로웠네요. ,8
411,이정재 감독은 한국의 클린트이스트우드가 될수 있다 ,10
412,뭐 하나 빠짐없이 다 완벽한 영화..! ,10
413,재밌게 봤어요. 2시간 긴장감 ,10
414,실제로 가능할수도 있을것 같은 스토리 적절한 액션과 비장함 ..  재미있게 보았음 ,10
415,연기력에 빈틈이 없는 영화 ,10
416,첩보 액션과 80년대 현대사를 생생하게 느낄수 있었던 영화+ 안기부 차장들의 말도 안되는 비주얼 ,9
417,"이정재, 정우성 두배우가 다했습니다:)비록 평범한 스토리에 반전은 강하지 않았지만 두 배우분의 연기력을 보는 것 만으로도 재미있는 영화!!!최근 본 영화 중에 가장 신선한 느낌이 들었음 ?? ",10
418,1980년대 배경으로 픽션은 있는데 너무 재밌게 봤어요 연기는 뭐 말할게 있을까요?  ㅎㅎ ,10
419,담백한듯 열정적인듯 재밋게 잘 보았습니다 ,10
420,스피디한 전개! 극장에서 한 번 더 보고싶은 영화! ,9
421,주연 뿐만 아니라 특별출연한 배우들까지 보는 맛이 있었다. ,8
422,주연급 배우들을 조연으로 다세워두고 대사한마디 없이 사라진 배우가 있다 거기다 연기 특급 러닝타임 꽤 길지만 지루함이 없이다 ,10
423,재밌으면서도 씁쓸한 끝맛이 있고. 현대사에 관심이 있다면 더 몰입감 있게 볼 수 있음. 상상력으로 잘 채워낸 역사 뒷이야기. 오퍼시티 75로 아른거리는 김재규. ,9
424,보고 나서도 여운이 깊었음… 역시 이정재 정우성 클라스…다르다… ,10
425,이정재가 감독한 영화가 맞나요 ~한국 액션영화 중에서 액션을 이렇게 잘찍은 영화 근래 못본것 같네요 ~~ ,10
426,잘 만든 한국 영화 기립박수 받을 만하네 ,10
427,오징어게임2 미루고 두 번째 작품 찍어주세요~ ,10
428,축하드립니다 신인감독상 이정재 ,10
429,이정재씨 영화 잘만드네요. 몰입해서 재밌게 봤습니다 ㅎㅎ ,8
430,자나 깨나 간첩 조심!! 나는 공산당이 싫어요♡♡ ,4
431,진짜 잘 만든 수작 액션오락영화로도 빼어나고 첩보물 시대물로도 훌륭하다 미화도 없고 그렇다고 과한 자극도 없다 ,9
432,영화가 빨리 안 끝났으면 하는 영화는 오랜만이네요 ,10
433,두 배우의 케미가 돋보이는 영화 ,10
434,감독 이정재의 입봉작이라고는 믿기지 않는 영화여름 한국 4대작중 1등 ,9
435,80년대 실제 있었던 사건들을 기반으로한 잘만든 가상의 스파이 영화.한국사에 대한 지식이 없으면 내용이해가 힘들수도있음.내용자체도 조직내에 숨은 스파이찾기라는 어디서 본것같은 소재지만연출이 좋아서 신경이 안쓰일정도....,9
436,이정재감독은정말이지대단하다 ㅎㅎㅎㅎ ,7
437,이번 여름 한국 영화 중 가장 좋지 않았나 한다. ,8
438,  이게 재밋다니  스토리엉성하고 발음은 안들리고  돈아까워OOO줄 ,2
439,데뷔작치고라는 말이 필요없이 작품 자체만으로도 좋은 평가를 받을 수 있는 영화였다. 진짜 강추하고 다시 보러갈 생각도 있음! ,10
440,올해 최고의 한국영화입니다!! ,9
441,정우성? 여전히 멋있다.이정재? 연출도 잘한다. ,10
442,넷플에 있는 자막켜기를 너무나 하고 싶었음 ,8
443,근현대사 조금만 알아도 처음부터 끝까지 집중해서 재밌게 볼 수 있는 영화임 하지만 한국인이 한국에서 한국 영화를 보는데도 가끔 자막이 필요한 부분은 아쉽다.. ,9
444,각하를 없애기 위해 북한의 손을 잡고 적화통일도 감수한다니; 5.18 민주운동가=빨갱이 라는 얘기 듣기 딱 좋은 내용인데요;;;; 각하 죽일놈인거 맞지만 민주주의를 외치는 사람들이 어떻게 선량한 국민을 전쟁에 밀어넣...,1
445,"모르고 한번, 다 알고 한번 더 보면 더 좋은 영화 ",9
446,영화 헌트는 완벽한 연출과 연기 그리고 한국의 실화를 픽션화시켜 진짜 있었던 사실처럼 느껴진 영화였다. ,10
447,이정재의 첫 감독작치고 너무 잘빠짐. 격동의 80년대를 짜임새있게 배치하고 쉴새없이 몰아부친다. 인물들의 심리와 그에따른 액션의 개연성이 거의 완벽함. 한국 영화 장르의 확장 ,8
448,"음악 덕분에 더 몰입이 됐습니다! 다만 영화를 보면서 뭘 전달해주고 싶은지는 알겠으나, 전체적인 내용 이해가 잘 안 되네요. 배경에 대한 설명이 있었으면 더 좋았을 것 같습니다. 액션은 정말 최고였습니다~! ",6
449,우리 엄마가 유일하게 보다 안 잔 영화 다만 30분동안 뭐라는지 1도 못알아들음 ,10
450,처음부터 끝까지 몰입감도 좋고 액션신도 멋집니다. ,7
451,긴장감 있게 봤다 ,7
452,장면장면마다 대충 찍은 장면이 없다는 느낌. 연기도 연출도 모두 좋음. ,8
453,이정재 감독의 멋진 첫번째 연출작!!! ,10
454,생각보다 괜찮았습니다출연진 빨만 있는게 아니더군요 ,8
455,이정재 첫 연출작이라는게 믿기지 않음. 완성도 높아요. 인기배우들이 많이 나와 놀람. ,10
456,배우출신 감독이란 꼬리표를 떼어도 될 것 같은 잘 만든 영화.. 다만 결말이 좀 아쉽다. 근데 형(들)이 왜 거기서 나와..? ㅋ ,8
457,총격전이 예술 간만에 속 시원 ,8
458,잘짜여진 첩보스릴러 입봉작이라는 느낌이 안들정도로 잘만듬. ,9
459,재밌게 봤어요 음악도 좋고 쉴틈없는 전개도 좋았습니다 ,10
460,두 배우 이름만 보고 예매했는데총싸움 좋아하시는분 좋아하실듯요.지루하지는 않았어요 ,8
461,지루할틈없이 쫄깃한 서스펜스와 박히는 액션..재밌다 ! ,8
462,가끔 대사가 안들리는게 아쉽지만 재밌게봤어요김남길 2회차에 찾음ㅎㅎ ,10
463,이거는 진짜 잘 되겠다 ,8
464,연출도 화려하고 스토리도 탄탄하네요 ,10
465,영화 재밌게 잘 봤습니다 ,8
466,이정재 감독은 배우만 하기 아깝구나... 후속작을 꼭 찍어주길... ,8
467,공들여 만든 영화구나~~싶었구요! 나중에 집에서 꼭 한 번 더 봐야겠다는 생각을 했습니다두 분 오래오래 찐한 우정 찐한 연기 기대하며 응원합니다!! ,10
468,"소재가 흥미로운 소재였습니다.전대통령, 안기부 등 연기도 스토리도 저는 좋아서 재밌게봤습니다. 시작부터 끝까지 몰입하게 되는그런 영화였습니다. ",10
469,거 정재 형 장난이 심한 거 아니오 ,8
470,이정재는 참 사람이 스타일리쉬해여 약간 목소리에 광기도 있고.. 영화도 딱 그러합니다 모든 캐릭터에 세련된 애정을 듬뿍 담아 만든 듯 특히 정우성이 어떤 배우인지를 잘 보여줬음. 최대한 스포없을 때 언능 보러가시는 ...,10
471,매우 재미있게 봤습니다 ,10
472,와 정말  스토리 탄탄합니다두분 연기는 남자가 봐도 멋지네요 ,10
473,군더더기 없이 깔끔하게 잘 만든 영화 ,7
474,"이게 사랑이지, 외치면서 나왔습니다 ",10
475,북한애들을 믿지 말자.. ,10
476,연출은 조금 정신 없었지만 오랜만에 재밌게 본 한국 첩보 액션 영화입니다 ,8
477,,6
478,청담부부 일냈네... ,8
479,반신반의하고 가서 봤다가 완전 집중해서 봤어요 한국 현대사의 껄끄러운 부분을 너무 리얼하고 과하지 않게 전달했네요 한국의 클린트 이스트우드 탄생한줄...연기뿐 아니라 신파로 흐르지 않는 연출.. 넘 재미있었어요 이정...,10
480,너무 재밌었어요 ,9
481,보면 볼수록 또 보고 싶게 만드는 영화. 대사 안들려서 무슨 대사였지? 누가 ㄷㄹ이지? 이 장면에서 의도한건 뭐였을까? 생각하면서 스크립트 다시 보고 또 보고 싶어짐 ㅋㅋㅋ ,10
482,재밌네요. 첫 감독작인데 잘 뽑아내셨네요 ,9
483,처음부터 끝까지 지루할틈 없이 재밌게 봄 ,8
484,이정재 감독의 다음 작품이 기대되는 영화 ,7
485,평점처음 남깁니다~ 우선 두배우의 연기와 외모에 눈을뗄수없었습니다ㅎㅎ 액션영화를보면 눈이 피로해져서 잘안보느뉘ㅣ 액션신 이후에 힘을많이 뺀듯한 영상이 좋았어요 쫄깃쫄깃한 느낌이랄까 완급조절을잘하신거같아요~  오랜만에...,10
486,첩보물이라 내용전개가 빨라서? 이해가 완벽힌되진 않았지만 지루하지않고 긴박하게 몰입해서 봤습니다. ,10
487,이정재감독의 입봉작으로 매우 훌륭하다 지루할 틈 없이 재밌게 봤어요 ,8
488,역사를 알고가면 진정 빠져드는 영화!! ,10
489,이정재 감독의 첫 연출작이 올 여름 텐트폴 영화중 가장 만족스러울지 몰랐습니다. ,9
490,영화 초반부부터 결말이 보이는게 아쉽지만 비상선언보단 낫더라. 억지는 보이지않으니. 다만 너무 매끄럽고 단조롭고 뻔한 스토리인게 아쉬움.. ,7
491,여름 영화중 최고임 재밋어요 바이럴 아님 ,10
492,올 여름 한국영화 4대장중 1등 ,9
493,여름 한국 영화들의 최종 승자는 헌트가 아닐까... ,8
494,이정재의 감독 데뷔작이라는 게 믿기지 않는다. 여름 4편의 기대작 중 가장 좋았음. 고문 장면 많아서 가볍게 보기는 힘들 듯. ,8
495,생각보다 몰입도 있고 재미있는 영화 ,7
496,숨죽이면서 계속 봤는데 너무 재밌었어요. ,10
497,이정재 배우의 첫 감독작 성공적이었다고 생각합니다. 국내 TOP 배우인 이정재 & 정우성의 케미 역시 돋보였습니다.^^ ,8
498,연출은 괜찮았는데 초반에 따라가기가 약간 힘듦. 외국배우 대사엔 자막이 필요할 듯. ,7
499,정말 오랜만에 평점 남깁니다.감독 이정재를 응원합니다. ,10
500,확실히 국민배우의 감독입봉작에 평가가 지지적이고 관대하네... 연출이뭔가 중구난방이고 작위적인데도많고 초반에 지루하던데 평점에 속은기분ㅜㅜ 다들 칭찬일색일정도는 아니던데... 물론 발전가능성이 많고 앞으로를 응원합니...,6
501,첨엔 뭔가했는데 갈수록 나무나 흥미진진 ,10
502,막 재미있는 줄 모르겠음 근데 또 재미없는건 아님 ,8
503,생각보다 잘 만들어서 놀람 ,9
504,한국 영화도 자막이 너무 필요해요 무슨 말 하는지 잘 안 들림 이정재 배우 연기도 잘 하는데 감독 데뷔도 성공이네요 ,8
505,이 영화가 이정재 감독의 입봉작이라는 것이 놀라울 따름 ,7
506,"둘이 어찌 그리 똑같이 목소리깔고 한표정일까? 홍콩느와르를 너무나 베끼고싶은 이정재 거장감독님, 아픈 현대사를 꼭 이런 식 신파에 팔아먹어야 하나요?! ",1
507, 발음이 정확히 잘 안들려서 자막이 있으면 좋겠어요 ,8
508,"그냥.... 그냥.... 그렇더라.... 그냥.... 뭐 흉내낸 거 같더라... 밀정 스토리 베끼고, 인맥동원해서... 시간 때우고... 황정민은 왜 나온거지? ",6
509,좌파영화들 뿐이없네ㅡㅡ ,1
510,북한 스파이가 밝혀지는 반전 이후에 내용이 완전 산으로 갔다 북한 온건파 간첩은 남북 전면전을 막기위해 전두환을 보호하려하고 광주진압군 출신이어서 그 참상을 목격했던 남한 안기부 요원은  전두환을 죽이려고해서 서로 ...,1
511,"오랜만에 재밌게 영회늘 봤어요이정재 배우님이 연기뿐만 아니라 감독까지 재능이 있으시군요정우성, 이정재 배우님 덕분에 안구정화 제대로 했습니다두 분의 연기도 너무 좋았어요 특별출연하신 연기파 배우분들이 많아서  보는 ...",9
512,자막 좀 ... 안 들려요 ㅜ ,6
513,"화려한 액션, 잘 나온 각본!! 올해 본 한국 영화 중 손에 꼽을 정도로 수작이라고 생각합니다. ",7
514,진짜 너무 재미있었어요!! 액션도 스토리도 연기도 모든게 완벽했다고 말하고 싶습니다’ ,10
515,내용 편집 촬영 연기 뭐 나무랄때가 없네요 ,8
516,영화 내내 긴장감도 좋고 액션도 좋았습니다. 영화 예고편 정도만 보시고 다른 정보들은 찾아보지 않고 영화를 보시면 더 재밌게 보실 수 있을 거예요. ,8
517,어처구니가 척척 걸어갑니다~ ,7
518,,10
519,기대 이상으로 재미있었고 생각보다 탄탄한 짜임새에 이정재 감독 다음 영화가 기대될정도 ,8
520,재밌는데결국 민주화를 외치며 전두환을 몰아낸 세력을 북한과 엮은꼴... ,1
521,오랜만에 영화관에서 본 영화였는데 티켓값이 아깝지 않은 영화여서 정말 만족했어요 ,10
522,생각보다 괜찮은 영화 베드로 나쁜놈 ,8
523,바로바로 이해하기 힘든 스토리 흐름이나 발음이 잘안들리는부분이 별로였어요액션이나 연출은 괜찮은 영화였습니다 ,6
524,너무 존잼ㅠㅠㅠㅠ!! 재미없을까봐 걱정했는데  괜한 기우였음!!ㅎㅎ정말 너무 재밌게봤슴당!ㅎㅎ ,9
525,기대보다 훨씬 더 재미있었어요. ,10
526,올해의 신인감독상은 이정재로 확정~ ,9
527,배우의 감독 데뷔작이라 기대안했는데 굉장히 재밌게봤습니다.. 긴장감의 연속.. ,8
528,재밌게 잘 보았슴다~ ,7
529,ㅤ ,6
530,"젊어서도 그렇게나 빛나던 두 배우가 근사하게 늙어, 이렇게나 팽팽하게 영화를 이끌어나가는 걸 보는 것이 너무 좋았습니다. 영화는 어?? 어..? 어???! 하며 끝도 없이 질주했고 눈을 떼기가 어려웠고 절박하고 가슴...",10
531,재밌습니다. 이정재 첫 작품이라는게 믿기지 않을 정도... ,10
532,스크린 속으로 빨려들어갈 뻔 했음 영화 보고나서 정우성 필모깨는 중 ,10
533,재밌어요 ,10
534,뻔할것같은 영화에 뻔하지않은 전개 ,10
535,정치색진하고무색무취노쨈 ,1
536,첩보 액션 스릴러의 진수 ,8
537,올~ 이정재.. 첫 작품 꽤 좋았어~ ,8
538,헌트 재미있게 잘 봤습니다 재미있게 잘 봤습니다 ,8
539,첫 작품이다보니 기대 하나도 안하고 봤는데 생각보다 훨씬 재밌었음 차기작도 기대됨 ,10
540,연기자의 첫감독작이라 기대는 안했는데 기대이상이네요. 다양한소재의 다음작품 기대되네요 ,10
541,익숙한 영상인듯 하면서도 예상은 전부 빗나가게 하는 이야기가티켓비용이 아깝지 않은 영화엿어요 ,7
542,"기존과 다른 신선한 스토리의 각본도 좋고 연기,연출 다 좋았어요! ",9
543,재밌게 보고 옴. ,8
544,꽉 찬 영화! 앉아 있는 내내 몰입되는 첩보물 ,9
545,청담부부의 치고박고 싸우는 영화! 재밌게 잘 봤어요~ ,9
546,"이정재와 정우성의 투샷!시원한 액션으로 여름 잘 보냈어요!이정재 감독님, 응원합니다!!^^ ",9
547,"멈추지 않는 폭주기관차에 탑승한 느낌을 주는 전개, 끊임없는 반전과 클라이막스에서의 배우들의 연기와 액션, 엔딩의 여운까지 올해 본 최고의 한국영화이다 1번보고 2번보면 또다른 재미가 있다. 이정재 감독 신인감독상 ...",9
548,아 이정재 감독님 잇뽕 추카추카 ,10
549,첩보액션물로 할리우드와 견주어도 손색없눈 영화였음 ,8
550,완전짱~~~~!!!! ,10
551,중간 까지만 재밌다 ,6
552,"마무리가 조금 더 좋을수도 있었던 영화라 생각하지만, 러닝타임 내내 정말 깊이 빠져들어 재밌게 감상했습니다 ",10
553,아주재밌게봤어요 ㅎㅎ ,10
554,기대안하고 봤는데 생각이상으로 제밌네요. ,9
555,몰입도 최고! 정우성 이정재 투샷이라니... ,10
556,기대가 높은 상태에서 봤는데도 재밌었어요!특히 특출 분들 중 눈에 익은 유명한 배우 분들이 많이 나와서 그것도 하나의 즐길 거리였던 것 같아요! 벌써 3번 봤는데 볼 때마다 몰입하는 시각이 달라져서 더더 재밌어요 스...,10
557,감독 입봉작이라고 믿기지 않을 만큼 연출도 좋았고 연기들도 좋았어서 재밌게 봤음 ,8
558,지루할틈 없이 흥미진진하게 봤어요 빠르게 진행되고 사건도 많고 복잡해서 두번봐야 할거 같아요 ,8
559,쉴새없이 이어지는 액션이 시원시원하네요. ,9
560,잘봤어요 이정재 능력있넹 ,10
561,오늘 내내 스토리 여운이 남아 한 번 더 보러 가야겠어요.한 번만 볼 영화는 아니라는 생각이 드네요. ,8
562,연출의 고생이 눈에 보인다 이 영화는 많은 것들이 있어서 두번째 볼때 인물들의 심리를 파악하면서 보면 더욱 재미있을듯 ,8
563,이야기도 액션도 아주 훌륭함 ,10
564,기대보다 재밌음 ㅇㅇㅇ ,10
565,1.이정재가 감독으로서의 전설의 시작2.필모와 인성이 안되었다면 이러한 캐스팅은 힘들지 않을까?라는 믿음3.극본을 이정재가 썻다고 믿을수 없는... 아니 단순 흥행배우는 감독 또는 극본은 그저그렇지...라는 고정관념...,9
566,액션영화 그닥 좋아하지 않던 저에게 흥미를 끌게해준 영화 ,10
567,이정재 감독의 새로운 발견!!! 정우성과 이정재 연기 합이 매우 높다. 액션 드라마 역사 영화를 잡음없이 만들어낼 수있다니. ,8
568,까메오 찾는 재미부터 영화도 다 재밋었어요. 잘생긴 배우들이 나와서 지루해도 재밌었을텐데 영화 자체로도 재밌어요 ,10
569,감독이 이정재가 아니고 다른 사람이었다면 이렇게까지 성공할 수 있었을까? ,7
570,자막이 시급하다 그리고 그게 끝 ,5
571,시대상의 아픔을 간결하고 스피드하게 잘 표현 하였습니다 ㅠ ㅠ ,10
572,정말 좋았습니다. ,10
573,생각보다 재미 있음..추천 ,8
574,잘봣습니다 ..고심한흔적이느껴지는영화입니다 ,9
575,저는 좀 지루했어요. ,6
576,올해 제일 재미있게 본 영화 ,10
577,연기뿐 아니라 연출까지 대단하다! ,9
578,정말 오랜만에 시간가는줄 모르고 본 대만족한 영화. 나쁜놈은 없다. 오직 전대갈 하나만 나쁜놈 ,10
579,조금 엉성한 느낌은 있지만 무난한 합격점을 받기엔 충분했던 감독 이정재의 입봉작 ,8
580,거짓말 하나도 안보태고 재밌습니다 처음 인데 연출력도 훌륭합니다 ,10
581,기똥찬 데뷔작.. 이정재는 못하는 게 뭐냐 ,10
582,이정재배우님정우성배우님최고의영화입니다 ,10
583,괜찮은 스토리에 신선한 연출. 괜찮게 본 작품이네요. ,8
584,감독 데뷔작이라 하니 첫술에 배부를 수는 없겠지만 평점에 비해선 그닥...무엇보다도 이 영화엔 자막을 넣어줘야 할 듯 ㅎㅎ  앞으로 더욱 발전하길 기대하며 ,6
585,대사가 너무 안들려요 ,6
586,반개도 아깝다. 정우성영화는 레알 믿고 거를수밖에 ㅜㅜ ,1
587,그냥 군사정권 악마만들기 영화였음. 증거도 없는 고문장면만 와장창 보여줌 쓰레기 영화임 ,1
588,대사 잘안들리는 단점이있지만 볼만합니다 ,8
589,댓글 모두거짓말... ,1
590,보고 후회함 111122223333 ,1
591,내용이 좀 짜증나게 어가지로 반전만들어 놓음. 정신없고 너무 허구임.. ,1
592,뭔가 산만하기만 하다가 끝나는 영화 ,2
593,지루해서 다시는 이정재 각본 영화 안봄 사람들이 다 너무 지루해서 심했음 보는 내내 짜증 끌어올라는 첨부터 끝까지 추리 같지도 않은 추리로 총질만 해대는 영화 ,2
594,와 진짜 진심 별로...돈아까움... ,1
595,해외평이 정확합니다 초반 알바+바이럴에 속지 마세요 ,1
596,언제까지 전두환을 악마로 묘사해서 선동하는 영화 제작할거냐? 한국영화가 이런식으로 나가니 발전이 없는거야. 부끄러운 줄 알아야지 ,1
597,나 처럼 스토리 와 검증된 팩트 를 중요하게 여긴다면 영화보단 변희재님 미디어 워치를 시청하는게 ... ,1
598,별로임 내 시간이 아깝다 ,1
599,이정재 정우성 얼굴 보느라 내용이 기억이 안나요두 분 부디 오래가세요 ,10
600,"즐겁게 봤지만, 배경상 고문, 살해, 총격, 폭력 장면이 끊임없이 나오므로 주의가 필요합니다.개판인 조직이 가감없이 개판으로 나오는것도 좋네요. ",10
601,결국엔 조커 게임이 아닌 신념의 싸움. ,7
602,다른 곳을 바라보는 다른 두 남자가 같다고 착각했을 때 ,8
603,화려하고 통쾌한 액션신 좋았습니다. 와우!! ,10
604,어쭙잖은 메시지 or 신파 없어서 좋다. 목표가 뚜렷하다. ,6
605,진짜 재미있습니다! ,10
606,"만만한 게 박정희, 전두환 ",1
607,"또 언제나 단솔 소재인 .... 전라도...광주...5.18...전두환...   <  진짜  전라도, 광주, 5.18. 전두환 아니면 마땅하게 만들 영화가 없나? ㅠ ",3
608,대사가 잘 안들려서 집중하면서 봄 영화는 재밌어요 ,7
609,청각을 폭행 당하는 것 같더군요.자막이 있으면 한 번 더 볼 것 같긴 하네요. ,6
610,재밌게 봤어요 대사 전달력이 많이 아쉽습니다. 특히 한국말 하는 외국인 배우분은 도대체 무슨말을 하는지 모르겠어요 ㅋㅋㅋ ,7
611,주연 둘의 조합이 좋았다. ,8
612,우당탕탕하고 조금 시끄러운 면이있긴한데스펙타클하고 재밌어요 ,9
613,오~두 주인공의 무게중심이 잘 맞아요. ,9
614,"동림이 누구인지 계속 추리하고 생각하는게 영화의 집중도를 높여줬구요, 모든 배우분들이 연기를 기깔나게 잘하셔서.. 캐릭터에 몰입이 확 됐습니다 다만 대사가 약~간 안 들리는 감이 있어서 초집중을 해야 들린다는..ㅜ ...",10
615,실화가 저렇게 영화에서 표현될줄이야. 멋있었습니다.꼬꼬무를 다시 봐야할것 같아요. ,9
616,올 여름 빅4중 젤 재미있었어요. ,9
617,이정재 감독의 첫 입봉작이라서 어떨지 궁금했는데 만족스러웠습니다고문 장면도 너무 잔인하지 않아 보는데는 힘들지 않았어요결말 부분이 여운이 남아 다시 한 번 더 보고싶습니다 ,8
618,연출 연기 좋아요 재밌어요 ,10
619,너무 뻔하고 바이럴이 너무 강합니다:) ,1
620,대사가 잘안들림무슨내용인지ㅠ잘모르겠음 ,4
621,후반부는 좀 황당하지만 초중반의 즐거움은 확실하다. ,7
622,"올해 본 최고의 작품중 하나입니다. 23년만에 스크린에 같이 등장한 정우성과 이정재는 어느덧 청춘스타에서 중년의 멋진 남자들로 변모했으며, 감독으로써 능력을 충분히 보여준 이정재의 연출력은 기대 이상이었습니다. 그리...",8
623,잘 봤습니다. ,7
624,박진감.긴장감.호기심충족.조금 과한 총격신이 용서됨 ,10
625,일제시대 밀정보는 느낌. 서로의 톱니바퀴가 어긋나지만 않았어도.. ,9
626,이정재 감독님 다음 작품도 기대됩니다 ,8
627,"극찬 받을 만한 작품이 아닌데, 극찬 평점 범벅인건 진짜로 역하네요. ",1
628,비상선언보고 속상했던마음이 다 풀어질 정도로 좋았어요.입봉작을 이렇게 잘 만들다니.. 두주연배우들의 불꽃튀는 연기가 압권이에요 ,9
629,천만도 충분히 들어올수 있을거 같은데 표값이 많이 올라서 그런가 흥행속도가 약해서 아쉽 ,10
630,신선해 보이게 만드는 능력에 놀라움. 막이 치달을수록 목적이 흐릿해져 가는 것은 아쉬움 ,7
631,이번여름 최고의 영화가 이정재가 감독한 영화일줄은 상상도 못함 ,9
632,마지막이 아쉽긴 했지만 초반부터 중후반까지 긴장감있는 몰입감은 대박이였음오랜만에 재미있는 한국영화 본거 같다 ,10
633,"그냥 오락영화로 봐도 충분하고, 시대적 배경을 자연스럽게 넣은 부분들이 있는데 굳이 배경지식 없이 봐도 무방합니다. 배우들 연기는 최고고, 이렇게 멋있어도 되나 싶은.. 아무튼 올 해 나온 한국영화 중에서는 최고지 ...",9
634,이정재 감독의 데뷔작이라니 놀랍네요 ,10
635,이정재 배우님의 성공적인 감독 데뷔작인듯 합니다..다소 무거운 분위기의 내용이였지만 지루할 틈 없는 전개와 액션신이 인상 깊었으며 스토리도 나름 탄탄했다고 생각됩니다 손익분기점은 충분히 넘고 흥행 성공 가능할거라 예...,8
636,비교적 짧은 시기에 있었던 많은 사건들을 잘 엮어놓은 첩보판 포레스트 검프? 모두 살짝씩 비틀기는 했지만 실제 있었던 사건들인데 그 인과관계를 줄줄이 엮어 놓았어요 ,10
637,정말 기대했던 작품이었던만큼 재밌게 관람하였습니다. ,10
638,기대보다 재미있었습니다 80년대 현대사를 숙지한다면 더 재밌게 볼 거에요 두 배우 연기도 볼만합니다 ,8
639,감독 데뷔작으로는 준수하게 만들어 졌다. 특히 액션 장면들이 인상적이었다. ,7
640,한국인을 위한 영화.. 재미있게봤습니다 ,10
641,시나리오 자체가 탄탐함이정재가 감독을 욕심냈는지 알겠음초반에 산만한 구성이 아쉬움 ,8
642,"갑자기 낮은 평점이 초기화되더니,  고평점으로 전환됨. ",2
643,중년 둘이 뭐하냐얼른 키스 안하고 ,8
