,Review,Rank
728,첫장면부터 창조된 자연의 조화로움과 익숙한 음악..뭔가 뭉클하면서 시작.무파사가 죽을 때는 너무 맴찢..이 영화에 요소요소 교훈적인 메시지가 많아서 힐링되었고 보고나서 또 그리워졌다. ,10
729,실사 영화에서 만화처럼 표정을 그려냈다면 오히려 거부감이 들었을 거 같았는데동물이 할 수 있는 최대한의 감정 표현을 과하지 않게 표현해서 훨씬 몰입감 있었다. ,10
730,심바는 역시 심바였다. OST는 역시 OST였다.실제적인 모습에 지리긴 했다. ,10
731,"어릴때 애니메이션처음접해서 걱정도 많았는데, 괜히 걱정했어요. 영상이너무 예쁘고 다시봐도감동 ㅠㅠ ",10
732,최고가슴이벅차다바바리치와와 ,10
733,아프리카 여행한 기분~아이들과 방금 보고 왔어요~재미있게 봤어요~ ,8
734,"CG정말 놀랍네요, 별로라는 후기를 먼저 봐버려서 기대를 하지않았고, 나름 재밌게 잘봤네요 ",8
735,사랑해 심바야ㅠㅠ 우리심바 ,10
736,"어렸을때 애니로 많이 봐왔었던 영화여서 이번 라이온 킹이 너무 기대되었어요. 예고편에서 비욘세 노래가 나오는데 너무 멋있더라구요.!!너무 재미있고, 슬픈장면도 있었고 역시 기대 이상으로 짱!! ",10
737,디즈니 애니메이션 라이온킹으로  감동받았던 세대라면 감회가 남다를듯해요. 세상이 정말 좋아져서 만화 속 심바가 상상처럼 진짜 사자모습으로 말하고 달리다니요. 티몬과 품바는 말할것도 없지요. 씨지도 좋았고 원작인 애니...,10
738,아이들도 저도 너무 재미있게 봤습니다오프닝보는데 추억물씬 ㅋㅋㅋㅋ ,10
739,재밌기만 하구먼 ㅉㅉㅉ ,10
740,머 애니와는 다르게 표정이 안들어난다 머다 하지만 전 실사화의 웅장함이 좋았습니다. ,10
741,리얼이라  다름  잼남~♡ ,10
742,대박ㅈ이네여^^ 그냥 말이 필요없어요 ,10
743,품바가 완전 씬스틸러네요 ㅎㅎㅎㅎ 너무 재밌게 봤어요 ,10
744,"CG를 넘 잘 만들어서인지 말을 하는게 어색하게 느껴졌는데, 계속 보니 또 적응되서 잼있게 보고 왔어요. ",8
745,꿈과 동심 세계ㄹ를 갔다왔어요 ㅎㅎ ,10
746,오프닝만으로 티켓값 뽑았다. ,8
747,난 원작보다 좋았다. 표정 잘 읽어지던데. ,10
748,와 오프닝시퀀스 진짜 소름돋고 나이드니 무파사의 부성애가 보이네요ㅠㅠ ,10
749,"예고편만 봐도 실사화가 리얼하게 된 걸 알텐데 다큐같다, 너무 진짜같아서 이상하다는 평을 이해할 수 없음;; 동물에 대한 애정이 없다면 추천하진 않음. 난 너무 재밌게 봤고 장면 하나하나가 좋았음. 라이온킹에 향수가...",10
750,어릴때 보던 장면이 새록새록 다 떠오르네요 세월이 흘렀음을 느껴요 ㅜㅜ ,10
751,장면 하나하나가 말하고자 하는 의미가 보이면 그 어떤 영화 보다 크게 느껴지고 그냥 보면 그저 그럴것입니다 ,10
752,재미없다고 하던데 생각보다 재밌었어요 ,10
753,영상미도 노래도 존좋ㅠㅠ감동... ,10
754,초반엔 기술력에 놀라웠고 중반부부턴 쏟아지는 감동과 소름 돋는  음악들..또 보고 듣고 싶습니다 ,10
755,그때그기분 그느낌 그추억 그감동 ,10
756,명곡 circle of life  삽입한 영화도입부는 웅장하고 감명입니다 ㅡ ,10
757,무조건 보세요 진짜 재미있어요 2시간동안 무표정이라는게 함정 ,10
758,생각보다기대이상임ㅋ ,10
759,당근 10점 빳따죠 OO ,10
760,마치 동물들이 연기하는듯한 착각이 들 정도 ,10
761,추억을 되살리며 재밌게 봤습니다 광할한 대자연에 압도당하고 섬세한 cg에 감탄하고.. 원작 속 스카 목소리의 제레미 아이언스가 역시 명불허전이네요 bbb ,10
762,그냥 다른 말 필요없이 재밌다 ,10
763,아프리카에 온 듯한 느낌이 들었던 두시간입니다. 잘 봤어요! ,10
764,보는 내내 추억이 방울방울 했네요. 실사판인데도 등장인물 표정을 살린 부분이 가장 인상적이었어요. ,10
765,평점에서  다큐멘터리 같다하고 별점도 안 좋아가지고  안 볼까 하다가 걍 봤는데  완전 소름 돋았고  사운드에 가슴 벅차오름 !!!! ,10
766,재밌게 잘 봤습니다. ㅎㅎ ,10
767,CG가 정말 대단하다. ,9
768,동물이 표정연기 부족해서 겁나 욕먹네~ 동물 실사에 표정씨지넣으면 징그러워서 더 욕할거면서~~ 라이온킹 실사판이 너무 다큐처럼 느껴지면 뮤지컬을 추천~ 비싸다고 욕하지말고 ,10
769,기억에 남는 건 봉주르 마드모아젤! 센스있었던 것 같음~~ㅋㅋ 거의 애니랑 똑같았구  실사두 평이 별로라 기대를  안해서 그런가 ㅋㅋ 생각보다 좋았음!! ,8
770,모션이 조금은 어색하겠지 싶었는데 전혀 그렇지 않은점은 경이로웠음. 근데 그런 극도의 리얼리티가 독이된 측면도 없지 않음. ,8
771,근데 더 엄청난 반전은 영화끝난 후 검색에 있었다 이영화감독 해피호건임 ,10
772,오프닝부터 소름이..집에서 본다면 덜하긴 하겠지만 평점이 이렇게 낮다니..!?ㅡㅡ난 다시 볼 예정이다. ,10
773,큰기대 없이 봤는데 대박 존잼 ,10
774,역시 기대이상였습니다~!!  멋있고 잼있었어요 ,10
775,진짜 처음시작부터 끝까지 너무너무 감동적이구 울컥하구ㅠㅠ아기심바너무귀엽구 진짜ㅠㅠ계속 눈물바다흑흑ㅠㅠ ,10
776,"아니, 이 영화를 보고도 저런 평점을 줄수있다니..도대체 뭘 기대하고 봤길래?10점 안줄수가 없는 영화인데 ",10
777,주책이다 나이먹었는지 눈물만 나오더라 ,10
778,평만보고 고민한 나를 매우 쳐야함 ,10
779,디지니 애니 실사중 최고의 작품 입니다. 다른 작품 다수가 변형되어 어릴적 추억을 해치는 부분이 많았는데 라이온킹 넘 잘살려 주어 좋았습니다. ,10
780,걍 보세요 최고임 품바 진짜ㅋㅋ ,10
781,애니만큼이나 나는 이 영화를 평생 사랑하게 될 것 같다. ,10
782,삶의 순환이란 주제의식이 원작보다 짙어진 느낌이 좋았다 ost 평이 별로여서 기대감 낮췄는데 기대이상. 심바가 돌아갈때 나온 새로운 곡도 임팩트있어 좋았다ㅠ 표정표현은 아쉬웠지만 몰입에 방해되는 정도는 아니었다 무파...,10
783,CG가 너무 현실적이여서 1점 주는 머가리는 도대체 무엇... ,10
784,와 역시 라이온킹은 최고다!감동그자체꼭보시길. ,10
785,어렸을때 보고 다시봐도 감동적이고 멋진 영화였습니다~! ,10
786,"정말 너무 감동이였어요,, 사람들 평보고 안봤으면 큰일날뻔,, 어떻게 그렇게 똑같이 실사판을,,,, 보는내내 나의 유년시절이 떠오르고,, 무파사,,, ㅠㅜ ",10
787,심바 품바랑 티몬이랑 클때 울었어요. 마음이 뭉클해지고 재미도있고 3D로보니 굳 ,10
788,이토록 아름다운데....뭐가 문제인지요 ,10
789,아 최고다 내 인생 최고의 애니메이션을 어떻게 똑같이 실사화했지? 진짜 너무 대단하다 ,10
790,너무 재밌고 2시간이 훌쩍 지나갔네요 ,10
791,일단 비쥬얼 굿내용은 15년전과 동일..1994년에 보고이번에 15년지나고 또 봐도 감동(내용을 알아도)얼마나 대단한 영화들을 보시길래 이런 명작이 7점이하인지 7점까진 개인호불호 인정해서 그럴만하나 왠만한 우리나라...,10
792,오늘 보고 왔는 데  댓중에  동물들 감정표현이 잘 전달안댄다하는데  동작이나 눈빛에서 표현을 했다는점에서 감탄했음ㅋㅋㅋcg라는게 너무 놀라웠음  굿~!!^^ ,10
793,"동물들의 정글과 사람들의 정글이 한치 다름이 없네요..부끄럽고, 미안하네요..많은 생각과 결단을 내어봅니다.너무 아름다운 영화입니다.*^^* ",10
794,안좋은평이 보여서 기대안하고 봤는데 넘넘 재미있게 봤어요 대사도 의미심장하구요 단체로 봤는데 같이 본 분들 다 평이 좋아요 ,10
795,"연출, OST 모두 감동ㅠㅠㅠ ",10
796,"너무 현실화 된게 조금 아쉽긴 하지만, 충분히 훌륭했어요. ",8
797,ost 너무 감동 ㅠㅠ 시작하자마자 전율이 ... ,10
798,최고 ♡  실사판도 최고네요 역시 ,10
799,"알라딘, 토이스토리도 좋았지만 라인온킹이 단연 최고였다. 영상과 ost의 조화는 감동 그 자체, 애니, 인터네셔널 뮤지컬을 2회 관람했지만 오프닝은 이영화가 1등. 동물표정이 작위적이지 않고 자연스러워 보기에 거슬리...",10
800,영상미만으로도 만점이 아깝지 않은 영회 ,10
801,이런 영화를 만들어 주셔서 감사합니다. ,10
802,좋았으나 원작 애니메이션을 따라가진 못했음 ,7
803,좀 실망하긴함 어렸을적 내 최애 영화였는데 처음시작할때 노래나오자마자 뭉클해서 눈물고였는데 잠깐 이었음... 왠지모르게 지루하달까 내용을 아는건 알라딘도 마찬가지였는데 알라딘은 끝나고 ‘아 재밌었다’ 였고 라이온킹은...,6
804,영상미가 아주 좋았다. 하지만 표정의 변화가 없어서 개인적으로는 애니메이션 추천...한번쯤 봐도 좋은 영화. ,9
805,동물 실사영화라 그런지 표정이 애니만큼 표현되지 못해서 아쉽지만 어쩔 수 없다 생각. 그래픽 훌륭했고 감동을 되새기기엔 충분했다. 스카 장면이 백미라 기대했는데 생각보다 어두운 색채에 밋밋했다. 비욘세 너무 애드립하...,8
806,너무 리얼해서 오히려 감정 전달이 잘 안되고 내셔녈지오그라피 다큐를 보는 느낌이랄까. 추억으로 커버 치기에도 재미와 감동 다 별로였음. ,4
807,돈이 아깝지는 않지만 아쉬움이 많은 영화... 애니에서 느낄 수 있었던 풍부한 감정들을 느낄 수 없었음 원작에서 좋아했던 연출들이 실사에선 많이 나오지않음 ㅜㅜ 그래도 영화가 실사로 나온거에 감사하고.. 또 제약이 ...,6
808,"아주잘 만든 봉제인형이 노래하는 느낌, cg라 그런지 감정표현이 너무 어색했음... 그리고 배역과 어울리지 않는 듯한 목소리. 기대안하고 봤는데도 그닥 재밌는지 모르겠음. 심지어 졸렸다 ",6
809,실사답게 고퀄리티이나 뭔가 아쉬움.. 더빙이나..ost나 ,6
810,오프닝부터 장난아님..4dx로 봤는데 지루하지도 않고 재미있었지만 실사라 그런지 동물들 표정이나 감정표현이 아쉬웠음...그래도 이렇게 다시 나와준것 만으로도 감사함니다 디즈니..ㅠ ,10
811,볼만합니다 디즈니는 봐야죠 ,10
812,믿고보는 디즈니 영상미가 훌륭 ,10
813,어릴때 봤던 라이온 킹의 희미한 기억이 생생하게 눈 앞에 펼쳐지는 놀라운 경험. 나이 먹어서 보니 눈물이 난다. 심바야 행복해 ,10
814,진짜...최곱니다ㅠㅠㅠ 어렸을 때는 그저 스토리로만 보던 애니매이션을 15년 뒤 아버지와 같이 보니 그때와는 또 다른 맛과 깨달음이 있네요 두번보세요ㅜㅜ ,10
815,실사로 이정도를 이뤗다는게 경이롭다.. 실사판의 웅장함이 전 더 좋네요. ,10
816,옛날 추억을 불러 일으키는 향수같은 느낌 ,10
817,"실사랑 애니랑 자꾸 비교하는 분 들 TT 라이온킹 처음보는  어른들이나, 처음으로 접하게 될 요즘 세대 어린이 친구들 한테는  너무 근사 하기만 한데요.. 다들 아날로그에서 좀 벗어나자구요 ~ 그건 그냥 우리들의 기...",10
818,왜 평점이 낮지? 꼭 보세요 ,10
819,"디즈니의 익살스럽고도 재미있는 표정 연기가 안보이는게 아쉬울 수 있다만, 실사화한 것 이기에 동물들의 조그마하게 바뀌는 표정, 귀나 꼬리 몸짓으로 표정을 읽을 수 있는게 이 영화의 재미 포인트.아름다운 추억을 아름다...",9
820,"지금도 울면서 쓰는데..실사 개소리, 보는 내내 알라딘만큼 울었다..나는 그들의 무표정에서 표정이 다 보였고 나는  다 보였다. 어릴 때 코 질질 흘리던 놈이 이런 리얼리티가 이런 기술이만큼 올라올 때까지 살아온 것...",10
821,타이타닉에 버금갈만한 영화다. ,10
822,다들 실사라 얼굴에 표정이 없다하는데실사가 표정 있으면 더 이상한거 아닌가?어느정도 감안하고 봐야죠애니가 워낙 명작이지만 어릴 적 감동을느낄만 하기에 충분했던 영화였다 ,8
823,페미ㅄ님들은 당장 아프리카 가서  숫사자 참교육 시키세요^^ 아니면 니들이 돈 투자해서 하이에나퀸 (하이에나는 암컷이 리더) 영화 따로 만드셈 ㅇㅋ?  머저리같은 말만 골라서 하고있네 진짜 ㅋㅋ ,10
824,"표정이 없다는 건 생각보다 큰 부분 이었다,,그리고 스카 목소리랑 Be prepared 내놔!!! ",4
825,실사화를 하려면 당연히 진짜 동물 같아야 하는데 그림이어야 하나?? 동물들 표정이 없다고 하는데 충분히 감정 느낄수 있었음! ,10
826,"동물의 왕국 2시간 보고 왔습니다.... 느낀건 cg훌륭하다, ost 뛰어나다. 외엔... 옆사람 코골면서 자는데 저도 자고싶더라구요. ",6
827,첫 장면부터 눈물샘이 자극하는건 왜일까...단지 동물이 나오는 것 뿐인데 왜 눈물이 흐르는걸까... ,10
828,라이온킹 애니메이션 세대인데 실사판으로 봐도 그 감동이 그대로 전해졌습니다 조조영화로 잘 보고옴ㅠ ,10
829,조조로 보고왔어요. 넘 재미있게 잘 봤어요ㅠㅠ ,10
830,ㅠㅠ 눈물 펑펑 흘리고 나왔다.. ,10
831,감동도 있고 재밌고 귀엽다 ,9
832,영화이지만 사실적인 느낌이였고 자연다큐를 본듯 휴먼다큐를 본듯감동있게 봤음요영상속 대사 하나하나가  멘토링 하는것 같았어요또 보고싶네요 ,10
833,이게 그 남성중심적이고 왕도적이야기의 변화없다고 kbs에서 깐 영화입니까???? 10점 만점 ,10
834,비욘세 노래잘하는거 티내고싶어서 원곡 다망쳣네 ㅋㅋ ,6
835,불필요한것 천국이었다 ,5
836,와 생명의 순환 모든것은 돌고돈다ㅠㅠ진짜 어메이징한 영화ㅠㅠ ,10
837,실사로 보니 대자연이 웅대하고동물들의 감정표현도 디테일이살아있음~알라딘에 이은 또 하나의 명작개봉날 첫시간 조조가 무더위를잠시라도 잊게하네 ,10
838,"실사화하며, 원작의 다양한 익살스러운 웃는 개그치는 슬픈 웃는 모든 표정을 잃어버렸다. 퀴즈탐험신비의세계 또는 네셔널지오그래피 보는 느낌이다. ",1
839,진짜 이건 연기가 없는 영화잖아... 그냥 동물 다큐보는듯.. 라이온킹이 인기있었던 건 스토리도 있지만 캐릭터성도 컸는데 그 캐릭터다 그냥 동물이 됨. ,4
840,향수로 다시 본 라이온킹 재미잇었습니다 ,8
841,아이와 감동적으로 잘 봤어요^^ ,10
842,정석 디즈니의 아름다운 영상과 음악 ,8
843,가족동반 즐겁고 잼있게 밨네요 ,8
844,"원작팬으로서 실망을 금치못했다. 상황과 어우러졌던, 뮤지컬방식의 음악들도 왠 말도 안되는 기교로 분위기를 망쳤다. Can you feel the love tonight이 나오는데 가사대로 원작의 아름다운 밤은 사라지...",1
845,너무즐겁게봤어요아이가좋아하며끝까지지루하지않고봤어요 ,10
846,동물이 연기하는 동물의 왕국 ,8
847,생생해서 좋았습니다. ,9
848,아이들이  정말 좋았다고 하네요 ,10
849,실사 생각보다 재밌었음 다른나라는 완전 흥했던데 우리나란 한국영화 때문에 스크린수가 점점 적어지기도 하고 생각보다 인기가 저조한듯 꽤 재밌던데 ,10
850,"감동의 물결입니다. 한편의 다큐멘터리를 본듯한 영상.대체 어떻게 이렇게 실제과 구분을 못할 정도로 섬세하게 제작할 수 있는지 놀랍니다.원작 스토리를 알고 보면서도 그 감동은 2019년에 새롭고,이렇게 심바를 다시만나...",10
851,왜 이렇게 상영관을 줄였는지 모르겠다. 지금 상영하고 있는 영화중 감명깊고 재미있는영화인데.북미엔 알라딘보다 더 단기간에 순이익을 돌파하고 2주연속1위중. 세계 흥행중.비판만 하지말고 한국기술력으로 이런 영화를 만들...,10
852,너무 재미있었어요. 실사라 오히려 더 좋았습니다. ,10
853,두시간동안 눈과 귀가 즐거웠던 영화!!  치열하고 비정한 사자왕국을 보면서 많은 것을 느꼈어요 어린 심바는 너무 귀여웠고 성장한 심바는 넘나드 멋졌어욤? ,10
854,다들 과거와 비교하면서 평점 깎는데 원작 라이온킹 한 번도 못 본 현대 아이들이 이거 보고 인생을 조금이라도 더 진지하게 받아들이게 된다는 것이 중요하다. ,10
855,조라라라라조아조라아아 ,10
856,추억 노래 영상미 합쳐서 강추 ,10
857,재밌었어요 ㅎㅎ추천합니다 ,10
858,라이온킹너무나재밌게잘봤습니다 ,10
859,생각보다 별로라는 평이있어 기대를 많이 하지 않았는데 애니와는 다른 느낌이라 너무 좋았어요 ,10
860,나의 최애 애니매이션의 귀환. ,9
861,완전 잼있네요..456789123 ,10
862,실제와 거의 흡사한 그래픽이 인상적 ,10
863,너무좋았습니다.ost도 ,10
864,"아이들과 함께 봤는데. 좋았어요... 만화로 봤던거 생각하고 별 생각없이 봤는데, 생각보다 퀄리티도 높고 좋았습니다. ",10
865,품바가머리박치기할때웃겼다. ,10
866,어릴적 추억이 그대로어른이되어서도 감동적 ,10
867,예전생각도나고 너무재미있어요 ,9
868,아이가 보기엔 좀 길긴하지만 잘봤습니다 ,9
869,기대 이상이군요. 애니메이션과는 또다른 매력이 있어요. 2시간이 빨리 지나갔어요. ,10
870,애니메이션과 뮤지컬로 본 제게는  원작의 감동이 더 크긴합니다만  실사판으로 처음 심바와 만난 아들에게는 최고의 작품이었어요 관람후 하루도 빼놓지 않고 OST를 듣고 따라불러요~ ^^ ,9
871,너무재밌고 감동적이였어요 ,10
872,아이들과 같이 보니좋네요.영화얘기도 같이하고 동심으로 돌아간듯해서 좋고.. ,10
873,아이들과 정말 재밌게 보고 왔네요.  역시 라이온킹~♡ ,10
874,오프닝의 웅장함을 보고싶어서 보러갔는데 오프닝을 못봐서 아쉽 ,8
875,남자아이들과 보기 좋아요 ,9
876,전작을 보지 않았는데 전 재밌게 봤어요 애니매이션 재밌게 보신 분들 실사에서 애니매이션의 다양한 표정을 기대한다는게 무리인듯 싶네요 우리 아이들도 잘보고 저도 즐거운 감상했으니 만족합니다 ,10
877,진심.어쩜.너무 대단하고 고마워요ㅠ너무 잘만들었자나~동물의 왕국도 알고보니 그래픽같은거?아녀??? ㅠㅠ진짜 너무 리얼하게 잘만들었고 무엇보다 캔유필더럽투나잇 부분 너무 소름이었어요.너무 아름답자나ㅠ고마워요ㅠㅠ디즈니ㅜ...,10
878,전반적으로 재밌었다! ,10
879,티몬과 품바 ㅈㄴ귀엽다 ,10
880,이렇게 잘만들어진 영화를 인터넷 찌라시들말만 믿고 안본 내가 한심한...정말 최고였음표정연기도 괜찮고 애니에서는 볼수없었던 역동적인 장면도 많고 늦어서 4dx를 못본다는게 아쉬움... ,10
881,8.71???? OO 염병들을하네 이런영화는 10점이 되어야 한다 하긴 다들 한국것들이야 개돼지라 뭘 알겠냐ㅎㅎ 어벤져스나 존나게 처봐라 ,10
882,너무재밌어요 무조건 보세요 ,10
883,어릴때 비디오로 수십번은 돌려봤던것 같은데.. 다시봐도 새롭고 재밌었어요 ,10
884,너도나도 까니까 나도 한번 까서 조회수 챙기자는 헬조선 유튜버들 반성 좀 하셈 ,10
885,7세아이가  좋아해요 3세정도 어린아이는 사자가 표효할때 울면서 나갔어요 ㅠ ,10
886, 아쉬움이 있지만 실망스럽진 않는듯. 잘 만들었어요 진짜. (이제 다 ,10
887,아이와 함께 좋은시간 보냈어요영화 좋습니다 ,10
888,진짜사실적으로잘만들었어요!! ,10
889,오프닝엔딩 수미상관에 소름돋았다...  꿀잼 ,10
890,엄마랑 이모 보여줬는데 넘넘 재밌으셨대용 ,10
891,실사와 리메이크를 이보다 잘하긴 힘들다만 스카는 좀 아쉽다 ,10
892,솔직히 애니보다 괜찮았음 ,10
893,"무조건 보라고 말하진 않겠다. 근데 영화 보는내내 타임머신을 타고 그 시절로 돌아간 느낌, 그 벅참, 라이온 킹안에서 느낄 수 있는 인생, 사람관계등등 얻을 게 참 많은 영화였다. 다만 흠은 너무 실사라 표정을 읽을...",10
894,나름 뜻깊은 영화였어요인간세상을 보는것 같았어요ㅠ ,10
895,엄마랑 같이 보고왔는데 저에겐 정말 큰 인생의 깨달음을 얻게 해준 영화였어용 ㅎㅎ 어렸을때 봤던 라이온킹을 커서 보니깐 완전 다름ㅋㅋ ,10
896,어릴때 보던 에니메이션보다 더욱 실감나게 잘 보았네요~~~ ,8
897,감동적이었어요 라이온킹최고 ,10
898,애니메이션 못따라간다는 평이 많은 것 같은데 저는 더 좋던데용 ,9
899,어렸을때본걸 지금본건 정말 감동 ,10
900,재미있게 잘봤습니다. ,9
901,최고에요. 아이랑 같이 봤어요 너무 재밌어요 ,10
902,애들도좋아하고 어른인 저도 재밌게봤답니다 ,10
903,너무재미있게 봤어요 ㅋ ,10
904,다시봐도 감동이에요 ㅠ ,10
905,초딩은 재밌게 봤는데 6세는 잤어요ㅎㅎ ,9
906,디즈니 애니의 실사 리메이크는 역시네요~ ,8
907,아이와 함께 갔는데 익숙한 오래가 나와서  제 귀와 눈이 호강했던 것 같아요~~ ,8
908,너무 잘봤어요 ~^^  위기에 빠진 삼바를 구출하다 죽는 무파사...좀 슬펐네요. ,9
909,아들과 함께 한  영화~나름 재밌었어요~애니메이션이라 기대를 덜 했었는데 어른이 봐도 충분히 재밌어요^^* ,9
910,애들 어릴때 보여준 디즈니비디오와 장면장면이 똑같아서 좋습니다. 노래가사가 참 많은 의미를 담고있네요.  느끼고  깨우치고 실천하겠습니다. 근데 관람객 예절은 엉망이었어요. 앞자리에 사람없다고 맨발을 뻗어있는 엄마와...,10
911,"영화 두번 봤습니다 !! 두번봐도 재밌네요. 그런데 평점보니까 대체 실사에서 뭘 바라는건지,, ",10
912,진짜 재미있는데 호불호가 많이 갈리네!!! 아튼 난 혼자 한번 보고 친구랑도 봤어요!!! 진짜 너무 재미있어요!!! ,10
913,역시믿고보는디즈니~~~아이보다제가더재밌게봤네요~두시간이후딱!이었습니다^^ ,8
914,대사부터 질이 높다고느낌 ,10
915,재밌어요. 어린시절 추억이 새록 ,10
916,아기심바는 너무귀여웠고 다큰 날라는 너무 예뻤음 ,10
917,안볼려고 했는데 봐버렸습니다. 최고입니다!!! ,10
918,누가뭐래도 실사든 애니는 라이온킹은 나에게 그냥 최고의 영화다 ,10
919,"권선징악의 소소한 교훈도 주고, 가족끼리 보면 좋을 영화 ",10
920,재미있네요매우 진짜오ㆍ우 ,10
921,꼭 imax 3d로 보세요! 귀요미 심바를 더 가까이서 볼 수 있음!!! ,10
922,평점들 보고 보겠다고 맘 먹었으면 imax로 보세요. 풀 사이즈의 아이맥스에서 나오는 Circle of life 오프닝은 압권입니다. ,10
923,첫 장면부토 곧 가슴벅참을 느끼게 될거예요 . 오랜만에 감동을 받고 집에왓네요 ,10
924,이 영화 감독이 해피였엌ㅋㅋ.ㅋㅋㅋ.ㅋㅋ ,10
925,ㅠㅠ 가족끼리 봤는데 넘나 잼써요 역시 디즈니 ,10
926,애니 본 적 없고 이번에 처음 봤는데 재밌었어요 뻔한 플롯이어도 영상미도 아름답고 감동도 있던데.. 동물들 표정이 안드러난다는 평도 있는데 감정 전달은 충분했다고 생각함 사실 별 기대 안했는데 훨씬 기대이상 ,10
927,너무 재밌었어요^^ 어릴적생각이많이나네요 ,10
928,어린시절보고 잊고 지내다가 오늘 극장가서봤는데 너무재밌었어요ㅋ심바너무귀엽구요ㅋost는 역시나 그때나 지금이나 띵곡이네요!!!명작으토 남아서 앞으로 계속 사랑받길 바랍니다♡ ,10
929,라피키가 심바한테 아빠 보여준다고 하고물에 비친 자신 모습 보게 한 뒤에“아버지는 네 안에 있다”라고 할때왜때문에 눈물이 나는지. 개인적으로 명장면이었습니다. ,10
930,동물이좋아 너무좋아 ㅠㅠㅠㅡ보는내내 씹덕사 ,10
931,라이온킹의 감동 그대로였음 ,10
932,재미없다고 주변에서 그러길래 고민하다가 보고 후회하자하고 봤는데... 보길 잘했어요 ㅠ 역시 디즈니는디즈니다!!!! 누가 표정없대 ㅠ 눈빛이모든걸 말하던데?? ㅠ ㅠ ,10
933,"ost 의 감동과 전율, 삶의 철학이 담긴 영화, 아이들과 함께 봐서 더욱 행복했습니다. ",10
934,하쿠나 마타타! 넘나 멋진 단어인것 ,10
935,너무감동적이고.재미있었어요. ,10
936,짱~~~~ 심바 넘 졸귀 ,10
937,동물표정이 좀 그렇긴 해도 난 ㅈㅐ밌더라 ,10
938,어딘가에살고있을것같은 느낌.. 여운이너무진해요 ,10
