,Review,Rank
0,마블 3000만큼 사랑합니다 ,10
1,Avengers Assemble! ,10
2,I'm Ironman. ,10
3,아이언맨으로 시작해서 아이언맨으로 끝난다.. ,10
4,아스가디언즈 오브 갤럭시 벌써부터 기대됨 ㅋㅋㅋㅋ ,10
5,히어로물보고 울줄 누가알겠습니까 ,10
6,인피니티워가 10년을 무너뜨리는 영화라면엔드게임은 10년을 돌아보는 영화입니다 ,10
7,쥐가다살렸음 ㅋㅋㅋㅋ ,10
8,마지막 한타에서 쌌습니다 ,10
9,10점 안주는 사람들은 마블에 6에서900까지밖에 애정이 없는거 ... ,10
10,영화 늦게 볼 수밖에 없는사람들을 생각해서 스포 자제해주세요ㅠㅠㅠ ,10
11,토르 등장씬보다 멋있는 어벤져스 집결씬 ,10
12,고맙다.나의 20대를 채워줘서 ,10
13,"내 어린시절 11년을 즐겁게 해준 어벤져스 원년 멤버들... 마블 영화 한편 한편이 저의 초중고 시절, 울고 웃었던 추억이 되었어요. 아 눈물날거같애. 그동안 즐거웠고 감사했습니다. ",10
14,와 내가 3시간동안 화장실을 안갔어 ;;; ,10
15,가장 큰 충격은 쿠키영상이 없단거다 ,8
16,토르의 뱃살은 밸런스를 위해서라는 게 학계의 정설 ,10
17,뭐 심하게 재미있지는 않고... 한 4번정도만 봐야겠어요... 아이맥스로.. ,10
18,헤일... 하이드라... ,10
19,토르 등장씬은 마블 역대 명장면중 2위로 물러났다 ,10
20,캡틴이 행복하면 그걸로 됐어. ,10
21,하일하이드라 ㅋㅋㅋㅋ 650석 사람들 다빵터졌다 ,10
22,"자기밖에 모르던 사람은 모두를 위하고타인밖에 모르던 사람은 자기를 위할 줄 알게되는지금까지의 인생에 복수(avenge)할 줄 아는 사람, 그런 영웅들의 이야기 ",10
23,"앞으로 얼마나 더 재미있고 얼마나 더 웅장한 영화들이 나올지 모르겠지만, 2008년 아이언맨1을 시작으로 2019년 어벤져스 앤드게임까지 내 인생의 영화시리즈중 최고의 10년을 선사해준 마블에 감사합니다. 어벤져스 ...",10
24,그래서로키는어디로감? ,10
25,진짜 대박이라는말밖에 안나옵니다... ,10
26,마블 어벤져스 만세! 이제 멀티버스의 세계속으로 ,10
27,3시간에 담은 11년 마블의 역사 인정 ,10
28,<관람 전 필수사항>모든 마블시네마틱유니버스 보기 아이언맨1 부터... ,10
29,한마디만 할게 스포아니다 화장실 갈타이밍은 도쿄 그때 가라 ,10
30,I'm Iron Man. ,10
31,이 모든게 닥터 스트레인지의 엔드게임이었다는거.. ,10
32,스포하는 색히들 평생 저주 받아라 ,10
33,이 영화 제대로 즐길려면 마블 전작 다 보고 오셔야합니다. ,10
34,히어로물 뻔하다고 여친때메 이거 안보고 영화 생일봤음 상영관1개였는데 여친 나 단두명 이었음 그 넓은 영화관에진짜 존나진지하게 헤어질까 고민중임 ,10
35,마블을 대표하는 가장 상반된 두 히어로가 맞이하는 가장 서로에 가까운 결말 ,10
36,하워드 스타크와 하워드 포츠가 만날 때 너무 애잔했다.. ,10
37,자신만을 위해 살아온 아이언맨은 모두를 위해 희생하고 모두를 위해 희생해온 캡틴은 자신을 위해 선택했다 ,10
38,영웅들 한 곳에 모이는 씬에서 지립니다... ,10
39,조조예매하고 못일어났다.. ,10
40,그래서 아스가디언즈 오브 갤럭시는 언제 개봉인가요?ㅋㅋㅋ ,10
41,엉덩이는 역시 미국 엉덩이! ,10
42,솔직히 극한직업이랑 이 영화랑 같은 표값인게 말이안됨ㅋㅋ ,10
43,해리포터 마지막 시리즈 보다 더 해 이 느낌은... ,10
44,7시 처음 상영영화로 봤어요 그냥 아무말도 안하겠습니다 제가 느낀 감정을 보는 모든분들이 느꼈으면 좋겠어요 일단 보세요 제발ㅠ ,10
45,인피니티워가 더 낫다. 근데 평생 기억에남게 될 건 엔드게임이다. ,10
46,아이언맨으로 시작해 아이언맨으로 끝나는 대장정 ,10
47,시간가는줄 모르고 봤지만 액션만 기대하면 절대 안됩니다. 각 캐릭터별로 스토리를 풀다보니 액션보단 드라마영화에 가깝다고 느껴지네요.. 느낌은 예전에 다크나이트를 보고 다크나이트라이즈를 본느낌?? 4가 정말 재밌긴 하...,10
48,"3,000 love you ",10
49,진짜 마지막에 너무 먹먹햇어요... 마블팬이시라면 꼭 보셔야해요.. ,10
50,오랜 친구를 떠나보내는기분..공허하다...좌석에서 일어나자마자 그립다 ,10
51,마블의 시대에 살게 해주셔서 감사합니다 ,10
52,다음 아이언맨은 아이언맨3에나온 꼬마애구나... ,10
53,엔드게임이라는 부제는 누가 붙혔는지는 몰라도 진짜 완벽하다 ,10
54,아이언맨1부터 본사람들은 알꺼에요 이영화는 그동안 본 모든걸 보상받을 수 있는 영화라는걸 ,10
55,감히 내가 평가 할 수준의 영화가 아니다... 10점도 부족하다 별점 3000만큼 준비해줘요...ㅠㅠ ,10
56,들쥐가 양자역학기계의 버튼을 누를 수 있는 확률 = 세상을 살릴 수 있는 확률 = 1/1400만 크... ,10
57,쿠키없으니까 기다리지마세요 ,10
58,옆에 여자 입틀어막고 보더라 물론 나도 같이막고봄 ,10
59,어벤져스!!! 어셈블 ,10
60,자기밖에 몰랐던 아이언맨은 대의를 위해 희생했고 대의를 위해서만 힘쓰던 캡틴아메리카는 이제야 자신의 삶을 찾았다. 서로 매우 달랐지만 결국 닮아갔다. ,10
61,전투신 미쳤어요 진짜 영화관에서 다들 소리지르고 난리남 ,10
62,가오갤찍는 토르.. 토르 찍는 캡틴.. 캡틴아메리카 찍는 토니..페어웰 어벤져스 ,10
63,내가 마블영화에 네이버평점 이런거 안남기는데하나 확실한건 내가 마블영화보고 운건 처음이다단전에서 올라오는 그런 눈물 마치 내 11년의 만난 연인과 헤어지는데 동영상으로 옛 추억을 되돌려보는 느낌이랄까 가슴이 진정이 ...,10
64,완다개좋아3000만큼 ,10
65,???? : hail... hydra... ,10
66,마블 팬이라면 보고 기분이묘하실듯 ,10
67,그로 인해 시작된 이 시작을 그가 마무리 지었다 ,10
68,스톤이 없는 타노스는 약할줄 알았는데 그래도 좀 쎄긴 하더라 세명을 걍 갖고놀아버리네 ,10
69,타노스... 빌런 주제에 최후까지 이토록 순교자처럼 거룩하면 어쩌잔 거냐... 아. ㅠㅠ ,9
70,사실상 아이언맨4엿다 ,10
71,마지막 30분이 진짜 불태웠다....전율이.... ,10
72,난 아이언맨이다. 이거 한줄로 충분 ,10
73,너무재미있어서 눈물이난다. ,10
74,3000편만 더 만들어 주세요 ,10
75,영화보고 버거킹 갔습니다... ,10
76,대작은 대작이네요...시원섭섭하고 아쉽습니다ㅎㅎ ,10
77,cgv하계 I 열 6 번에 앉았던 새기야 봉지과자랑 맥주가 그렇게 쳐먹고 싶었냐?? 니때메 3번 볼거 5번 본다 ㅡㅡ 영화관에서 봉지과자좀 처먹지마세요 제발……… 죽이고 싶습니다 ,10
78,단독 영화였으면 8점이였겠지만 지난 10년의 시리즈의 마무리와  MCU 창립멤버들의 최고의 은퇴식으로는 10점 만점 ,10
79,2명의 죽음이 인류 절반의 죽음 보다 슬픈 것 같다. . . . ,10
80,토르한테 그렇게 하다니 ㅜㅠ ,10
81,스타크...수고햇어 ,10
82,영화 시작하지마자 인생 최대의 급똥이 찾아왔지만 화장실을 가지 않아도 됐다. 시각과 청각을 제외한 모든 감각이 멎었다고 착각할 정도로 최고의 영화. ,10
83,그래서 로키는 어케되는데? ,10
84,와 상영 시간 한 시간 더 했어도 만족했을 것 같다. ,10
85,어벤져스에 댓글 알바가 필요할까? ,10
86,영화 보지도 않고서 본 척 하고 스포 하는 애들 극혐. 보지도 않았는데 왜 자꾸 본 척 스포하는거임 관종인가??; ,10
87,타노스... 그정도 파워면 행성 하나 잡고 왕노릇이나 하면서 살아도 되는데 굳이 우주의 질서를 위해 싸우겠다며 시간과 돈을 써가며 사람 모으고 스톤 모은... 마지막까지 불한당들과 끝까지 의연하게 싸운 모습을 보면 ...,10
88,여러분 맥주가 그렇게 위험합니다 ,10
89,재밌는데 캐붕 너무 심했음 ㅠㅜ 재밌긴 재밌는데 아 햄식이 핫바디는 암묵적인 룰 아니었냐고요.... ,8
90,여러분 베댓이외에는 스포가 가득할것이니 평점은 읽지맙시다 ,10
91,닥터 인성을 재조명해야함ㅠㅜ ,10
92,영웅들도 인간이었고 삶이있었다.... ,10
93,세상에 스토리가 없다고 한 사람 진심인가? 설마 마블 영화를 처음으로 엔드게임부터 본거 아니겠지??단 한편에 마블의 모든 스토리를 관통했는데???? ,10
94,"이 영화를 보시려면 아이언맨123, 캡틴 아메리카 123, 어벤저스 123, 가디언스 오브 갤럭시 12, 토르 123, 캡틴 마블 1, 스파이더맨, 앤트맨 12,팬더,닥터스트래인지등 총 20편을 보셔야 합니다.그래야...",10
95,전혀생각지못한놈이 캡틴이 된듯... ,10
96,재밌었는데 왜 개인적으론 인피니티 워가 더 재밌는것 같이 느껴질까요? 아무튼 세대교체를 위한 영화 잘 봤습니다. 다음에 나오게 될 어벤져스가 기대되네요. ,10
97,진짜 소름이 돋음 역대급 전투씬인듯 ,10
98,방광도 울고 나도 울고... ,10
99,지난 11년간 MCU를 사랑해준 팬들에게 마치 선물과도 같은 영화.  손수건 꼭 준비하세요 ㅠㅠ ,10
100, 3시간 동안 양자터널속에 있었던 기분 ,10
101,재밌는데..진짜 재밌는데 개인적으로 인피니티 워가 더 소름 돋았음.. ,8
102,아이언맨 1 편부터 봤던 사람들은 눈물나온다 ,10
103,꼭 보십시요. 마블 팬이 아니어도 표값은 합니다. ,10
104,10대는 해리포였고 20대는 어벤져스였다 ,10
105,하워드 포츠 당신도 분명 좋은 아버지가 되었을 거예요. ,10
106,토니....그동안 고생 많았어 이제 불안해하지 말고 편안한 곳에서 맛있는거 먹고 푹 쉬어 ,10
107,아 보고나니 뭔가 가족을 떠나보낸 기분이에요 ,10
108,I...am ironman. ,10
109,미쳤습니다.. 7시 첫 영화 보고 출근하는데기분 세상 짜릿.. 보면서 두손 꼭 모으고 입을 틀어막았어요ㅠㅠㅠㅠ 어벤져스 짜릿해... ,10
110,조조로 보고와서 일하고 있는데 자꾸만  생각나고... 벅차고...  뭉클해진다. 영화가 주는 최상의 행복이 이런 게 아닐까 생각한다. ,10
111,해리포터를 떠나 보낼 때의 감정 ,10
112,아침 7시 영화 지금 엔딩 크레딧 올라가는 중.일단 모든 편을 다 보고 오시는 걸 추천. 기존 스포는 스포도 아니었음을 미리 알려드려요.화장실 한 번을 못 갔음.... ,10
113,콜라 대량 흡입금지 화장실 갈 시간이 없습니다 ,10
114,아이언맨의 심장이 따뜻했다는 증거.. ,10
115,히드라만세에서 터졌었네요 ,10
116,어벤저스의 시작과 끝은 아이언맨이다딱 이생각 밖에 안들었음쿠키영상기다리면서 이생각이 들었음(마블영화 최초로 쿠키영상없음) ,10
117,나는 아이언맨이다... ,10
118,"""그""로 시작해서 ""그""로 끝났다 ",10
119,가디언즈 오브 갤럭시3  토르 출현 할가능성높음 ,10
120,토니스타크는 아이언맨이 됐고 캡틴 아메리카는 스티브 로저스가 됐다. ,10
121,말이 필요없으니 그냥 영화관 가서 보세요. 아 참고로 이번영화는 쿠키영상 없습니다. 대신 크레딧영상 보면 다들 찡 할거에요. ,10
122,온몸에 소름만 한 10번정도 돋은듯.. ,10
123,대강 예상은했지만 포탈열릴 때 지렸다 ,10
124,내가 본 히어로 영화중 현재까진 엔드게임이 최고 였다 ,9
125,1/1400만이 쥐가 버튼누를 확률이었놐ㅋㅋㅋ ,10
126,2번 보겠습니다  아듀  어벤져스 ,10
127,진짜 10년의 시작과 끝을 너무 멋있게 보여줬다어셈블 ,10
128,아이언맨4 잘보고 왔습니다. ,10
129,'목을 쳤어야지'  '응 목따러 왔다' ,10
130,3000만큼 사랑해. ,10
131,"진짜 최고의 영화다. 마블은 천재다 이 말 밖에 안 나온다. 끝나고는 벌써 3시간이나 지나있었다는게 믿기지 않았고, 그저 눈물만 났다. 마블과 11년 동안 행복했습니다. 이 시대를 즐길 수 있게 해주셔서 정말 감사합...",10
132,이제 뭘 기다려야 하나요.. ,10
133,역시 걸복동 과는 다르네 캬.ㅎㅎ ,10
134,결국 세상을 구한건 쥐 한마리인건가..? ,8
135,아이언맨 사가라 해도 과언이 아니다.. ,10
136,쿠키영상 없으니까 친필싸인 다보면 집가도됨 ,8
137,마블 영화들 전부다 봐야지 하나하니 세세히 이해할 수 있어요.안봐놓고 지루하다 하지마십셩. ,10
138,11년간의 보상당일 아침에 본 사람들이 승리자다 ,10
139," 누군가와 같은 시간 속에 같은 기억을 공유하며 함께 살아간다는 것은 멋진 일이라고 생각합니다.  함께 해서 즐거웠고, 함께해서 영광이었습니다. 고맙습니다. 어벤저스. ",10
140,마지막 전투씬에서 완다가 염력을 이용해 타노스와 대치할때 전투씬말고 다른걸 보았습니다. ,10
141,이제 무슨 낙으로 사냐. ,10
142,토르 너무 좋아 아스가디언 나왔으면 ,10
143,어벤저스 어셈블!!ㄷㄷ ,10
144,진짜 재밌었어요 요즘 만족스럽게본 영화가 없었는데 어벤져스는 좋아하는만큼 기대한 그 이상으로 재미있어가지고 행복했어요ㅎㅎ!! ,10
145,i'm iron man으로 시작하고 끝나네ㅠㅠ ,10
146,개봉했을때 보고 이해안되는 장면이 많아서 마블시리즈 처음부터 시간순으로 다 보고 다시 보니...완전 감동..명작.. ,10
147,죽기전에 이런 영화를 또 볼수있을까? 히어로물의 장르적 한계를 엄청나게 확장시켜놓은 어벤져스 시리즈의 대미를 장식하는 최고의 명작. ,10
148,울었다 너무 웅장해서 두번본다 ,10
149,이 이상의 걸작이 뭐가 있을까 싶을 정도로 모든 것이 완벽한 영화. ,10
150,"Ironman의 iron은 '강철` 이외에도 '끝내다, 해결하다` 의 뜻도 있듯, 토니의 아이언맨은 그저 강철수트를 입은 남자가 아닌, 해결사이자 종결자였다. ",10
151,아버지의 치즈버거.. ,10
152,마블 팬들을 위한 최고의 선물 ,9
153,쿠키영상이 없다는건 이미 알고 있었습니다. 근데도 일어날수가 없었어요. ,10
154,보는 내내 오오거리고 재밌는대사 소리내서 따라하는 무개념20대 커플덕분에 영화가 더 재밌었네요.  어린애들보다 나대는 커플을 피해야할듯 싶음 ,10
155,마지막 싸움에서 지리고 아이언맨은 짠했다 ,10
156,지금까지의 모든 마블 영화가 앤드게임의 마지막 순간을 위해 제작되었다는 느낌을 받음 ,10
157,와 미친.. 꼭보세요 강추강추!! ,10
158,뭔가 허무해..근데 재밌어 ㅠ ,10
159,그냥 안보면 후회함 ㄹㅇ ,10
160,어벤져스 보러 한국오신다는분ㅋㅋㅋㅋ 일본도 26일 개봉인데 어그로 ㄴㄴ ,10
161,스포할 생각도 들지않는 영화를 보고 나온 사람들끼리 그동안의 얘기를 풀고싶어지는 영화네요 10대에 해리포터였다면 제 20대는 어벤져스로 마무리지어지는 그런 영화였어요 영화가 끝나고나서 제 속이 텅빈느낌과 꽉찬느낌 2...,10
162,마블이 현시점 최고의 제작사인듯 ,10
163,닥터 스트레인지 양반 ! 꼴랑 찾아낸 승리하는 미래가 이거였수?  더 찾지 그랬수 .어이 캡틴  .   가정 지키고 싶다는 친구 등 떠밀고 본인은 행복한 미래? ,10
164,이 영화를 굳이 하나의 독립된 영화로서 평가해야 하나? 2008 아이언맨부터 시작된 마블시네마틱 유니버스의 연계 캐릭터의 서사 액션 전부가 이 엔드게임에 녹여져있다 그리고 11년간 함께해온 어벤져스 원년멤버에 대한 ...,10
165,와칸다포에버 채드윅보스만포에버 ,10
166,말이 필요없는 최고입니다 ,10
167,쿠키영상은 없습니다. 본편에 쿠키라 할만한 이야기들을 다 풀어내고 완벽한 마침표를 찍습니다. ,10
168,로다주랑 스칼렛한테 왜이러냐 마블아...로키코인으로 깽판기원갑니다 ,10
169,히어로 영화 싫어해서 안보려다가 어쩔수없이 친구에게 반강제로 끌려가서 눈물쏟은 영화 ,10
170,할리우드가 보여줄 수 있는 기술의 정점    팝콘무비의 정수                                          그동안 마블을 사랑했던 모든 이에 대한 헌정시 ,10
171,지루하다고 하는 사람들은 마블시리즈를 다 안 본 사람들이 아닐까 싶음. 꼭!!!! 마블유니버스 영화를 다 보고 이거 보세요. 장면 하나하나 다 놓칠 수 없습니다..감동이 다를거에요 ㅠㅠ ,10
172,아임 아이언맨. 할때 눈물나옴 ,10
173,아 진짜 애들 데리고 영화보러 올거면 미리 애들한테 영화관 안에서 어떻게 행동해야 하는지 가르치고 데리고 와라. 주의력결핍인 초딩놈 때문에 짜증나 죽는줄 알았다.  애가 어리면 말도 안해 딱봐도 초등학교 5학년 이상...,7
174,"재미없다는 사람특징 : 지금까지 마블영화 제대로 안봤음, 그래놓고 지루하다 재미없다 운운, 그 거대한 이야기 이정도면 최고의 마무리 ",10
175,명작이야 닥터스트레인지가 애들 다시 돌려보낼때 진짜 울뻔 ,10
176,마블영화보면서 울컥한건 처음입니다..꼭 보세요 너무 재밌습니다! ,10
177,말이필요합니까 ,10
178,이 영화 때문에 SNS를 다 지웠습니다. ,10
179,로키는 어디로 사라졌을까? ,10
180,스포하는 새끼 올해 출근하다 교통사고 당한다 ,10
181,어벤져스다운 영화였다 ,10
182,영화다보고 화장실갔는데 영화 내용 엄청 떠들던 분들..;내가 이미 봐서 다행이지 이기적으로 살지 맙시다 ,10
183,엔드게임 한 편으로만 보자면 완성도가 떨어지지만 어벤져스 1세대의 마지막으로선 완벽했다. 토니 스티브 행복하길... 나타샤도... ,8
184,제목 그대로 엔드 게임. 대단원의 막을 내린다. ,9
185,이십대중반 아가씨때부터 애둘 아줌마까지.나의 청춘에 큰 즐거움이었던 어벤져스 사랑합니다 ,10
186,댓글 처음써봐요 어벤져스 3000만큼사랑합니다 하.. 지렸다 ,10
187,스포를 즈제하겠습니다. 너무 재밋다 정도는 아니지만 좋은 마무리가 아닌가 싶습니다 ,10
188,"누군가는 액션의 분량이 성에 차지않거나 너무 드라마가 많아서 조금 지루할지도 모르겠지만  이 영화는 단순 오락 액션물이 아니고 가상의 유니버스에서 인간 내면의 갈등과 사랑, 선과 악, 웃음,가족애, 동지애를 그리는 ...",10
189,마블 3000만큼 사랑해 ,10
190,이시대에 태어나서 다행이다... ,10
191,고마워요..사랑합니다 마블 ,10
192,가장 임펙트있는 장면 나는 아이언맨이다 ,10
193,다크나이트 라이즈랑 비슷한 느낌. 마블과 SF라는 장르에 대한 오마주와 헌사로 가득하고 깔끔하게 마무리를 지은것은 놀라운 성과이지만 그를 위해서 자연스러움이 많이 희생되었다 ,8
194,어벤져스는 모든게 완벽하다 ,10
195,밤새고  7시15분 첫상영보러왔는데 만석에놀랐고  사들고온 팝콘은  아침부터 보러오신분들께 감히 방해될까봐영화끝날때까지 손도 못대고 버렸지만 이영화를 관람했다는게 감사할뿐이다.영화야 뭐.. 말해뭐하겠어요.  지릴준비...,10
196,울었다 ㅠ진짜 눈물날만큼 재밌었다 ,10
197,소름돋는 장면과 눈물이나오는 장면 마지막 배우들의 자필 서명때 나오는 영웅들까지...! 완벽한 영화였습니다 ,10
198,어벤져스 어셈블!! ,10
199,인피니티워가 더 낫다는 의견에는 동의하기 힘드네요 지금까지의 거의 모든 마블 시리즈 영화의 풀리지 않은 떡밥들을 회수하면서 최대한 식상하지 않게 끝맺음을 지었단 점에서 조금 더 좋은 평가를 줄 수 있을것 같습니다 ,10
200,미국대장이 날라오는 외국산망치와 번개뚝배기브레이커 잡을땐 개전율과 동시에 지렸다.... ,8
201,역시 재미있었어요 ㅎㅎㅎㅎ ,10
202,재밌네요 어벤져스 엔드게임 ,10
203,MCU에서 가장 뿌리깊언던 두 히어로. 지금까지 둘이 다투는 모습을 보며 서로의 이상향이 다르다 생각했지만 실은 누구보다도 서로를 이해하는 사이였다. ,10
204,어벤져스 11년이라는 대장정의 마침표를 찍는 완벽한 마무리였다.그가 시작한 게임을 그가 끝냈다.액션씬도 마지막인 만큼 진짜 멋있고 웅장했고 스케일도 컷다.아이언맨 캡아 없는 어벤져스 생각도하기싫다ㅠㅠ그리고 타노스 당...,10
205,어벤저스가 마지막이라니 ㅠㅠ여운남네요.. ,10
206,재밌긴한데 인피니티워가 더재밌었음 ,9
207,정말 재밌는 영화인데 먹먹합니다.. 앞으로 볼 수 없다는 것 때문에요.... ,10
208,스포는 자제... 많이 울었네요ㅠㅠ ,10
209,쿠키영상없는데 사람들  안나가고 기대중 ㄷ ㄷ ,10
210,진정한 영웅은 앤트맨구한 쥐새끼임 ,10
211,보기전엔 기대됬지만 보고난후 허전하다 ,10
212,엄복동하과 엔드게임하고 관람료가 같다면서요? ,10
213,3시간 순삭 ..마지막 전투씬은 제작진들의 혼을 갈아 넣었다.... ,10
214,이시대 최고의 블록버스터.. 만들어주셔서 감사합니다 ,10
215,제발 재미있었으면한다 ;; 내인생에서 군대가기전 마지막 영화니깐 .. ,10
216,3번보고 재개봉으로 또봐도 눈물 펑펑이에요 ,10
217,어벤져스 엔드게임은 영화가 아니다 ,10
218,이번영화 주인공은 쥐다.. ,10
219,"7시 30분 영화보고 바로 쓰는 후기.말잇못...히어로 영화 특유의 액션의 짜릿함은 물론이고,재미,감동,서사 모두를 잡은 완벽한 영화.깔래야 깔 곳이 없습니다. ",10
220,타노스가 쎄긴 진짜 쎈넘이였음 최강빌런답게. 그렇게 두들겨맞고도 멀쩡히 장갑끼고 나는 필연적인 존재다 이 ㅈㄹ하는거보면 ,10
221,내 인생에서 가장 빠른 3시간 이었다. ,10
222,마블을 보면서 울게 될 줄이야.. 너무 멋있었습니다 ,10
223,"모든 영웅의 퇴장이 꼭 처절한 전투에서의 장렬한 전사일 필요는 없지 지금의 mcu를 만든 두 주역중 하나에게는 이게 가장 걸맞는 예우, 어울리는 퇴장이었다 ",10
224,정말정말 사랑하는 마블이지만.. 이게 최선인가 띠용하는 장면이 꽤 많았다 마지막인데 토르한테 꼭 그랬어야했어..? ,8
225,마블과함께한 내젊은날의 10년.. 마지막 장면 캡틴같구려 ,8
226,아이맥스고 뭐고 다 필요없다 사람들 없는데 가서 봐라  화장실 간다고 들락날락  먹는다고 우걱우걱   뿌시럭 뿌시럭   개짜증남 ,9
227,아스가디언즈오브갤럭시ㅋㅋㅋ ,10
228,모든 장면들이 다 쩔지만 진짜 중간부분에 2012 뉴욕 뽝!!!! 나오고 어벤져스 나오는 장면도 레알 소름....몇년 안된거 같은데 되게 젊어보임ㅠㅠ 엉엉 진짜 나의 10대의 마지막부터 30대까지 함께해줘서 고마워 ...,10
229,말도 못하고 봤음. 히어로물 보면서 눈물 날줄 몰랐다. 액션물이 아니라 한편의 드라마. 펑펑 터지는 거 기대하고 갔다가 먹먹해지고 왔다. ,10
230,2008년 이후 모든 마블 사가와 함께 해왔다면 만점이 응당 과하지 않다. 이제껏 어벤져스만 보면 왜 모이면 솔로무비보다 항상 아쉽나 했지만 처음으로 완전체가 모여 캡틴이 어셈블을 외치기 위해 그동안 숨죽여 왔던 것...,10
231,영화 재밌게 잘 봤습니다.감사합니다. ,10
232,완벽한 결말 이런 영화는 다시 나올 수 없을 만큼 완벽하다 ,10
233,딱 이번년도 개봉한 한국영화의 100배쯤 잼있습니다 ,10
234,명불허전 입니다  꼭보세요 ,8
235,어벤져스들 전부 소집됫을때 계속소름;;;; ,10
236,눈물난다 보내시싫다... ,10
237,잘가요 어벤져스 그동안 고생했어요 ,9
238,토니와 같은 사랑을 나누고 싶은 캡틴이야 말로 영화가 우리에게 전달하고 싶은 말이 아닐까? ,10
239,나의 토르를 돌려주세요 ,10
240,캡틴 아메리카 ..당당히 제 몫을 해냈다☆ ,10
241,토를를 왜..? 재미있긴했는데 ,8
242,마지막 전투씬은 단연코 인생 최고 3시간동안 버릴 장면이 없다 ,10
243,댓글ㅋㅋㅋ쳐보지도않고 베플되고싶어서 씹 오글거리는 댓글들 써재끼네ㅋㅋ ,10
244,잘가요 어벤져스 그동안 고생했어요 ,9
245,인피니티워가 시원한 다크판타지류 액션영화엿다면 엔드게임은 10년의 시간을 정리하는 휴먼드라마네 sf를 보고 이만큼 감동을 할수 잇을런지 시리즈물중에 어벤져스를 능가하는 작품은 나오기 힘들듯 어벤져스 어셈블 포에버 ,10
246,존잼탱입니다 꼭보세요 ,10
247,하루종일 할 수도 있어. ,10
248,정말 이건 명작이다 그러나 토르는... ,10
249,덕분에 핫도그에 마요네즈 뿌려먹어봄 ,10
250,진짜 꼭봐야합니다 평점 3000만큼 주고싶네 ,10
251,꼭 봐야 한다. 꼭. 꼭. ,10
