,Review,Rank
346,검은사제들과 비슷한느낌입니다. 공포물은 아니고 미스테리 스릴러로 생각하고 보면 재밌습니다. ,8
347,영화 호불호가 엄청 갈리네... 전 재밌게 봤어요! 호러 연출이 굉장히 세련돼고 잘찍었어요. 평범한 미스테리 스릴러는 아니고 호러+판타지쪽 장르네요. 퇴마록 느낌도 남. 개인적으로 박목사를 중심으로 앞으로 시리즈물이...,10
348,이게 불호인사람은 최소한의 생각도 하기싫은 게으른사람들인듯.곡성보다 재밌음신천지들 부들거리네 ,8
349,호감순 왜저러냐? 순 영화 이해 못하는 애들 뿐이고만.. 뭘 말하고싶은지 모르겠다는애들은 영화를 제대로 보긴 한건지ㅋㅋㅋ ,10
350,"이영화 장면과 대사에 떡밥과스토리가 담겨있습니다생각할거리도 있는영화에요 머가리빡통들이킬링타임용 영화기대하고 술술 넘겨보다가""이건왜나옴""""이게뭔의미임?""하고 별점 1점주는 짓을 합니다 이영...",10
351,평이 안좋아서 기대안했는데 솔직히 재밌었다.. ,8
352,내안의 그놈보다 훨 재밌엇다 ,10
353,재미있게 봤음. 마지막까지 풀리지않는 의문은 남지만 해석은 관객에게 맞기는느낌이드네요. ,8
354,이정재  역시  멋져요ㆍ이상한  종교는 없여지면  좋겠어요 ,8
355,신과함께 같은 쓰레기 말고 이런게 떠야한다.. ,10
356,한 가지만 해라 이게 무슨 영화인가 싶다 ,1
357,떡밥 오지게 푸는거같아서 초반에 하나하나 뭐 쓸데없어보이는거같이 캐치하고 다했는데개뿔 쓸모하나도없고 회수도안되고 너무 흐지부지 3/2는 재밋는데 마지막3/1이 다 말아먹음 그냥 젠가하다가 하나 잘못빼서와르르맨션 마냥...,6
358,왜 영화보는데 생각을안할려고 하는거야??보면서도 생각좀하고 끝나고도 생각을좀해봐 염소가왜울고 소가왜죽는지 왜 이해를못해? 쌍둥이 언니가 악으로태어나서 그기운때문에 그런거잖아 그것도 이해를못해?? ,8
359,신천지가 별점테러 한다길래 들어옴 이거 재밌음 ,10
360,"선과 악, 빛과 어둠. 그 정 반대인 것들의 균형과 공존을.. 빛도 어둠이 될 수 있고, 어둠도 빛이 될 수 있음을.. 많은 생각을 하게 해준 좋은 영화 ",10
361,믿음에  대해  다시한번 곱씹어보는 작품이예요 ,9
362,재밌어요! 조금 어렵지만요ㅠㅠ 이 영화는 꼭 해석을 보셔야 합니다! ,10
363,전 재미있게 봤는데... 왜극 초반에 동물들이 죽은건지 물어보시는데 이전에 영화 설명에도 나왔지만   그신이 악하든   선한것은  사람이 바라보기 나름이죠 그이야기 그줄거리입니다.. 극중에 테러당한 선배의 이야기를 ...,10
364,민감한 소재를 가지고 흥미진진하게 잘 풀어냈네요 ,8
365,재밌게 봤습니다~ 집가서 사바하 해석 찾아봐야할 거 같네요~ ,10
366,"곡성처럼 훅하고 들어오는 소름끼치는 영화적재미는 덜 하지만, 곡성처럼 보고난 후 후기나 의미하는 것들의 해석을 찾아보는 재미도있고 배우들 연기도 좋았어요. 음향과 미술은 진짜 최고였네요! 근데. . . 유지태씨는 영...",8
367,코끼리 불쌍해오... ,6
368,흥미로웠어요 !  근데  초반에  재미있다가 마지막에  뿌려듄거 수습하느라 약간 미흡했는데 볼만 했어요 ,8
369,"용의 머리는 세상을 덮을 만큼 컸으나뱀의 꼬리는 새끼손가락보다 작은느낌의용두사미 영화개연성 포기한 영화, 짜집기영화내가 감독이였으면 가족한테 부끄러웠을듯합니다. ",1
370,1점도 주기아까운영화 사바하.. 보는내내 하품함 ,1
371,이거 재밌다고 추천 하는 새끼들이랑은 상종하지 말고 다 라이터로 불 태워서 김제석 시켜버려야한다 한줄평) 돈과 시간이 아까운 영화 ,1
372,박정민 믿고 봤음... ,10
373,짜 별한개도 아깝다. 이거를 영화라고 만들었냐? 보는내내 너무 루즈하고 솔직히 뭔내용인지도 이해가 안감. 두서없는 전개와 중간중간 자극적인 장면 조금 삽입이 전부. 역시 같은돈내고 한국영화는 보면 안돼... ,1
374,성지순례왔습니다 왜 이렇게 평점이 낮은거죠? ,10
375,"기독교적 이분법 세계관을 뒤틀어낸 영화. 탐욕과 집착은 누구든 악으로 변하게 할 수 있다는 불교관이 반전이라면 반전이네요. 두 번째 보니 영화기 훨씬 잘 보입니다. 스토리, 연기 뿐만 아니라, ost가 특히 인상적이...",10
376,빡대갈 개독교충들 평점 까내리는 꼬라지바라...소재도 연기도 그렇고 솔직히 평점이 이 정도는 아니지 안냐? 수작인데...영화보고 ㅈ도 남는거 업는 코미디영화보다 훨씬 잘만들엇음 ,10
377,수작인데 평점 왜이래 사이비에서 평점테러 들어왔나.마지막에 개쩜....음향은 확실히 좋네 ,10
378,"이 영화 나올때 신천지인이었는데.. 아침9시 전도단때 이런영화 보지 말라고 해서 안봤다가, 탈퇴 후에 봄ㅋㅋ신천지가 별점 테러 한다고하니 10점 주고가야징 ",10
379,이거 진짜 개띵작인데 빡대가리랑 종교쟁이가 평점 다 깎아먹네 ,10
380,유튜브에 사바하 해석 검색하면 너무나 친절하고 상세하게 지루하지 않게 해석한게 많아요 심지어 유튜브댓글마저  엄청난 설득력을 갖고 있어요  이거 보고나면 왜 코끼리가 나오는지  왜 그것이 금화의 다리를 물어뜯었는지 ...,10
381,평점보고 안보려 했다가 검은사제를 너무나도 재미있기 보았기에 믿고 보았음. 역시나 긴장감 및 몰입도는 실망시키지 않았고 결말이 좀 후다닥 끝나는 느낌은 있었습니다.하지만 결고 별1개짜리 영화는 아님..별1개짜리는 영...,9
382,좀 무서운 귀신들 말고는 영화 스토리 재밌고 그렇던디 평점이 낮아서 안 보려다가 봤는데 재밌었어요 ,10
383,최고의 배우 최고의 전개 최고의 반전3박자가 어울러진 최고의 영화진짜 재미있게봤어요 ㅜㅜ ,10
384,우리나라에 오랜만에 스릴러물이 제대로 나왔네요 종교와 접목된 스릴러물! 기대이상만큼이나 재밌었어요 또한 박정민 이정재 이재인 배우의 조합 그리고 열혈연기 너무 좋았습니다~ ,10
385,생각보다 평점낮은 이유를 모르겠지만 .. 이해하고 보면 꽤 수작입니다 ,10
386,미스터리를 매니아인 나는 너무 잼게봤는데 평이 별로네... 곡성이랑 오히려 비슷하네 스토리 반전이나 전개가 곡성보다 자극적이지 않으면서 좀더 현대적인 감성? 암튼 긴장감 있게 잼께 봤다.왜이리 못떴지? ,10
387,평점이 왜 이렇게 낮아? 영화관에서도 소름끼치게 잘 보고 왔었는데 .. 종교 주제 영화 중 개인적으로 최고다 평 보면 대부분 감독이 말하고자 하는 걸 전혀 이해하지 못한 듯 .... 이 영화는 무서움을 다룬 단순 오...,10
388,나름 재밌었음 ! 곡성의 충격까지는 아니지만 ,10
389,영화 즐겁고 재미있게 봤습니다 ,10
390,이런 류의 영화를 좋아해서 재밌게 봤어요~ ,10
391,첨에 한번 보면 이해 안가는데 유튜브에 뜬 해석 보면 소름입니다 ㅎㅎ 한국 영화 중  최고 ,10
392,재밌스546128888 ,10
393,재재재재 밌었습다다다 ,10
394,꽤  괜찮은 오컬트 영화. ,8
395,스토리가 탄탄하진 않지만 꽤 괜찮게 봤어요 너무 흔하지 않는 내용이라 좋았어요 ,8
396,깊고 무거운 영화. 무교인데 뜻깊게 봤습니다.추천해요! ,10
397,오랜만에 우리나라에서 정말 훌륭한 시나리오가 나왔네요. 첫장면부터 마지막까지 버릴 장면이 하나도 없고 여운까지 남는 멋진 작품입니다. ,10
398,미스테리 장르에 종교라는 신선한 소재로 전개돼서 볼 만 했음 ,8
399,솔직히 꿀잼은 맞지 않습니까? 여러분? ,10
400,되씹어보게 한다 마음에 든다 ,10
401,1점 누르는 것도 아깝다 ,1
402,무엇을 야기하고싶은지도 잘 모르겠고.. 몰입도도 떨어지고 ..영화 중간에 나갈까 고민했던 영화는 참 오랜만입니다. ,1
403,숨겨져서 안타까운 명작. 난 곡성보다도 이게 재밌었어. ,10
404,개인적으로 검은 사제들 이상. 평점 내리는 세력이 있네. 누군지는 말 안할게. ,9
405,야 이게 재평가 될줄은 몰랐다CGV 지금 시국에 예술이네 ㅋㅋㅋㅋ ,10
406,약간 이해안가는부분도 있긴한데 평점보니까 영화를 이해 못한 사람들이 많네ㅋㅋ 유지태는 진짜 신 미륵이였는데 티벳승령가 예언한후 눈빛이 변하면서 그도 죽음이란것에 연연하는 그냥 미물일뿐 자기가 살기위해 죄없는 어린아이...,8
407,결국은 티벳승려의 예언이 다 맞았고 세상을 구원할 진짜 미륵은 죽고 뱀은 사명을 다하고 죽었다. 정라한은 뱀의 혀로 진실을 보지 못했고 목사 이정재는 그토록 찾았던 진짜를 찾았음에도 인정하지 않았다. 모순된 인간들처...,10
408,평점 낮게 주는 애들은 뭐하는 뭐냐. 다 때려뿌수고 죽이는 자극적인것만 찾는거냐? 아 머리가 안좋으니 상징적인 의미들 해석을 못해서 재미를 못느낀건가? 근래 한국영화수준 어떤지안다면 이 영화정도면 명작은 아니여도 최...,8
409,네이버 영화 평점 남겨본 적이 단 한 번도 없는데 이번에 처음남김. 별점테러가 이해가 되지 않음 이걸 왜 극장에서 안봤을까...생각보다 낮은 관객수에 괜히 내가 마음쓰라린다 ,10
410,주제의식을 잘 살린 수작 ,10
411,단순한 오락성 영화는 아니다. 말 그대로 '화두'를 던지는 영화 ,9
412,이 영화는 한번 봐서는 그 백미를 느낄 수 없습니다. 모든걸 알고 두번째 보면 감독의 연출에 소름이 끼칠겁니다. 평점이 왜이리 낮은지는 모르겠는데 진짜 재평가 받아야할 명작이라고 생각해요. ,10
413,"어렵지만 그만큼 깊은 생각을 하게 해준 영화네요,,,사이비 무서워 죽는 줄 ",10
414,뭔가 되게 묘한 영화네요ㅠㅠ ,10
415,신선한소재...배우들의 연기는 말할것도 없다 ,10
416,보고나서도 생각하고 찾아볼게 많은 영화 ,10
417,이해가 좀 안되는 부분이 있었지만 그래도 나름 재밌었습니다. ,8
418,아...오랫만에 우리나라에 좋은영화 하나 나온거같습니다!감독님~수고하셨습니다~!!! ,10
419,독특했어요 추천합니다 ,6
420,볼만하구만 재미있다 엉 ,8
421,한국판 다빈치코드.조연들의 어색한 연기가 쫌 아쉽운 부분입니다. ,6
422,적어도 6~7 점 정도는 되는 영화라 생각되서...종교적 요소가 들어가면 날선 시선들이 많은 거 같아요. 종교가 주제인 내용이 아닌대도...암튼 전 재미있게 봤습니다. 이 감독님의 이런 소재의 영화는 다음에도 꼭 볼...,10
423,악이 선인거고 선이 악인건가..춥다던 광목이가 결국.. ,10
424,그러게요. 생각보단 재미가 없네영. ,1
425,저는 개인적으로  별로였어요. ,6
426,완벽하지는 않지만 흥미로운 소재와 스토리 끌고가는 힘은 대단했어요 ,8
427,개연성이라곤 ㅈ도없는 개 폐급영화. 창고 짱박힌 오로치마루년 빠박이변신 실화냐? 진짜 그지같은 알바충들 인트로 1분 이후로 다 최악임. ,1
428,초반의 강렬함과 소재의 다양성과 깊이는 검은사제들보다 좋았으나 그 기대만큼 못미치는 후반의 마무리였습니다. 그래도 여러가지 종교들의 색채가 담겨 있는 최고의 한국식 오컬트 영화 였습니다. ,8
429,방금 보고왔네요 저는 이런 오컬트 좋아해서 재밌게 봤어요 곡성같은 느낌이 강하지만 검은사제들에서 보여준 추리나 풀이도 나와서 흥미진진했어요 다만 마지막 악인에대한 감정씬은 별로...그래도 나름의 반전이 좋았습니다. ...,8
430,경찰은 왜나온거고 싸둥이 언니의 정채는 뭐고  ㅋㅋ ,5
431,기분만 더러워지는 영화 ,1
432,"평점 알바 장난없네요ㅋㅋㅋ오늘 심야보고 온 사람입니다. 이 영화는 인트로가 제일 재밌습니다. 그 이후는 스토리 중구난방 이랬다 저랬다 여러가지를 던져 놓고 감독님이 다 회수를 못하셨네요;;허술한 스토리,억지스러운 신...",1
433,나름 재미나게 본 영화 중간중간 추가 설명이 없이 이해안되는 부분이 있었던건 아쉬움 ,7
434,이런게 작품이지.. 영화보기전 평점이 왜이리 낮았는가 궁금했는데 이제 이해가 된다. ,10
435,지금보니까 재밌네...완전 망삘도 아니고신천지들이 왜 미쳐가는지알수있음 ,9
436,우리나라에서 이 정도 퀄리티 영화면 대만족이지속편 나왔으면 좋겠다 ,10
437,"이 시국에 재평가 되는 영화 ㅎㅎ  반대는 신천지, 사이비들ㅋㅋ ",8
438,영화 볼 땐 몰랐다. 하지만 이제 알았다. 이건 신천지에 대한 이야기다. ,10
439,사이비 종교 다 쓸어버려야됨 ,8
440,애당초 오컬트 소재의 영화는 호불호가 갈리는데 그안에서도 종교적인 색채를 녹인 영화는 더할것. 허나 이영화는 감독이 얼마나 치밀하고 많은 준비를 하였는지가 잘만든 오컬트 영화로 만들어짐을 느낌.단순 영화에서 보여줌을...,10
441,쉰천지 많네 쉰네 풀풀 난다 ,10
442,"선과악, 현시대 종교에 대해 생각 해보게 되는 영화.사이비들은 1점 주고 싶겠지 ㅋㅋㅋ ",10
443,와 우리나라에 이런 오컬트영화가 있었다니 이게 7점대라고? 9점도 부족한데 ,10
444,곡성 재밌게본사람이면 무조건 재밌게볼듯ㅠㅠ 딴 사람은 모르겠지만 난 너무 재밌게봤다. 연기력 말할것도없고 연출이 너무 좋았음.. 갠적으로 곡성보다 잼게봄 ,10
445,뼈대스토리 이해못하니 염소 소 무당 할머니 할아버지만 찾지ㅋㅋ 웰메이드영화임 ,10
446,씬 별로 하나하나 해석까지는 못해도 전체적으로 뭘 말하고싶은지는 굉장히 분명한 것 같은데 이렇게 이해를 못하는 사람이 많을 줄 몰랐네 ㅠ 근래 본 한국 영화중에 정말 흥미롭게 봤음. 그리고 연기력 다들 대단함 ,9
447,해석을 제대로 이해하고 보면 정말재밌는영화. ,10
448,정말 괜찮은 종교 영화입니다. ,10
449,오랜만에 유치하지 않고 세련된 분장의 귀신을 볼 수 있어서 좋았습니다. 한국 공포 영화 수준이 많이 향상되었음을 느낄 수 있었던 영화! ,10
450,종교인들의 평점테러가 망친 희대의 명작. ,10
451,만약 김제석이 티베트 고승의 예언을 듣고도 미륵의 삶을 살았다면 그것도 악으로 태어났겠지.. 예언이 뭐길래 용이 뱀이 되어버렸네 ,10
452,해석 꼭 보시길 부탁드려요 ,10
453,작년 최고의 한국 영화중에 하나. 너무 저평가 받은 저주받은 걸작 ,9
454,여기서..영화가 노잼이라느니 .. 그러는 사람들은 빡대가리여서 영화 내내 이해를 못한 사람들이다..감독의 디테일한 연출을 느낀다면..사바하는 무엇보다도 훌륭한  영화임에 의심의 여지가 없다. ,10
455,너무흥미. 신선함.이런영화가 이제야 나오다니 ,10
456,"가끔 어색한 공포분위기도 있지만 한국의 잘만든 수작, 영화가 그렇게 재미있진 않지만 감독의 디테일함과 도전에 9점 ",8
457,새로운 한국식 오컬트 무비 감독의 도전정신에 박수를 ,9
458,정말 재밌게 봤어요 왜 이해를 못하고 별점테러하는지를 모르겠네요 진짜 신천지들때문인갘ㅋㅋㅋ 뱀과 박쥐는 무조건 악마의 상징이라 생각했는데 그 안일한 생각을 파고든 반전이라는 장치에 놀랐습니다. ,10
459,후반부에 약간 혼란스럽지만 전체적으로 재밌어요. ,8
460,장르를 속이는것 같은 초반과 후반의 전환은 아쉽지만 오컬트영화로서의 짜임새는 좋다. 친절한영화지만 초반의 기세를 계속살렸으면 더 좋지않았을까 ,8
461,평점이 낮은이유: 사이비 종교인들이 낮은 점수테러를 해서입니다 꼭 보세요 ,10
462,아니 도대체 이게 왜 사이비 영화라고 하는거지이 영화 보고 사이비라느니 떡밥 회수 못했다느니 하시는 분들 기독교 관점뿐만 아닌 불교적인 관점에서도 보세요 이 우리가 얼마나 편협한 생각을 가지고 영화를 보게 되는지 알...,10
463,공포분위기를  끌고가는 영상..평점이 왜이런지...보고 후회안하실듯... ,10
464,평점때문에 안 볼뻔 했네..초대박작까진 아니여도 곡성보다 훨 낫고 치밀한 영화구만. 별점1 태러는 어떻게 생각해도 종교단체에서 깎아내리는 거라고밖에는 생각 안됨. 영화가 취향이 아니여도 절대 1점 짜리는 아님. 1점...,10
465,지금껏 한국 영화에서 이정도 짜임새와 스토리를 본적이 있는가요? 수작입니다! ,10
466,재미만 있구만 평점 왜케 낮지? 신천지s? ,10
467,재밋게봣는데 평점 별로네...반전도 있고 갠적으로 검은사제들보다 나앗음 ,10
468,"별점 낮게 주고 꼬투리 하나라도 잡고 늘어지며 뭐라하는 사람들은 신천지나 여호와의증인, 그리고 그외 기타 잡 사이비종교 인들이라고 보시면 됩니다. 개재밌어요 꼭보세요~ ",10
469,"영화를 이해했다면 최고의 영화, 이해못했다면 최악의영화 ",10
470,"뱀은 기독교에서 사탄을 상징, 불교에서는 수행자를 돕는 자를 상징, 염소는 기독교에서 악마를 상징, 불교에서는 윤회를 상징함. 사바하는 종교 비판적인 시각도 보여주며, 상대적 모습도 보여주는 진짜 잘 만들어진 영화,...",10
471,충분히 의미성 있었던 영화.. 개연성 없는 장면 많은 거 인정하지만.. 악귀잡는악신이 무엇인지.. 고민할 수 있었음 8점대 가자 ,10
472,나만 존나 재밌었음 ?? 집중하고 보니까 시간 훌쩍가던데 ,10
473,이해되는 사람들에겐 명작중의 명작 ,10
474,이정재는 시청자와 같은 시선자 입장입니다. 배역들의 부분을 보지 마시고 서술되는 사건의 과정과 결과를 추적 해 보시면 한국영화 중 꽤 많이 괜찮은 영화 입니다. ,10
475,왜 평점이 낮은지 모르겠네 재미만 있더만 ,10
476,가벼운 흥미를 가지고 보는 사람들과 영화의 깊이를 느끼고자 하는 사람들의 평가가 극과 극으로 갈리는 영화. 나는 수작으로 느꼈음. 곡성처럼 두어번을 봐야 함. ,10
477,이럼영화가 200만이 안넘다니..정말 대박인데생각하게 하는영화 난너무좋앗음 ,10
478,저렇게 평점을 까내릴 정도로 개판인 영화였나? 의아한데? 개인적으로 8점은 주고 싶음 ,10
479,개 쓰레기같은 영화보지말고 사바하봐라곡성보단 아니지만 비슷한 여운 느낌 받을수있다.3일째 여운 느끼는중 ,10
480,"재미가 없다/개연성이 없다 이런 이유로 1점주는건 이해하겠는데, 내용이 이해가 안된다는인간들은 본인 머리가 빡대가리라 그런거니 영화 말고 본인 지능탓을하시길. 스토리 수준의 높고 낮음을 떠나 내용이 이해가 안되는건 ...",7
481,과연 감독이 그저 사이비를 비꼬기 위해 이 영화를 만들었을까? 그보다는 더 철학적이고 심오한 영화다. 선과 악이라는 추상적인 개념을 이렇게 긴장감있게 다룬 영화가 또 있었을까 ,10
482,"생각할수록 좋은 영화. 감히 예측해본다면 감독은 세번째 작품 공개 후 검은 사제들, 사바하를 포함하는 유니버스를 구축할 듯 하다.(그렇다면 정말 멋질 듯) ",7
483,"평중에 염소 울음소리랑 소 죽음은 뭐냐, 그것은 도대체 뭐냐 하는애들은 영화 다시 보시길..ㅉㅉㅉㅉ ",10
484,"""곡성""의 파괴력을 넘지 못하였으나, 충분히 잘 만든 수작 ",9
485,생각할게 많은 복잡한 영화라 그런가무뇌들 덕분에 평점테러ㅋㅋ재밌게 잘봤고 많은 연구가 엿보였음배우들 연기도 좋았고초반에 너무 무겁지않게 가져간 것도괜찮았음 ,10
486,리얼 진짜 이거 보셈  이거 평점 왜 8점이지 ,10
487,신천지  여호와의증인 하나님의교회 이것들 다 사이비아닌가? ,10
488,"본인이 moviegoer 라고 생각하시면 예매 2번하세요. 그렇지만, 1600만찍은 호X이 2마리치킨 영화가 취향이라면 집에서 먹방이나 보시는걸 추천. ",9
489,방금보고나옴 오랜만에 재밌게 본 영화몰입도 최고 아래 1점지지리들은 뭔 내용인지 이해 못해서 저러는거 같음 ,10
490,생각할  거리가  많은  영화 ,10
491,이것이 있으므로 저것이 있고 저것이 있으므로 이것이 있다.. 선이 있으므로 악이있고 악이 있으므로 선이 있다. 우리 인생또한 누군가에게 선인 사람이 또다른 누군가에게 악이 될수도있다 ,10
492,"종교판 곡성, 감독님 정말 천재이신듯. 이런 영화가 더 많이 나왔으면 좋겠다. 영화 전반적으로 감독님이 하고 싶은 메시지는 그래서 신은 존재하느냐, 존재한다면 이 무질서한 세상에서 과연 무엇을 하고 계신 것이냐 인 ...",10
493,이건 내용다 정확히 이해하면 존나 재밌음 ,10
494,요즘같은 국뽕영화만 판치는.가운데 한줄기 빛과같은영화' 단순한 이야기를 너무 질질끈거는.오점이나 보는내내 오컬트적인 영화의.전반적인 분위기 배우들의 연기 그리고 연출은 칭찬할만함 ,10
495,재밌었음 별 생각안하고 보면 지루할수야 있겠지만 몰입해서 본다면 수작 소리는 들을만한 영화 ,10
496,오컬트의 새 지평이에요! 재밌습니다. 생애 첫 관람후기 남길 정도? ,10
497,생각하게 만드는영화 안무섭긴한 ,10
498,전체적인 전개가 난잡해요 ,6
499,여기저기 뿌려진 떡밥들을 친절하게 다 회수해주는 치밀한영화. 오컬트 관련 영화는 취향이 아니라 잘 안보는데 이 영화는 정말 재미있게 봤습니다. ,10
500,어렵다 하지만 그만큼 뜻이있다 ,10
501,영화 생각이상으로 친절한데 이해가 안된다니... 그게 이해가 안가네. 이런 장르의 영화가 더 나왔으면. ,10
502,이거는 유튜브에 사바하 해석이라고 치고 스포를 당해도 어떤 내용인지 먼저 이해하고 봐야됌 나도 첫번째 볼때는 무섭기만 햇지 별루 재미없엇는데 2번째 영상 보고보고 이해하고 보니까 그냥 인생영화 개꿀잼 노잼이라는 사람...,10
503,곡성은 설명이  너무 없어서 좋았고사바하는 설명이 많아서 반전을 느낀다영화 전반의 TMI때문에 긴장감에 등골이 서늘해졌다면 이미 영화에 빠졌다는 증거 ,10
504,이 영화가 극한직업보다 점수가 낮다는 것 자체가 대한민국 영화계 그리고 관중들의 평균이 얼마나 머저린지 보여주는 반증. 극한직업 명량 재밌다고 10점준 사람들은 그냥 보지마라. 니들한테 보여줘야할 이 영화가 아깝다 ,10
505,귀신이 라이타주는거 진짜 웃겨죽는줄 ㅋㅋ ,4
506,초반에는좀 지루한데 스토리도 좀 독특하고 이것저것 좀 멋진 장면도 있었음. 검은 사제들만은 못한듯. ,8
507,검은 사제들도 재미있었는데 저는 이영화가 훨씬 재미있네요.내용도 더 단단해진것 같구요.배우 박정민의 연기가 이렇게 대단해졌군요.영화 잘봤습니다.어쩜 우리 모두의 고통과 상처가 영화에서 보여 집으로 오면서 마음이 계속...,10
508,괜츈했음 나름 볼만함 박정민쫭 ,9
509,"저는 개인적으로 만점. 각자가 생각하는 신과 종교에 대한 나름의 신념, 잣대 그리고 시선으로 보았을때 완벽한 허무감을 준 영화인 것 같아요. 신에 대한 의구심과 상실감 또한 느끼게 해준 영화. 다양한 종교적요소가 잘...",10
510,저는 완전 재밌었는데....약간 여운 남는 영화랄까 ,10
511,이정재 배우의 힘이 오롯이 느껴진 영화였음 진짜 이정재의 캐릭터 변주에 박수를!!! ,10
512,상징과 은유가 많은 영화다. 주제도 간접적으로 전달하고있도..  이 영화를 잘 분석한 글or영상이 좀 풀려야 더 흥할듯 ,10
513,개봉하고 신천지한테 평점 테러를 당한게 지금 오히려 다시 평가받는 기회가 된것같다. 영화에서 불교와 기독교의 세계관을 잘 섞었으며 그 속에서  사이비종교 이야기를 자연스럽게 잘 풀어갔다. 살짝 아쉬운점도 있지만 시도...,8
514,평점이 왜이렇게낮은거지.. ,10
515,참으로 시의적절하다.. ,8
516,별점 테러하러 온 신천지들 많네ㅋㅋㅋㅋ 얘들아 찔려서 부들대면 너희가 사이비란거 인정하는거야ㅋㅋ 머리 좀 잘 굴리고 글남기렴 ,9
517,이런 장르의 한국영화 중엔 당연히 최고. ,10
518,난 이 감독 계속 이렇게 갔으면 좋겠다 ,10
519,이정도로 평가가 안좋을 영화는 아닌데... ,8
