,Review,Rank
694,4명의 소년수 4명의아이들이 트릭일줄 영화4번보고 알았습니다. 감독천재다 진짜... ,10
695,기대 안하고 봤는데 재미있게 보았습니다. 음향효과도 은근 좋은 듯 ,10
696,무서운 사이비.. 세뇌교육이 이렇게 무섭습니다.. 정말 현실적인 영화가 아닌듯싶습니다~ ,10
697,신천지 평점 테러가 재조명 되네요. ,10
698,재밌었어용!!! 좀 슬프기도하고 ,10
699,극과극의 설정(미륵으로 추앙받는 김제석과 귀신  또는 악으로 여겨지는 쌍둥이 언니 ) 후반에 가서는 그 설정이 뒤바껴지면서 우리의 선입견을 비틈 솔직히 검은사제들보다 더 좋았다 ,10
700,특정 종교인들의 평점테러로 저평가된 영화 진짜 종교란 것에 대해 비판적으로 생각하는 사람이라면 너무나 와닿는 이야기다 ,10
701,정말 최고의 영화였다. 선과악은 종이 한장 차이임 ,10
702,와... 그냥 와.... ,10
703,불교는 악이 존재하지 않습니다 선배천적이 있다는 말을 듣는 순간미륵이 된 생불이 인간이 된 것 일 뿐... ,10
704,극장가서 볼껄..하고 후회했다. 물론 동행없이 가는 편이 나았겠지. 불친절했을지언정 전달력이 부족한 영화는 아니였다고 생각한다. 검은사제들보다 좋았다. 검은사제들도 그랬지만 '퇴마록'을 정말 영화로 보...,10
705,재미있게 봤는디  1점 주는 애들은 필시 사이비일듯 ,10
706,"솔직히 후반부 아쉬운 점은 있지만 스토리만으로노 별 다섯개 충분하다고 본다. 박정민이 부처모양의 그것과 대면하는 장면에서 그것의 모습에 소름돋았고, 그것의 대사 ""너와함께 울었다""던가? 그리고 스님과 ...",10
707,왜 난 괜찮음? 개봉당시부터 별로라고 들어서 기대감이 많이 낮아그랬나 박정민 캐릭터 꽤 괜찮고.. 내용도 참신하고 괜찮았는데 개봉때 평점이랑 달리 지금 후한 평점많네ㅜ 아깝 영화관에서 볼걸. 내용 이해안되면;;; 이...,8
708,호불호가 있는지 평점이 낮아서 괜찮나 했는데 생각보다 재밌어요.스토리도 개연성 있구요. 나름 생각하게 하는 여운도 있어요. 공포 위주를 원하셨던 분들에게는 조금 실망감이 있을 수 있지만 개인적으로는 상당히 재밌었고 ...,10
709,작년에 영화관 가서 보고 티비에서 해주는거 보고 또 본다. 개인적으로 엄청난 수작이라고 생각함 이걸 이해 못하고 불친절 하다고 생각하는 사람들이 있다는게 신기한데.. 선과 악의 경계 그 모호함에 대해서 다시 생각해보...,10
710,사바하2 기다립니다.나름 개 꿀잼이었어요 ,9
711,솔직히 찾아본건 아닌데..  와우 보다가 눈을 뗄수가 없었다.  몰입감 짱~!스토리도 재미있고 남주인공 박정민 연기력에 감탄 ,10
712,"꽤나 수작입니다. 한번의 상영으로도 충분히 이해가 갈만큼 개연성있으며, 우우우 거리는 브금이 주는 긴장감이 영화에 더욱 집중하게 만드네요.  영화를 감상하니 염소라던지, 금화의 할아버지, 할머니라던지, 미륵불의 존재...",10
713,열번은 봤지만 방영하면 또 앉아서 보고있음.   스토리 너무 좋고 너무너무 재밌음.나한텐 콘스탄틴 급. ,10
714,스토리가 독특합니다.한국영화에서 볼 수 없는 스토리.최근 본 영화중..독특한것으론 최고 ,10
715,수작인데 비해 많이 알려지지않아서 아쉬웠는데 tvn에서 설특집으로 해주니 너무 반갑다 다시봐도 역시 재밌어! ,10
716,"3번째 보는데도 재밌네요! 최소한 1점짜리 영화는 아닙니다. 본인이 이해못한다고 테러하지 맙시다. 존재에 대한 인간의 두려움, 오만함과 욕망, 종교적인 의미까지 훌륭한 영화였습니다. ",9
717,나는 진짜 괜찮게 봤는데 왜 다들 별로라는지 모르겠다 ,10
718,별점테러 하지마라 사이비들아 ,10
719,장재현감독 인터뷰때 눈물을 흘리던 그모습과 영화에대한 진정성이 이영화를 그리고 다음 영화를 말해준다 진짜 이감독의 다음영화가 기다려진다.이감독은 계속 진화하고 한국영화를 바꿔 놓을것 같다 ,10
720,이런 철학적인 공포영화가 있나! ,10
721,악마인 줄 알았던 쌍둥이 언니는 부처님의 화신이었고 미륵으로 둔갑한 악마로부터 화신을 지키고자 가장 흉측한 몰골로 이 세상에 오시니 아름다운 눈과 달콤한 혀를 가진 뱀만을 쫒던 가짜 미륵의 사천왕들이 속았구나. 결국...,10
722,검은사제들에 이은 또하나의 심령영화 시작부터마지막까지 긴장을 늦을 수 없었다 불교 천주교 기독교 등 종교에 대한 해박한지식으로 설득력있는스토리텔링이 마음에들었다. ,9
723,생각보다 재밌게봐서 돈은 안아까움 ,10
724,재밌었어요!! 두번째 관람인데 두번째 보니 모르고 지나쳤던 부분들이 의외로 많았습니다. 처음봤을 때와 달리 알고보니 굉장히 친절했던 영화였네요ㅋㅋ ,10
725,"비천하게 태어나 일생을 상처입은 이들을 위해 울었던 신은, 태어날 때처럼 조용히 눈 감는다. 늘 생각했왔었다. 정말로 신이 있다면, 바로 저런 모습이 아닐까 하고. 모두가 경외하며 무릎 꿇게 만드는 휘황찬란한 절대자...",10
726,가서 보고 판단하기! 미스테리물이고 우리가 잘 모르기도한 종교 세계관을 흥미롭게 봤어요ㅎㅎ ,10
727,종교와 믿음에 대한 여러가지  생각을 하게된 시간입니다. ,8
728,어제 심야보고왔다 언니 반전이네 잼있던데 평점이 낮네VOD나오면 또 보고싶다 개인적으로는 ,10
729,이런영화는 계속 나와야한다고 생각해요 다양한 장르 ㅠㅠ 재밌게 잘 봤습니다. 엔딩은 많은 생각을 하게 했어요 ,10
730,각 종교의 상징적인 의미를 잘 섞어 관점에 따라 해석이 달라지는 점에서 굉장히 흥미로움영화를 보고 한번에 이해하긴 조금 어려운 영화지만 감독이 하고자 하는 말에 대해서 계속 되짚어보고 생각해보게 되는 영화 ,10
731,사바하사바하사바하사바하 ,10
732,재밌었음 선과악은 정해져있지않다 ,10
733,저는 기대를 안하고봐서 그런가 굉장히 재밌게봣는데..심오하고 나름 이야기 스케일이 컸는데 그걸 헷갈리지않게 잘 풀어주신거같아요 광고가 별로안된건 마켓팅이 별로인건지 영화는괜찮은데 보는사람이생각보다적더군요 전 집중도도...,10
734,진짜신천지 제발없어져라 ,10
735,많은 생각을 하게 하네요이재인 1인2역 최고 ,8
736,저만 재미있엇나용?? ,10
737,종교적 지식이 없으면 절대 이해못한다. 영화속 오컬트 하나하나 다 의미가 있고 박목사의 마지막 행동과 대사조차 모든 의미를 부여했다. 오락으로보면 1점 오컬트 회수로 보면 10점 ,10
738,굿 진리다 이영화 칸트적이다 ,10
739,재밌다 이정도면 잘 만들었다 ,10
740,올해 본 한국 영화중에 제일 잘 만들었다. 평점이 7.23이란게 이해 할 수 없어서 올린다. 보면 후회 안한다. ,10
741,무엇이 선악을 가르는지 ,10
742,해석영상보고 또 보고싶다 그럼 더 재미있을 것같아. 처음엔 뭐지 싶었지만 ,8
743,오랜만에 영화 같은 영화였습니다...감사드려요~~ ,10
744,종교의 의미를 생각하게 해준 영화. ,10
745,깊이있게 생각 되는 영화 ,10
746,8점대정도까진 올라야한다고 봐서 10점 줌! 노잼인줄알았는디 재밌음 겁나 재밌는데 무서움 ㅠㅠ 보고 유투브에서 리뷰영상 꼭 보삼 ,10
747,잘봤어요 생각이 많아졌네요 ,10
748,알바 아닙니다.영화 해석이나 감독의 의도는배우대사에 다 나와있다고생각해요. 모든악은 인간의욕심에서 시작된다는 것에동의합니다 ,10
749,너무 재미나게 보고왓습니다..몰입감 제대로인데 호불호 갈리는듯~ ,10
750,매니아들은 제대로 취향저격 영화입니다. 신선하고 기막힌 복선의 전개..하지만 대중 상업영화로 보기에는 어려울듯.. 종교에 관심없는 분들에게는 개연성도 없고 황당한 영화일뿐 ,8
751,평점과 평가는 의미가 없다. 생각해보자 ,10
752,인간의 욕심에 대한 영화가 아닌가 생각합니다.찌릿찌릿한 느낌이 드는 좋은 영화인데 호불호는 갈릴수 있겠네요 ,8
753,재밌었어요 스토리도 잘짜여있고 ,10
754,개인적으론 재밌던데. 이런 주제로 다루는 영화가 많지 않다 보니..익숙하지 않은듯. ,10
755,두번 볼때쯤 상당히 친절한 영화라고 생각될 정도로 이해장치를 잘 심어놓은 감독. 확실히 장재현감독 영화는 두번이상 봐야 재미있다. 그리고 영화의 절반은 사운드가 다살렸다... ,10
756,중간에 좀 무리수가 있었지만 연기들을 너무 잘해서 몰입도가 좋았고 종교적인것들을 이렇게 연출한것에 대해 다시 한번 놀랐다 난 너무 재미있었다 ,10
757,그냥 쳐봐 ! 잘 만들었구만. 네티즌 OO들 말 졸라 많네 ,8
758,재미있는건 맞는데 내용 이해가 어려움.. ,9
759,짜임새에 아쉬운 부분이 있긴 하지만 종교적 색채가 있는 오컬트를 좋아한다면 재밌게 볼 수 있습니다. 보고 나서 생각할 거리가 많고 불교 밀교 내용에서 느껴지는 신선함과 신비로움이 좋았네요. ,10
760,와 박정민배우 연기 진짜 잘하네요 ,10
761,재밌었고 보고나서 다시한번 생각해보는 영화였어요 진짜 혹평받을정도는 아닌데... ,10
762,감독님 이런장르영화 많이많이 찍어주세요 ,10
763,스릴러에 걸맞는 음산한 분위기도 좋았고 교훈도 있어서 좋았는데 영화 내용이 이해 안되시는 분들은 애초에 별점을  안주시는게 낮지않을까요? ㅋㅋ ,8
764,신의 존재를 나타내기 위해 너무 많은 캐릭터들의 존재가 애매해지는 경향이 없지 않아있던 영화였습니다. 영화 등장 캐릭터들이 친절하게 모든것을 다 설명해주기에 이해 안되는 부분이 없는데 이해가 안간다는 사람들은 얼마나...,7
765,중간중간 긴장감도있고 나름볼만했어요 ,6
766,이 영화는 절대 낮은 평가를 받을 수 없는 영화다. 평점란에 빗발치는 1점파티를 보니 감독의 의도가 제대로 관객들에게 전달됐다보다. 신천지 친구들아.. 정신차려라.. 신은 믿지않지만 맹목적인 믿음은 결국 사람의 눈을...,9
767,상징적인 의미가 많이 포함되어 있어서 인과관계가 확실하게 직관적으로 영화를 보는 사람들은 재미없을 듯  대사나 장면이 상징하른 것들이  숨겨져 있어 찾으며 곱씹어보는 재미로 봤네요 저는 재밌었어요 ,9
768,재밌고 쫄리더이다ㅡㅡㅡ ,8
769,아무 생각없이 봤는데 졸잼 ,10
770,초반에 너무 무서워서 토할뻔했어요.. ,10
771,뭐야? 신과함께3가 아니였네? ,10
772,오랜만에 여자친구와 재미난 영화 보았습니다.저에게는 너무나도 슬픈영화로 다가왔습니다.극중에는 너무 슬픈 캐릭터들이 있습니다.현실에서 힘든 사람들을 한번더 돌아보게 만드는 영화였습니다. ,10
773,기대안하고 봤는데 잼났음! ,10
774,평점 안믿고 그냥 봤는데 내용 반전이나 긴장감이 너무 좋았고 스토리가 진짜 좋았어요!!추천합니다ㅎㅎ ,10
775,난 이런영화좋음 흥미진진하게 끝까지 긴장감을 유지하는 감독의 노력이 빛났음 하지만 필요없는 몇몇 엑스트라는 왜 넣엇는지는 이해가 안감. 하지만 스토리자체는 탄탄함이 느껴짐 ,8
776,오랜만에 좋은 분위기의 영화 잘 봤어요. ,9
777,"엄청 새로웠다. 신이 존재하는건지? 존재한다면 어떤형태로,형상으로? 존재하는지. 그 답을 주는게 아니라 계속 질문하게 만드는 그런 영화. 촌스럽지 않아서 좋았다 ",9
778,"이것이 존재하기에 저것이 존재한다 불교에는 절대선도, 절대악도 없습니다 이분법적 사고로 바라보던 내가 한방먹은 영화.. 개인적으로 재밌었습니다 ",10
779,오랜만에 잘만든 한국영화 봤네여. 그리고 신천지 쓰레기들 제에레에에ㅔ에에에발 디졌으먄 ,10
780,그냥 보는내내 소름돋았구ㅠㅠ박정민ㅠㅠ이정재ㅠㅜㅠ ,10
781,음악이랑이 오져버렸다 ,10
782,영화를 보며 각종 실마리가 풀림과 함께 앞서 나온 대사들과 연결지어지는 상징적인 장면들을 보며 점점 입이 벌어졌네요... 감독님의 차기작이 정말 기대됩니다 ,10
783,다소 난잡하다 느껴질 수 있지만 전체적인 스토리는 탄탄하고 잘 만든것 같음꽤 참신한 시도임재미는 곡성이 더 있지만 스토리는 사바하에 한표! ,10
784,쿵따리 사바하 빠빠빠빠 ,10
785,"분명 호불호는 확실하게 갈리는 영화인데, 오컬트 장르를 제일 좋아해서 재미있었다.갠적으로 따지자면 곡성 >> 사바하 >> 검은사제들 인듯새로운 이런 소재들로 영화 많이 나왔으면 ㅠ본지 3일이 넘...",10
786,개연성면에서는 쪼금 아쉽지만 근래 본 영화중에서 가장 재밌었음. ,10
787,염소가 울고 소가 죽은건 절대악이 없기때문과 연관된 것입니다.. 영화 재밋엇어요~~ ,10
788,"8.5점은된다고본다 그래서 10점줌검은사제들, 곡성 만큼은아니지만 비슷한 분위기를느낄수있음 ",10
789,ㄱㅊㄱㅊ하비다... ,10
790,보고나서 되새길 수록 깊이가 느껴지는 영화입니다 ,10
791,진짜 박정민 연기 장난아님 ,10
792,이정재가 읽는 경전 내용 잘 새겨들으면서 영화 보면 진짜 몰입감 장난아닙니다. 이런 영화가 천만 가야되는데 최근의 모 영화 수준은 진짜.. 하.. ,10
793,"던져놓은 수많은 것들이 다 결과물로 나타나진 않았지만 (경찰, 무당, 염소 등등) 그래도 영화가 끝나고도 여운이 오래남는 의미깊은 영화였습니다. ",10
794,역시 믿고보는 박정민 ... ,10
795,불교에서는 악이 없고 유동적이라는게 신선했습니다. 오랜만에 재미와 오랫동안 생각하게 하는 영화를 만난것같습니다. 좋은영화 잘봤습니다. 올해 본 한국영화중 오락과 작품성최고입니다. ,10
796,난 영화 재미있게 봤는데 딱 보고 나와서 와 진짜 재미있다 라기 보다는 보고나서 곰곰히 왜 저런 설정인지 왜 저런 장면을 넣었는지 생각해보고 감탄했음 약간 곡성을 보고 난 다음의 느낌이였네요 ,9
797,난 진짜 곡성보다 훨씬 좋았다 ,10
798,이게 왜 7점짜리야  우리나라 스릴러라인 중에 9점 이상 영화임 ,10
799,별점 테러한 애들은 이해 못한 애들임 ,10
800,평점이 낮은게 이해가 안된다. 몰입감도 최고고 스토리도 탄탄하다. 마치 주인공이 되어 추리해나가는기분도 들고 긴장감은 최고조로 향한다. 인간의 이기적 본성이나 신에 대한 인간의 욕망과 갈증의 질문을 던지는 영화다. ...,10
801,꿀잼. 스토리도 탄탄하고 결말도 괜찮. 근데 누가 별점 테러하냐 ,10
802,"이런영화가 7점, 블랙머니, 너의이름은같은 OOO기영화가9점대.. 네이버평점의수준  재밌습니다 몰입감 괜찮고 어려운 영화같은 느낌인데 오히려 잘 들어오고 여운이 좀 있는영화.. ",10
803,한국 오컬트의 한 획을 그었다 ,10
804,이게 사자보다 평점이 낮다니 영화 보는 수준들 알만하다ㅋㅋ ,8
805,사자 보고나니 역시 오컬트는  장재현감독님이구나  하고 느낌^^ ,10
806,신선했고 보는내내 집중할수있었던 영화였다 ,6
807,은근 무서움종교이야기.좀.소름 ,6
808,몰입도가정말좋았어요  역쉬 연기잘하는 배우들이나와서 더몬입해서 본듯반전 완전깜놀입니다 ,10
809,"주민번호가 경전에? ㅋㅋ 개그냐.라이타를 줘? 퓨전이네. (심지어 차는 불 안붙어)코끼리? 장난이 지나쳐.해볼려다 안되니, 장난으로 대충 마무리한 영화. ",3
810,난 재밌던데.. 후기보는재미 ,10
811,장르적 호불호를 제외하면 진짜 너무 취향에 맞아서 눈물까지 난 영화. 진짜 퇴마록은 이런 감독이 영화화 해야될텐데..  장르적인 한계로 돈이 안되는게 너무 안타깝다.. ,9
812,또보고싶은 영화 오랜만이었어요 ,10
813,근래 본 영화 중에 가장 몰입감 있게 봤던 영화. 취향을 좀 타는 것 같긴한데 곡성을 재밌게 봤던 분들이라면 흥미롭게 볼 수 있을 듯 합니다. 개인적으로 극한직업보다 훨씬 재밌게 봤습니다. ,10
814,시작부터 끝까지 긴장감과 생각을 멈출수가 없었다. 기독교신자인 나에게 온전한 믿음이 무엇인지 생각하게 하는 귀한 영화였다. 꼭 추천합니다~~ ,10
815,어떤 흔들림도 없는 완벽한 작품입니다. ,10
816,"임팩트 있고, 재밌네. 이정도 몰입감에 퀄리티 인데 이상할 정도로 왜이리 조용한걸까.입소문 아직 인가. ",10
817,나는인생영환데 평점이 생각보다낮네 ,10
818,불교와 기독교를 심도있게 표현한 작품 ,10
819,재밌었음. 개연성이 자로긋듯이 맞지는 않지만 상징적 요소들로 생각해볼거리가 많은 영화. 다른세계로의 여행. ,10
820,한국 오컬트 영화의 희망 ,9
821,"난 재밌었는뎅...제일 기억에 남는건, 박정민이 자는데 귀신들? 나오는거....가위눌리는걸 시각적으로 표현함..소름돋음.... ",8
822,우리나라 영화수준을 다시금 끌어올린 영화. 진짜 잘만들었다! ,10
823,내용이 신선해서 재밌었다.. ,10
824,간만에 영화가 끝난후 얘기꺼리가 생긴 영화 ,10
825,잘만든 영화네요.재관람 예정입니다. 이런 장르를 풀어내기가 쉽지않은데. ,8
826,재밌게 잘 봤음.+ㅈㅈ ,9
827,"난 진짜 잼있게 봤는데ㅋㅋㅋ 진짜 신천지가 활동하는건가ㅋㅋㅋ 솔직히 10점은 아니고, imdb 7점 수준이다ㅋㅋ 근데 imdb 7점은, 한국영화치고 정말 잘 만들었다는거임 ㅋㅋㅋ 난 정말 인상깊게 봤음 ",10
828,감독에 감탄을 느낀적은 이 영화가 처음. 아는만큼 보이고 생각한만큼 의미가 느껴지는 영화다.. ,10
829,몰입하며 봤습니다.  생각을 많이 하게 하는 영화입니다. ,10
830,왜이렇게들 까는거지 진짜 신천지인가? 평점보고 안보려다 봤는데 영화 안 설명들이 불친절한것도 없고 영화 자체도 잘 만든 한국에선 보기드문 수작임 냉정하게는 8점정도 주고 싶으나 어디서 지령받고 온 1점 주는 놈들때문...,10
831, 악귀를 죽일 악신으로 태어나 고통받다 죽은 언니가 참 가여웠습니다. 빛 한 번 못보고 짐승보다 못한 삶을 살다 갔지요. 용도 다시 뱀이 될 수 있다는 설정이 새로웠네요.세치 혀의 말 한마디에 보살의 마음이 살겠다는...,8
832,일반적으로 이런 종교적이고 생각을 많이하게 만드는 장르를 좋아하지 않는분들은 정말 흥미를 느끼기 어려운 영화이고스토리부분에서 불필요한 요소를 많이 느꼇을겁니다그치만 본인은 아주재밋게봄 개꿀 ,10
833,한번더보고싶어지는 영화네요 ,10
834,영화 본 이후에도 해석 찾아보는 재미가 솔솔함. ,9
835,"좆노잼이라고 리뷰한 분들의 생각도 이해는 갑니다.영화 자체가 어둡고  내용이  상당히 많고 주요 이야기가 4갈래에서 시작되다보니 헷갈리고원하는 장면은 안나오고 하지만, 자세히 뜯어보면 이 영화는 감독의 노력과 정성과...",8
836,감독의 오컬트 지식을 폭발시킨 영화라고 생각. 10점 만점도 아니지만 절대 평점이 7점대 받을 영화도 아니라고 봄 종교적으로 불편하신 분들이 1점대로 깎는것 같아 평균 맞추기 위해 10점 ,10
837,신은 존재하는가 존재한다먼 왜 그 모습을 드러내지 않는가 ,10
838,영화가 넘 좋아요‥수준이 정말 높아요~~^^역시‥ 장재현긴ㅁ독님 작품 믿고 보게 되네요 ‥ ,10
839,"기발한 설정, 상징물의 활용이나 종교적 성찰의 깊이가 있어 개인적으로는 굉장히 울림이 컸음. 다만 후반부로 가면서 늘어지거나 설정의 원활한 조립을 위한 개연성이 희생되는 부분이 있음. 모르면 당혹스럽고 알면 알수록 ...",9
840,왜 난 재밌던데.. 에초에 오컬트 영화인데 종교적 메타포를 친절하게 설명해주는 것도 웃기지 않나. 그걸 떡밥회수 실패라고 해버리면;; ,8
841,볼만했다 ㅇㅇ 반대누르는사람 신천지~~ ,10
842,영화보기전 평점보고 갔는데 이해안되는 부분 전혀 없었고 개연성 없는 부분도 없었다. 이해 안된다는 사람들은 영화를 제대로 안본건지 진짜 모종교의 훼방인건지..;; 자고로 나와 내 지인들은 굉장히 재밌게 보고왔다. 또...,10
843,대박 잘 짜인 영화.. 이해를 못하는 사람이면 재미가 없을 수도 있다 ,10
844,종교와 신에 대한 고민과 묵직한 메시지가 담긴 영화입니다. 이야기를 풀어나가는 서사와 반전도 좋았습니다. 이런 영화가 많이 나왔으면 합니다. ,10
845,생각보다 전개도 괜찮고 재밌었는데 .. 음 ,10
846,영화를 제대로 보셈 할배랑 할매는 간다고 했음.진짜 노답 ,10
847,호불호는 갈릴지언정 이정도 평점 받을 영화는 아닌데 ㅋㅋ 신천지때메 그런가 ,10
848,2편만들어주세요 감독님 ㅠㅠ ,10
849,우리나라 왜이런류의 영화가 발전못하는지 알겠다. 반응이이러니원. 살짝아쉬운부분이있긴 해도 참잘만든영화라생각했는데 1점준애들은 생각은하고사는건가? 블록버스터나 액션만 빨게아니라 사색이란걸 좀 해봤으면. 근데뭐 대중성은...,10
850,친절하게 알려주진 않치만 대사를 곱씹다 보면아ㅡ 하는 순간이 온다  생각이 많아지는 영화 ,10
851,음향감독 상줘야됨아는만큼 재밋는 친절하진 않은 영화~! 종교나 무속신앙에 대해 좀 알고있다면정말 재밌게 볼 수 있고.. 그런거 관심없으면그래서 뭐 결말이뭐야..? 싶고 재미없을수있음ㅋㅋ종교에관심많은 사람으로서 생각하...,10
852,"새로운시도, 기독교와 불교적 이야기의 조합은 괜찮은  조합인것 같았습니다. ",10
853,영화가 너무 슬픈건 나뿐인가.. ,8
854,"상징적인 요소들이 많았지만 이 영화의 런타임이 짧았던것인지 미처 다 풀어내지 못한듯해 1점을 내렸다. 하지만 단순히 공포가 아닌 미스터리, 스릴러 장르를 잘 풀어내 보여줬다고 생각한다. ",9
855,근래 본 중 정말 잘 만든 영화 ,10
856,쉬운듯 한데 계속 생각나요 ,10
857,가짜는 진짜를 못이긴다 명백히 진짜 신천지가 왜 ㅆㄹㄱ인지 보여준다 신천지 사이비 종교의 특징 쉽게 말하면 자기 자신이 신이라고 개 짖는 소리를 한다 그리고 세뇌 지키고 자기가 죽으면 그 후예를 찾는다 한마디로 개소...,7
858,보고나서도 계속 생각하게 만드는 영화였어요.집중해서 봐야 이해가 될 스토리 같아요.제 취향엔 만족했습니다 ,9
859,"초반은 임팩트있게 시작하는데 후반부로 갈수록 너무 힘이 빠진다. 그럼에도 불구하고 다양한 소재성이라는 점에서 높은 점수를 주고싶다. 최근 2년간 반일 아니면 민주화, 정치성 드러낸 작품들만 있던터라 지쳤었는데 이런 ...",8
860,진짜 잘만든 영화입니다!! 끝나고 해석 찾아보니 더 대박... 철학적인거 되게 좋아하는데 철학적이고 심오하고 뭔가 내 내면에 물음표를 던져주는 그런 영화입니다. 무엇이 선이고 악인가. 신은 존재하는가. 등등을 생각하...,10
861,"불교의 악은 교화와 깨닮으로 윤회하는 대상으로서 기독교의 선과 악에 대한 이분법적 사고로는 진리를 추구할 수 없다는 이 영화의 진정한 의미를, 표면만 보고 신천지라며 배격하고 오컬트에 거부감을 느끼는 사람들이 있는 ...",10
862,신기하면서 엄청 무섭더라 ,10
863,모 사이비 종교에서 별점테러를 한다는 소식을 듣고 왔습니다. ,10
864,모 사이비 종교에서 별점테러를 한다는 소식을 듣고 왔습니다. ,10
865,종교를 안믿는다는 내신념을 더울 굳건하게 해준영호ㅓ ,10
866,"공포 장르 싫어하고, 정말 재밌다 입소문 자자한 영화들도 한 번 보면 끝인 사람인데, 사바하는 최초로 자발적 2차 뛰었습니다. 종교에 관심없고 해석에 취향이 없으시다면 그래서 뭔 내용인가 싶으실 수 있으실테지만 개인...",10
867,난 짱 재밌었음 재밌었음 곡성보다 더 ,10
868,신파로 가득한 한국영화에 내려온 한줄기의 빛같은 영화. ,10
869,너무 재밌게 봤습니다. ,9
870,재미있었음 생각할 것도 많아지고 흥미로웠던 영화 너무 잘 만들었다 감독 천재다 하면서 영화관 나왔음 ,10
