,Review,Rank
621,"진짜 그래픽, 액션씬 보면서 온몸에 전율이 났어요.스토리가 그나마 옥의티일수도 있겠는데등장인물들의 성격과 그들이 처한 상황을 살펴보면 전개가 납득갑니다 ㅎㅎ ",10
622,극한직업 30점알리타 99점알리타재미도재미지만 감동찡 ,10
623,극한직업보다 훨 재밌음... ,10
624,저는 2월 6일날 봤는데  아직도  관객 200만 못넘기다니 당황스럽네요 .   아이맥스 3D로  진짜 잼있게 봤거든요 .  아바타 이후로  극장 한번도 안가봤었느데 . 알리타가 너무땡겨서  극장 다녀왔습니다 . 후...,10
625,와.. 왜 이게 9점 밑인지 모르겠다.. cj에서 알바쓴거다..극한직업 밀릴까봐..꼭영화관에서 보세요!! ,10
626,잼있게 잘봤어요. 2탄이 나올꺼 같은데 빨리 나왔으면 합니다. ,10
627,영화보고 평점등록해보기는 처음이네 ,10
628,영화보는 내내 즐거웠다. 주변사람들에게 추천하고싶은 영화 ,10
629,현재 가장 진보된 CG 를 구경할수 있고1700억이란 거대한 제작비로(그것도 가격대비 작품잘뽑는 감독) 제대로 만든 영화다.단언컨대 21세기에 남을 화려한 액션영화.왜 이런대작이 한국은 상영관도 적고 네이버 영화에 ...,10
630,근래 본 영화 중 단연 최고 ,10
631,최근몇년간중 가장 재밌었다 레디플레이어 스필버그작 이후 ,10
632,원작의 팬이다. 예고편보고 솔직히 고민했는데 의외로 생각했던것보다 더 재미있었고 나름 감동적이었다. 원작의 방대한 내용을 잘 각색했다. 철학적인 깊이는 원작보다 떨어지나 런닝타임상 어쩔수 없나. 런닝타임을 더 늘려도...,9
633,극한직업 극혐 알리타 진리 ,9
634,평점후기 잘 안남기는데 보면 후회 안해요 재밌습니다 전 2d로 봤지만 아이맥스에서 볼만한 가치가 있는 거 같습니다 ,10
635,노바 안경벗는장면에서 온몸에 소름이 에드워드 노튼 후속편에서는 분량 많이 나오길 ! ,10
636,"조오오오오온나 꿀잼!! 진짜 이건 꼭 봐야 함. 배경, CG, 액션 그냥 전부 다 개지림. 영화가 지루한 타이밍이 1분도 없음. 그냥 꼭 봐요 여러분 진짜 갓띵작임! 영화 끝난 순간부터 알리타2 보고 싶어짐 ",10
637,이 세대에 살게해주셔서감사합니다...이런영화를 볼수있다니...ㅠㅠ  인생작...4d추천합니다.. 다른영화 4d랑 또 달라요ㅠ 특히 경기할때ㅠ ,10
638,진짜 너무 재밌어 만화책으로 봤었는데 더 재미난듯 ,10
639,원작 팬으로써 십수년을 기다린 최고의 선물. 걸작. ,10
640,알바들아  꺼지거라.  니들이  나댈  데가  아니란다.  3D 액션 영화에서  왠  스토리  타령이니.... ,9
641,초중반은 지루하고 전투신은 꿀잼 ,9
642,그냥 친구한테 끌려가서 아무생각없이 갔다 보고 왔는데정말 장난아님. 이야기 미쳣고 오늘부터 알리타 팬ㅠㅠㅠㅠ무슨 감동이랑 액션이랑 다 정말 완벽ㅠㅠㅠㅠ ,10
643,100점 주고싶다 10밖에 못주는게 아쉬움사이버펑크 좋아하시는분들은 강추 ,10
644,영화보고 평점남기는거 처음이네 이런 영화가 극한직업보다 평점낮은게 빡쳐서 10점줍니다ㅋㅋ솔직히 스토리는 약간 슉슉 넘어가는김이 있지만 극한머시기 보다 백배 잘만듬ㅋㅋ한국영화시스템 좀 갈아엎어라 ,10
645,아바타 의 버금가는 액션 씬 특 캐릭터 넘 이쁘게 나옴 최고 ,10
646,쓰레기같은 한국경화 가운데 눈이 호강했다 ,10
647,"일반 2D보다는 아이맥스, 3D 등 특별관 관람 추천함. 나중에 VOD로 보면 재미가 반감 될 듯. ",9
648,두시간이 콱차게 잼있었다 .뭐보고 언친 속이 확 뚫리는 느낌 이게 영화지 !!! 고맙다 ,10
649,킹갓명작 진심 후회안함 ,10
650,어벤져스보다 더 재밋게봤습니다 .. 강추 또 강추 .. 두번 세번보세요 ,10
651,진부한 사이보그 이야기는 아니다. 재미와  감동 모두 잡은 영화. ,9
652,와우!!!시간가는줄 모르고 봣네요..한번더 보고싶어요.정말 재밋어요 ,10
653,영상미 짱짱 재밌었어요 ,10
654,정말 재미 있습니다. ^^ 추천 ,10
655,우선 알바 아님. 개인적으로 별 기대없이 봤는데 예상외로 꽤 수작임. 알리타는 볼수록 매력있고 커여웠고 만화 원작인지 모르고 봤는데 그 만화가 기대될 정도로 재밌게 봤음. 액션이 꽤 화려하고 나름 슬프기도 한듯 ,9
656,인생 처음으로 영화평점 남겨봄. 수많은 영화중 제 최고의 영화.3번볼겁니다.이걸보려고 지금까지 살았나보다.이시대에태어난게행운 원작스토리가 워낙 방대해서 영화에담기힘들어 개연성이 떨어지지만 다보면 알리타의 매력에 빠져...,10
657,역시기대를저버리지않는영화 ,10
658,난 이  명작을 어떻게 살릴까 걱정했는데... 진짜 명작 인정!? 어 인정!! ,10
659,스토리로 까내리는 분들이 많은데 저는 질질 끈 느낌은 별로 못받았고 후반부 너무 급조된듯한 느낌만 빼면 완벽한 영화였습니다 ,9
660,레디 플레이어 원 과 유사하네요. 액션신이 아주 재밌습니다. imax laser 3d 로 보는것 추천합니다 ,10
661,극한직업도 재밌는데 알리타가 못 잡을 정도가 아닌데 극한직업이 9정도로 재밌었다면 이건 10정도로 재밌다 꼭보세요 여러분 ,10
662,존잼ㅠㅠ꼭 보세요 정말..강추 ,10
663,10점보다 더 높게 점수 줄 수 있다면 무조건 최고치를 주고 싶습니다. 말문이 막혔습니다.. 정말 대단합니다. 강추 !!! ,10
664,처음 여주인공 눈이 너무커서 적응 안되고 비호감이었는데 후반갈수록 점점 빠져듬...  그리고  12세 관람가라고 하기엔 수위가 높다고 생각됨.. 피만 안나왔지 절단 되는 수준이..R등급이던데..그래도 매우 잼있게 봤...,10
665,아니 이게 어떻게 재미없지? ,10
666,진짜 재밌어요. 긴장하며 보느라 땀날 정도로 몰입감 최고!다음 시리즈 기다려지는 영화?? ,10
667,다시보고  싶은  영화... ,10
668,화려하네요. 눈이 황홀해지는 기분입니다 ,10
669,재미나게 즐겁게 가족들이랑 봤어요~^^ ,10
670,기대이상!현실과 구분ㅇ ㅣ안되는 cg는 진짜 최고 ,10
671,환상적인 애니메이션과 연출 정말 재밌게 잘 봤습니다.후속작이 기대되네요. ,10
672,2018~2019 2월 현재까지 최고의 액션 영화. 보면 적어도 돈 아깝단 생각 안함. SF를 어지간히 싫어하지 않는 이상. ,10
673,아바타 이후 최고의 영상 충격 ,10
674,진심 그냥 가벼운 마음으로 보러갔다가 개재밌게 보고옴 ㅋㅋ 후다닥 두시간 지나감 ㅋㅋ ,10
675,극한직업보다3배잼있어요~^^ ,10
676,SF 가뭄기인데 퀄이 굳 ,9
677,재미있었으나 멜로 부분은 별로였음 ,8
678,"cg개쩔더라 진짜 왜케쩌나 했더니 아바타 제작진 ㅋㅋ 액션, 스토리 빠질게 없다 꿀잼이다. ",10
679,간만에 눈호강햇음!! 저는 정말정말 재밋게 시간가는줄모르고 바써욤~ 2편 빨리나오길.... ,10
680,2편 넘 기대됩니다 아이맥스 3d 재관람 예정. ,10
681,로보캅+제5원소+테미네이터+트렌스포머+페이스오프+심석희를 잘 버무려 섞어논 영화임 ,10
682,알리타 존예 ㅠㅠㅠㅠ뚜보고 싶다 ,10
683,"일단 평가하기가 매우매우 애매하다..액션씬,cg는 두말할거 없이 최고다 . 하지만 원작을 각색하는 과정에서 너무 여러 에피소드를 짬뽕시켜서 몰입을 방해하는  중구난방한 스토리가 된거같다. 그래도 '총몽의 실사...",10
684,공각기동대 실사판에 비하면 명작입니다 ,10
685,원작 모르겠고..그냥 졸라 재밌고 진짜 잘 만들었다. CG는 여태 봐왔던 CG 중 인간을 표현한 CG의 최정점이다. ,10
686,극한직업 저리가라급 추천해요 ,10
687,SF 좋아하는데 이건 역대급임 무조건 두 번 이상 봐야 되는 영화.. 레전드다 레전드 ,10
688,제발 재미없다는넘들 ... 영화 뭐아는척 평론가인척하지말자... 토 할거같아... 그냥 존나 잘 만들었어... 꼭 봐라. ,10
689,액션은 예고편이 전부였고 스토리는 생략한 게 너무 많아 개연성이 부족했다. 솔직히 많이 실망함... ,7
690,돈이 아깝지가 않은 영화다... ,10
691,그깟 치킨영화때문에 묻혔다.치킨예매한 내손가락부러뜨리고싶음치킨볼거면 알리타2번보는게 개이득진짜 꼭보세요아바타 저리가라임 ,10
692,아쿠아맨 같은건줄알고 재미없을거같아서 기대 하나도 안하고 봤는데 알리타 2 언제나오는지 검색하는중... 개쩔ㄹ어어 ㅠㅠㅠㅠ ,10
693,아바타보다 더 재밌음 갠 적으로는 극한직업보다 볼 만 했음 ,10
694,알리타 매력적 순수의 전사 ,10
695,이걸보고 재미를 못느끼는 사람불쌍하다...평생 극한직업 개콘 따위나 보면서 재밋다고 낄낄거리고 만족하며 살겟지?? 평생 김치콩나물이나 먹으며 살아온 노인들한테 고급서양부페집데려가봐야 김치만 찾더이다 그렇게 자기수준만...,10
696,유투브리뷰어들 평들이 안좋길래 안보고있다가 친구가재밌다길래 보고왔는데 재밌었어요 이런상업영화에서 어떤작품성을 바라는지? 진즉 볼걸 싶었네요 지금 개봉영화들중 제일 극장에서 돈주고 볼맛나고 흥행해야되는 영화라고 생각함...,10
697,"트랜스포머를 뛰어넘는 충격..아바타 이상의 사랑..그냥 이영화는 ""미쳤다"" 3글자네요..! ",10
698,"솔직히 극한직업 보다 훨 씬 재밌다.개OO튼 스크린쿠ㅜ터제 때문에 ., 상영관 수 보면 답이 안나온다.. ",10
699,누가잼없다했나요?눈물뚝뚝.감동.뛰어난영상미.어느것하나빠지지않습니다.2편이 벌써 기대됩니다.배순탁님께서 어느 방송에선가 기대된다.꼭.보겠다말듣고 극한직업안보고봤는데무조건.엄지척!!! ,10
700,극한직업을 보며 한국식 싸구려 개그로 2시간을 소비할바엔 이걸 봐라 ,10
701,극장에서 한국 드라마 보지마시고 이런거 보삼 ,10
702,무조건 한국영화한테 스크린많이 줘서 이런영화가 묻힌다는게 안타깝다..동일선상에서 경쟁해야 한국영화도 많이 발전하거늘.... ,10
703,와 진짜 이런 영화가 극한직업 밀린다는게 말도안된다 그냥 지린다 갓만에 헐리우드에서 제대로된 영화나왔다 내용 막 뭐라고 평점 깍던데 도대체 얼마나 훌륭하신 시나리오들을 가지고 계시는지 ㅡㅡ 내용도 훌륭하다 ,10
704,2시간이 어떻게 갔는지 모르고 봤다 ,10
705,극한직업볼바엔 한번볼바엔 알리타열번보겠다 ,10
706,아바타를 능가하는 상상력과 뛰어난 영상미로 볼거리가 가득한 영화 ,10
707,평점이 왜이래 더 높아야 되는데~>< 전 어벤저스보다 더 잼났어여~ 아쿠아맨보다도~ ,10
708,인생작 이렇게 빠져본 영화가 없다. 알리타 매력쩐다. 꼭 속편볼수잇길  빈다ㅜㅜ ,10
709,꼭 보세요후회 없어요 ,10
710,어벤져스 이런것보다 훨 잼있다 ,10
711,스피드하고 재미 있었음 ,9
712,각본의 만듦새는 아쉬움이 있지만 아이맥스 3d의 경험이 좋았기에 ... ,10
713,알겠냐? 실사화란 이런거다. ,10
714,살면서 본 영화중에 제일 재밌었다. 꼭 봐야함. ,10
715,"원작인 총몽을 넘어선듯, 만점 드려요 ",10
716,내 기준 로봇영화 1위 알리타 2위 트랜스포머임 ,10
717,말이 필요없는 영화정말 끝내줍니다 ,10
718,액션영화에 소름돋은적 처음임  원작 여린감성의 여전사를 정말 잘 표현했음 또보러 갈꺼임 ㅜㅜ ,10
719,무적권 4DX 액션 개박살난다ㅠ ,10
720,4dx를 추천합니다. ,10
721,극한직업은 집에서 재미있게 볼수준알리타는 극장용.. 이런게 재미지 굳 ,10
722,아이맥스로 보세요~요새들어 제일 볼만한 영화 ,8
723,와씨 극한직업에 상처받은 마음 치유받네 ,10
724,이게 재미 없다고? 최고다 ,10
725,알리타 넘이쁨 액션도 짱짱 ,10
726,영화가 이렇게 까지 발전했네요 ,10
727,역시 국산 영화(극한직업)는 DVD로~모든면에서 완벽한 완성도 알리타는극장에서~꼭 보러가시길~ ,10
728,사이버보안 알리타의 인간적인 너무나 인간적 모습에 반했습니다. ^^ ,10
729,?내가 처음으로 댓글 평가를 한 영화. 완벽 ,10
730,미쳤다..! 꼭 봐야하는 영화다속편을 기다리겠습니다!! ,10
731,극한직업이랑 비교할께못됨 ,10
732,아바타보다도 뛰어났고 극한직업이 국산 영화라 해도 빨리 내려와야 이 좋은 영화를 많이 볼텐데 아쉽다. 어제 3d atmos 로 보는데 50명도 안되더라. 집에 와서 hdts라고 저화질로 촬영한 것을 되네이면서 또 봤...,10
733,최근 몇년만에 최고의 영화! 아바타급 ... 적극추천 ,10
734,극한직업 흥행 여파에 밀리는 감이 있으나 둘다 본 경험으로는 알리타 추천!! 4dx로 보세요~ ,10
735,아이맥스로 봤습니다...보면서 다음에 영화 찍을 영화 감독들이 불쌍하데요 단 1초도 지루할 틈없어요 ,10
736,극한직업보다 100배는 재밌네요 ,10
737,최근 3년안에 본 영화 중 제일 재밌다. 이게 왜 박스오피스 1위가 아니지??? 궁금하네;; ,10
738,웬만한 픽사 마블 영화 이상이다 극한직업 말고 이거 보세요!! ,10
739,원작보다 훨 낫다. 잘 만들었다. ,9
740,카메론디아즈 총몽판권 사더니 12세 관람등급. 원작 특유의 그로테스크함은 어디다 두었나..가상이지만 현실에 투영을 몰입하게 하는 잔혹함이 배제됨과 상업성 화려한 영상물에 포커스를 둠. 주는 메세지를  배제한 상업영화...,7
741,진짜 재밌다 무조건 보자 ,10
742,극한직업 따위와 비교할 영화가 아니지 한국수준 ㅉㅉ ,10
743,와 심각하게 재밌다 ㄹㅇ.. ,10
744,다음편을 염두해두고 만든것이라 그런지 성장과 배경에 중점을 둔것치고는 설명이 부족한부분이 좀 있고 그부분이 개연성이 없게 느껴지게만듬 루즈한부분을 그런쪽을 좀더 보강하는게 났지않았나싶고 액션과 cg는 만족스러웠습니다...,8
745,"장르영화의 새로운 기준이 나왔다고 생각합니다.. 현대 영상기술이 어디까지 온 건지 이 영화로 확인할 수 있고, 원작 자체가 좋아서 그렇겠지만 명장면과 명대사들 나올 때 입 벌리고 봅니다.. 꼭 보세요 ",10
746,추천 추천 추천 추천 추천 추천 추천 추천 추천 추천 추천 추천 ,10
747,"액션, 판타지, 모든게 만족스러웠다 ",10
748,어제밤에 보았는데 상상 이상으로 재미있음   전좌석 매진이라 심야에 겨우 볼수 있었음 예쁜만화얼굴과 스펙타클 SF 영화와의 놀라운 어울림 ! 이영화는 실로 대단함 ! ,10
749,극한직업은 관객들 상대로 웃음으로 장난쳤다면 알리타는 감동의 품격으로 관객을 홀렸다 ,8
750,진짜 극한직업같은 알바푼영화보다가 이런거보니까 눈정화 ,10
751,평점 낮게준 ㅄ들은 그냥 시비걸고 싶어서  안달난 관종으로 보일정도로 잼있음.  보통 이런류는 스토리가 부실하기 마련인데 스토리도 좋고 후속작도 아주 기대됨. 평점테러하면서 지가 뭐라도 되는양 착각하는 더라이들 말 ...,10
752,심야로 영화나 볼까 찾던중 시간맞은 영화로 대충 골랏다가 홀렷음  존잼.... 에니메이션같아서 그냥 그러겟지하고 봣엇은데 투 언제나오나 생각 ,10
753,단점을 찾을 수 없을만큼 훌륭한데 2편제작이 요원할만큼 흥행되지 못했다는게 너무나 아쉽다. 이렇게 후속작이 기다려지는 영화는 처음.. ,10
754,진심 너무 재밌네요 2편 빨리 만들자 ,10
755,이거진짜 장난아니네.. 알리타 보고싶어서 어쩌지 ㅜㅜ ,10
756,저는 정말 재밌게 봤네요.ㅋㅋ 후속작이 기대됩니다.바로 보러가야 쥥 ,10
757,신선하고 영상완성도가 매우 좋았던 영화원작이 20년전이라는게 안믿어졌어요처음엔 사람 얼굴에 몸이 로봇인게 조금 징그럽고 난해했는데 가면 갈수록 적응이 되었네요. 물론 얼굴이 cg라 그런거지 진짜 실존인물이었다면 적응...,10
758,원작캐릭터보다 영화속 알리타가 훨씬 낫다반해버린... ,10
759,아주 신선한 영화. 속편이 정말 기대된다. ,10
760,정말 볼 만함.2번 정도는 봐줘야 할 영화 ,10
761,2편 언제나오나요 ㅠㅠ ,10
762,시간가는줄모름 그래픽이 좋음 ,9
763,근 10년간 최고라고 생각합니다 벌써 다음회가 기대되네요 ,10
764,이게 진짜 잘만든 영화지 마블도 잘만들었지만 알리타 더더더 잘만든 영화임 1만원 아니 2만원 아니 3만원을 주고도 아깝지 않은 영화입니다안보신분들 꼭 보시고 알리타의 매력에 빠져보세요 감독님 2탄 꼭 만들어 주삼 ,10
765,마지막에 알리타가 향한 칼끝 그끝을 꼭 다음편에서 보고싶다!! ,10
766,이정도로 외면 받을 영화가 아닌데 흠.. ,10
767,현존하는 SF의 지존. ,10
768,재미있습니다. 적극 추천합니다 ,10
769,재밌게 잘봤습니다~! ,10
770,여자친구랑 첫 영화 그치만 그녀는 떠났다 ,10
771,알리타넘멋있어ㅜ두번봤다능ㅋㅋ ,10
772,알리타 2가 어서 나오길 벌써부터 기대된다 ,10
773,재밌습니다 ㅋㅋㅋ 속편도기대되네요 ,10
774,2탄이 기대되는 영화얐습니다 ,8
775,다음편 나올때까지 기다린다 ,10
776,재밌습니다 생각 이상인거 같아 좋습니다 ,7
777,알리타가 연기를 잘한다는 생각이듭니다.너무 잘만든 영화.4D로 2번 봤습니다. ,10
778,"약은 약사에게, 진료는 의사에게. 역시 망가 원작인 영화는 헐리우드에서-_-b ",10
779,개꿀잼인데 왤케안보지 ,10
780,오우 재밌습니다 ㅎㅎ 참 ,8
781,재밌습니다. 마지막이 이상하다 했는데 다음편이 만들어진다네요. 다음편도 볼생각입니다. ,10
782,정말 장면하나하나 잊을수없다 ,10
783,"과거 총몽 보면서 느꼈던 흥분,설레임을 다시 느꼈다. 최고다. 개인적으로는 마블의 히어로 시리즈 보다 더 재밌다. ",10
784,괜찮네요 2편 기대합니다 ,10
785,너무 재미있다.  집에서 소장 구매해서 또 볼 생각이다. ,10
786,아바타를 이은 최고 판타지다 역대급이고 이거보면 눈이 지루할때가없고 ㄹㅇ 영화속갔다온 느낌 이건 무조건 영화관에서봐라 난 스크린x 로봤는데 ㄹㅇ쌌다 ,10
787,계속 생각나. 굿..  3d로 보고프다 ,10
788,완전  재밌는데요 다음편이 기대되는 영화입니다 ,10
789,상영할때 봐야함 4d로 캡틴마블에서 못느끼는걸 느낄거임 ,10
790,난 충분히 재미있었다. 호불호 클듯.  다음편이 더 기대되는 영화. ,9
791,제작 기간이 왜 길었는지 직접 보면 느낄수 있는 영화!  개인적으로 정말 재밌게 봤습니닿 ,10
792,진짜 재미있게 봤습니다. 강력 추천! ,10
793,진심외국영화 안보는 사람도 봄!!! 졸잼!!! 스토리있는영화!!  본지 됐어도 계속 응원할꺼다!! ,10
794,"그래픽이나 액션은 좋았지만, 한방이 없어요..  스토리가 2편 예고편인 느낌 ",8
795,도전적일 만큼의 CG가 한층 더 살린 영화 ,10
796,왜 내용이 늘어지는가 했더니;; 후속작이 있다는 걸 모르고 보면 의아해하면서 볼 듯... ,8
797,아주 재미있었어요 최고에요 ,10
798,Cg에 놀라고 기계가 사지절단되면12세사람은19세 ㅋ ,10
799,개연성 없는 것도 쿨해보인다 ,8
800,2편 빨리 또나왔으면 좋겠다 ,10
801,원작을 뛰어넘는 훌륭한영화 ,10
802,존잼임 추천합니다 후속작 꼭나오길 ,10
803,생각보다 재밌었어요ㅎㅎ ,10
804,재밋어요재밌어요재밌어요 ,10
805,시나리오 전개 연출 액션 모든면에서 휼륭하고 너무 좋았다 ,10
806,진짜 재미써용 ㅠㅠ 마블급 액션이다 이건 ... 2 나올 것 같은데 기대하고 기다릴게요 ,10
807,그래픽 쩐다. 속편은 나올라면 제작기간 오래걸릴듯 ,9
808,재미있습니다.2편 기재됩니다 ,9
809,액션씬에서는 손에 땀나고 긴장하면서 봄 알리타 너무 멋있었고 어벤져스 싸우는장면보다 타격감 쩔음그와중에 슬픈것도 있어서 관객 눈물흘리는 구간도 있음 ,10
810,"한마디로 ""와~!""다. ",10
811,미쳤다 완벽하다 여운이 가시질 않는다.... ,10
812,'이런 종류의 영화' 끝판왕... ,10
813,올해 본 영화 중에 가장 재밌었다 ,10
814,간만에 볼만한 영화. 추천합니다. ,10
815,진짜 알찬영화랄까 !보고나니 넘 뿌듯하고 좋았어요 이런영화는 돈이 안아까움 ♡ ,10
816,"끝내주는 소년만화 한권을 본 것 같다! 생동감이 넘치고 시원시원하다. 정교한 스토리텔링이나 깊은 감동을 주는 것은 아니지만, 정신없이 화면을 보다보면 즐겁게 시간이 지나간다. ",10
817,영화관에서만 세 번째 봄 .. 살면서 최초로 영화관에서 세 번 보게 만드는 영화 ,10
818,저 SF 병적으로시러합니다이 영화는진짜 말이안나옴 그래픽이..정말 미친영화 마지막에개움 ,10
819,왠만한 마블보다 더 잘만들었어요! 스토리 cg 액션 모두다 조아서 쫄깃하게 봤어요! 두번 봤어요 ㅋㅋ 안보신 분둘 꼭 보시고 빨리 속편나왔으면 좋겠아요 ㅜㅜ!! ,10
820,볼거리 끝판왕 로드릭게즈스타일 영화 ,10
821,사이보그 정말 시지 잘만든듯.. ,10
822,너무 재미있다ㅠㅠ 상영관이 너무 없어서 안타까워요 ,10
823,엄청납니다 추천드려요 ,10
824,진짜 근래에 본 영화중에 최고였음.. 왜 현실 캐릭터가 아니여야 되는지.. 그리고 왜 리얼인지.. 정말 박진감 넘치고 그래픽 음향 최고였음.. 마지막이.. 짠함 ㅠㅜ ,10
825,재밌음. 영화관에서 안보면 후회함 ,10
826,이런영화가 왜이렇게 조용하죠?대박대박!! ,10
827,왜안보는거야... 지금이라도 보세요. 안보면후회합니다 ,10
828,"개존잼. 평론가 평점처럼 스토리라인은 90년대 느낌 날 정도로 구려요. 그래서 별 1개 뺐는데 그래도 요즘 영화, 만화에선 쉽게 볼 수 있는 은유와 상징이 표현돼 있고 액션씬이 죽여서 9점 줍니다. 만화 찾아보고 싶...",9
829,극한직업보다 재밌음 돈 안아까움 ,10
830,무조건 2편 나와야 해요 ㅠㅠㅠ만들어주세요...안봤으면 후회할 뻔 했네요. 기술이 많이 발달했음을 다시금 느낄 수 있었던! ,10
831,"박정현 ""꿈에"" 와 015b 6집 정서적 레퍼런스 ""총몽""홍보가 아쉽다. ",10
832,액션 입벌리고 봄 한번더볼의향잇음 ,10
833,"진짜 같은 실사영화  아바타를 능가하는 CG영화의 끝판왕입니다. 특히 알리타의 눈동자의  디테일한 묘사  등 정말 놀랍군요  역시 터미네이터, 에어리언2 , 아바타 SF영화의 거장다운 작품입니다. 속편이 기대됩니다....",9
834,진짜 지금 당장 다시 보러가고 싶음 ,10
835,멍청한 남친만 빼면 완벽한 영화 ,10
836,로맨스가 필요보다많다는 것을 제외하면  대단히 만족스러운 영화이다 ,9
837,만화의 전형을 잘 따른 스토리텔링에 모터볼 씬은 특히 잘 만들었다. 좀 잔인하고 자극적이라 피로도가 있긴 했는데 2편은 또 볼 생각이다. ,9
838,그래픽 액션 대박이여서 스토리가 진짜 더욱 아쉽다 스토리가 빨려드는 그런 느낌이 없음 약간 아쉽지만 그패릭 액션이 캐리했다 ,9
839,오홍  가족들과 오늘 보고왔읍니다 ㅎ  다들재미 있게 보고와서   즐거웠습니다 ,10
840,2편을 기대하게 만드는 영화~ ,8
841,2편을 기대하게 만드는 영화~ ,8
842,감독판으로 다시 나왔으면 좋겠다. 만화책 4권 분량을 두 시간 짜리 영화로 축약하다보니 감정이입이 필요한 부분에서 그러질 못했다. '기갑술'을 제대로 실사 스크린으로 옮긴 액션 연출은 근래 헐리웃 영화...,8
843,꼭봐라 평소 sf물 딱히 좋아하진 않는데 딱히 볼것도 없어서 봤다가 기대이상이었다. 진짜 눈이 호강한다. 시나리오는 솔직히 뻔하긴 한데 cg가 모든걸 압도해서 두시간 넘는 시간동안 단 한번도 지루한적이 없었다. 다음...,10
844,"절대2D로 보지말고 IMAX3D로 보기바람. 2d로 봤을땐 뭐 그저그렇네. 아유 식상해 했었는데, IMAX로 관람후 역대급 이었음. IMax 기술이 이렇게까지 발전했다니 불과 몇년만에...ㄷㄷㄷ ",9
845,뭐라 말을 못하겠다. 왤케 재밌지.. ,10
846,하...너무재밌어서 영화관에서 3번봤습니다.ㅎㅎ ,10
847,아맥으로 3번봤는데 또 보고 싶네요 ,10
848,이런 그래픽은 무조건 10점임. 못보는 사람이 안타까움...상영관 벌써 줄어들어서 몇군데 검색해보고 상영관 찾아서 보고옴. ,10
849,극한직업보다 좋았어요 ,8
850,내 인생영화...와 굿 ,10
851,꿀잼꿀잼꿀잼꿀잼꿀꿀꿀 ,10
852,대박대박대박대박대박대박 ,10
