,Review,Rank
393,막장드라마같은  영화가 너무 전형적이고 뻔함   류준열캐릭터도 매력이 없음 차라리 뺑소니사건을 해결해가는 내용이였으면 10배는 더 재밌었을듯 ,2
394,올해 본 영화중 젤 잼 없음  레알 이게 먼 영화인지도 모르겠음 암튼 비추 보면 나랑 똑같은 생각할꺼임 ㅋㅋ ,1
395,내가 이때까지 노잼 영화 다 피햇는데 이걸 못 피햇네 ,1
396,알바들은 양심도 없냐... ,1
397,평점 믿지마세요ㅠㅠ.... 하 진심 노잼 다세포소녀 이후로 핵노잼임 사람들한테 먼저 영화보자고 해서 봤는데 미안해서 죽을뻔 ,1
398,매주즐겁고재미있었다 ,10
399,끝까지 참다가 스나이퍼에서 터졌다. ,1
400,신선한 소재를 가지고 영화를 이렇게 만들어버리고 길거리 레이싱장면에서 이야 정신병자들 많네 라는 대사를 듣고 귀를 의심했네요자동차 관심있는사람 좋아하는사람 한번에 모아다놓고 정신병자 만들어버리는 영화.. ,1
401,제발 보지 마세요 진짜 걍 지루하고 개연성도 없고 킬링타임용으로도 아까움 ,1
402,진짜 지루하다...평점이 왜캐 잘나오는거지... ,1
403,한개도 아깝다.. 영화보는내내 극장안 사람들 한마음되서 웃었다. 내가지금 여기서 뭐하는 것인가.. 허탈함에 웃음밖에 안나오는 영화.. 알바들 진심 때리고싶네.. 중반부까진 볼만함.. 중반 이후부터 쓰레기 좀비영화됨....,1
404,생각보다 재밌어요 볼만한듯 ,10
405,재미없어요 지루햇어요 ㅠ ,2
406,저는 제가 주의력결핍인 줄 알았어요 저만 그런게 아니었군요.. 내용흐름이 전혀...; 억지로 끼워넣은 렉카출동은 뭐임?? 연기력 쩌는 배우들 데려다 편집을 어떻게 저 따위로...--; ,2
407,류준열짱 조정석대박 공효진존멋 ,10
408,다 알바들인가? 남는건 배우들 연기력뿐 ,6
409,대체로 배우분들의 연기 모두 좋았다 생각하며 특히 류준열배우님이 돋보였다고 생각합니다 :)하지만 이야기 연결이 매끄럽지않고 어수선하다고 생각하였습니다 :( 그리고 초반부에 비속어와 잔인성이 커서 되도록이면 아이와는 ...,6
410,류준열 연기력 오졌다.... ,10
411,"배우들과 감독의 필모그래피를보고 괜찮겠다싶어 보러갔는데 내용이 너무 별로였습니다...개연성이 너무 떨어지고 진짜 띠용의 연속이었던,,다 보고나니까 제값주고 본 돈이 너무 아깝네요 그래도 안본눈이라도 사고싶은 심정입니...",1
412,전 재밌게 잘보고 왔습니다~~~^^ ,10
413,조정석 류준열 개 멋잇음!!! ,10
414,아~~~~영화보는 내내 힘들었음 ,6
415,ㅋㅋㅋ 조정석 류준열 케미 뭐에여 ㅋㅋ 너무 좋잖아여! ,10
416,공효진 염정아 전혜진 ㅠㅠㅠㅠ 다들 너무 멋있으십니다 배우님들 ㅠㅠ 앞으로도 스크린에서 자주 보고싶은 사람들! 진짜 재밌어요.. 다들 한 번씩 봐보세요! ,10
417,여배우들이 너무 멋졌어요 레이싱장면도 스피드감 느껴져서 좋았어요 ,10
418,살짝 지루한감이 없지않아 있었지만 공효진의 연기가 워낙 좋았고 후반부의 카체이싱 액션도 괜찮았다 한번쯤은 볼만한 영화 ,8
419,역시 조정석 카리스마 ~~류준열 연기 확실히  멋진 배우입니다~~~ ,10
420,개인적으로 극한직업 보다는 잼나게 봤네요 ,10
421,기대한 만큼 재미있었어요!!! ,10
422,연기력 탄탄한 배우들 캐스팅 뺑반 기대되는 영화입니다 이번주 예매들어갑니다★★ ,10
423,지루하지않고 재미있네요 ㅋㅋㅋㅋ ,10
424,제가 오늘 엄마랑 이 영화 보러가려고 하는데재미있으면 공감 재미없으면 비공감 눌러주세요!! ,10
425,두번 세번 볼 영화 ㅎㅎㅎㅎ 넘나재밋음 ,10
426,광고만봐도 존잼각 대박나세요 ,10
427,마지막 비하인드 개핵꿀잼 ,10
428,이슨생 류준열이 나오니 당연히 재밌을 수 밖에 없는 !! 기대한 만큼 딱 ! ,10
429,배우들 연기력에 다시 한번 감탄하고 나옴 !  2시간  순삭당함 ㅠㅠㅋㅋ ,10
430,이것저것 너무 짜집기했다..렉카 원기옥은 아주 오그라들다 못해 역겨웠음 ,2
431,올레tv 5천원..개연성 최악마이크녹음 최악배우발음 최악시나리오 최악웬만하면 끝까지 보는데 절반도 안봤다..욕나온다 진심... ,1
432,취향이긴 한데 감독의 편집능력(?)이랄까 연출이랄까 그런게 아쉬웠네요 배우들 연기는 그럭저럭 볼만했는데 역시 영화는 감독의 예술이라는 말이 맞는다는걸 새삼 느끼게해주네요 ,6
433,조정석..류준열..연기잘한다...끝 ,5
434,"뺑소니 범죄에 유능한 류준열도 잡지 못한 시간, 돈(영화표 값) 뺑소니범...(배우들의 연기만 뛰어났음) ",4
435,캐릭터의 설명 미흡개연성 없는 전개쌩뚱맞은 신파차라리 캐릭터들을 설명할 분량과에피소드등을 세밀하게 표현할 수 있는드라마로 제작하는게 나을뻔했음~2편 제작은 손익분기점을 못넘겨 힘들듯... ,3
436,배우들이 연기를 잘해서 그나마 볼만함 ,4
437,살다가 중간에 존 첫번째 영화+너무 재미없어서 영화보는내내 나갈까 말까 고민하던 영화+ 마지막김고은나온거 설마 2만들려는건지 그렇게 노잼인데 무슨배짱으로 시즌2까지만들려고 한걸까....왜 0점은 안되는거져ㅠㅠ ,1
438,민재야 이간진짜 오바야 ,1
439,시나리오에 개연성도 없는데다가 무슨 여경들의 활약이 있다고. 현실 고증 좀 하자. 보배에 고속도로에서 후미등 넣은 차량 신고하니까 후미등이 뭔지 구별도 못하는  여경 때문에 하소연 글까지 올라오더만ㅋㅋㅋㅋ 무쓸모 여...,1
440,절대보지마세요~ㅆㄹㄱ리뷰알바들은눈으로안보고돈으로봤음 ,2
441,"쓸데없는 장면도 많고, 스토리도 기승전결이 없고, 지루하기도 함 ",1
442,10점은 알바냐???? ㅅㅂ평점 낚여서 보고 왔는데 처참하다.그 좋은 배우들을 데리고 뭐하는 거냐?작감 반성해 ,5
443,조정석연기는 조금 봐줄만 개인적으로 공효진 좋아하는 배우라 보기 햇지만 추천은 글쎄네요 2월 5일 상영하는 알라타 넘 기대됩니다 ,4
444,막 엄청 재미있거나 하지 않고 그냥 평범함. 레이싱의 짜릿함으로 보실 분들 비추천. 류준열 공효진 이성민 등 연기가 그나마 극을 살림. 저격수 등 말안되는 내용 다분. 중간중간 설명없이 건성건성 넘기는 부분 많음. ...,6
445,배우들 연기 3점 영화 평점 1점 총 4점 배우들 연기 생각해서 더 주고싶지만 이런영화말고 다른영화에 출연하시면 더 좋게 드릴게요 ,4
446,지금보고있는데 집에가고싶다 ,2
447,이거 딱 6점짜리 영화인데 그냥 10점씩 주는 애들 때문에 1점 줌 ㅡㅡ ,1
448,운전대잡기가 무섭당 또라이만날까봐ㅠ ,3
449,"중간빼고는 별로 재미없던데;,,; ",2
450,영화가 뒤로 갈수록 엉망이 되는듯 허다...애초에 기대치가 낮아서 그런지 초반에는 생각보다 볼만한데 생각이 들었지만 진행이 되면 될수록 영 꽝이더라...카체이싱도...촬영 감독 실력 부족인듯...옜날 방식 그대로 쓰...,6
451,재밋어요!! 재밌어요!! ,10
452,가족끼리 보러ㅜ갔는데 잼썼어요 ,10
453,뻔한 한국영화 반성좀해라 ,2
454,나만 이렇게 생각하는게 아니었군요 ,1
455,별 하나도 아깝다 돈이 아까워 보지 말아~~ ,2
456,배우 연기만으로도 충분히 재밌어요 ,10
457,개연성이 없네 ㅋㅎ 돈아까움 ,1
458,어처구니가 없는 개연성 여자친구가 좋아해서 다행.. ,3
459,류준열 연기 잘하더라 조정석도 하지만 영화는 노잼 ,2
460,당했다 10분동안 욕해도 안풀림 안본눈삽니다 ,1
461,조정석의 명품연기에 영화순위 1등하시라고 상징성 하나 박고갑니다. 1점씩 모아서 1등 꼭 하시길. ,1
462,진짜 노잼 내용 없음. 극한직업이나 보셈 ,2
463,"영화 개연성이 1도 없고, 스토리도 하.. 영화끝나기 5분전까지 오늘안에 끝날 수 있을까 싶었음. ",2
464,스토리 전개가 너무 지루해서 보다 죽는줄;;; ,1
465,류준열의 연기말고는 남는 부분이 없다 ,6
466,옆옆자리 비었길래 누워서 잤습니다 ,2
467,그래.. 알바들 너네들이 고생이 많다 ,1
468,뺑소니 당한 티켓 값은 누가 찾아주나! 드럽게 재미없다 키 빼고 배우가 아깝다~~ 1점도 가깝다 빵점이다 올해 본 영화중에 최악 ,1
469,"앞에 한시간반정도는 지루하다가 끝나기 한 40분?전부터 재밌었음,, 근데 류준열 운전할 때 진짜 존멋탱ㅠㅠ 조정석도 연기개잘하고. 좀 지루한것만 빼면 나름 볼만한듯 ",8
470,"스토리 인과 관계 떨어지고, 자동차 액션은 마지막 몇장면 빼고는 속도감이나 박진감 못느낌. 악당 조정석 캐릭터설명도 부족하고, 다른 영화보면 동네조폭도 시체 바다에 버리는데, 회장이란 사람이 동네조폭도 안하는짓해서 ...",1
471,나 방금 뺑반 보고왔는데 진짜 너무 재밌는데..? 화장실 1시간 30분은 참은거같은데 영화 너무 재밌어서 끝나고 화장실감.. 그정도로 재밌는데.. 호불호가 있나 이게.. 나 최근에 본 영화중에 손에꼽음.. 그정도로 ...,10
472,난 재밌었늠데ㅠㅠㅠㅠ ,10
473,류준열 연기 너무  잘하네요 ,10
474,재밌었어요 잘봤어요! ,10
475,몰입감 짱!!! 다들 연기 잘하고 재미있음 ,10
476,기대이상으로 즐겁게 봤어요 ,10
477,ㅋㅋㅋ류준열 연기평점이 아니란다 영화 평점을 남겨라 이건 내가 못피했다. 리얼도 피했는데 이건 못피했네 욕나온다. 차라리 이거 볼려면 극한직업 두 번 본다 ,1
478,IPTV로 보세요...개연성 진짜 없고 그냥 지루해요 ,2
479,평점처음다는데 핸펀 시간만 본게 4번이었음알바들 양심도없다 ,1
480,진짜 대충만든것같은영화 배우들 연기는 너무좋다만 스토리는 개연성제로에분위기는 기승전결도아닌 뭣도안되는 이상한 구도에보는내내 지루했음 마지막쿠키영상은 재미도없는데어딜후속작을노리는지...평글보니까 영화보지도않은 알바들이...,1
481,극한직업이훨재밌다... 스토리가너무ㅜㅜ ,6
482,재밌게 잘봤습니다! 재밌었어요~~ ,8
483,진짜 뺀반 후회안합니다 너무재밌어용ㅎㅎ ,10
484,그냥 연계성 1도없고 억지감동 끌어내고 매드맥스 찍어버리네 마지막에는... 답도없다 ,1
485,한국식 분노의질주.. 이긴한데 너무좀 .. ,2
486,어제 봤다. 당신이 세상에서 가장 관대한 사람이 아니라면 보지마라 제발 진심 제발!!!!연출력도 그지같고 개연성은 개판이고 류준열이 연기를 잘한다고?? 이전에 류준열나오는 이런의 영화봐봐. 똑같다.그냥 드래곤길드리기...,1
487,박진감 미쳤어요 올해영화중에 제일 재밌었습니다 ,10
488,나만 재미없었냐... ,3
489,뺭소니당한 느낌이다 ㅎㅎ ,1
490,알바댓글에 제대로 낚였다 ,1
491,대박 기대이상ㅋㅋ분노의 질주 보는줄 배우들 연기도 짱!!!! ,10
492,어제 츄잉챗으로 봤습니다 ㅋㅋ 큰 기대는 안하고 봤는데 공효진 남친분  너무 매력적이여서 바로 검색해봤어요 ㅋㅋ손석구배우님 매력넘칩니다!! ,10
493,드뎌 개봉날... 극장가는 길... 류준열 기대만빵!!!! ,10
494,역시 믿고 보는 조정석과 연기로 또 한번 놀랜 류준열 ,10
495,기대보다 너무 재밌음! 심장 쫄려서 죽는 줄 알았다! ㅠㅠ 조정석 OOO기 잘해 역시 잘해... 재밌어ㅓㅓㅓ...!! 또볼래 ,10
496,오늘 애마가지고  한번 달려야 할 듯... ,10
497,류준열 개멋있다 ㅠㅠ 또 보고싶당 ,10
498,지루할 틈 1도 없이 몰입감 최고bb  강추합니다! ,10
499,"대박,심장 쫄깃하고 시간가는줄 모르고 봄 류준열 연기 조정석연기 지금까지중 최고 ",10
500,공효진 넘모 예뻐용@-@ ,10
501,연기 대잔치! 손에 땀이 차는 카체이싱! ,10
502,며칠전에 시사회로 봄 - 캐릭터들이 매력이 살아있습니다 ,10
503,진짜 핵잼이네요 ㅎ 응원합니다!!! ,10
504,이 영화 추천합니다! 재밌더라고요. ,10
505,이거는뭔지 ??? 극한직업두반보는게 더재밋을듯 ,4
506,재밌게 봤습니다.  배우들 연기 모두 좋았았어요  카체이싱도 굿 ,9
507,곽미향! 너.... 맞구나? ,10
508,짱짱! 말이 필요없는! 류준열 역시!! 기대를 저버리지 않네요~ ,10
509,개봉일만 기다리고 있었어요~멋진배우님들 연기를 한곳에서 볼수 있으니 기대두배합니다~ ,10
510,염정아의 연기 정말 최고! 카리스마 압도 뺑반 너무 잼있다 ,10
511,시간 가는줄 모르고 봤음 배우들 연기 최고 ,10
512,몰입감 쩔어요 오랜만에 한국영화에 여성캐릭이 많이 나와서 좋았음 ,10
513,아 역시 믿고보는 캐스팅!! 대박 존잼여 ,10
514,"기대가 큰만큼 실망하지 않을까 싶었는데, 진짜 기대 이상으로 재밌음ㅋㅋㅋㅋ 웃음코드가 딱 내취향임 ",10
515,간만에....좋은 영화!! ,10
516,류준열때문에 재미있게봤네요 ,10
517,"망한 이유가 있다. 다른 영화에 밀린 거라 하지 마라. 뻔한 전개에, 뻔한 신파극, 캐릭터는 많이 짜네놓고선 전부 일회용 캐릭터로 소비. 총은 드립다 들어대면서 그 총은 전부 아군을 향해. 영화라는 것은 보면서 중간...",1
518,평점 읽는게 더 재밌어요 ㅎㅎ ,1
519,영화보는내내 -_- 이표정유지 ,2
520,영화보면서 실소만 나오다가 2편을 암시하는 내용보고 감독이 미쳤나 싶었다 ,1
521,망하는데엔 이유가 있구나 돈내고 봤으면 큰일날 뻔했네 ,2
522,역시 사람들 보는 눈은 비슷하구나 티비로 보는 데도 시간 아까운데 영화관에서 봤으면 땅을 치고 후회했을듯ㅋㅋㅋ ,1
523,류준열이 이런 시나리오 졸작 영화를 왜 찍었을까? ,2
524,캐스팅에 비해서 작품의 개연성이 좀 많이 떨어지는거 같습니다. ,5
525,잠깐 잠깐 졸앗어요..ㅠ ,6
526,그래서 결론이뭔데....뭘 말하고 싶은건데....개그지같음 빵점주고싶은데 빵점이없네 ㅜㅠ ,1
527,"배우들의 연기력에 박수, 시나리오는... 음... ",1
528,영화좋았습니다~다른영화보러갔다가 예고편 보고 개봉하기만 기다렸어요ㅎ 배우분들 다좋아 하는 분들인데..류준열 & 조정석 배우님 정말연기 최고더라구여..평점 남겨본적없는데..처음 평점남기고 싶단 생각이 들었네요~ㅎ 조정...,8
529,조정석하고 류준열이 찢어놨어 ,10
530,재미도 없고  감동도없고  이런  영화는  처음   1점이  아까움 ,1
531,너무재미이없어요 돈너무아까워요 ,1
532,전개뭐라는지 모르겠음 ,3
533,"1점이라고 점수주기 정말 적당한 영화다배우들은 다 내가 좋아하는 배우들이지만 처음 나왔던 배우들의 반전 성격들은 가면갈수록 우리가 알고있던 배우들의 성격으로 바뀌고 내용은 점점 산으로 가다가 급 마무리^^,, 돈과 ...",1
534,배우들이 연기력쩐다? ,9
535,난 그럭저럭 잘 봤는데? ,10
536,"평점이 너무 극과극이어서 걱정했는데,영화관가서 직접 보고 평하는걸 추천함~!! ",8
537,차 액션이 스릴넘치고 재밌었어요 ,10
538,난 짱재밋었는데... 굿 진짜 알바아님 내돈 주고 보고옴 ㅋㅋ 다들 연기 잘한다 ,10
539,레커 부르는데 왜 갑자기 우냐고 ㅡㅡ ,1
540,배우님들 모두 연기 다 대박!!!! 류준열배우님 액션부터 눈빛 말투 억양 모두 최고 재미와 스릴 전부 다 좋았어요 감사합니다~재밌게 봤어요 ,10
541,"ㅠㅠ 너무 재밌었어요~~ 연기 최고,,, ",10
542,모든배우들 연기좋고 넘 재밌게봄~!! ,10
543,조조로 봤어요. 배우들 연기 정말 잘하고 속도감 있는 영화라서 좋았어요. 시간 순삭~ ,10
544,조정석 나올때만 몰입됨 영화보다 그냥 나가고 싶었던 적은 처음 ,2
545,간만에 잼있게 실증없어 달렸네요.배우들 연기 참 잘해요.연기력보는재미도 좋더라고요.보세요~ ,10
546,배우들 연기 진짜 좋았습니다 마지막이 조금 아쉽지만 재밌었어요^^ ,8
547,왜 다들 재미없다고 하는지 모르겠네 알바아니고 재밌었는데 ,10
548,아니진짜너무자미있는데 ...짱인데 ,10
549,뺑반 재밌어요!! 극한직업도 재밌게 봤지만 뺑반도 잘 만들었던데 ,10
550,재미없다해서 기대안하고봤는데 재밌던데 ,10
551,개재밋던데....평점보규. 기대를안해서 그런가 ,10
552,"류준열 매력은 점점 더해짐. 조정석, 류준열이 다한 영화. 지루하진않았음 ",8
553,평점 너무 안좋아서 기대 안하고 봐서 그럼지 재미있었음 내가 구분을 잘 못하는건가 개꿀잼이었는데 연기가 젤 미쳤음ㄹㅇ ,8
554,뻔한 스토리에 억지가족애.. 차는달리는데 하품만.. ,2
555,"쏘쏘 , 생각보다 길어서 살짝 지루할수도있는 ",6
556,스릴있고 재밌는데 별점테러 알반가?.. ,10
557,만화 보는 느낌이였고. 캐릭터 한명한명 다 맘에 들었고.. 재밌었는데 난..ㅎ ,10
558,평이 별로길래 기대없이봤는데 생각보다 재밌게 봤어요 6점대 영화까진 아닌거같아서 10점 드립니다 킬링타임용 영화로 나쁘지않아요 ,10
559,올해의 영화가 될듯...!!! 몰입하다보니 어느새 시간이 가버림...!!! ,10
560,진짜 배우님들 연기 미쳤음 ㄷㄷ ,10
561,긴장감과 흥미 재미적인 요소와 배우들의 연기까지~~최고였습니다. ,10
562,기대하고 본 사람으로서 팩트만 정리한다연기 쩔고 내용은 쏘쏘 전반부 살짝 지루한감 있으나 후반부 좋아 평소 영화보는데 대사 못알아먹는 사람들 극지루 할 수 있음 장면이나 연출보다 배우들 대사로 내용전개 대부분임볼만하...,8
563,오랜만에 시원한 한국여화 였네요~~잼나게 잘봤네요 ,10
564,완전 재밌어요!! 역시 믿고 보는 배우들 이었다 ,10
565,나쁜놈보다 더 나쁜놈 많다.... 권력..스릴과 긴장감때문에 시간가는줄 모름. ,10
566,극한직업때문에 안뜬건가 싶은 영화 더 잘됐으면 ,10
567,류준열은 배우의 좋은점 들을 거의 다 갖춘 스펙트럼한 배우 ,10
568,기대이상 최고의 영화입니다!!! ,10
569,완전 최고입니다!!!! ,10
570,모든 배우들의 열연으로 너무 재밋게봤어요!! 카체이싱 장면 보는내내 손에 땀을 쥐게되는 영화!!! 강추합니다!!! ,10
571,꼭 봐야하는 영화인 부분아니냐시원하고 통쾌하고 매력적인 배우들공들여 찍은 티가 난다 ,10
572,시사회 2번 당첨돼서 봤는데 존잼ㅠㅠㅠㅠ진짜 안지루하고 캐릭터들도 멋있고 카체이싱은 감독님 의도처럼 무섭게 느껴지면서도 긴장감 쩔어요 ,10
573,최고!!대박입니다~ ,10
574,좀 많이 실망했다. 시나리오에. ,5
575,극한직업 천만에 불알을 탁치며 10점준다 개인적으로 연기나 내용이 이게 더나음 ,10
576,진짜 스릴있고 재밌던데 ..  평점 왜이럼? 보고말하는거맞음? ,10
577,극한직업 보다 낫다 확실히 ,10
578,와~짱 잼있음.평점 좋게 준 사람들은 알바아닌 듯울 딸은 잼 없다고 함.호불호가 갈릴 영화.다만 중간에 살~짝 지루하지만 류준렬과 조정석 추격신찍을 때 겁나 멋짐 ,9
579,진짜 진짜 재밌는데 평점 왜이렇지?? 극한직업 보고 나서 이 영화 본 1인입니다 ,10
580,류준열+공효진+조정석 연기들이 소름돋는다.조정석의 디테일한 연기는 누구도 따라올 수 없을 정도 ,8
581,류준열이 돋보인영화!! ,6
582,아 이거 진짜 아냐 ㅠㅠ ㅜㅜㅜㅜ ,1
583,재밋어요 극 초반이 재밋엇구 좋아하는 배우들이라 연기가 그간 캐릭터랑 색달라 재밋엇네요 ,8
584,아놔! 속았다..이 알바들.. 진짜 억지스런 스토리 전개에 전혀 공감이 안 가는 영화.. 그나마 류준열 연기땜에 별 하나 투척한다..핵노잼.. ,2
585,배우들의 연기에 박수를 보냅니다. ,10
586,류준열 두일이 이후로 인생 캐릭터 조정석 연기는 말이 필요 없음 ,10
587,재밌네요 진심으로조정석 연기도 일품류준열 연기를 이렇게 잘했나요.. ,10
588,아 뭔가 가슴이 뻥 뚫리는 느낌. 배우들 연기 끝내주고 액션 카체이싱 시원하고 멋있다. 주말에 또 보러 가야지 ,10
589,뺑반!! 정신없이 보다보니 순식간에 끝 ㅋㅋㅋ ,10
590,배우들의 연기가 정말 현실같아서 몰입 할수밖에 없었어요 ! 중간중간에 웃는 포인트가 있어서 더 재미있었어요기대이상으로 재미있었습니당 ,10
591,와~배우들의 빈틈없는 연기력이 뺑반의 스토리와 재미를 끌어당긴다.다시 한 번 더보며 느끼고싶은 영화. ,10
592,재밋게 보고 왓네요!!! ,10
593,배우들의 연기에 소름~~ ^^ 재밌다!!! ,10
594,공효진 류준열 조정석 이성민 염정아 전혜진 연기최고!!! ,10
595,연기 최고..반전 요소가 있어서 보는 내내 심장이 쫄깃쫄깃합니다. 개봉하자마자 조조로 봤습니다. ,10
596,류준열 조정석 공효진 다들 연기 대박이에요ㅠㅠㅠ 꼭 보세요 두번보세요 세번보세요 ㅠㅠ ,10
597,자동차경주 보는내내 하얗게 불태웠다 ,10
598,달리고 또 달린다~~뺑반 좋네요 ,10
599,재밌게 보신분들많나요? 저는 별루였습니다. ,4
600,시나리오 날림에 배우들 감정만 날아가버린 영화. 이영화에 어떤연기를 하면 잘한다는 소리를 들을까. 고생한 배우때문에 1점줬다.  황당... 공효진도 좀 이영화랑 안맞는 느낌. ,1
601,나만 재밌음 ? 개재밌게 봤는데 ,10
602,극한직업보다 재밌게 봤음조정석 류준열 연기력짱 ,10
603,진짜 재밌어서 난 2번 봤는대 댓이 이런거보니깐 호불호거 심한갑ㅎ다...배우들의 연기가 죽인다 정말로 ,10
604,왜 그렇게 재미없다 그러지..1점 줄만한 영화는 아닌것 같은데...소재도 신선하고 배우들 연기도 좋고스토리도 나름 괜찬았던 것 같은데ㅡ그리고 개인적으로 류준열 팬이라되게 인상깊던데ㅡ ,10
605,1점 에바다 알바인듯..개인적으로 8점줍니다~ (극한직업도 8점 줍니다~)재밌었어요!!테러하신분들때문에 십점 드림! ,10
606,연기구멍 없는 영화였어요. 스토리도 잼나고 배우들의 새로운 모습이 좋았습니다. 기회되면 또 보고싶음 ,10
607,그냥 기대없이 갔다가 시간가는줄 모르고 봤어요. 충분히 재밌네요. ,10
608,올만에재미난 영화봤습니다박진감 넝치고 웃기고 암튼 재미났음 ㅋ ,10
609,이성민 형...나도 똑같이 당했어... ,1
610,나는 극한직업보다 재미있었다!!! ,10
611,너무 즐겁게 재밌게 보고 왔어요~~ ,10
612,"재밌는데 ,,,,왜 다들 재미없다고 하는걸까 ,,,,엄마가 진짜 재미없다해서 기대안하고봤는데 그래서 재밌었던건지,,,같이 본 친구들도 자거나 재미없었다고 하고,,,,평점은 생각보다 더 낮고,,, 눈물난다,,뺑반 흥해...",10
613,재밋엇는데ㅡㅡ난혼자봐서그런가 여튼조정석도 말더듬는연기잘햇고 공효진류준열도괜찮았고 결말도 개참신햇는데 상상도못한사람이 2편을기대하게만들엇음 ,8
614,평점 똥이길래 기대 안하고봤는데 엄청 재밌는데요?? 후반부에 조정석이랑 류준열 연기 ㅎㄷㄷ ,10
615,너무 재밌게 잘 봤어요~~ ,10
616,와우 조정석 류준열의 연기 어마어마하네용 ,10
617,손석구님 진짜 멋있고 류준열을 다시 보게 된 영화 ,10
618,배우들 캐릭터와 감성도 잘 살아있는 영화고 재밌었어요~  한번 더 보고 싶어요~ ,10
619,"들리는 혹평들이 많길래 별 기대없이 봤는데 나름 재밌던데요 진짜 경찰영화였고, 배우들이 정말 잘 이끌었고, 류준열의 액션영화가 보고싶어지는 생각보단 재밌었어요 ",10
620,전체적으로 배우들 연기보는 맛이 있어요후반부 조금 지루하게 느껴질수 있지만 잼나요..정재철악역연기를 한 조정석배우의 연기변신 최고입니다!!! ,10
621,배우분들 연기 최고ㅜㅜㅜ 재밌었습니다 !! ,10
622,조정석 연기 대박입니다 류준열 관심없었는데~매력있어요 멋져요 연기도잘하고잘봤습니다~~^^시사회에서~ ,10
623,대박예감. 지인한테 추천해야지. ,10
624,류준열은 늦깍이 배우였는데 본인만의 필모를 잘 쌓아가네요.. 조정석이야 정말 연기 잘하고.. 다만 공배우의 액션신 등이 아쉽네요.. 죽기살기로 하는게 느껴져야 하는데요..그래도 전체적인 오락 영화로는 흠잡을데 없습니...,10
625,손에 땀을쥐고!!! 배우들 최고!!! ,10
626,스릴감은 조금떨어져도 폭력성은 딱거기까지라좋았구  연기자들 good 잼나게봤어요 공효진씨 류준열씨 조정석씨 고생하셨어요 ,8
