,Review,Rank
627,"남자주연배우들이 정말이지 제몫을 다해주는 영화! 몰입도 높은 카체이싱, 잘정리된 흐름, 누구 하나 흠잡을 데 없는 연기력! 거기에 재미까지! 국내 영화 중에 이만큼의 카체이싱 영화는 없었던 것 같다. 4D로 보면 더...",10
628,같은남자가봐도 류준열 너무 매력있고 멋있음.재밋게 봤습니다. ,10
629,"벌써 뺑반2가 기다려짐.류준열 인생 캐릭 중 하나가 될 듯 싶다. 영화 속 모든 인물이 하나하나 살아있고, 범죄 오락 액션영화에 충실하면서, 그 안에 감성까지 잘 녹여낸 영화다운 영화. 2시간13분 동안 버릴 씬이 ...",10
630,스피드감이 장난아니에요 공효진 남친역할분까지 진짜 너무 웃겨욬ㅋㅋㅋ ,10
631,시사회로 미리 보고왔는데 배우들 케미랑 내용도 탄탄하고 정말 재밌었음 다시 한 번 돈 주고 볼 가치 있었던 영화 !! 별 10개 주고 갑니다 ,10
632,주인공들의 케미 폭발... ,10
633,"오잉 진짜 재밌었는데 다들 왜 그러지,,,, ",10
634,이런 평점 받을정도는 아닌데..낮은 평점 주라고 알바풀엇나 할 정도..추격신 넘 멋잇어요..조정석.류준열 넘 멋잇고.스토리 넘 괜찮고..이제 까지 보던 영화랑 차별성도 잇고..넘 좋앗엇요..아가씨같은 쓰레기.영화보다...,10
635,전 솔직히 재밌게 봤는데.. 돈을 뺑소니 당했다고 할정도로 절대 지루하지않던데요? 그리고 조정석 진짜로 미친사람인줄 알았어요..연기대박 류준열도 멋있네요 ㅎㅎ ,8
636,별점테러가 알바인건가...너무재밌게봤는데. 류준열 연기 이젠믿고봐될듯! 전혜진님 연기도 너무좋았고. 개인적으로 분노의질주가 생각났네유!(주관적)  피해가지마시고 보셔도될듯!* ,10
637,이영화가 평점 이렇게 낮은이유도 모를정도로 재미있음 ,10
638,"솔직히 평점때문에 망설이다가 보고온영화,솔직히 극한직업보다는 재밌게봤음(개인적인생각)극한직업은 예고편에 있었던게 전부이고 그냥 집에서 드라마보는느낌?근데 뺑반은 영화보는 느낌,웃긴건 없지만 나름 재밌었어요,극한직업보...",8
639,리뷰보고예매할까말까햇는데솔직히전볼만햇어여 긴장감도잇고 까일만한영환아닌거같네여  돈아깝진않네요 ,10
640,아니 이렇게나 재미있는데 왜 다들 재미가 없다고 하시는지 이해가 안가네요 ; 극한직업보다 10배는 스토리있고 볼만한데 ,10
641,아니 왜..? 영화보고 나온지 십분도 안됐는데 평 좋겟지 하고 궁금해서 들어왔는데 평안좋네ㅋㅋㅋ 재밌었음 존잼 심장쿵쾅 ,10
642,평점이 안좋아 안보려했다가 기대없이 봤는데 러닝타임내내 쫄깃하게 긴장하며 본영화.일단 보세요 ,10
643,이성민씨는 왜 망작만.... ㅠㅠ ,1
644,방금 cgv에서 보고 나왔어요.의외로 염정아 은근 많이 나오고 중요한 인물로 나오네요. 보고 나서 운전대 잡는데 폭주하고 싶어졌음ㅋㅋ 재밌게 봤어요 ,10
645,재밌게봤어요~~~ 드라마도 좋고 배우들 새로운모습도 좋았습니다~~!!^^ ,10
646,정말 영화보는 내내 너무 재밌었고 배우분들 연기력에 감탄했습니다..독전 보고 류준열 배우님 연기 최고라고 생각했는데 뺑반에서는 더 오지니까 봐주세요..공효진임 조정석님은 제가 워낙 믿고 보는 배우님들 류준열님..사랑...,10
647,그냥... 말이 필요 없음 꼭 보세요 ,10
648,배우들 연기 최고!! 재밌게 봤어요 ,10
649,2편도 만들어 주세요! ,10
650,배우들 연기가 다했다 아갈미향 사랑해요 ,10
651,"나는 잘생긴 사람 좋아하는데, 류준열은 왜 이리 멋있고 좋을까ㅋㅋ 살짝 예전 납득이 같긴했지만 조정석 연기도 좋았고, 뭔가 막 화려하진 않았는데, 지겹지도 않았다. 2탄 예고하는듯한 마지막은 헐리웃 영화에서 자주 봤...",9
652,류준열 조정석이 좋아서 봤는데 손석구라는 분 왤케 잘생김..ㅠ ,10
653,"공효진, 전혜진, 염정아 역할들 다 존멋 ",10
654,유준열 연기 끝은 어딘가요 오랜만에   시원하고 통쾌한  영화 한편 감상했슴다~~~ ,10
655,공효진 염정아 전혜진 걸크러쉬 개쩔어요 ㅠㅠㅠ 세분한테 반함 ,10
656,분노의질주보는듯 스트레스풀려요그와중에 조정석OO시 ,10
657,공효진과 류준열 출연진이 맘에 듭니다. 주말에 보러가야겠어요~ ,10
658,기존 경찰소재의 영화들과 달라서 신선했고 거기에 믿고보는 배우들까지 스토리나 액션 연기력 뭐하나 빠지는 거 없다고 생각함. 꼭 영화관에서 보길!!! ,10
659,공효진의 이런연기처음봄.굿! ,10
660,류준열 나온다는 예고에 기다리고 기대한 영화!최고^^ ,10
661,캐릭터가 모두 살아있고 카체이싱은 물론 배우들 액션도 좋아요. 영화관 찾아 큰 스크린으로 보는거 강추합니다!!! ,10
662,우리나라도 드디어 분노의질주 같은 영화가 나왔네요~ 너무 잼납니다~ ,10
663,정말 기대됩니다~!! ,10
664,예고편만 보면 섭섭한 영화:)무조건 보셔야 합니다! 강추~!! ,10
665,"음,,그냥 그저 그런 영화; ",6
666,나만 진짜 존잼이었나... ,10
667,솔직히 극한 직업보다 재밌었음 ,8
668,너무 했다 이건.. 긴 러닝타임 견디면서 봤다 ,1
669,대박.이영화가평점이낮은이유를.모르겟다조작된평점인가의심스러움스토리전개며 연기력들이며 완전강추최근본영화중최고 ,10
670,"평때문에 기대하지않고 봤는데 연기력이 좋은 배우들이 다수 포진하고 있어 기대이상의 여운을 남긴영화. 조정석, 류준열 짱! ",8
671,기대해도되 공감 기대하지마 비공감 ,10
672,배우들 연기 쩔고 카액션 속이 완전 뻥 뚫리는듯 간만에 돈 안아까운 한국영화! ,10
673,공효진 전혜진 배우님 포스쩔고 ㅋㅋ 조정석도 역시 연기굿 간만에 볼만한 한국영화가 2개나 나왔네요 극한직업도 재밌게 봤는데 뺑반도 재밌음 ㅋㅋ ,10
674,죤잼 ㅎㅎ속 뻥뚫리는기분 ,10
675,카 체이싱 장면 최고!!!배우들 연기합도 좋았음 ,10
676,오 류준열  공효진 길쭉길쭉 케미 좋을듯 ,10
677,긴 말 필요 없고!  개.존.잼 설날에 가족들 데리고 보기 좋은 영화인것 같아요!!저는 가족들 데리고 같이 보러 갈랍니다ㅎㅎ ,10
678,7시40분 메박조조로 보고왔는데 스토리가 이상할진 몰라도 마지막 추격전 진짜 대박이고 류준열 조정석 연기 미쳤다....조정석 더듬는 연기 와진짜....bb ,10
679,조정석 너무 나빠요류준열 이성민 케미 굿굿 ,10
680,와. 누가 재미없다했냐? 개재밌구만. ,10
681,평점 왜 저런지 1도모르겠다.10점만점준다. 올해 가장재미있엇다..ㄹㅇ루 ㅋㅋ 정말 리얼로다가 개잼따내용이 이해안된다는 애들은 이해능력이딸리는건가..? 영화애호가로써 보는걸 꼭추천한다!! ,10
682,난 차라리 재미없단 댓글이 알바같은데 그 정도 아님 배우들 연기 다 미쳤고 스토리없는 극한직업보다 훨배 나았음 ,10
683,대체 뭐가 문제여서 노잼노잼거리는거지..어느 수준영화를 내줘야 님들 수준에 맞겠음?ㅋㅋ극한직업보다 재밌게 봤는데 ,10
684,그냥 쏘쏘~~ 뭔가 공감이 안가는 내용이네요 류준열이랑 염정아 연기는 최고였어요 ,5
685,재밌어요 기대 없이 봐서 그런지  카체이싱도 재밌고 ,10
686,연출과 시나리오가 몰입감이 높거나 흡입력이 뛰어나진 않음.하지만 조정석의 개싸이코연기와 공효진 류준열의 안정감있는 연기가 너무 좋았음 ,8
687,염정아 보는내내 스카이캐슬만 떠올렸다. 뺑반 역대급 범죄액션 굿! ,10
688,조정석과 류준열의 연기대결 멋지고 재밌게봤음. ,10
689,영화 굿!!!배우들의 연기가 장난 아니네요 ,10
690,류준열 배역 찰떡 몰입했나봄 ㅋㅋ레이싱하는 장면이 인상 깊었던 영화!! 조연들도 한몫함!!!생각보다 기대 이상이였던 영화!! ,10
691,유쾌하고 시간가는줄 몰랐어요류준열 공효진배우님의 뺑반연기! 조정석배우님의 악역 조연배우님들의 연기까지 완벽했어요:) ,10
692,재밌어요 오랜만에 정말 영화같은 영화 보네요 한국 경찰 영화에서 경찰이랑 범인이랑 이렇게 대놓고 오래 카체이싱 하는 영화는 처음인 듯 할리우드 도로에 비하면 규모가 작아도 우리가 늘 다니는 도로위에서 카체이싱이라 더...,9
693,굿굿굿~~~좋아요~ㅋ믿고보는 명배우들의 연기에 몰입도 최강~!!! 류준열의 다양한 표정연기 잊을 수가 없네요~ 다시 보고픈 영화예요~~~ ,10
694,별로 였습니다. 웃긴영화인줄 알았는데.. ,2
695,"염정아는 정말 배우를 하기 위해 태어난 사람. 완벽한 타인의 모습과 스카이 캐슬의 모습과는 다른 새로운 모습임. 앞으로도 누군가의 엄마, 누군가의 아내 역할이 아닌 이런 역할 자주 해줬으면 ㅠㅠ ",10
696,"제목이 이상해서 뭐지 싶었는데 배우들 연기력, 스토리 전개, 액션 뭐하나 실망시키는게 없었던 영화. 기대 이상으로 잘보고 나왔음. 같이 보러 온 언니도 시간 가는줄 몰랐다고 함 ",10
697,뭐지....나 재밌게 봤는데ㅋㅋㅋ공효진이랄 류준열 존멋이고 조정석 진짜 연기 미쳤음 진짜 조정석 개쩔어서 초반에 조금 무서웠음.초반 스토리 좀 지루했는데 뒤로 가면 액션 쩔어서 재밌게 봤음 액션 좋아하는 사람만 보셈...,8
698,영화  참 재밌었어요.  배우들 연기 모두  좋았고 류준열배우의 연기가 특히 인상적이었어요. ,10
699,꼭보세요 스토리 연기력 뭐하나 빠지는거 없어요 극한직업보다 훨 재밌게 봤어요 ,10
700,"카체이싱도 좋지만, 조정석 연기 변신 대박 ",10
701,뺑반 배우들의 연기력 최고!!였습니다! 시간가는줄모르고 봤네요~ ,10
702,무리수인 영화. 지금 막 보고 짜증남. 어둡고 말안되고 걍 무리수. 마지막 장면은 2탄을 염두에 둔 듯하지만 이것마저 무리수.김고은이 아깝다. ,2
703,우리나라 카체이싱이 많이 발전했구나라고 느낀 영화 순간 몰입력 최고 그리고 조정석씨의 어딘지 모르게 불안하고  초조해보이는 상또라이 완전 찰떡이예요 ㅎㅎㅎ 이배우 원래 이리 연기 잘했나요? ,10
704,손석구 진짜 졸귘ㅋㅋㅋㅋ대사마다 다 터짐 ,10
705,극한직업보다 훨씬 재밌어요!! ,10
706,올만에 재밌었어요~ㅋㅋ다들 연기 잘하심 ㅋㅋ ,10
707,카체이싱 몰입도 최고. 배우들이 캐릭터를 입체적으로 진짜 잘 살림. ,10
708,재밌어요  연기잘함 배우들 ,10
709,시사회 다녀왔는데...헐...진짜 생각지 못했던 액션에 눈호강 했어요ㅋㅋㅋ조정석은 죽이고 싶을 정도로  나쁜놈 그대로였어요ㅋㅋㅋ주변에 추천 엄청 하고 있어요ㅋㅋㅋ ,10
710,재밌습니다! 갠적으로 진짜 재밌었어요 ㅋㅋ ,10
711,개존잼.... 진짜 캐릭터마다 다 매력쩔고 액션 통쾌함 ,10
712,개봉일에 보기 잘했다 진짜ㅠㅜㅠ 액션쩔bbb ,10
713,여캐들이 진짜 매력있음..우계장님 존멋 ,10
714,중반부 류준열 연기 인상깊다. 배우들 열연 최고!! ,10
715,자동차와 스피드를 즐기려면 큰 스크린과 빵빵한 사운드가 답b  재밌어요b ,10
716,정말 재밌게 봤어요! 류준열에 한 번 더 감탄! ,10
717,러닝타임 긴편인데 연기구멍이 일도 없고 전개가 엄청 빨라서 시간 후딱 갔음ㅋㅋ ,10
718,배우 퀄리티 대박 쩜 ㅋㅋㅋㅋ 시원시원한 스토리도 조음! ,10
719,속도감 있는 레이싱 액션과 어우러지는 긴박한 음악 삽입으로 몰입도 높음. ,10
720,주연배우들은 물론  전혜진 염정아도 서로 다른 매력의 걸 크러쉬  오져버림 ,10
721,간만에 티켓 값이 아깝지 않은 영화였음! 조정석 악역연기도 처음인데도 불구하고 역시 b ,10
722,"뻉반 기대 안하고 봤는데 너무 재밌었네요, 오락액션으로는 정말 즐길거리가 많은듯 ",10
723,"재밌는 영화 진짜 오랜만에 봤음...연기 구멍 한 명도 없고 진짜 다들 열연 오짐ㅠㅠ초반에 진짜 웃기고 재밌다가 후반부에 쫄리는 느낌 진짜 너무 재밌음ㅠㅠ아 진짜 한 번 더 본다 진짜,,,.. ",10
724,류준열때문에 봤는데 영화도 너무 재밌었어요 류준열짱 흥해라 뺑반 사랑해요 류준열!!! ,10
725,"진짜 배우들만 보고도 엄청 기대했던 영화였는데 진짜 실망시키지 않았고.. 공효진, 전혜진, 염정아 최고ㅠㅠ ",10
726,기대한만큼 진짜 최고였던 영화! 카체이싱도 대박이고 배우들 연기도 최고!! 또보고싶어요ㅠㅠㅠ ,10
727,뺑반 개재밋음 배우들 연기도 다 넘나 잘 하는 것 카 체이싱도 짜릿짜릿ㄷㄷ 하나 문제는 집 가는데  풀악셀 때려밟는 날 발견함 ,10
728,쿠키영상? 있어욬ㅋㅋ 마지막까지 꼭 보고오세요! ,10
729,속이 뻥 뚫리는 카체이싱 액션! 정말 최고입니다!! ,10
730,돈 주고 안봐서 다행이다 ,2
731,공효진은 뭔 영화를 찍어도 답답노 ,4
732,"액션 1, 스릴 1, 나머지 도로구경 8. ",2
733,영화 때문에 여자친구랑 싸우고 깨졌다. 다시는 안보고 싶은 사람과 보면 좋은 영화~ 추천!! ,1
734,음... 2까지 만들필요는... ,4
735,류준열 혼자 볼만한듯 에바에바 ,4
736,특이한데어설프고논리가업고세련되지안음 ,7
737,감독이 편집 잘했으면 재밌었을 영화.소재도 흥미롭고 배우도 연기 잘했지만 감독이... ,6
738,배우들 연기력은 좋았어요 개연성보다는 연기력에 몰입했네요 ,6
739,너무 재밋지도 않고 너무 재미없지도 않은 영화같은 ,6
740,재밌게보고 왔습니다~배우들 연기력에 감탄하고 가요ㅎㅎ ,9
741,지금 티비로 보다 황당해서...조정석 활용의 최악의 예로 기록될듯.ㅋㅋ ,1
742,시나리오때문에 별3개 뺌. 배우들 깔건 하나도없음 ,7
743,이게 2가 나온다고?ㅋㅋ 와 이건 진짜 발암영화다. 스토리 왤케 엉성하고 진부한데? 조정석 몇번을 잡았다 풀어줬다 무슨 술래잡기하냐? 공효진 연기는 이게 자연스러운 건지 성의없는 건지 몰겠고 진짜 OO노잼이다. 뭔 ...,1
744,설마 2나올려고...? ,4
745,그냥저냥 봣어여..ㅎㅎ ,6
746,류준열과 조정석 보려고 본 영화 ,8
747,액션이나 기본 스토리는 괜찮은데 뭔가 허술하고 연출이 너무 별로임 ,7
748,"진짜 류준열만 내 대가리 깨져도 좋아ㅅㅂ,, 나중에 보면 백덤블링하면서 악수하고싶다;; ",6
749,촬영은 열심히 해놓고 편집을 어떻게 해야될지 몰라서 우왕좌왕한 영화 ,6
750,예서엄마는 항상 연기가 똑같애. 그리고 음향감독 누구야.. 영화 초반 음악 초이스 최악 ㅠㅠ ,6
751,중반까지는 재밌게 보다가 나중에 공효진씨 연기에 실망했습니다. ,6
752,"조정석의 악역 연기는 재밌고 좋았지만, 경찰들의 엎치락뒤치락의 뻔한 액션과 사실과 동떨어지는 개연성에 재미를 잃었습니다. ",3
753,뺑반이라는 소재는 흥미로웠으나 특성을 잘 살리지는 못했고 기대했던 카체이싱도 그냥 무난했다. 공효진의 캐릭터도 아쉬움이 많이 남았다. 하지만 류준열을 필두로 다른 조연들은 생각보다 매력적이고 중간중간 잔웃음은 좋았다...,4
754,"스토리 부실. 스펙타클한 액션씬 부실. 조정석, 류준열 연기 발군. 염정아 평타. 공효진 지루. 옥에티ㅡ마지막 장면에서 ㄱㄱㅇ의 어색한 연기 및 존재감 부족으로 속편의 기대감 하락. 감독은 마지막 장면의 여배우를 바...",7
755,진짜 머리아파서 나오고싶었음 보지마세여 ,1
756,뭔가 편집 덜 된 영화를 보고 나온 기분.보이는게 진실이고 전부라면...이건 아니지... 하.... ,1
757,지루하구 스토리엉성 .... ,2
758,영화 내용이 먼지 잘 이해가 안감  왜 저격을 하는건지 ,6
759,캐릭터는 좋지만 스토리가 너무 뻔함 ,7
760,예서엄마가 잘못한 영화. ,8
761,기대이상으로 재미나게 보고왔어요 ~~~^^ ,10
762,배우들 연기 너무 좋았어요 ,10
763,배우들의 연기력 덕에 몰입이 잘된 영화! ,8
764,4d로도 얼른 보고싶다!!! 장르적인면과 캐릭터 구축방향에서 다양한 시도를 했다는 것만으로도 의미있는 영화... ,8
765,무슨 자신감으로 이걸 봤을까 ,1
766,한국영화의 한계를 보여준 작품 ,3
767,공효진 진짜 영화 못 고르네 ,4
768,"10 점 주면 알바냐 1점 주면 알바냐,, 난리다.  취향은 존중해줘야 하는 부분이죠.  저는 이번 조정석 배우님 연기가 돋보였다고 생각합니다. ",10
769,정말 지루하고 그냥 래이싱 장면만 재밌고 류준열 조정석 연기 잘한다 끝. ,2
770,뒷심이 부족해서 아쉬운 느낌 ,8
771,조정석이랑 류준열때문에 6점줌 이 두 배우는 연출만 잘해주면 날아다녔을텐데 너무 불쌍ㅠ 공효진은 왜 나왔는지 모르겠고 카체이싱도 기대했는데 별로.. ,6
772,적당한 긴장감으로 영화보는내내 잼 있다는 생각을 했어요~^^ ,9
773,초반 구성 볼만하다고 여겼음 근데 중반부터 설정붕괴및 개연성이 우주로 날아감 ,3
774,보는 씬 대부분이 다른 영화에서 본 유명한장면 짜집기짜집기라도 잘하면 좋겠는데 앞뒤 내용 이해안되는 짜집기고 감정공감이해 하나도 안되고공효진 캐릭터가 이해안되니 연기도 못하는것같고 남자배우들 연기로 캐리하고있으나 캐...,4
775,뺑소니 범인은 따로 있는데 벌금은 왜 우리가 낸듯한 고런 느낌ㅋ ,1
776,연기력이 대박..:D ,8
777,생각보다 영화가 현실성이 부족하고 그냥 차레이스로 보면 됨.스토리가 탄탄치 않아서 잘 보지 않으면 스토리를 놓침.누구한테 보라고 권하고 싶지 않은 영화임. ,6
778,처음부터 끝까지 개연성이 1도 없는 영화 ,1
779,뺑반보고 나도 시나리오 쓸수 있다는 희망을 가졌다~뺑반 흥해라 ,1
780,묵혔다 나오는 영화는 이유가 있다 ,1
781,배우들은 연기 겁나 잘하는데 내용은 별로인듯... ,1
782,에휴...!!!!ㅜ ,1
783,최광희 때문에 안보는 영화. 최광희가 쏟아내는 구역질 나는 말들에 정말 환멸이 느껴진다. 항상 비판이라 우기며 비난을 즐겨하는 최광희에게 똑같은 말들이 가득 날아가길... ,1
784,초반엔 영화가 불친절하다 라는 생각이 들 정도로 캐릭터들이 자기 얘기만 한다는 느낌이 강했고 중반에는 너무 지루해서 조정석 풀려났다난 얘기 나올때 진짜 힘들었음..아직 영화 한참남았다는 말이니까..그런데 후반부는 볼...,6
785,먼가 애매한 마무리...뒤끝이 조금 찝찝한느낌...그래도 류준열은 멋있었다 ,6
786,류준열 조정석 연기 진짜 인정. 조정석 진짜 어쩜 그렇게 무섭게 연기하나요 ,8
787,배우들 연기 탄탄해요 조정석 류준열 공효진 기타 다른 조연배우들까지 but 스토리라인이 너무 진부해요...베테랑과 내부자들 합해놓은 느낌 막판 추격신은 볼만했지만 결말이 영.. 속편 내려는건 알겠지만 본편에 충실한게...,6
788,재밌어요!! 배우들 연기 진짜 굳... ,10
789,왜 조정석님 연기 칭찬은 없지 ㅜㅜ 새로운 캐릭터에 연기 너무 잘하셨는데에!!ㅜ 진짜 쉴틈없이 빠져봤어영!! 오나귀 정주행 중인데 갭차이 넘 심한것ㅋㅋㅋ ,10
790,"질투의 화신에서 봤던 공효진, 조정석 케미에 류준열이라니 하며 봤는데 중간중간 재미도 있고 마지막에 스릴도 있고 볼만 해요! ",9
791,지루함없이 아주 재밌게 잘 보고 왔습니다 ,10
792,주연 배우들의 연기력이 흥미를 더해줬으며경찰영화중 가장 재미있게 본 영화로 생각됨. ,10
793,한국영화치고 액션 화려함~배우들 연기 좋음다만 스토리가 조금 이해 어려움 ,8
794,재미있을꺼 같네여  저아직 이영화못받았거든여명절때 가족들이랑 볼라고여 ?? ,8
795,좋아요~~재밋어요 도라이연기ㅋㅋ ,10
796,춘천의 자랑 이성국 파이팅!! ,10
797,부모잃은 조정석은 뭘해서 큰돈을 벌고 회장이 되었을까? 마지막에 김고은은 뭐냐고요 아놔ㅋㅋㅋㅋ 알고보니 감독 각본 한사람.. 은퇴작 각이로다 ㅉㅉ ,1
798,니들 투자금 회수하려면 뺑이 좀 돌아야긋다.이은선 평론가는 국어부터 다시 배우고 평론가질해라. ,1
799,ㄹㅇ별점 1개도 아까운 영화 개노잼 ,1
800,야 너두 당했어? 내돈.... ,1
801,"별 0개는 없냐?중심 내용 없음, 감정신에 하나도 감정이 들 수가 없음, 걸크러시를 많이 노린 것 같은데, 그것만 잘보이고 전체적인 내용 없음 ",1
802,그래도 나름  재밌게 봤어요 ,8
803,재밌게 봤어요ㅎㅎㅎ다들 연기 너무잘하세요 ,10
804,"생각보다 진짜 재밌게봤는데,,존잼인뎅....평점이 ",10
805,난 왜재밋었지...2 기대합니다 ,10
806,다들 연기력은 대박~하지만 먼가 아쉬운...평점 여친이 다올렸네요 ,9
807,조은데그냥 볼만합니다 ,8
808,류준열 조정석 연기 대박이고~ ,10
809,저격수 탄 헬기만 아니었어도 별 다 채워드렸을건데ㅎㅎ 저 알바 아니고 오늘 관람객ㅋㅋ 배우들 연기 잘하고 레이싱 관람 포인트 등 극장서 볼만해요 반전도 있고 효진언니 영화중엔 최강잼ㅎㅎ 배우들 다 연기 잘하고 감동포...,8
810,보는내내 너무 쫄리고 무서웠습니다. 조정석님 너무 연기를 잘하세요 ,7
811,"댓글에 호불호가 있듯이 스토리와 개연성이 떨어지지만 배우들의연기 특히 류준열,조정석의 연기덕분에 영화에 몰입감을 갖을수 있었다그래서 결론은 뺑반2나오나요? ",10
812,대체적으로 재밌게 봤습니다긴장감도 있고 배우들 연기좋고!!! ,7
813,괜찮은데 잼있는데ㅡ ^^ ,10
814,"베댓ㄹㅇ이다 야너두 시나리오쓸수있어,, ",1
815,내돈과 시간을 뺑소니해감 습ㅏ ,1
816,이와중에 배우들은 깨알같이 신들린 연기를 보여주니.ㅠㅠ.감독아! 과유불급.다음 작품엔 꼭! 세겨라.다음이 있을가 모르겠다만.배우들 역기력 때문에 별사나. ,2
817,재밌음!!! ㅋㄷㅋㄷ ,10
818,전날보고 왔는데 기대가 너무 컸나? 배우들 연기는 좋음 물론 연기만.... 그리고 마지막 쿠키는 뭐여? 무슨 마블이냐? ,1
819,오줌이 너무 마려웠다. ,2
820,그냥 웃긴영화인줄알고 봤는데 손에 땀을쥐게하는영화였어요 나는 재밌던뎅ㅋ연기도잘하구 ,8
821,오씨엔에서 12부작 드라마였어도 좋았을 것 같아요  섬세한 연기가 멋있어요 ,8
822,아니 여러분 진짜 재밌어요 ???? ,1
823,"줄거리도 모르고 시간때우러 보았던건데, 의외로 재밌게 본 영화. 자동차 추격씬도 멋있고, 배우들 연기도 잘 해서 정말 재밌었습니다. ",10
824,"액션, 연기력 너무 좋은데개연성이 너무 없음;; 그래서인지 영화를 꾸역꾸역 보게 됨 ",4
825,실망. 80분이면 끝날 얘기. ,2
826,진짜 너무 재밌음 특히 류준열!!! 뺑반2기대합니다 그리고 꼭보세여!!! ,1
827,류준열 연기는 매우 잘하지만 영화스토리는 너무 단순하다 ,6
828,OO노잼.돈아까움. ,1
829,너무 지루합니다. 이걸 2시간 넘게.. 이걸 2편 만들 생각으로 후속 암시는 너무 건방지다. ,2
830,억지감동 오글거리는연출 뻔한스토리 전형적인 한국영화 ,1
831,내용이 좀부실하고 스토리 개연성이 부족해서 조금 지루했지만 극한직업보다는 훨씬 괜찮다고 생각한다.배우들의 연기력이나 영화속에서 등장인물 몰입도는 최고다. ,6
832,정말 영화보다 집에가고 싶은적~~첨이예요~^^알바분들 대박~~ 10점만점10점이라니~~~정말 1점도 아끼고 싶네요ㅜㅜ ,1
833,"베테랑과 비슷한 느낌, 뺑소니 내막이 좀 더 자세하게 밝혀졌다면 하는 아쉬움, 류준열과 조정석의 연기는 상상 이상 ",8
834,초반 30분만 보면되는 영화. 시도는 좋은데 짜집기한 영화. 공짜표 아니면 굳이 볼 필요없습니다. 내용 전개는 개연성 1도 없음. 그냥 보지마세요. 설날 망치기 싫으시면... ,1
835,영화 잘봤어요 조정석 류준열 연기 대박!! ,10
836,실망.. 개연성이며 스토리전개도엉망이고 레이서영화냐고..  배우들 연기가 넘 아깝드라.. 후속나올것처럼끝나던데. 절대못나올듯.. ,1
837,"공효진, 염정아 배우 연기는 언제나 그렇듯 좋았습니다. 대사도 재밌고 영화 자체도 젊은 느낌에 전체적인 캐릭터구성이 시류를 잘 알고 있다는 인상을 받았네요. ",9
838,중간에 좀 지루했던거 빼고 나름 재밌게 봤어요 조정석 연기 대애박 !!!! ,8
839,와따시 지리고오지고 ㅋ.ㅋ ,10
840,조정석 류준열 소름돋게 연기잘함 ;; ,10
