,Review,Rank
423,진짜 최고ㅜㅜ 오랜만에 너무 무섭고 재밌는 영화였습니다 보는내내 소름이 돋고 와.. 진짜 무조건 보세요 공포영화 매니아로서 강추 ,10
424,연기를 어쩜 이렇게 살벌하게 하나여 ㅜㅜ 잘 보고 왔습니다. ,10
425,숨 막히게 무서워요 ㅜㅜㅠㅠ ,10
426,"갑자기 영화가 끝나는듯한 결말이긴했으나(중간중간 부족한게 있었음, 앞집아저씨에대해서도 부족하고)근데 진짜 심장쫄깃하고 스릴만점!! ",10
427,둘째의 설움을 그린 영화 ,8
428,중반까지 쫄깃하고 긴장감에 재밌었는데폭팔부터 이상해짐 ㅠ마지막도...ㅋㅋ...갑자기 죽고...살짝아쉽네여둘째랑 죽은신부아쉽고 백윤식씨랑 제자들 불러놓고 아무것도못한거 뭐임ㅋㅋㅋ ,8
429,둘째는 신경을 잘 안쓰고 불에 타죽어도 그렇게 슬퍼하지 않은거 같아 씁쓸함.. 악마얼굴 들이댈때랑 효과음 소리에 깜짝깜짝 놀람. ,8
430,조이현 좋아서 영화 관람 했는데 조이현이 제일 무서웠던 영화 특히 샤워신 간만에 한국 영화보고 욕했다.... ,10
431,소재가 참신하고 긴장감 최고!! 그리고 배성우님의 연기에 감탄했습니다!! ,10
432,???:아니 니코 누가 키웠냐 ,8
433,너무 좋은소재였는데 아쉽네요. 중반까지는 진짜 무섭고 긴장하면서 보다가 후반에 악마가 수퍼맨되고 둘째딸 하루종일 찾지도 않고... 개연성이 너무 떨어짐 ,8
434,배성우 연기...진짜 역대급이었다 ,10
435,도와주겠다고 온 사제들이야 인사해.  감사합니다. 끼이이이익 쾅~ ,10
436,평점을 높게 줄 수 있으면 더 높게 주고 싶은 것이 바램이다.. 정말 완벽한 공포영화다. ,10
437,둘째 딸과 신부님의 명복을 빕니다. ㅠㅜ ,10
438,어머님 먹방에 10점드립니다 ,10
439,후반부가 좀 급조된 느낌이 들지만 전체적으로 스릴감이 많아 좋았던 영화 ,9
440,아주 잘만든 공포영화 같아요~ 2019년 최고 명작인듯 ,10
441,재밌네요.. 상상하지못한곳에서 놀래키니 많이 놀랐던거 같아요 ㅠㅜ ,10
442,무조건 1점만 주는  알바있나봄?ㄷㄷ 개인적으로 공포영화인 만큼  무섭기도 하고 나름 볼만하던데~ ,10
443,공포영화 종아하는 사람으로써 한국 공포영화 중에서는 정말 괜찮았던 영화에 속함 ,10
444,평점 아예 안올리는데.. 진짜 대박이라 올립니다. 정말 무서워요 ㅠㅜ ,10
445,스토리는 그런데로 괜찮으나  감독의 연출력이 조금 떨어지는거 같다..   좀더 매끄럽게  이어졌으면  꽤 수작이었을 텐데.... ,8
446,한국 영화치곤 잘만듬편임. 호불호 갈려서 걱정할 바에는 한번 봐도 괜찮을 공포영화임. ,7
447,남편이랑 오늘 봤는데 진심 개무섭 (TㅅT) ,10
448,아니 개잼있게 봤는데 평점 믿지말라니ㅋㅋ 사람마다 다른거지 그리고 재밌게 본 사람이 더 많다는데 지들이 알 바여?ㅋㅋㅋㅋ ,10
449,간만에 제대로 된 공포 영화를 봤습니다. 다만 마지막이 좀 아쉬워요 ,10
450,끝이 너무 허무해서 아쉽지만 전체적으로 보면 좀 독특한 공포영화임. 난 재미있게 봤음. ,10
451,영화 잘봤어요~! 일단 연기력부터 먹고 들어가니 더 무섭고 긴장하면서 본 거 같아요~! ,10
452,영화자체는 나쁘지 않았는데 기생충보고 나왔을 때랑 살짝 비슷한 느낌같아서 호불호가 좀 갈릴 것 같다 가장 안전하다고 생각한 집과 가족을 소재로 삼아서 더 소름돋고 충격적인 영화같다 배우들 연기가 진짜 최고...! ,8
453,다리가 후들거리네요 낮에 봐서 다행ㅠㅠ 무서운거 좋아하시는 분은 잘 보실듯 재밌긴했는데 넘 무섭네요 하...글고 너무 잔인함 ,8
454,여러가지를 생각케하는 영화입니다~ ,10
455,핵꿀잼입니다. 기대안하고봣 ,10
456,음... 일단 이 영화 관람연령은 19세로하는것이 맞다고 생각합니다.오랜만에 오늘밤은 잠을 못자겠네요...예수 하나님 아버지 아멘 ,9
457,결말 이상하다고 욕하는 글 많아서 기대 안하고 봤는데 허무하긴하지만 욕할 정도는 아니고 ㄹㅇ 재밌게 봄 ,10
458,안전운전의 중요성과 돌다리도 두드려 봐야한다의 중요성을 깨달은 한편이었습니다.  것보다 마지막에 왜 죽였어요엉헝헝 그것덕분에 막판에 완전슬펐어요ㅠㅠㅠ것보다 둘째ㅠㅠㅠ제일 불쌍해ㅠㅠㅠ중2병이긴 한데 사춘기로 인한 틱틱...,10
459,무서운데 결말이 갑자기 좀 아쉬움 ,9
460,연기도 좋고 몰입감도 좋다. 다만 작은 딸이 안보이는데 아무도 찾지 않는다거나 어색한 장면이 많아 감점 ,8
461,"기대하고 봤는데도 존잼, 이렇게 무서운 공포영화 진짜 오랜만. 배우분들이 연기를 잘하셔서 훨씬 더 무서웠음ㄷㄷ ",10
462,믿을사람이 없어요ㅠ 무서워요~~~~ ,10
463,간만에 공포영화다운 공포영화를 봤다. 정말재밌네요 ,10
464,진심 너무 무섭고 재밌습니다!! 이런 영화 놓치면 후회해요^^ ,10
465,아빠....!!!무서워 ,10
466,영화 잘봤어요 재밌어서 내일 이영화 또 보러 갈거에요! ,10
467,엄마랑 같이 봤는데 샤워신에서 놀라서 둘이 머리박음 ㅠ ,8
468,이게 진짜 한국 영화야 라는 생각이 들정로 대단했음. 압도적으로 재밌다 ,10
469,최근 본 공포중에서 최고. 이이상의 영화는 기대하기 힘들지 않을까? 뻔한 내용을 잘 풀어 만드는 것도 재능이다. ,10
470,생각보단 집중해서 잼나게 봤네요~ ,8
471,ㅜㅜ 왜 영화관에 나포함 5명밖에 없는거죠 초중반 보고 집으로 도망갔어요 ㅠ 무서운건 확실해오.. ,8
472,롯시에서 봣구요 내용은 그냥 기대안하고봣는데 몰입되서 끝난시간인지도ㅠ몰랏고 ,10
473,올해 본 영회중 가장 재미있게 봤습니다 모두들 보러가세오~ ,10
474,진짜 무서웠음ㅜㅜㅜㅜ근데재밌어ㅋㅋㅋ ,10
475,긴장감도 쩔고 연출력 연기력 다 좋아요. 피 많은 거 싫어하시면 약간 힘들수도 ㅎㅎㅎ ,10
476,몰입력이 엄청나서 팝콘이랑 콜라를 남김..와..너무 재밌다..너무 재밌다..진짜 너무 재밌다.. ,10
477,곡성이랑은 결이 완전히 다르지만 소름 돋는 느낌은 정말 비슷하다. 수작 영화 나왔다. ,10
478,카페베네 엔딩 빼고는 진짜 재밌었어요 ,8
479,무섭게 잘보고있는데 영화막바지 다가올수록 집가고싶음 악마 사제라는스토리 자체가 우리나라 정서에 아직 어색함 성동일 배성우 아저씨들 캐릭터가 너무 강해서 갈수록 더 어색함 연기 너무 잘하시는데 몰입이안돼유 그래두 초중...,9
480,그랬으면좋겠네요부디 ,10
481,갸꿀 ~~! 오줌말고 똥쌌다..ㅜ ,10
482,볼만하네요 쫄깃했음~~ ,10
483,저 무서운거 진짜 잘 보는데 이건 진짜 대단합니다 ,10
484,아니 뭐가 무섭다는거임;:: 참놔~ 그래서 엄마 아빠 오늘 몇시에 잘꺼야 같이자자>_< ,10
485,성동일 침대씬 미쳤습니다 .. ㅜ  성동일 배성우 여배우들 연기력으로 다한영화 ,10
486, 연기 대박이에요 영화 진짜 잘만들었어요ㅠㅠ ,10
487,소재도 독특하고 연기도 좋고 긴장감있어요. 재미있게 시간 가는줄 모르고 봤어요. ,10
488,다들 미친 연기력에 10점 만점에 100점오랜만에 오싹한 한국 공포영화가 나온듯 하다 ,10
489,좋았음 색다르고 신선했ㅇㄷㅁ ,10
490,"성동일과 배성우의 케미, 그리고 장영남. 한국판 엑소시스트라고 하기에는 장르의 조합이 너무나 잘빠졌다. ",10
491,영화 시작할 때 너무 무서웠어요. 여배우 진짜 고생했을 듯 ,10
492,한국 오컬트 영화중 갑이라 생각함. ,10
493,대박입니다. 썸타시는 분들 꼭 보세여!!! ,10
494,정말 무서움. 영화 내내 가족에 대해 생각하게 함~ ,10
495,꼭 보세요~시간가는줄도 몰랐어요. ,10
496,소재도 신선하고 배우들의 연기력도 좋았고 무서운거 좋아하시면 완전 꿈잼 영화 ㅎㅎ ,10
497,처음부터 끝까지 기분나쁜 영화처음부터 끝까지 눈못떼는 영화검은사제들 오마주 느낌도 나고전반적으로 잘봤습니다. ,10
498,"몰입감, 긴장도, 연기력 다 훌륭함 ",10
499,흥미진진해요 믿고보는 성동일 ,10
500,99% 으어어으아어으어어으어!!!! 하다가 1% 어? 하고 끝남. ,8
501,보고난후에 십자가 끌어안고 잤어요 ,10
502,남자친구랑 보다가 기절하는줄 알았습니다. 긴장감..말로 표현할수없습니다.. 절대혼자보지마세요ㅋㅋ ,10
503,공포 영화답게 정말 무섭기도 하고 깜짝 깜짝 놀랐어요!! 긴장감 대박!! 무엇보다 배우들 연기들이 최고였어여^^ ,10
504,개인적으로 제일 불쌍한건 귀국하신 신부님과 뒤에 두 사제들 ,9
505,초반에 잘 나가다가 중반부터 너무 이상해서 분노했음 ,2
506,검은사제들이랑 곡성 보고 처베낀거같은데 진심 감독 때려쳐라 이딴게 영화냐 에휴. 검은사제들도 쓰레기였는데 이거 보고 보면 명작이라고 느껴질듯 ,1
507,내인생 최악의 공포영화 ,1
508,이도저도 아니고 개연성없이 산으로 가다 흐지부지 끝내버긴 영화. 아무정보없이 들어가서 댓글평점에 낚여서 조금 기대했는데 와르르 무너져버림 ,3
509,그냥 보지마요 제발 돈낭비 시간낭비 ,1
510,ㄹㅇ 조온나 노잼 손더게스트나 프리스트같은경우에는 구마할때 발음이나 섹시하게하지 이샛기들은 필리핀 발음에서 영감따와서 앗살라말라이꿈 이이잉 하면서 구마하는 수준;; 영어발음듣고 씹정색함 중간중간에 갑툭튀해서 한번 놀...,1
511,노잼이여 돈아끼세여ㅋㅋ ,1
512,나만 당할 수 없다 보다가 나올 뻔 했지만 참음 ,1
513,지리게 노잼이다 정말로 ,1
514,생각보다 지루하고 정말뻔한스토리.사운드로만 놀라게하려는게 보여서 별로라고 생각하며 봤어요. ,1
515,진짜 개노잼 검은사제들이 더 재미있음 ,1
516,"둘째가 오븐구이가 되도 가족들이란 사람이 찾기는 커녕, 아예 생각조차 없음필리핀에서 세자들이 와서 뭐 할거같이 가오만 ㅈㄴ잡고 하는거라곤 교통사고 나서 피흘림마지막 삼촌이 대신 죽었는데 나몰라라 하고 거실로와서 가족...",2
517,아.. 아깝다 뭐가 인생이? 아니 내 돈이평점 1점 아깝습니다. 변신 비추합니다. 제 2의 곤지암? 헛소리하지마세요. 전개 구립니다. 여성 취급 개같고요. 사탄 보여주려고 만든영화같네요. 보고싶으시다고요? 돈 많고 ...,1
518,"대체 이게 왜 재밌다는거임?? 대체 알바를 얼마나 풀었길래.... 공포영화라는 장르라면 관객을 압도하고 긴장되게 해야하는데 이건 압도하지도, 긴장감을 유도하지못함초등학생이 쓴 각본같음 배우들이 제작진 줄빠따쳐도 아닥...",2
519,오랜만에 집중하며 본영화네. ,10
520,배성우 배우님 진짜 연기 너무 잘하시는거 같아요. ,10
521,재미있었어여 ! 한국판 컨저링 느낌? 오랜만에 공포영화보는 느낌 났습니당 ,10
522,무서워서 진짜.. 악몽꿀거 같아요ㅜㅜ ,10
523,공포 너무 좋아해서 저예산B급 영화까지 다찾아보는데 이영화는 한순간도 긴장을 늦출수 없는 긴박감있는 전개로 흥미진진하고 즐거웠어요 그리고 원래 크게 공포를 못느끼는데 오랜만에 귀도 막아보고 옷으로 얼굴도 살짝 거리면...,10
524,무섭다기보단 깜짝 놀란 장면들이 있어서 살짝 검은사제들 같은 느낌인데 섬뜩하고 재밋었어요 ,9
525,엄마 음식먹는씬 겁나 소름임흔하지않은 공포영화라 재밌었음 가족끼리 저렇게 서로의심하고 씌이면 너무 무서울거같음 신선함 ,10
526,영화보는 중간에 핸드폰을 한번도 보지않았다는거는 그만큼 재밌고 집중있게 봤다는 뜻인데이영화가 그랬음 긴장감 쩔고 배우들 연기가 소름끼치게 무서웠다 ,10
527,배성우 악령 씌이고 오바이트 하는 모습 곡성 황정민 모습만큼이나 넘 충격 ㅠㅠ ,10
528,진짜...이건아닌거 같아... ,1
529,이거 볼꺼면 차라리 치킨 먹으면서 유튜브 보는게 더 개이득 인지용? ,1
530,결말이 조금 허무했지만 재밌었음 배우분들 연기 너무 잘하심 ,10
531,보는내내 긴장되고 소름돋았네요..배우분들 모두 미친 연기입니다ㅠㅠ강추!근데 백윤식선생님은 빅피처 예상했는데뭐죠..ㅎㅎㅎ ,10
532,김홍선감독님과 스탭들이 고생한 결과물의 완성이 피부로 와닿았습니다.고생하셨습니다 ,10
533,백윤식이 나온 이유는 배중수 공항으로 불러서 집 비게 만드는데 꼭 필요한 역할이라 등장시킨거 같은데 왜 나왔냐고 물어보는건 왜지.. ,10
534,재밌고 연기 구멍없음. 진빠 구마의식 저런게 있나요 궁금 ,10
535,박진감. 긴장감이 넘 좋았고 배우들의 리얼한 연기가 넘 인상적입니다. ,10
536,16부작 드라마중 14화엔딩처럼 끝나서 개당황함;; ,6
537,사자는 피햇는대 변신은 못피햇네 ㅋㅋ나만당할순없다ㅋㅋㅋ ,10
538,와 최근 본 공포영화중에 제일 역대급ㄷㄷ둘째 너무 불쌍하게 죽음 ,10
539,짜증나게무섭다는 후기를본적있는데 진심 보는내내 무서움에 쭈구리고있어서 근육통올지경입니다ㅋㅋ결말은 개인적으로아숩.. ,8
540,초반부터 심장떨려서 손가락 사이로 봄 ,10
541,성동일 연기 너무 잘하네요 ,10
542,와~ 진짜 시간 가는 줄 모르고 볼 정도로몰입감 있고 재밌게 봤어요~ ,10
543,이영화 보기전에 본 영화가 사자였습나다.사자보다 딱 100배 재밌습니다.개인적인 감상평입니다. ,10
544,연기   다들  좋았구요한순간도    지나칠수  없는   긴장감 여름의   끝을   이영화로   마감했네요 ,8
545,완전 재밌음 무서운거 1도 못 보는 쫄보인데 실눈뜨면서 다 봤어요. ,10
546,대박  생각보다 스릴있네요. 너무너무  재미있어요. 진심  강추합니다. ,10
547,와 진짜 내 심장 돌려줘 ㅠㅜ ,10
548,기대가 됩니다 너무너무 무서울거 갵아요!! ,10
549,진짜 지릴뻔했어요 무서워서ㅜㅜ 여러분 혼자보지마세요 !@!@!@!@ ,10
550,긴장감 있는 스토리와 배우들의 연기의 조화가 아주 좋았습니다. ,10
551,진짜 재밌음. 가족이야기 신선하고 보는내내 심장이 너무 두근두근 거렸다 ㅠㅠ ,10
552,진짜 무서웠어요.. 꺅이 아니라 욕이 그냥 나왔.... ,10
553,재밌다... 존나재밌다 ,10
554,시간가는줄 모르고 봤어요 재밌어요 ,10
555,집이 너무 무서워졌어요ㅠㅠ 영화는 재미있네요! ,10
556,진짜 재밋으모ㅠㅍㅍㅍ ,10
557,방금보고왔습니다. 한국판 엑소시스트 그냥볼만했습니다. ,8
558,스타마케팅 없이 이렇게 좋은 영화가 나오다니.. 많이들 봤으면 좋겠다. ,10
559,개봉전부터 왜 인기가많았는지 알겠네요 .. ,10
560,동생이랑 보는데 생각없이 보다가 무서워 죽는지 알았네요 진짜ㅠㅠ완전 추천합니다♡ ,10
561,혼자보러갔는데 성동일 둘째딸 머리채잡는 장면에서 혼자 소리질렀다 어우씨!뻘쭘.. ,8
562,현주는 주워온 딸인가요? ,10
563,울산진장cgv  15시 5관 h6 7 8 뒷줄앉으신 어른분들 상영중에 여담은 카페가서 나누시죠눈치드려도 굴하지않고 웃고떠들고 휴대폰진동까지;ㅎ상영내내 불편했습니다 ,10
564,뒷심이 아쉬웠지만~ 나름 참신하고 재미있었음. 둘째를 모두 잊어버린 게 좀~~ㅡㅡ; 끝까지 고통받는 중수가 안타까웠음~ㅜㅠ ,8
565,뒷 스토리는 허무하지만 소재는 정말 좋았음 ,8
566,최근 몇년사이에 본 공포영화중엔 가장 재밌다. 배우들 연기도 훌륭하고.. ,10
567,혼자보면 정신나감 ㅠㅜ 개무서움 기저기 하나챙겨가세요 ,10
568,"진짜 귀찮아서 평점 안남기려했는데 너무 최악. 감독은 배우들 멀뚱멀뚱 서있게 만들고, 솔직히 다들 이번작품에서 연기가 시원치 않아서 개 거지같은 개연성을 커버칠수가 없다. 각본가가 자기 라틴어 자랑하려고 만든 영화인...",1
569,변신을 본 내가 병..신이다. ,1
570,댓글 알바가 너무 많네요...한국 영화가 이제껏 잘해오다가 오랜만에 후퇴한 것 같은 작품을 봐서 마음이 안 좋았습니바 ,2
571,역대급아니냐   보는도중  영화관나갈뻔 주말시간아깝다 ,1
572,옆집은 무슨의미 인지....??내용 솔직히 너무 허술함. ,1
573,어설프게 만들어서 교훈도 어설프게 주려고 한다 ,2
574,긴장감만으로도 충분히 굿 ,10
575,욕하는 사람들 특징 파라노말엑티비티 쏘우(1편 인정) 이딴거 들먹이면서 한국공포는 안돼 이러고 있음 걍 그 사람들은 한국공포가 싫은거임 백점은 아니라도 충분히 돈 내고 볼 정도임 재밌었음 ,8
576,중후반부터 지루하고 뭔가 빠진듯한 느낌이 들었다. 또한 둘째의 비중이 줄어들다 마지막엔 급하게 마무리한 느낌이랄까. 조금 더 세심하게 다뤘다면 좋았을 거란 생각을 해본다. ,8
577,엉망. 스토리 빈약 하고 쌍팔년도 스탈 ,2
578,진심으로이야기하는데 잼없어요 개연성도 없고 스토리에 구멍이 많음 ,3
579,식상한 도입부중간중간 곡성과 같은 오브제중간까지는 흥미가 났지만이해할수없는 캐릭터들과 캐릭터들의 행동들차로 몰고 가는데 까마귀떼가 공격하는것도 장면 곡성과완전똑같고누구도 믿을수없다하는것도 곡성같고스토리 개연성도 갈수...,1
580,한국에서요즘 이런 구마의식소재의영화가많이나오는거같은뎅 너무 식상하고 뜬금없이놀래키는 장면들도많고 뭔가 그려내는 의도가 전달이잘안되요 ,2
581,내가 변ㅇ신이였어..ㅠㅠ ,1
582,ㅇ아무리 공포영화가 개연성이 없다지만 필리핀 전개부터 급격하게 개연성이 떨어짐. 중간에 뻔한 반전. 결말은 억지스러룬 감동유발. 여친이랑 보는데 ㄹㅇ표값아까워서 눈물떨어질뻔함 ,1
583,영화 만들다 귀찮았나봄.. 중반부 부터 점점 스토리 감당안되는느낌 뭔가 욕심에 이것저것 넣은거같은데 연관성은없고 중반까지는 볼만했음 갑자기 아모르겠다 대충 만들고 끝내자 그래도 끝은 감동을주고싶어!! ,4
584,무서워요. 영화 나쁘지 않습니다 ,10
585,군대 다시 가는 것처럼 무서움. 젠장 ㅠㅜ ,10
586,기대했던 것보다 좋은 작품이었습니다. 엑소시즘 외에도 가족에 대한 밀도있는 이야기가 담겨있었던 거 같아요. ,10
587,영화관에서 유일하게 나만 소리지른듯..넘나깜놀 ,10
588,"내가 연기력을 논할 수준은 안되지만 다른 영화 ‘검은사제들’이랑 비교 된다 특히 엑소시즘 구마 외국어 발음 , 영상 CG처리 ",10
589,"아 검은사제들 이후로 한국영화 이렇게 쫄려가며 본건 처음이네요.간만에 제대로된 수작 나왔습니다.저 평점알바 아니니까, 공포. 퇴마물 좋아하시는 분들은 무조건 보시면됩니다.컨져링 상위호환느낌입니다. ",10
590,영화 초반에 계속 얼굴 가리고 있었음. 무서워서 반쯤만 봤음. 진짜 너무 무서워 ,10
591,두시간 동안 무서웟어요  최근본공포중 젤 재미있엇어요 연기도 모두들  쩔었어요 ,10
592,검은 사제들도 재미있게 봤고 이런 장르 좋아하는데 변신도 소재는 나쁘지 않았습니다. 연출도 좋았고 배우들 연기는 말할 것도 없어요. 근데 굴뚝에서 불 올라오던 장면이 잔인해서 계속 찝찝했네요. 엔딩이 좀 더 깔끔했다...,7
593,똥줄 잡고 끝까지 너무 긴장하면서 재밌게 봤다. 팝콘 처음 쏟음. ,10
594,연기자들의 연기가 매우 좋아 몰입이 됐고 세련된 내러티브가 너무 좋았습니다. 영화보는 내내 긴장을 늦추지 못했습니다. 추천합니다. ,10
595,완전 진짜 너무 무서움. 한국판 컨저링1 ,10
596,호러 영화 보면서 이렇게 많이 놀란건 처음이네요 ,10
597,소재가 신선하고 성동일 배성우의 연기가 좋음. 볼만함 ,8
598,"엔딩은 약간 아쉬웠지만, 진짜 잘 만든 공포영화. 무서워서 놓친 부분이 있어서...재관람 가즈아! ",10
599,심각한 개연성 부족너무 뻔한 스토리전혀 공감가지 않는 가족들의 대처올해 본 영화 중 최악이였음공포영화인데도 중간에 졸뻔함깜놀장면 몇개로 1위라니..차라리 전설의고향 보세요 님들 전설의 고향은 교훈이라도 있음 ,1
600,개연성 부족 뭘 말하고자 하는지도 모르겠고 시간낭비.내용만 늘어놓고 회수가 안됨 ,1
601,"아무도 같이 안봐줘서 혼자 봤는데 혼자보길 잘했다.없는 친구마저 잃을뻔.. 가족들끼리 벌어지는데 까지는 좋은데 그 이후가.. 악마 연출도 촌스럽, 뻔한 반전,스토리전개x 차라리 가족들 끼리만 다뤘으면 더 나을뻔. 오...",4
602,이게 왜 1위인지..시간이 갈수록 망작 ,1
603,근친요소를 넣을 필요가 있었을까? 쓸데없는 장면 많고 떡밥 회수 안됨 악마가 슈발이라 욕해서 무서운거 다 사라졌다ㅋㅋ ,1
604,"영화 전개도 이상하고 보고나니까 내 정신이 이상해지는거 같은 느낌임 ,, ",4
605,2019 최악의 영화 완성도 0 ,1
606,엄마 아빠가 연기를 잘해도 애들이 나오면 어색하고 스토리와 결말도 허술하다. 집중하고 무섭고 싶어도 넘 아니다며 영화관 나올때 반응이었는데 평점이 만점이 많다니.. 공포매니아들도 다들 돈도 시간도 아깝다는데 이럼 평...,1
607,왜 평점이 좋은지 모르겠음. 좀 무섭긴한데 스토리에 개연성도 떨어지고 신부라는 사람이 임팩트가 너무 없음 ,1
608,소재가 호불호가 갈린건가? 시간가는 줄 모르고 봤네요. 연기들 너무 잘하고 재밌어요 그리고 엄청 무서워요. ,10
609,최근 본 공포영화 중 가장 볼만했다 ,10
610,개인적으로 곡성보다 쫄렸던 한국영화 였습니다. ,10
611,"후반부 스토리는 영 납득이안감. 흘러가는게 별로긴한데 진짜 재밌음. 연출,연기 지렸따 올해본 국내영화중 최고재밌었음 굿! ",10
612,올해 돈 안아까운 영화중의 하나. 진짜 시간 가는 줄 몰랐어요. ,10
613,본 영화중에 제일 무서웟다....공포영화 엄청 많이 봤는데 ,10
614,"이 영화 까는 사람들 이해 안된다. 스토리,연기,소재 뭐하나 빠지지않고 탄탄한 영화다. 어설픈 한국영화랑 비교가 안됨. ",10
615,무서워서 온 몸이 쪼그라들었다. 역대급 호러영화 진심 재밌다 ,10
616, 의외로 오랜만에 깜짝 깜짝 놀랬던 영화 ,10
617,무서워서 죽을뻔....전개빠르고 집중도도 좋아요 배우들 호흡말할것도 없고 한국을 배경으로 그런 주제니 더 신선! ,10
618,개재밌어요진짜 원래 엑소시즘영화는 허무한게많은편인데 첨부터끝까지 몰입도쩜ㅋ 애들한테도추천하고있음 꼭보셈 ,10
619,무섭긴한데 스토리좀 답답하고 일단 평점 8.4의 영화는아님 .... 기대하지말고 보세요 배우들연기는잘함 ,1
620,외국공포영화 짜집기한 허접한영화.. 지하실로 악마가 유도하는거 컨저링 애나벨거 배낀거같은데 진짜어설픔 .. 여기댓글에 낚이지마라 무서운거1도없고 cg도 개허접하고 돈날린다 ,1
621,너무 재미없고 무섭지도않음 시간아까움 ,1
622,연출 시나리오 특수효과 모두 너무 형편 없었는데 8점 넘는 평점은 뭐지...평점이 더 무섭다....나만 당할수 없다.. 로 하려다 정의 구현하려고 평점 남김. ,1
623,무섭기도하고 재밌기만히구만 테러쩌네 ,8
624,곡성을 뛰어넘는 인생영화매 여름마다 보고싶네요 ,10
625,완전 다르지는 않지만 꽤 신선하고 잘만든 호러영화. 진심으로 추천합니다. 근데 무섭습니다. ,10
626,크레딧 나오고 소리내서 욕한 첫 영화입니다개연성이라고는 1도 없음모든 행동들에 왜? 라는 의문만 듬백윤식님도 왜 나왔는지 모르겠고.. 유명 영화들에서 나오는 반전이나 인상깊은 장면들 짜집기했는데 인과관계없이 이거 멋...,1
627,이건뭐.. 뭐하자는건지 ..어쩌자는건지.. ,2
628,"이야기의 개연성이 하나도 없음,  귀신들려 가족때리고 파멸하는 이야기 ",1
629,공포영화인데 어이가 없어서 웃음이 터짐 끝나고 관객들 참나..ㅋ 이런 소리만 들림 ,4
630,보지도않고 글쓴사람들은 대체뭘까요 ㅋㅋㅋ ,10
631,머죠?애낳고 5년만에  첫 밤영화ㅡㅡ;;;; 이럴수가요.랄수럴수이럴수가요. 댓글보고 기대했는데 황망해서 돌아가는중..  돈아까움.시간아까움. ,1
