,Review,Rank
632,빡쳐서 살면서 처음 리뷰씀. 보러갔다가 헛웃음만 나왔고 살면서 극장에서 본 영화 중 가장 최악. 평점이 1점 아니면 10점 극과 극인 것엔 이유가 있다. 경쟁작도 없는데 누가 평점테러 알바를 풀겠나. 제발 알바에 속...,1
633,혼자 봤다가 미치는줄 ㅋㅋ 허세 부리지 마라. 이렇게 무서울수가 없다. ,10
634,좋은 소재.. 좋은 배우 잘못된 스토리텔링 ,4
635,....에휴 ㅋ 이게 머예요 잔뜩 기대만 높여놓고 정작 아무 내용도 없고 시시 ,1
636,"이런 말씀 드려서 정말 죄송하지만, 필름 낭비라고 생각합니다. 시나리오 부재가 가져온 참극... ",1
637, 진짜 시간낭비했어요유치하고 재미 더럽게없습니다 살다살다 이런영화를 보게될줄이야허접..ㅡㅡ ,1
638,영화가 뭔가 .. 연출이나 스토리가 전체적으로 엉성한 느낌이.. ,4
639,이런걸 영화관에 걸었다는걸 이해할수가 없다 ,1
640,너무 역겨울 정도로 자극적인 장면이 많아요 솔직히 스토리도 재미없구요  .. ,1
641,음..  뭐랄까? 정말 대뜸? 아무거나 막? 이상황에? 뭐.. 이랬음. ,1
642,연출이 너무 허접했고 구마의식하는 내내 웃겨서 못참겠더라 전날 영화 사자의 안성기님 연기를 보고와서 그런지 ,6
643,어줍잖은 연출과 보여주기식 오컬트 요소... 예고편에 속은느낌이 상당히 많이든다 카톨릭이라는 종교를 공부를 더 하고 만들던가 검은사제들이 잘 되니 급하게 만든거 같은데 진짜 가톨릭 신자로서 어이없고 황당한 장면들도 ...,1
644,"개연성이 너무 부족해 빈약해 허술해. 연기만 좋은, 연기가 아까운 영화는 이제 그만 좀... ",1
645,너무기대를해서그런지 쏘쏘 ,6
646,용두사미 영화. 배우들 연기 전체적으로 좋았고 초중반부까지는 스토리도 재밌음 가족들 2명으로 변할때 소름끼치고 잔뜩 쫄면서 봤는데....후반부 넘어가면서 점점 개연성 현실성 1도 없는 상황이 펼쳐지기 시작. 집에 귀...,6
647,개연성 너무 떨어진다. 좀 심한데 ,4
648,솔직히 배우들이 연기를 너무 잘해서 그게 더 무섭고 소름이였음 근데..  막판엔 진짜 영..  ㅠㅠ 엔딩이 아쉬움 ,8
649,구마의식 하기 전까진 진짜 쫄려서 지릴거 같았는데...아쉽다... ,7
650,영화는무서운데 옆에 혼자오신 아줌마가 더무서웠음.비닐소릴내기에보니까 계속뭘먹으면서 씹고계셨음.50분을 아드득거리기에 진심 쌀드시는줄알았음.궁금해서 힐끔거렸는데 어이없어서ㅋ웬 디오니소스마냥 손에 포도가;;쌀아니라 포도...,10
651,"무섭긴하다. 알포인트 상황과 유사하나 스토리가 조밀하지 못함.. 사탄은 육체조종, 순간이동, 육체복사, 엄청난 근력, 배경사물 조종, 스페인어회화(?) 등 영화에서 보여준 사탄의 능력이라면, 인류종말도 가능하겠어. ...",8
652,우리나라 퇴마영화의 한계..재미없지도 재밌지도 않고 성동일 침대씬 한번 깜짝놀람. 연기들은 기가막힌데.. ,6
653,초중반너무좋았는데 둘째 뜬근포로죽은거랑 백윤식무슨역할하는건지 ,8
654,저예산의 좋은 예.연기력으로 커버함 ,8
655,팝콘이 맛잇었어요 콜라도요 ,10
656,둘째의 서러움을 잘 나타낸 영화. ,8
657,평점 테러 둘째들이 한 듯 ㅋㅋ ,10
658,삼촌 연기 대박이다 진짜 ,10
659,"배우 조이현씨 존예 ,  존잼 ",10
660,성동일 배우님 연기...ㅠㅠ ,10
661,둘째가 죽어야만 가족들이 산다. ,10
662,내가 뭘 본건지 얼이 빠진다 ,10
663,계란말이먹방이래 ㅋㅋㅋ 미친다..난의외로재밌었음! ,8
664,그냥 집 안에서 귀신 나오는 영화도 무서운데 ㅜㅜ 가족으로 변신한 악마라니이이... 넘 무서웠어요 ,10
665,"보는내내 무섭고,, 분장 진짜 징그럽게 잘했다. 성동일 나쁘게 나올때 소름돋았다. 둘째 엄청 허무하게 죽고,,, 결말에 뭔가 더 있을 것같았는데 아쉽게 끝났지만, 누가 악마일지 찾는게 스릴넘치고 재밌었다 ",9
666,기대이상으로 재밌게 봤습니다 배우들의 클라스가 엄지척입니다. ,8
667,진짜 너무 무섭다...ㅜㅜ ,10
668,음향이나 영상 때문에 초반에는 긴장감이 고조.무서워서 인지 영화 상영 도중 퇴장하는 사람들도 있었음..  영화 끝나고도 그 장면 장면들이 일부 생각남.다만 결말은 너무 신경 안쓰셨네요. ,8
669,볼만함 재밋음 둘째 신경안써서 답답했음 다들연기굿굿 ,10
670,뻔한 클리셰 한국인들은 아파트에 대부분살지만 2층에 지하있는 목조주택에절벽은 왜 보인거예요 너무 웃겼어요하지만 향후 한국영화에서 컨저링같은 영화를 이 영화로 인해서한발자국 나간거같아서 기쁩니다.둘째서럽네요 ,10
671,여름에 보기 딱~인 영화~~ ,10
672,너무 징그럽고 무서운데 15세 관람 맞는거죠? ㅎㅎ 완전 재미있게 보고 왔습니다. ,10
673,진짜 최근본 영화중에 제일 무서웠음...집가는데  쫄려서 죽는줄ㅠ ,10
674,정말로 진짜로 무섭습니다ㅠㅜㅠ ,10
675,워메 진짜 무섭게 잘봤네요. 근데 오프닝 구마된 소녀는 누구지? 배우 정보에도 없던데. 공포 잘 살려냄. ,10
676,네.잘봤어요..뭔가 찜찜한 그런기블.. 잼나요 ,10
677,그럭저렁 봍만한영화 재미는 없다 ,8
678,초반은 무서웠지만 후반 힘이 조금 약한것같습니다. 하지만 충분히 볼만하다고 생각되는 영화입니다. 앞으로 한국영화가 발전하려면 이런 영화도 많이 시도하고 나와야한다고 생각합니다. ,8
679,배우들 연기 좋고 연출 이런거 다 좋은데 왜 갑자기 필리핀사제들나오고 둘째는 갑자기 죽고 차에서 신부님! 하는데 신부님들은 기도문 같은거 왜 안외우고... 모르겠다.. ,8
680,발암물질영화   암걸리는영화 리뷰댓글 알바많음 1위인지 이해안가 ,10
681,둘째 레전드급 존재감.... ,10
682,약간 결말이 찝찝해서 더 기억에 남는영화 재밌어요. ,10
683,배성우 웃는 모습이랑 성동일 표정이 자꾸 생각나요.. 너무 무서워요 ㅠㅠㅠ씻을때도 무서워요 ㅠㅠㅠ ,10
684,어제 보고 왔는데 전 재미있게 봤습니다. 고민하시는 분들 문화의 날 때 보시면 좋을듯해요. ,10
685,"계란말이 맛있을 것 같았는데 그렇게 짰나 싶고,,,ㅋㅋㅋㅋ ",10
686,아쉬운부분도있었지만 나름 볼만했다.기억남는  장면은 배성우 미친듯 웃는연기.. ,10
687,절정에서 결말로 넘어가는 과정에 개연성이 조금 부족하고 결말이 너무 짧다는 점만 제외하면 괜찮은 영화네요. 연출과 배우 연기가 너무 훌륭합니다. ,8
688,처음엔 깜짝깜짝 놀라고 몰입도 쩌는데 중반부터 조금씩 응? 하다가 후반부에 뭔가 그냥 웃김ㅋㅋ 약간 뒤로갈수록 감독이 손 놓은 느낌 ,8
689,둘째좀신경써주지ㅜㅜ엄청무섭 ,8
690,처음 볼 때 너무 가리고 봐서 또 보고 왔네요. 역시나 무서워요. ,10
691,오랜만에 제대로 된 영화를 보고 왔네요. 이런 완성도 높은 영화가 계속 나왔으면. ,10
692,우리둘째어디갔오! 챙겨주이소 ㅋ ,8
693,계란말이 먹방 너무 기괴했음... ,8
694,정말정말 간만에 제대로 된 공포가 있는 공포영화. 존잼입니다~ ,10
695,잘봤습니다. 마지막만 괜찮았다면 100점짜리 ,10
696,장영남 진심 OOO기력이다 ,10
697,공포영화 치곤예매하네여 공포물 무서운 사람도 변신으로 도전해도 나쁘지않을거같네여 약해요 별좀 높게주기에는 흠....정상가보고봣으면 열받을뻔 ㅎㅎㅎ 할인받고 봐서 다행 ㅋㅋ ,8
698,존나무서움 존나재밌음 ,10
699,세계최초로 배우들 한명씩 1인 2역을 소름끼치게 잘하는 영화 ,10
700,너무 쉬지않고 무서워서 보고나와서도 영혼이탈탈털린기분... 짜증나게 무섭다 ,9
701,배성우 웃는 장면이 제일 지리는 장면이었다. ,10
702,영화라 다행이다  혼자는 못자겠다 ,10
703,마지막은 좀 아쉽지만 대체적인 연기나 스토리는 만족 ,8
704,"카프카 ""변신""생각하고 봤는데 너무 무서워서  깜짝 놀랐어요. ",10
705,고문장면은 진짜...눈뜨고 못보겠더라.... ,10
706,진짜 똥 나왔다가 들어갔어요 ,10
707,심하게 스릴 넘치네요.. 매 씬이 긴장돼서 혼났어요.. ㅠㅠ ,10
708,진짜 스릴넘치고 너무 재밌는데 마지막이 아쉽네요 ,9
709,무슨 의미를 전하는지 알겠는영화. 초반에 몰입도 최상 하지만 영화 중간에 좀 오바하는장면때문에 몰입도가깨짐 그게아쉬웠음 영화자체는 한국영화치고 잘 만든영화 ,10
710,둘째 딸은 왤케 늦게 찾음 ,8
711,"중심을 잡아준 성동일, 처음보는 모습이지만 너무 잘맞는 옷 배성우, 다른 배우들도 다들 끝내줌. 성동일 대표작!! ",10
712,개쩔 ㅠㅜ 이름 기억안나는데 여자분들 진짜 연기 잘하고. 성동일 배성우씨도 좋았어요~ ,10
713,보는내내 심장쫄깃  몰입도 굿 ,8
714,20%는그냥깍아네리네요10%알바70%정도 겐찬고공포영화7점정도면겐찬은거저도보러갈의향이있고일단다떠나서연기력이젤중요 한거임보니까연기력은뛰어나다니별로란소린 하면안되조많은비평비난에도망작이라해도 연기력이정말뛰어나다면모든게커버...,10
715,"공포에 스토리까지 갖춘 영화!영화 대박습니다. 기자, 평론가는 어떻게 뽑느거죠?그냥 입만터는 기레기 같은...평점을 저따구로 주냐... ",10
716,"시각,청각적으로 압도되는영화 호불호가 갈릴듯싶다. ",8
717,이런 공포 영화가 우리나라에서 나왔다는게 자랑스럽다. 염정아 나온 영화보고 실망했었는데.. ,10
718,가족이라는 틀안에서 공포감을 이끌어내는게 참신하고 그 공포감이 그대로 전달되서 더 몰입해서 보게됨배우들 연기는 명불허전!! ,10
719,재미있게 봤고 긴장감 넘치고 스릴있고 좋았습니다 ,10
720,킬링타임용으로 나쁘지않다 ,10
721,무섭지만 재밌네요 ㅋㅋ ,10
722,기대하지않았지만 소름돋았어오. 진짜 소름돋을정도로 무섭고 몰입됬었음 ,10
723,조금은 아쉬웠지만 그래도 잘 봤습니다.배우분들 연기도 최고였습니다. ,8
724,와 진짜 오랜만에 정말 영화보고 온몸에 피가 식는 기분이 들었다 엄청 소름끼치고 명작. 너무 무섭고.. 안무섭다는 사람들은 감각이 없는게 아닐까 의심스러울정도.. 막판에 한국영화특 슬픈게나왔지만 전체적으로 만족스러움...,10
725,나는 악마를 믿는다. 너무 무서웠다. 진짜 이제 집에 어떻게 가지.. ,10
726,영화시간 내내  숨 죽인채 113분이라는 시간이 호다닥 지나갔습니다.정말 재미있게 봤습니다. ,10
727,무섭지만 또보고싶다 꼭봐라 돈아깝지않다 평점 조금 주는 애들 다른영화알바들 진짜 재밌다 ,10
728,영화 너무 재밌었어욬ㅋㅋㅋㅋ역대급 최고에요!!!성동일 너무 좋아하는데...짱이에용보는 내내 몰입 장난 아니었네요 그정도로 초대박!! ,10
729,혼자가서 봤는데 오우 너무 재밌게 봤어요~!! ,10
730,"변신- 내안에 또다른 모습, 완전 무서움. 무서움! 성동일님,배재성님,장영남님,김혜준,조이현,김강훈 모두 대박나세요~~ ",10
731,연기자들이 변신하면서 하는 연기는 정말 소름끼치게 무서움~결말이 뻔하다는게 조금 아쉬움~;; ,8
732,영화안보고도 평점남기기되네요 ㅋ ,10
733,대박입니다.. 너무 소름돋음. 한국 공포영화 수준을 한단계 끌어올린 영화. ,10
734,그렇게 능력이 출중한 사탄이 왜 변신까지 해 가며 모습을 숨겼을까요? 정체가 드러나면 힘을 잃는 것도 아니던데.... 그냥 나타나서 한꺼번에 가족들을 다 죽여도 누구 하나 말릴 존재도 없던데... 스토리 개연성은 전...,1
735,어이가 없어 웃음만 나온다. 8점 가까이는 별점테러네. 딱 3점. 이번엔 박평식 적절했네 ,1
736,보지않았다면 더 좋았을 영화 ,1
737,"댓글이 다 알반가,,, ",1
738,너무너무 재미없다 ㅜㅜ ,2
739,강렬한 오프닝 그 이후에도 지속된 긴장감. 엑시트 봉오동 전투 보다는 100배 나은 영화 중간 중간 개연성 떨어지는 부분은 있음. 글구 백윤식 배우님 영어로 스피킹 할때 웃으라고 만들어 놓은거 맞죠? ,10
740,상업 영화인데 존나 재미없어요 이렇게 찍기도 어렵겠다 감독은 재능이 없으니 딴길 알아보세요 ,1
741,무섭긴 진심무서움 결말이 좀 아쉬움.. 둘째딸은 신경도안쓰더만 ㅠ ,8
742,평점은 안좋고 주변분들 반응은 좋길래 반신반의하며 봤는데 재밌어요 근데 허술한 부분들도 많았네요 의문점이 많이 남았어요 잔인한거 못보는데 잔인한장면이 너무 적나라하게 나와서 속이 울렁거리긴 했지만 공포영화니 당연하다...,8
743,장영남 먹방 귀신 들린장면 진짜 명연기~~너무 무서웠어요.. ,10
744,ㄷㄷ넘흐 무서워요. 무서운거 못 보는 사람 마음준비하고 보세요... ,10
745,"초중반까지는 몰입감 최고, 후반부는 그냥 따뜻한 가족드라마로 끝나버림...ㅎㅎ 결말이 허무했지만 볼만했음 ",8
746,심장이 바운스 바운스 진짜로 정말로 무섭웠다고요요 ㅜㅜ ,10
747,최근 봤던 공포영화랑 비교가 안 될 정도로 재미있었습니다~~ ,10
748,영화보는 내내  긴장해서 몸이 아플정도네요 ㅜㅜ 음청 재미있습니다! ,10
749,진짜 연기구멍이없어서 제일 좋았다 ,10
750,"전 엄청 재미있었어요, 진짜 최근 나왔던 공포영화 중 에서 짱인듯 ",10
751,성동일 배드씬 ㄷㄷㄷ. 공감하시쥬?? ,8
752,공포영화면서도 코미디장면이 나와서 꿀잼 ,10
753,꿀잼 연기최고 ㅜㅜ 영화도 재밌어요 ,10
754,둘째의 서러움... 물건 찾으러간 둘째보다 변신한 첫째를 더 걱정하네.. ,10
755,개무서움..  연기력 장난없음 ,9
756,배우들 연기하나는 참 잘하드라 ㅎ ,8
757,만족스러운 영화 곤지암보다 무서웠다 ,10
758,진짜로 무섭고 소름돋았음 ,8
759,이런 미친 연기력에 감탄 스토리에 또 감탄. 솔직히 진짜 나만보기 아깝다. 공포 좋아하시는분들은 개거품물고 볼듯! ,10
760,사운드 좋고 편집 좋고 무엇보다 연기대박 ,10
761,나름 괜찮았는데 둘째딸은 왜 마지막까지 안챙겨주시는지.. ,10
762,내 인생 최악의 영화 탑3에 들어갈 영화 변신 ,1
763,이거 진짜 재밌다고 느끼는 사람들은 어떤 부분이 재밌는거임? 개연성x 스토리 뚝뚝끊김사자랑 변신 연달아보니깐 사제물 공포증 올 거 같음 ,1
764,정말 계속 장영남 시금치 먹는씬만 계속 생각남ㄷㄷㄷ ,10
765,"변신 이거는 역대급 공포인듯. 그냥 귀신이 나오는게 낫지, 이런 심리적 공포가 여운이 너무 남아 더 무섭네요ㅠ 몰입감 쩔었습니다. ",10
766,사람들이 보지말래서 혼자봄!! 생각보다 괜찮은데 왜그러는지 모르겠당.!  연기력 쩔어~ㄷㄷ ,10
767,악마로 변한 배성우 아저씨 웃음 너무 소름끼쳐ㅜ 계속 생각나요 ,10
768,"얼굴 잘생기고 몸좋은 말도 안되는 사제들 사이, 배성우 사제 등장ㅋㅋㅋ연기 너무 좋고 악마가 변신했을때 넘 무서웠음 ",10
769,"육성으로 소리지른적 처음이에요! 가족과 집을 배경으로 설정해서 너무 몰입되고 누가 봐도 밑에서 나와야 하는 장면인데, 반대로 위에서 나옴.. 반전도 좋았고, 둘째 신경을 아무도 안써서 둘째걱정 관객들이 다했어요. 근...",10
770,장영남 악마 들려서 아침 식탁에서 식사할 때 연기가 진짜 빙의된 사람같아서 소름돋았구요. 그 장면 보고나니까 지금까지 속이 매스껍네요... ,8
771,내 생각임 역대 공포영화 많이 봤는데 소름돋게 연기잘해서 무서웠음 내가 좋아하는 배우들이 항상 웃다가 인상찡그리고 진짜 악마 씌인것처럼 무서웠음 무서운장면없는 진짜 무섭다라는걸 잘살림 ,10
772,"외국 공포영화도 많이봣지만, 이미 아는배우들이 연기해서그런가 역대급 무서웠음. 한국공포치고는 최고! 심장쫄깃 ",10
773,제목만 듣고 본영화세상 반전있는 영화감정이입 제대로되어 무서움과 두려움에 눈물까지 난 영화하..공포영화 못보는데 뭔가 색다른 느낌의 소재임돈이 안아까븜 ,10
774,침대씬  진짜무섯기하더라구여대체적으로   무서웠어요 ,10
775,사운드가 큰 한몫했다 가족들 간에 긴장감 표현도 정말 좋았음 근데 백윤식 배우님이 왜 등장한지 모르겠고 영어 쓸 때 많이 깼고 결말 부분으로 가면 갈수록 아쉬웠음.. ,8
776,숨쉴틈이 없이 무섭내요 ㄷㄷㄷ....ㄷ.. 괜히봤ㅇ.ㅁ.. ,10
777,백윤식님 왜 짠 등장만 하시고 제일 불쌍한 건 둘째고 ,8
778,안 무섭다는 친구 말 듣고 봤다가...싸울뻔했네요.  진짜로 잘 만든 영화 오랜만에 보네요. 추천합니다. ,10
779,나름 공포영화 많이 봤는데 내가 본 공포 영화중에 가장 참신하고 연기 구멍 없음 ,10
780,보고 나서 그 날 잠을 못 잤어요 그정도로 여운 있습니다 하지만 한편으로는 뭔가 찝찝한 기분이 들었습니다 보고 나면 한동안 안잊혀질 것 같은 영화입니다 ,8
781,도전적인 작품이었다. 초중반까지 좋으나 후반부에 의미가 불분명하고 의아하게 흘러간다. 상상가능한 이야기로 흐르는 후반부가 아쉽다. 그러나 충분히 놀랍고 무서웠다.  도전에 점수를 준다. ,9
782,너무 무서워서 1점 뺏어요... 무서운데 재밌어서 끝까지 봤네요 ,9
783,숨 죽이면서 봤어요. 나와서도 멍...빠른 전개에 몰입도 장난 아니였어요. ,10
784,섬뜩한 것도 있고 깜놀한 것도 있고  스릴있게 봤어요 ,10
785,넘 무서웠어요~~오랜만에 공포영화라  후덜덜~~ ,10
786,공포영화 잘 안보는데 남친이 보자고 해서 보고왔어요 공포 치곤 저도 잘 본거 보니까 막 무섭진 않은데 소름끼치는 장면이 많았어요 ,10
787,무섭다. 공포 좋아하면 꼭 봐라 ,10
788,귀신 호러 같은 장르가 아닌 내용으로 만들어진 공포감이 드는 영화였어요~ 볼만했어요~ ,10
789,"귀신들어간 배성우님 표정연기 너무 소름 돋았어요 ㅠㅠ 잠잘려고 할때마다 그 표정이 생각나서 미치겠어요,, ",10
790,역시나 믿고 보는 배우들이라 그런지.. 전 배우들의 연기로 다 살린 영화라고 느껴지네요 ,10
791,개인적으로 최고였어요 :) ,10
792,올해 엑소시스트 영화가 좀 나오네사자보다는 나음 ,10
793,오 좀 무섭 ㅜㅜ 연기력이 다 살린 영화같아요 전 너무 무섭고 재밌었는데 신랑은 그냥 별로라고 하네요 보는 사람마다 호불호는 좀 갈릴 것 같아요 저는 신선하고 연기력땜에 시간 가는 줄 모르고 봤어요 ,8
794,생각보단 괜찮았어요ㅎ진짜무서웠구요ㅜㅜ배우들연기오지고 무서웟뜸 ,10
795,스릴있는 공포였다~ 연기자들 연기 오진다~ ,10
796,오컬트 공포는 첨인데~ 사람으로 변하는 악마라니 무서웠어요 ,10
797,1000만가자~다시보고픈영화 ,10
798,무섭기도무섭고 연기미쳤고 반전도 있었음 ,10
799,몰입감이 보는내내 스트레스받고 짜증날정도로  쩔음 ,8
800,재밌음 2시간 가까이되는 영화를 지루하단 생각안들고 본건 오랜만인듯 일단무서움 ,10
801,난 정말 영화보면서 눈감고 고개숙인적 처음이다. 존나 쫄보 됏따. ,10
802,갠적으로 공포영화 중에 손에 꼽을듯~ 무섭기는 무섭더라구용! 그래도 정말 볼만해용! ,10
803,와우~~한국공포영화치곤 징쨔대박 오싹오싹시간가는쥴모르고 빠져들어서봄 ㅋㅋ방금보고 집에왔는데 아직두 후덜덜~~ ,10
804,소품과 분장의 완성도가 높았고 몰입해서 볼 수 있었습니다 긴장감 넘치고 재밌게 봤어요! 다들 연기도 잘하고 막내 너무 귀여워.... ,10
805,진짜 추천이요. 갑툭튀가 좀 있지만 그래도 진짜 재밌고 무서워요 ,10
806,원하는 결말 아니라고 스토리가 엉성하니 어쩌니 하는사람들 영화 제대로 다시 보시길 ,10
807,막내 칼들고 장난칠때 지릴뻔 ,10
808,좀 많이 쇼킹한 영화다 진짜 잘만들었다 ,10
809,진짜 무섭다.. 스토리는 최고!! ,10
810,친구 추천으로 보고옴 굿 ,10
811,재미짐 근데 결말이좀.. ,10
812,금방 보았는데 평점낮아서 재미없을줄 알았는데 시간가는줄 모르고 봣네여무섭기도 했고요. ,10
813,아 진짜 긴장감 최고…보면서 소름이 100번은 돋은듯.. ,10
814,처음 시작부터 무서워서 괜히 봤다 싶고 빨리 끝나길 기다린영화 ...ㅠㅠ ,10
815,이게 안무섭다는게 진짜 알바 아님?ㅋㅋㄷㄷ ,10
816,결말에 다들 허무해하긴했지만 시간 가는줄 몰랐음 그만큼 영화에 몰입되었다는 뜻. 검은사제들이랑 비슷한 영화지만 검은사제들보다는 훨씬 무서운듯 ,8
817,누가 검은사제들  비슷하다고 해서 그냥 그랬는데  개인적으로 검은사제들보다  더 무섭고 괜찮게 봤어요. ,10
818,징그럽긴 하지만 간만에 무서운 영화 잘 봤어요 ,10
819,소재가  기발~ 배우들 연기력도 구웃~ ,10
820,"초중반까지는 굳, 중후반 갈수록 필요없는 장면이나 개연성 많이 떨어지는게 보여서  집중력 떨어짐 ",8
821,오랜만에 심장 쫄깃하게 봤던것같다근데 확실히 한국공포영화 특성상 뒤가 느슨해지는건 어쩔수없는듯 ,8
822,생각보다 잘만든 한국판 컨저링 ,10
823,너무재밌게봄~~조아용 ,10
824,한국 공포스릴러라는 가정하에 솔직히 재밌게 봤다 영화후반부 갑자기 다급해진 전개와 결말이 아쉬울뿐...공포영화라는 조건에 9점 줄수있는 영화라고 생각한다 ,9
825,나는 무섭고 재밌었었어요 ,8
826,연기는 정말 최고였던 영화. 마지막 조금 허무하긴 하지만 재밌었다 ,8
827,"흥미롭고 무섭지만 중반 필리핀부터는 베댓과 같은 생각으로 흥미로움이 무너졌다. 하지만 초반부, 오프닝이 너무나도 좋았고, 나머지도 노잼은 아니고 평타는 쳤으므로 8점대 중반에서 후반이이 딱 적당하다고 생각한다. 그래...",8
828,약간 내용이 허술하지만~~ 딸들은 넘 이쁘네요 ㅎ ,8
829,그돈으로 참.. 잘 만들었네... ,10
830,액소시즘 영화 좋아하는데 한국영화중에 이런영화나온다는게 정말기쁘네요재밋게봣어요 ,10
831,팝콘을 먹을 수 없을 정도로 몰입해서 봄. 마지막 배성우 개멋 ,10
832,배성우의 놀라운 연기력에 감탄했고. 너무 재밌었다. 진심 역대급 표현이 어울리는 영화. ,10
833,진짜 너무 무서웠다. 끝부분만 빼면 ,10
834,"한국공포영화 는 항상 기대에 못미쳤는데 이번 영화는 스토리도 좋고 연출,연기력 3박자가 잘 어우러졌네요.  정말 무섭고 재미있습니다. 꼭 보세요 !! 강추!! ",10
835,연기를 너무 잘해서 시간 가는 줄 모르고 봤습니다. 겁이 많으신 분들은 팬티 꼭 두개씩 챙겨가세요~~ 너무 재미있습니다 ,10
836,볼려고 고민한다면 무조건 봐라. 절대 후회 안함. ,10
837,우리나라에서 검은 사제들 다음으로 이런 장르의 영화가 이정도의 퀄리티로 나오다니.. ,10
838,검은 사제들이랑 비슷하지만 다르다. 둘 다 너무 재밌다. 강동원도 좋고 배성우도 좋고 ,10
839,용두사미... 처음 중간까지는 정말완벽했다. 그러나 끝으로  가면 갈수록 ..속상했다 이런 영화를 끝에가서 허접하게 만들다니그래도 배우님들 연기덕분에 완전 긴장하고 봤다. 성동일 배우님은 진짜... 믿고보는 연기력!...,9
840,무서워서 눈 가리고 봄. 모든 짐을 홀로 지고 가는 마지막 장면은 장렬하고 숙연해짐. ,9
841,최고에요ㅜㅜ짱재밋음... 방심하고 봣는데 넘무섭고 스릴쩌네요 ㅠㅠ계속 웅크리고봣어서 영화 다 끝낫을 때 온몸이 떨렷어요. ,10
842,배우들의 완벽한 연기에 압도됐다. 특히 악마 연기들은 본적도 없으면서 왜이렇게 잘하는지.. 배성우 웃을 때 압권 ,10
843,여름에 왜 공포영화 보라고하는지 알겠음 처음으로 공포영화보면서 한기를 느껴본 영화 ,8
844,재밌게 보고 왔음. 평론가급 아니면 불만없는 영화인듯 ㅎㅎ 내가 볼껀데 나만 만족하면 되지 뭐 ,10
845,영화보는 내내 너무 무서워서 어깨 담왔어요ㅋㅋㅋ성동일님 진짜 ㅠㅠㅠ ,10
846,"진짜 이렇게까지 영화가 안 지루할 수 있나???시간이 여태껏 봐온 영화 중 가장 빠르게 지나간영화였다. 한국에서 이런 시도, 굉장히 신선했다고생각한다. 계속 여운이 남는 영화다 ",10
