,Review,Rank
359,영화에 장르를 이것저것 다 섞어놓아서 정신이 없음 ,1
360,올해 가장 최악의 영화. ,1
361,너무 유치합니다.  진짜 너무너무 ,1
362,너무 유치합니다.  진짜 너무너무 ,1
363,한개도 아깝다. 스토리전개가 어거지 뭐가 말이되는게없다 ,2
364,진짜 너무하네..한국영화 진짜쪽팔린다 ,1
365,신파가 먹히긴하는데...지친다 ,3
366,2019년도 영화맞냐  차승원이는  요리나해라 ,1
367,ㅅㅂ 다행이 남이 사줘서  다행이지 존ㆍ나노잼 개노잼 ,1
368,보는내내 럭키 감독이 만든게 맞나 싶었음 도대체 어디가 코미디 원조 맛집임 차라리 그렇게 홍보를 안했음 어땠을까 싶을정도임 ,1
369,그놈의 깡패는 치트키네 ㅋㅋㅋ ,1
370,OOO기 노잼 영화  절대 보지마세요;; ,1
371,"노잼 억지웃음. 감동부분은 인정하지만, 차승원의 모자란 연기가 너무 안 어울리고 억지스러움 ",2
372,도대체 뭘 말하고싶은걸까? ,1
373,퉤 올해 본 영화 중 가장 최악 ,1
374,너무 유치합니다.  진짜 너무너무 ,1
375,쥐어 짜내도 너무 가식적이다나만그런가 ,4
376,하..이걸 못피했네... ,2
377,진짜 알바가 있구나.. ,1
378,생애 최악의 영화였습니다 ,1
379,댓글 알바 무시하고 보지마세요.. 돈 아까워요 ,1
380,너무많은걸 담아내려고 욕심내서 내용이 엄청산만해요 주연배우님도 자신이 소화할 수 없는 배역을 선택하신듯ㅜ ,2
381,"눈물이 나긴 하는데, 그냥 짠한 장면장면에 눈물 났을 뿐ㅜㅜ 웃음과 감동을 넘나리 억지로 우겨놓은듯....ㅜㅜ ",4
382,아 진짜 명절이라 알바들 풀어놓고 .... 시작하자마자 나왔습니다. 휴~ ,2
383,별 하나도 아까워요..차승원 배우때문에 본건데...모두의 연기가 어색하고 ... 억지 웃음 억지 눈물..말도 안되는 전개와 사건 껴 맞추기.... ,2
384,밑도 끝도 없는 전개에..말도 안되는 감정선에..많이 웃었네요 실소가 빵빵..^^ ,1
385,평점만 믿고 봤다가 짜증나서 나옴 처음에는 대체 무슨 의도인지 드라마 장면들이 나오고 조폭들이 도우려 나서고 뭔 삼류영환가 싶더니 갑자기 끝날 무렵 대구 지하철 사고를 꺼내면서 감동적인 요소를 넣으려는데 너무 억지스...,1
386,ㅋㅋㅋㅋ댓글알바가 있다는걸 깨달았습니다근2년간 영화관에서 본 영화중 제일 재미없었어요 나오고싶은거 꾸욱참고 간신히 봣음그냥 한마디로 핵노잼 ,2
387,내가 왜 이걸 돈 주고.... ,1
388,오그라들어요..ㅠㅠ연기도 억지스러웠고 전혀 웃기지 않았음 ,1
389,댓글 조작할 열정으로 영화나 제대로 만들 것이지... 쯧쯧...  안타깝네 ,1
390,아빠모시고 갔다가 욕만 디지게 얻어먹음 이걸 영화라고 예매했냐고 ㅠ ,2
391,"억지감동 개연성 없음ㅠ,,,돈주고 보지 마세요 ",2
392,별로 돈아까워   보지마  후회함 ,1
393,코믹의 코믹도 못살리고 정색빨고 본건 처음이네요 마지막 몇십분 감동적인 부분 그나마 나은축에 속하다해서 2점남깁니다 2점도 아까워죽겠지만 ,2
394,영화 초반에 아들이 재미없다고 나가자고 했다. ,2
395,평점조작 알바가 있다는것을 알게해준 영화.. ,2
396,에휴 전형적인 억지감동팔이 신파 김치무비. ㅉㅉㅉㅉ ,1
397,차승원 좋은배우를 어정쩡한 바보로 만들다니..영화보다가 손발이 오글거리는 신파로 헛웃음이 나더라 ,2
398,인생에서 가장 아까웠던 2시간ㄹㅇ 댓글알바를 얼마나 푼거임 ,1
399,가족끼리 다같이 보기 좋은 영화였어요. 유별나게 웃기고 연출이 좋은 건 아니지만 잔잔하게 웃고 울며 볼 수 있는 작품이었습니다. 백혈병 환자들에 대해서도 아주 조금이지만 더 알게 되어서 좋았어요. ,6
400,백혈병 환자를 이용한 자칭 유머러스한 상황 등  억지 웃음 요소들도 그렇고 후반부엔 영화 자체에서 느껴지는 슬픔 고난이 아닌 그저 대참사를 떠오를 때 오는 제 개인적인 슬픔과 추모의 기억만 떠오르고 뭘 보여주겠다는 ...,1
401,오글거림 내용이 좀 산만함 ,1
402,40분이면 많이 버텼다 보다 나옴 ,1
403,제가 너무 잘 자는 바람에 중간에 못 나가고 끝까지 봐야 했던 팀원들에게 너무 미안합니다... ,1
404,이게 재밌냐? ㅋㅋㅋ 영화보다 처음 뛰쳐나왔다 ,1
405,"처음으로 중간에 영화보다가 나갈뻔했어요..차승원의 어색한연기, 억지웃음코드, 쌩뚱맞은 등장인물들.. 끝나기 30분전부터는 감동을 주려고했으나 그것마저 식게만드는 유치한상황들.. 휴 진짜 이런 평 잘안남기는데 보기 힘...",1
406,최악의영화..댓글알바적당히좀하시길  ㅡㅡ보자마자 황당해서 인생 첨으로 평점남깁니다ㅡㅡ시간아까워 ,1
407,오늘보고왓는데...댓글알바 심하네요....연기 스토리 감동 개연성그어느부분에서도 ....별로였어요 ,1
408,"유치한 연출, 일본 영화같은 연기,  짜임새없는 극본까지... 이 영화의 단 하나의 장점은 잊고있던 대구 지하철 참사를 기억하자는 것. 단 하나다. ",2
409,하아 이런... 90년대 삼류 신파 영화각본 연출 연기 삼박자가 전부 ,2
410,힘을 내는게 미스터리다 진짜 ,3
411,핵노잼 영화보는내내 각막상태 악건성 러닝타임은 왜이리또긴거야집에서 유튜브나볼껄 ,1
412,진짜 너무하네 난 여태 댓글알바의 존재를 믿지 않았다 이 영화를 보고 댓글 알바가 존재함을 확신했다 ,1
413,"대구 지하철 참사와 백혈병, 부성애... 슬프지 않다면 그게 더 이상하지...근데 너무 뻔해서 별루...개그도 너무 올드하고 스토리 진행도 뻔해. ",1
414,이게 뭔 8점대냐 내려라 ,1
415,극전개가 다소 느리고...어거지 연출이 많아서 아쉬웟어요 ㅠㅠ ,2
416,감동이 어마어마ㅠㅠㅠ ,10
417,처음에는 웃었다가 나중에는 뭉클한  무엇인가를 던져주는 영화.... 요즘같은 세상에...잔잔한 감동을주는 영화그리고 역시 차승원을 다시한번 확인시켜주는 영화다시한번 보고싶은 영화...꼭다시 한번더 보고싶은 영화.. ,10
418,댓글알바들 개어이없다ㅡㅡ최근 몇년간 최악의영화!!! 차승원의 코메디영화 커리어에 찬물끼얹는영화~ 이건 코메디도아니고 감동휴먼드라마도 아니고 차라리 병맛영화도 아니고 그냥 졸작!!!화가난다 ,2
419,슬프고 재미있고 가족들과 같이 보기 너무 좋아요 ,10
420,차승원이 얼마나 대단한 배우였는지 너무 오랫동안 잊고있었다. ,10
421,이거모야 개재미있네~~ ,10
422,진짜 재미없어요 하품만 하게 되네요 돈만 아까운 영화입니다 보지마세요 ,1
423,평점창을 들어오는 순간 알바의 냄새가... ,2
424,차승원의 코미디연기 넘 좋았어요 ,10
425,평식이는.. 진짜 그러다 한 대 맞겠다. ,10
426,1년에 한번 후기 남길까 말까인데이건 남겨야할 듯보는내내 불편했던 영화 ,1
427,억지..가 넘 심함ㅠㅠ ,2
428,첨엔 무슨 아침막장드라마처럼 시작해서 이승엽씨나올때부터 펑펑 울었다~샛별이 연기넘잘하고 마지막에 감동적~ ,8
429,평점ㅋㅋㅋㅋ 알바 너무 쓴거 아니냐? ,1
430,신파..신파...신파.. ,1
431,방금 봤는데 단순 코믹 영화인줄알고 가족끼리 시청했는데요 눈물엄청흘렸네요 후반부는 정말 뒷통수한대 맞은 기분이더라구요..샛별이 엄채영 님과 차승원 님의 캐미 너무 좋았구 정말 감동이었습니다 병원에서 본인과 같은 처지...,10
432,"추석 때 가족들이랑 봤는데.. 코미디 수준은 그렇다치고 소재가.... 대구 사건을 다루고 있는 거 전혀 몰랐는데, 사고 당한 유족들은 아직 이런 거 못 봅니다. 제발 이런 거 만들지 마세요 ",1
433,신파를 조금더 개연성있게 만들었다는 것말고는 뻔하디 뻔한 전형적인 코미디를 가장한 신파영화 ,2
434,너무재밌게봤어요ㅜ눈물찔끔 승원이형너무좋아 ,10
435, 제발 속지마세여 저도 당했습니다 ㅠ 설마 했는데 진짜였다 ,1
436,본사람이 없으니 알바성과 오지네ㅋㅋ ,1
437,차승원 연기의 한계인가? 어울리지 않은것인가그래도 한가지 다시는 이 감독과 영화 찍을 생각마라 ,2
438,유치함.... 티비에서 공짜로 나와도 보기 힘든수준.... ,1
439,진짜 보지마라짜증난다 ,1
440,평점읽어보고 그나마 평타일거같아서 봣는데 흠...  봐도그만안봐도그만 돈은좀아까움후반부가 감동이긴하지만 초중반은 뭐지?하면서봄 ,6
441,뻔한 내용 심신한 스토리 억지감동... 언제끝나나 시간봄 ,6
442,슬펐어요. 마냥 코믹한줄알았는데 말이죠. 특히 과거 대구지하철참사가 떠올라 마음이 아팠어요. 아빠와딸 연기가 좋네요~  추천합니다. ,10
443,"각본 누구냐! 개연성 하나 없는 뜬금 상황설정에 우연으로 쳐발른 (뜬금포 딸상봉, 우연히 상황 맞춰 만나, 우연히 사기꾼 만나 우연히 승엽이 만나 알고보니 사기꾼이 연관되있고...) poor pon으로 눈물샘이나 말...",2
444,진짜 별루인. 보다졸았어요. 연기도 어색한느낌. 관람비가 아까웠어요. ,1
445,댓글알바 너무하는거아녜요?감독님 열심히하시는건좋지만 아직재미는없습니다 없어도너무없어요 그래도화이팅!! ,1
446,평점을좀더 밑에까지 봤어야하는데 위에 거짓평점 몇개에 낚인듯ㅜㅜ 낮잠이나잘걸.. ,1
447,"정말 오랜만의 병맛영화후반부로갈수록 슬프내, 감동이네하는데기다리기 힘들만큼 짜증나서 초반에 나왔다. ",2
448,"영화보다 뛰쳐나온거 첨이네요.심지어 표를공짜로 받아서 본건데 시간이아깝고 머리가 지끈지끈아파서 중간에 나왔어요. 진짜너무하네요, ",1
449,차승워이 저력있네. 원맨쇼로 백만 넘겠으니~ 다음주에 파일 뜨면 받아봐야겠군. ,4
450,후반부 말곤 별로 재미없고 특히 차승원 연기가 진찌 별로였음 바보연기는..안하시는게 좋을듯하네요 ,6
451,설정 이야기 전개 등 일본 드라마 같네 ,6
452,차승원 연기는 훌륭했지만나머진 다 별로였다 ,6
453,아오 진짜 개 OOO영화다.. 후반30분만볼만함 ,1
454,코미디라고해서 박장대소정도는 아니더라도 어느정도 웃겨줄거라생각했고 마지막 감동씬도 기대를했는데 뭐지? 아휴ㅡㅡ ,1
455,결국 한국영화 특유의 신파극 ,4
456,유치하고 재미없어요 ㅠㅠ ,1
457,감동적소재를 가지고 이렇게 못만들수도 있다차승원같은 배우를 이렇게 허비할수 있다감독님은 돌직구날려주는 친구도 없나투자한 분들도 이해불가 ,1
458,"영화시작부터 끝날때 까지 억지웃음, 억지감동 유발ㅠㅠ예상을 1도 벗어나지 않는 뻔한 전개ㅠㅜ돈버리고 시간버린 영화ㅠ ",1
459,재미없어요 후기보고 점수 높아서 재밌을줄 알았는데 실망 ,1
460,,10
461,최악이다.진짜 재미없다 ,1
462,코믹영화인데 진짜웃음1도안나옴 럭키는재밌게봤는데.. 그리고 bgm감독누구인지... 정신좀차리길 ,4
463,"후반 3분의 1을 빼면은 건질 것은 배우들의 연기력과 배우들 밖에 없는 듯함 연출, 효과음, 웃음, 대사 그 어느 하나도 구리지 않은 것이 없었음.. 보는 도중에 나갈려다가 돈 아까워서 계속 봄;; 이거보느니 차라리...",2
464,"포스터랑, 제목 어떤 OO들이 만들었음?아무 대학교 경영학부 애들한테 외주맡겨도 저거보다는 잘만들겠다 ",4
465,"재미나요,? 인간적으로 ",6
466,"초반에 너무 억지 웃음, 후반엔 감동적인데... 뭔가 좀 아쉽 ",4
467,진짜 노잼. 돈 날린게 아까워 엉엉 울었다... ,1
468,엄복동=미스터리 공감 ,1
469,야구팬이라면 이승엽이 자기 싸인볼 희소성 떨어진다는 이유로 아이들 팬에게 얼마나 싸인 안해주는지 다 알지 ,1
470,3류영화... 배우들이 아까워요 ,1
471,뜬금없이 100개100개 왜 그러는지에 대한 뭔가 장치가 없었다.차라리 지하철 참사 당일 부인 생일이었고 생일선물로 준비한 100개의 장미꽃이 그 말의 배경이었다든가 이런 설정이 추가로 있었어야했다 한마디로 생각이 ...,4
472,소문난 잔치에 먹을게 없다 마무리를 신파컨셉으로 잡아 욕을좀 덜 먹는거지  초반은 진짜 참을 수가 없게 못만들었다 배우들한테 사과해야 함 이걸 돈주고 보다니 어이가없다 ,2
473,"코미디도 완성도 있게 만들 수 있는데.. 관람객 수준을 무시한 수준의 연출. 쥐어짜낸 웃음코드.. 앞에 앉은 분들 주무심. 후반에 눈물나는데, 이 영화를 보고 눈물 흘렸다는 사실이 분할 정도. 그냥 소재자체가 슬픈거...",4
474,유치함의 결정체..높은 관객수준에 한참 모자람.. ,2
475,음.... 그냥 그랬어요 ,6
476,으~~ 억지감동ㅜㅜ 기대가컸나봐요 ,2
477,코미디인줄 알고 봤다가 감동과 더불어 눈물도 많이 흘렸네요.. ,10
478,억지스러운 면이 좀 있다. 차승원의 간만에 코메디영화 그 뿐... ,4
479,별점 많은 평점 믿지 마세요..엄청 웃고 울고 했단말 믿지 마세요..전부 알바임..일단 나만 당할수 없으니 가서 보시고 판단 하시길 ,1
480,관객수봐 ㅋㅋㅋㅋ 망했네~ ,1
481,요새 한국영화 엄복동이랑 대적할려고 일부러 이러나??? ,1
482,"어머니 모시고 보는 관계로 타짜, 나쁜 녀석들 거르고 봤는데 돈, 시간 뭐 그런 것들의 소중함을 일깨워준 영화다 차라리 이시간에 어머니랑 막걸리나 한 잔 할 것을...뚝뚝 끊기고, 억지로 눈물 쥐어짜고, 설정도 코메...",1
483,제가 이런거 남긴적 없는데....추석때 장인장모 모시고 갔다가 너무 죄송해서 올립니다....2시간 부모님과 드라이브하고 맛있는거 챙겨 드릴걸...너무 죄송합니다... ,1
484,"제대로 시간낭비 돈낭비했습니다. 혼자갔음 절대 안 볼 영화였는데 가족끼리 가서 할 수 없이 봤어요ㅠ 누구라도 예측 가능할 것 같은 전개, 초반부 개그+후반부 억지 울음 감동 끌어내려는 것까지 아주 전형적인 한국영화였...",1
485,어이 읍네 짜마추기식 어이없는 소방찬양 시나리오웃으려 하다가도 짜증이 나네 ,1
486,감독 실망했음.초반에는 솔직히 B급 영화? 근데 심지어 웃기지도 않음.그러나 후반부에 많은 관객들이 거의 울었음. 세월호만큼 대구지하철 사건은 대구시민에게 상당히 아픈 기억인데 갑자기 나와서 이소재로 제작할거면 좀 ...,4
487,차승원 보러왔다가  노잼을 얻고감 두번은 못볼영화... 집에서 귀신이산다  더볼걸... ,3
488,"싸구려 신파극의 정석, 유치 끝판왕 ",1
489,배우 연기력은 좋으나 스토리가 망. ,1
490,진부한 신파 틀에박힌 코미디이번 엑시트의 성공을보고 배운게 없는걸까... ,5
491,"딴 건 모르겠고, 음주운전이 별 거 아닌 것처럼 나온 서브 스토리에 어이가 없었다. ",6
492,이유있는 코미디알고 우는 신파 ,9
493,초반엔 쫌 그런데 뒤에서 소름과 감동이 ,10
494,잼있음 기대이상입니다 ,10
495,추석 온가족이 보기 딱인 영화 ,10
496,훈훈한 영화.악역에서만 본 박해준 배우에 또 다른 모습을 봐서좋았습니다 ,7
497,가끔 웃음도 나고 눈물도 나는데 지루하고 재미없어요 ,4
498,중간에 보다가 나왔어요..죄송해요 너무 유치했습니다 못볼정도로.. ,1
499,믿고 거르는 이계벽... ,1
500,보는내내 지루해 혼났씀 ,1
501,이십분정도보다가 뛰쳐나왓음 영화보다가 재미없어서 나온건 처음..;; 아내돈.. 치킨시켜먹을껄 ,1
502,지나친 억지 코믹 연기와 대구 지하철 사건의 실화와 상관없는 감동 포인트. 가족 영화라도 구성과 연출이 좀더 고급스러워 졌으면 좋겠습니다 ㅜㅜ ,4
503,말 그대로 예측대로만 흘러가는 영화. 억지 웃음 포인트에 신파까지.. 시간 낭비였습니다.. ,1
504,장난하나ㅡㅡ영화보다가 나옴 발로 만든 영화차승원 배우님 의리로 찍으신건가요...믿고 본건데.... ,1
505,영화의 개연성이 부족하고 억지웃음을 유도하는 영화 너무 판에 박힌 영화의 흐름으로  솔직히 굉장히 실망했던 영화. 알바들 너무써서 객관적 평가를 뭍는것같은데.. 넷플릭스나 vod가 떠도 다시 보지않을 영화였다. ,1
506,엄복동 저리비켜 ~! 이젠 리복동이다 ,1
507,꽁짜로 친구랑 둘이서 봤는데도 아까웠던 영화.진심 시간이 너무 아까웠습니다.백혈병 아이가 눈물도 물건 얻어내는 장면은 뭐하러 넣은 건지.감독이 뇌가 있는건지 의심스러웠습니다.결말 뻔히 보이고 웃음코드가 90년대라고 ...,1
508,평점에속았습니다.. 7번방 선물 어설프게 따라했는데 내용은없고 슬픈것들로 눈물짜내는 감동.. 정말 최악 ,2
509,"이거 재미있단 애들은 집에서 뽀로로,파워레인저 보는 애들이니??? ",2
510,진짜로....보지마시길....최악... ,1
511,가족힘들게 모여서 의미있는시간좀 보내려갓다가  한시간 보고 나왓어요 차승원씨도 서운 대본은 읽어보고 선택 한건지?아님 추석이고  하니 기본은 하겟지? 아무튼  고등학교졸업 발표회작품도 이정돈 아닐듯 ㅜ ,1
512,울어라 울어라 이래도 안울어 대구지하철참사를 이리 다루다니좋은 소재를 ㅠㅠ ,2
513,속았다... 평점 만큼은 아닌듯 ,7
514,진짜 댓글알바들 너무하네요이런 스토리로..이런 연기력으로..즐거운 추석명절을 다망쳐놓다니..이건 사기입니다2차피해 막읍시다 ,1
515,가족끼리 볼게 너무 없어서 봤는데 정말 한숨만 나옵니다. 영화 보는 내내 이런영화가 돈을 버니 한국 영화가 발전하지 못한다는 생각만 들더군요. 연출도 안좋고 스토리 전개는 모두 뜬금 없으며 대구 지하철 사건 엮는거에...,1
516,염력을 능가하는... ,1
517,"진짜 보는내내 스토리라인, 개그코드, 죄다 촌스럽고 유치해서 짜증만 났음. 별 반개도 아까움. ",1
518,천만가즈아~~~~! ,10
519,내가 본 영화 중 가장 재미없는 전반부. 후반부는 슬픔. 놀라운 영화평. ,2
520,더도 말고 덜도 말고 딱 명절 특선 영화. ,9
521,내가 웬만하면 영화보다가 안자는데 개운하게 자고 나왔다.. 이거 보느니 7번방의 선물 0.5배속으로 다시보는게 더 재밌음.. 차승원 바보 연기부터 숨 막혀서 호흡 곤란 증세 올 것 같음 ,1
522,2시간짜리 농심이랑 라이온스 광고 ,1
523,단순한 코미디인줄알고 봤는데 이런 감동영화 정말 오랜만... 연기력도 모두 쵝오! ,10
524,평점낮은것들도 많던데 전 너무슬프고 감동적이였어요.. 대한민국사람이라면 봐야할 영화라고 생각듭니다 ,10
525,차승원 바보연기하지마라 너무억지스럽고..못한당... 그리고영화가..너무웃길려고애쓰는데 난안웃김..좀유치함.. ,2
526,뻔또속.. 추석영화인데도 100만...중간에 이승엽나올때 웃김 ,6
527,"초반에 너무 지루했다. 대구 지하철 참사 뜬금포에 악질경찰 세월호 뜬금포와 올해의 쌍두마차였다. 흥행의 3요소 웃음, 감동 , 휴머니즘을 어떻게든 짜맞추려는 연출이 졸작으로 밖에 안보인다. 차승원의 어눌한 바보연기가...",4
528,솔직히 만원 내면서 보기는 좀... ,6
529,"억지 눈물  차승원  ,연기만  굿굿 ",2
530,큰기대 안하고 봤는데 너무나 큰 감동을받았어요 ,10
531,이 영화는 코메디 영화가 아니다.누군가의 인생영화가 될만큼 수작이다허나 흥행을 위해이 영화 주제와 어울리지 않는1. 영화제목2. 영화포스터3. 영화예고편 을 만든듯 하다.이것이 많은 이들에게 오해를 불러일으킨듯 하고...,10
532,대구 지하철 참사 배경인 영화라 그런지 더 뭉클했네요 ,10
533,생각보다 잼있어요 추천요 ,8
534,야구선수 어떤사람 인성을 좋게만들어주셨넼ㅋㅋ ,1
535,소방관에 대해서 많은 생각을 하게 되었습닌다. 좋은 영화 감사합니다. ,10
536,벌집핏자 광고 아니었나요? ,1
537,보다 나왔음 나중에 감동이 있건 어쩌건 30분을 넘긴 내가 용하다 시간 돈 아깝다 ,1
538,"중간 중간 밑밥을 던지고 후반부에 하나씩 잘끼워맞추는 전체적인 아이디어는 참 좋았으나, 유치와 개그의 비중 조절이 좀 아쉽고, 흐름이 자연스레 연결이 안되고 끊기어 웃을려다 감동받을려다 마는 느낌 ",5
539,요즘 네이버 평점 ㄹㅇ 못믿겠음차승원 바보연기는 ㄹㅇ 개잘함근데 너무 억지웃음 끼워둔듯이번 추석 영화 다꽝임 ,4
540,"너무 너무 재밌고, 가슴 먹먹하고, 너무 너무 가슴 따뜻해 지는 좋은 영화였습니다.좋은 영화 감사합니다 ",10
541,아이들이 넘좋아하네요 강추합니다 ,8
542,재밌었어요배우 연기력이 좋아씀 ,6
543,장난하냐 ㅋㅋㅋㅋ어제 구글로해서 티비로 봤는데 개노잼이엿는데 ㅋㅋㅋㅋ머 영화가 없던데 ㅋㅋ승원이형 억지 코믹.이런컨셉 코믹은 안되요 형은 통통튀는코믹을 해야해요..올해들어 제일 노잼인 영화로 생각들꺼같음요... ,1
544,3점 줄라했는데 평점이 8.5나 되길래 1점 준다 ,1
545,댓글 알바들 영혼없이 쓴 칭찬글보면서 웃고 거릅니다ㅋ ,2
546,"차승원씨는 시나리오, 상대배우, 조연등등 배우로써의 안목이 아직 좀 모자란것 같다 ",2
547,먼가 조금 부족한듯... ,8
548,차승원은 차승원이였다 ,10
549,"감동,재미 둘 다 잡은 영화 ",10
550,넘나 재미있고 눈물나고...웃다울다 시간순삭이었어요 ,10
551,볼만함 공백10자 ㅎㅎ ,8
552,훈훈하다 ㅠ 가족 영화답네 ,10
553,코믹 영화인 줄 알고 봤는데 웃음 타율은 매우 낮았고.. 마지막 대구 참사 사건 손바닥자국 디테일에만 조금 놀랐음.. 내일이 추석 연휴라 기분이 좋아서 그냥 저냥 즐겁게 보려고 노력한 영화. ,5
554,인생역대급 쓰레기 영화 ㅋㅋ마지막부분에 조폭이 길터는거 보면기가찬다 기가차 ㅋㅋ그리고 어이가없어서 웃기다 ㅋㅋ 이거평점댓글이 영화보다더재밌다 ㅋㅋ절대보지마라ㅋㅋ 이거볼빠에 그냥 똑같은 재밌는영화다시본다 ㅋㅋ ,1
555,한마디로 재미없음 보는내내 지루했고 후반부에 약간읙 감동은 있지만 눈물흘릴만큼은아님 돈주고 보기아까운영화임 ,5
556,댓글들 알바입니다... ,5
557,내가 영화만들어도 이보단... ,1
558,힘을내요~슈퍼파월~ ,1
559,재밋어요!!감동영화 가족들이랑 보기 좋을거같애여 ,10
560,재미 감동 눈물 다잡으려다가 정말 하나도 못잡음 캐스팅은 잘했다 ,2
561,50분정도 정말재미없구 후반40분 감동 눈물 ,4
562,코믹으로 생각했는데~감동의 눈물이 절로 나오네요~^^강추 ,10
563,"지적 장애인은 웃음거리, 소아암환자는 동정거리, 사회적 참사는 눈물거리밖에 되지 않는 굉장히 실망스러운 영화 ",1
564,웃긴연기는 참 잘하는 차승원인데 바보캐릭은 안맞는 옷이네요 정말 미스캐스팅... 한국영화 잘 공감되면서 많이 우는 난데 이 영화보고는 단1도 공감이 안되 눈물 한방울 안흘림 대구 지하철 참사를 가져와서 억지울음을 유...,1
565,개노잼 이 세글자로 다 표현됨 ,1
566,손익분기점 200만인데 결국 또 망하는 차승원! ,1
567,사람들이  무식하게 보여 아쉬웠다 ,2
568,대구지하철참사인 소재를 감안해서 드리는 3점입니다.. 정말 후반 30분을 위해서 1시간 넘게 너무 힘들었습니다. 너무너무 힘들었어요. 부모님이랑 같이 봐서 꾹 참고 나가지 않고 봤습니다. 마지막이 감동이긴해도 너무해...,3
569,후반부에 찡한 감동은 있으나 전반적으로 억지개그 지루했습니다 ,2
570,알바님들아 너무 티납니다 영화 개봉 첫날에 평점 9.1이드만 지금은 8.5네요 ㅋㅋㅋ 영화 보고 나서 평점 다세요 ,1
571,너무 감동적... 하품하다가 눈물 한번 흘림... ,1
572,진심영화란영화는다보는데...이렇게중간에 나오구싶은영화는 처음이였음ㅜㅜ차승원때문에봄 ,2
573,억지 감동 코드.. 나의 영화 눈높이가 높은건가 ㅠ ,4
574,진짜 감동이랑 웃음 2가지 다가진 영화였습니다 ,10
575,가족끼리 재밌게 봤어용 ,8
576,이런거 안쓰는데 진짜 돈 안주고보기도 아깝다. 진짜 너무재미없다 ,1
577,영화를 보면서 계속 물음표만 나던데 역시나... ,3
578,제발...보지마..보지마!!!! ,1
