,Review,Rank
772,사람들이 꼭 봤으면 좋겠는 영화 ... 너무 감동적이고 스토리도 대박입니다 ㅠㅠ ,10
773,생각  없이 보다가 대구 지하철사고 시작부터 온몸의 소름과 가슴 한편에 있던 슬픔이 마구 올라왔다... ,10
774,큰 사고가터지고 1년 2년이 흐르고나면 남들은 다 잊지만 당사자는 끌어안고 살아요.온몸에 가슴속에 내상으로.아무도 모르고 잊어버리는 일을 꺼내어줘서 우리가 같은 공간에서 살고 있다는 사실을 잊지 않게 됩니다감사합ㄴ;...,10
775,차승원 연기 대박... ,10
776,너무 재밌었다 슬프고 감동적 ,10
777,아씨ㅠ 코미딘줄 알았는디 펑펑 울엇네 ,10
778,연기자분들이 다연기를넘잘하셔서 울다가웃다가 ..하다보니 끝났네요~~~  스토리도넘 감동적입니다ㅜㅜ ,10
779,시사회때 보고 한 번 더 봤는데도 재밌네요. 당시 크게 흥행하지는 않아 아쉽네용. 스토리도 나름 탄탄하고 실화 바탕이라 울면서 봤습니다. 가족끼리 보기에 정말 딱 좋은 영화입니다! ,10
780,재미와 감동의 조화실제이야기도 포함되어 있어서 더 감동적 ,10
781,차승원이 날 웃게만 하더니..울게도 만드네.. ,10
782,아 너무슬프다ㅜㅜ 차승원연기랑딸역할아이연기ㅜ ,10
783,편하게 보다가 엄청 울었음요ㅜㅜ ,10
784,최고~최근 몇년동안 자극적인 소재로만 물들어있던 영화계에한줄기 산소같은 영화. 지루하지도 않고 코믹하면서도 휴머니즘이 녹아있고 주연부터 조연까지 모두의 명품 연기로 만들어진 명품 영화 적극 추천합니다 몇년중에 제일 ...,10
785,평점이 좋아서 봤는데 마지막이 너무 감동적이네요. 재미있게 잘 봤습니다^^ ,10
786,차승원의 연기는 믿고보는것이다...너무 감동임...울컥한영화는 10년넘게동안 없었는데 이영화보고 울컥함.. ,10
787,대구지하철참사 잊지않을게요... ,10
788,아ㅡ아침부터 펑펑 울었네요ㅡ따뜻한 코미디 너무 좋았어요ㅡ크리스마스같은 영화예요 ,10
789,코미디인줄알고 보다가 엉엉움 ,10
790,솔직히 별로 기대안하고 보고 그냥 코미디로 가볍게 보자 해서 본건데 완전 명작이네요ㅠㅠㅠ 코미디랑 감동 대박이에요ㅠㅠ 너무 슬퍼요 진짜ㅠㅠㅠ 꼭꼭 추천합니다ㅠ ,10
791,배우들의 연기에 감탄했습니다. 개봉했을때 영화관에서 볼걸 이제야 봤어요.. ,10
792,너무 웃기다가 너무 슬프다가 너무 감동적이네..뭔 영화가 다 해먹냐..ㅜㅜ차줌마 좋아서 찾아보다 보게 된 어쩌다 만난 명작이네요. ,10
793,딸둘이랑 같이봤는데.애들이재밌다고~.후반부너무울었네요.감동입니다~~ ,10
794,7번 방의 선물보다 관객은 열배 적지만 재미와 감동 연기는 천배정도 더하다 ,8
795,가볍게 웃긴 영화인줄 알고 집에서 봤다가. 한 방 묵직함을 주는 영화네요.  추모의 방법이 어찌되었든 깊이나 방법이 중요한 것이 아니라 대한민국에서 일어난 비극적인 사건에 우리 국민이 함께 아파하고 기억해 줄 수 있...,10
796,진짜 연기도 그렇게 내용도 너무 인상 깊었어요.아까 넷플릭스에서 보고 온 길인데 진짜 계속 울었어요 ㅠㅠ 소방관님들 진짜 사랑합니다 ㅠㅠ 그리고 백혈병 어린이들 힘내자ㅠㅠ 내가 다 슬프네..이 영화 진짜 제 인생작품...,10
797,한때는 강인하고 용감했던 소방관. 그래도 여전히 딸에게는 사랑하는 아빠. 실제 있었던 참사라 더 슬펐던 영화. 잊고 있었지만 아직도 상처가 아물지 않은 분들을 생각하니 눈물이 납니다. ,10
798,평점 처음쓰는데 진짜 연기를 너무 잘하고 감동입니다 ,10
799,보는내내 감동적이었고 많은생각이드는영화였어요 너무잘봤어요 ,10
800,코믹과 감동 두마리토끼 다잡았네요 ,10
801,가볍게 보다가 진지하게 보고 마지막에 감동.평론가 평이 맘에 안드네.. ,10
802,뒤늦게 보고 눈물 흘렸네요ㅠㅠ다시는 이런일이 없었으면 좋겠습니다 ,10
803,너무 감동스럽고 소방관님들감사합니다 ,10
804,웃다 울다 넘 재밌게 봤네요 ,10
805,중간까지는 웃으면서봤는데중간후반부터 끝까지울었어요 ㅠㅠ ,10
806,귀엽게 웃겨버린 미스터리 ,9
807,좋은 영화 감동 100배 ,10
808,너무 재미있게 봤습니다! 평점이 왜 안좋은지 잘 모르겠지만 엄마랑 같이 웃고 울면서 봤어요 대구지하철참사 얘기가 나오는지 모르고 보다가 눈물샘 터졌네요 ㅠ ,10
809,개감동과 개재미 둘다 잡은 영화 ,10
810,웃기다가 막판 눈물콧물 펑펑 그러다 마지막 오분 흐뭇함 소방관님 늘 감사합니다감정은 개인차이나 저는 즐겁게 또 감동적으로 봤습니다. ,10
811,감동도 있고 좋아요~~ ,10
812,모든 소방대원님 분들을 응원합니다 ,10
813,정말 좋은영화입니다. 우리나라사람이라면 한번쯤 꼭 봤으면 하네요.. ,10
814,슬픈 기억. 다시는 반복되지 않았으면 하는 사건. 차승원 연기 잘하네요. ,10
815,모두 연기잘하는 배우들 차승원에 오랜만에 보는 코믹연기에 감동스런 아가같이 울고 같이 웃은 영화네요 다들 행복해요 ,9
816,몇년동안 이렇게 울어본적 없습니다. 내 상황이 그래서 인지 더더욱 와닿네요 ,10
817,웃다가 울다가 감동적이었네요.. 영상미도 굿~^^  간만에 힐링했어요. ,10
818,슬픈 현실을 조심스럽게 코미디 요소로 감싼 영화예요. 배우들 연기가 탄탄하니 부족한 부분들이 꽉 채워지네요. ,10
819, ㅠㅠㅠㅠ 우는 거 참느라 혼났습니다 ,10
820,그냥 꼭 보세요 진짜 이렇게 엉엉 운 적은 처음이네요 배우들 다 연기 너무 잘하고 스토리 넘 대박... 아직도 못 헤어나오는 중 ,10
821,"초중반 개재밌어, 극 후반 개 감동.. ",10
822,생각지도않게 대박 영화네요 ㅎㅎ ,10
823,재미있게잘봤어요 아역들연기도너무좋아요^^ ,10
824,진짜 리뷰를 한번도 남겨보지 않은 사람이예요!! 처음으로 남기는 이유는!! 진짜 감동적이면서 웃기면서ㅜㅜ진짜 스토리가 너무 좋아요ㅜㅜ ,10
825,세월호만 기억하라 세뇌하지말고 대구지하철 삼풍백화점부터 기억해라 어떤건 잊어도되고 어떤건 리본까지 만들어서 기억해야하나 ,10
826,너무 잘봤습니다^^ ,10
827,"사실 영화 평점따위에는 전혀 신경을 쓰지 않는 1인임.내가 보고 싶음 보고 보고싶지 않음 안보면 그만,평점이 높던 낮던 상관안하는...그런데 이영화를 보고서는 초반에 아... 평점 낮겠다 싶었는데...뭐... 그냥....",8
828,상당히 작위적이지만 나름 웃음과 감동이 있음. 바보 아빠와 아픈 아이가 나오는 영화는 무조건 슬픔.이 바보 아빠는 어쩔 때는 말을 잘 하다가 갑자기 심하게 어버버 거리는 게 이상함. ,6
829,영화는 좋았습니다.다만 소방시설이 정상적으로 되어 있는데 소방시설이 제대로 되지 않아 피난인명이 피해가 난것처럼 나온 장면은 조금 실망적입니다(01:19:28)방화셔터는 내려가더라도옆에 사람이 대피하게 피난문이있습니...,10
830,이런영화를 영화관에서 안본걸 후회합니다 ,10
831,재미잇엇요 두번봐도 꿀잼 차승원 짱 ,10
832,대작까지는 아니지만 차승원 특유의 코믹과 감동이 있다 재밌게 봤음 ,10
833,나 재미잇네요 시간가는줄 모르겠어요 ,10
834,힐링 영화착한 영화차승원 코믹 연기 굿아역 배우 귀여워요 ,9
835,감동 마니주네요.새벽에 혼자 보면서 마니 웁니다.차승원  소방관 옷 입은거 보고 대구지하철참사 생각이 나면서  소름이 돋았습니다.정말로 다시는 일어나서는  안될일이며 잊고잇엇는데  다시  상기시켜 주네요.요근래 본 ...,10
836,대구 지하철사건 다시한번 생각나네요. 소방관님님을 힘내시고 차승원 연기 좋았습니다 ,9
837,아무 기대없이 봤는데 차승원 특유의 코믹 연기와 아역 배우 연기가 정말 인상적이었어요웃기다가 슬프다가 간만에 좋은 영화봤네요 ,10
838,영화감상평 처음남겨보네요대구에 살지는 않지만 그때이야기 마지막남긴문자들을 보며 그때생각이나 울컥하네요아들들데리고 가벼운맘으로 봤다가 혼자 울고나왔네요 40대 남자입니다 대구참사이야기입니다  코믹영화로 생각하고 가시면...,10
839,이승엽이는 아니쥐 ㅡㅡ ,2
840,와...진짜 억지웃음 오지는 핵노잼 영화 ,1
841,웃기고 울리고 다했숩니다강추!!!! ,10
842,진한 감동과 코믹에오랜 만에 웃고 울었네요 ,10
843,대구사람으로써 대구 지하철참사 일어나기 바로전날 지하철탔었는데...참 슬픈사건이었습니다 xx호처럼 지하철참사는 보상도 제대로 못받고 유족들만 많이 아팠죠 영화는 그냥저냥 볼만한데 감독님께서 너무  많이 표현을 하실려...,5
844,한 달치 눈물 다 흘림.. ,9
845,"스토리가 참 좋았다. 바보가 되어버린 히어로와 허약한 똑순이.잘 나가다 저리가라 2샛ㄱ1야 이x엽이 나오서부터 엉망 진창,대구지하철 참사를 끼워넣고 억지스런 진행에서 점수가... ",6
846,시간 가는 줄 알고 봤어요. ,4
847,코믹과 감동 두마리 토끼를 다 잡았다.. 영화관에서 다 같이 훌쩍거린 듯 ,10
848,가족끼리 즐겁게 볼 수 있는 영화입니다 ,8
849,가슴 따듯한 영화네요 지난사고 희생자와 구조요원들을 다시 뒤돌아볼수 있는 감동있는 영화네요 ,10
850,삼가 고인의 명목을 빕니다 ,10
851,웃음 뒤 눈물.  공식은 정확했으나 너무 정확해서 탈. ,6
852,첨엔 그냥 나갈려다  중반부 부터 집중 후반부 눈물 ,8
853,재밌는 영화는 아니예요. 아마 평점 낮게 주신분들은 코메디만 생각하고 보셔서 그런거 같아요. 아픈 아이의 감정선에서 영화를 보니 눈물 범벅으로 영화관 나왔습니다. ,10
854,감동적이고 재미있었어요ㅎㅎ ,10
855,너무 나도 슬픈 영화 맘이 이픕니다 ,10
856,마음이 따뜻해지는 영화네요. 차승원 연기는 항상 좋네요. ,10
857,이런 영화 넘 좋아요~~따뜻감동 ,10
858,재미와감동이 함께한 영화 ,10
859,웃긴건 별로 없었는데 왠지 모르게 몇년만에 영화보면서 눈물흘리네유 ,10
860,대구참사는 정말 가슴아팠던 사건이였죠.이렇게 다시금 떠올릴수 있게하는 영화는 좋은것 같습니다.하지만 조금 감동이나 웃음 포인트가 억지스러웠던것 같아 아쉬웠습니다.출연배우들은 다 좋아하는 배우라서 좋았습니다! ,7
861,이거 왜 망한거냐 볼만한데 최소 300만짜린데 ,10
862,생각없이 보다가 눈물콧물 다 뺐다요 ㅠ ,10
863,"흐르는 눈물을 주체할 수 없었습니다. 대구 사람들의 아픈 마음을 깊이 어루만져주는, 진짜 대구 영화. 만들어주셔서, 진심으로 감사합니다. ",10
864,이영환 홍보가 잘못됐다.세상에나 코메디라니 난 실컷 울었네 ,10
865,"왜 이영화가 묻혔지? 싶을만큼정말 감동적으로 봤어요뭐.. 흠잡고싶지 않은영화내요가족극이라 망설이시는분들,보세요억지 울음없는 가족극이네요 ",10
866,무한감동 네이버 평점 처음써요 ,10
867,대구 지하철 화재사고 얘기인가요 ?슬프게봤습니다 ,7
868,재미있고 감동이 있어 좋았음 ,8
869,정말 감동적이고 재미있었습니다  믿고보는 차승원. ,10
870,스토리가 재밌어요 아이와 함께 재밌게 봤습니다 ,10
871,재밌게 잘 봤어요. ,8
872,계연성 없는 스토리와 억지 코믹 억지 감동 억지 눈물. ,1
873,카드값은? 그리고 휴유증장애라면서 찾아온 사람들도 많더만 치료도 못해주나? 스토리가 왜 중간에 끊기고 억지웃음 작렬하게 만든 영화 ,1
874,진정 기생충이랑 같은 년도에 나온 영화? ,2
875,저의 아이는 발달이 많이 느립니다 항상 힘들고 괴로웠습니다 영화가 많이 힘이되네요 여러분 아프고 장애가 있는 사람들을 위해 기도해주세요 좋은 영화 감사합니다 ,10
876,"소아암 환아 가족으로써 공감되는 부분들이많았어요 아무거나 못먹어서 과자만 먹고, 식당에서 수저를 뜨거운물에 담궈놓고, 버스 의자를 소독하고 등등 다른 분들은 공감하기 어렵겠지만 사소한 하나하나 까지 디테일한 부분에 ...",10
877,최근 본 한국영화중에 제일 짜임새있었다.정말재밌다.묻혀서너무너무아쉬운영화 ,10
878,감동적이고 실화가 바탕인 영화여서 다시한번더 기억될수 있어 좋았습니다 ,8
879,어따대구? 이래도대구 안그래도대구 ㅉ ,4
880,"아 너무 울었어요 감동,,이 감동적인 영화를 보고 댓글에 알바니 뭐니 하는 사람들은 감정공감이 떨어지는  사람들인거 같음;솔직히 그렇게 코믹은 아니지만 감명깊게 봤어요 .갓승원,,♥ ",10
881,소재랑 스토리는 흔하지만..배우들 연기는 좋다. ,8
882,재미없을줄알고 기대 안하고 가족끼리 갔는데 다들 울고나옴.차승원 연기 어색하다고 생각했는데 생각외로 연기 너무 잘함...(바보연기는 못할줄 알았지)집에와서 치즈광고보는데 정상적인 차승원이 더 어색하더라.바보가 너무 ...,8
883,나만 당할 수 없다. 10점 드립니다.꼭 보시길 바랍니다. ,10
884,타짜3나 나쁜녀석들 보다는 볼만했다... ,6
885,울긴했는데...약간 억지스럽고 대사와  연기력들이  물과 기름처럼  뜨네여 ㅠㅠ ,6
886,ㅜㅜ눈물이....꼭보세여 ,10
887,차승원배우님의 연기가 진짜ㅜㅜ ,10
888,부모님과 잘 봤습니다ㅎㅎ 코믹하면서도 슬프고 감동적인 영화였어요ㅎㅎ ,10
889,무슨 내용인지 모르고 가족영화로 보러 갔는데 저는 보는 내내 울고 웃고 했구요 끝난후 남편은 재밌네 라고 했고 중딩 딸은 코미디인줄 알았는데... 코미디 아니어도 감동이긴 하네라고 하대요. 저는 지금도 영화 생각하면...,10
890,멋진  남자배우는  코믹연기도 잘 소화해 낸다는걸알았습니다  영화보고  힘내고  갑니다  ㅎㅎ ,10
891,너무재밌어요 !! 이번 추석 영화로 강추 ,10
892,웃음 눈물 최고인 영화 차승원 배우 너무좋아요 ~~ ,10
893,가족끼리 보기에 좋습니다!!! ,10
894,웃음+감동 완전짱이네요 ,10
895,많이 웃었지만 그보다 더 많이 울었어요. 감동~!! ,10
896,코미디보단 가족드라마같은 잔잔하고 감동도 있는 영화네요~ 실컷 웃을까 했는데 눈물이 나는 영화였어요그래도 좋았어요 ,8
897,코미디인줄 알고 봤다가 눈물 콧물 쏙뺌 ,9
898,재미있고 감동적이었습니다. ,10
899,차승원 연기는 믿고봅니다!!! 아역들도 연기 너무 잘해서 눈물 펑펑 쏟고 왔네요 ,10
900,재밌고 감동적이고 너무 좋은 영화 ,10
901,진짜 감동적이에요... 이런 영화 만들어주셔서 감사합니다. ,10
902,좋아요 백만개 아니 백개^^ ,10
903,정말재미있어요!!! ,10
904,차승원영화여서봤는데 너무슬펐다ㅠㅜ대구지하철참사에 아픈애기까지..코미디영화아니고슬픈영화였다ㅜㅠ애기연기너무잘하고 차승원말할것도없고ㅜㅜ막되먹은코미디아닌 수준있는코미디 ,10
905,이딴걸 20OOO도에 만들다니....대구 지하철 참사같은 비극을 이딴 영화에 이런식으로 써먹었다는게 어이가 없네요. 이건 아닙니다 감독님. ,1
906,세상에서 가장 아름다운 100개.. ,10
907,재미없는것같은데요 조폭풀어서 애찾는장면까지보다가관뒀음..차승원역할도안어울리고 재미도없고 걍꺼버렸음 ,2
908,평점 2점 이상 남긴 시람 다 패고싶다 ,1
909,대구지하철... 때 친구를 잃었던 사람입니다. 그 친구에게 이 별점을 보냅니다. 보고싶다. 정우야. ㅠㅠ ,10
910,한국영화에서 이런스토리는 이제 안했으면 좋겟다 아프지만 영리한 애와 덩치크지만 어리숙한 마초아빠 눈물샘자극 뻔한스토리 작년에도 이런비슷한거 몇개 하더만ㅉㅉ 솔까 과장도 심하고 ,3
911,차승원이 미국국적이고 할리우드에서 활동했으면 세계적인 배우가 되었을텐데 아쉽다.. ,4
912,영화 소재 너무 좋다 많은사람들이 봤으면.. ,10
913,코미디라고 해서 봤는데넘 감동적인 장면이 많이 나와 계속 울었어요 ~너무 감명깊어어요~ ,10
914,"뻔한 감동 유발이라고는 하지만 울지 않을 수 없는 소재. 다시 한 번 지난 참사를 상기하며 슬퍼하고, 항상 수고하시는 소방관 분들께 감사하게 된다. 머리 쓰지 않고, 힘들이지 않고, 가볍고 재밌게 명절에 보기 딱 좋...",8
915,이런거잘안쓰는데진짜재밌다 ,10
916,연기들이 살아있네~^^ ,10
917,"이유없이 잔인하시만 한 타짜에 실망한 마음 달래주는 잔잔하고 따뜻한 영화, 차승원 멋있다 추석에는 가족과 이런 영화를 봐야지요 ",10
918,큰기대를 하고보면 후회할것이요..친지와 가볍게 보자하면 괜찮은 영화..이미 럭키본분들 우리나라에서 세얼간이 수준을 찾는건 아니자나요.. ,7
919,저는 개인적으로 무척 마음에 드는 영화였습니다. 표현하고싶은 것들도 많지만 표현을 어떻게 써야할지  어렵네요. 한번 꼭 봐도 괜찮다고 생각이 듭니다. ,10
920,초반엔 좀 유치한듯했지만 점점 더 재밌어지기 위한 서론이 필요했던 것. 웃다 울다 무한반복. 믿고보는 차승원님. 보고나니 기분좋아졌어요!! 가족 영화로도 강추 ,10
921,엄청난 영화는 아니였지만 좋은 가족영화는 맞아요~ ,10
922,할머니와 엄마와 셋이서 봤는데 너무 훈훈하고 웃기며 감동적이었어요. 진짜 훈훈한 영화. 강추합니다 ,10
923,지금 가족들과 보고왔어요.딱 차승원 스타일영화.저는 차배우를 좋아해서 재밌게봤습니다.마지막 대구 지하철에서는 눈물이..ㅜㅜ어르신들도 많이보시고 욕 난무하는 영화들보단좋았습니다 ,8
924,눈물 콧물 하 이렇게 슬퍼도 되냐 ,10
925,재미도 있고 감동도 있고 !!! ,8
926,개봉영화중에 제일 나은듯 ,10
927,엄청 재밌고 슬프고 감동적이에요 ,10
928,헐뜯고 끌어내리려는 요즘 세상에 한줄기 피어난 새싹 하나 ,10
929,오래만에 감동받은 영화를 봄 ,10
930,사랑과 삶에 대해 새롭게 생각하게 된 영화입니다..메말랐던 제 마음을 다시금 힐링하게 해주었네요...추천합니다♡ ,10
931,기대이상으로 재미있어요 감동적ㅠㅠ ,10
932,이제 이런영화좀 그만 만들자... ,1
933,이거 진짜 럭키 찍은 감독맞음???? ,1
934,내용을 떠나 영화를 너무 못만들었다. 억지로 짜맞춘느낌. ,1
935,이승X명언 : 저리가라 이색히야 ,1
936,너무했다 이건.. 알바평점에 당할줄이야... ,1
937,평점조절. 정말 별로입니다 ,1
938,감독 배우 작가 모두   삼류영화... ,1
939,반응이 극과 극이네 ㅎ억지웃음 유발. 유치함. ,1
940,왜 관객수가 적은지 이해 못하겠음; ,10
941,차승원.   컬투 나왓을때부터. 알아봣음... ,2
942,코미디라고 하기엔 별로 웃기지 않았구 후반부엔 눈물나와요 감동스토링~ 글케재밋진않어요 평점이 넘 높은둣 ,6
943,나쁜 녀석들 더 무비를 볼꺼면 이걸 보세요.재밌습니다. ,8
944,"오랜만에 건전하고 편한 영화 나중엔 차승원이 정말 그랬던 사람인것처럼 느껴질정도로 몰입하게 되네요, 혹시 폭력물 지겨우신분 추천해드립니다 오랜만에 눈물한번 흘렸습니다 ",10
945,엠뷸런스 나오는 장면에서 끝냈어야했다 ,6
946,넘감동적이었어요 정말 좋았어요 ,10
947,차승원씨 연기 정말 훌륭합니다 ,10
948,너무 감동적인 영화 ㅠ.ㅠ ,10
949,많은 분들이 보셨으면 좋겠어요. 꼭 봐주세요! ,10
950,아ㅡ 차승원 연기 개 잘해 ,10
951,추석에 가족과 함께 보는데 싸우고 피나는것싫어서 가벼운 영화인줄알고 선택했어요그런데기대없이 예고편안보고갔다가 마음따뜻해지고왔어요 ㅎㅎ강추(대구사람이라 마음이 무겁기도) ,10
952,대구 지하철참사를 기리는 영화입니다.꼭 한번 보시길 추천합니다. ,10
953,눈물콧물 다 흘리고 온영화영화관 안에 흑흑 소리에 혼자 우는게 부끄럽지 않았네요 짱 꼭 보세요 ,10
954,가족과 함께 봐야할 영화 ,10
955,최곱니다. 그냥 보세요 ,10
956,"잔잔하면서도, 착하고 감동적이면서도 맘이 정화되는 그런 느낌였어요~~ 많이들 보시고 정화하셨으면... ",10
957,웃으러갔다가 신나게 울고왔네요 ㅠㅡㅠㅋㅋ 올만에 따뜻한 영화 한편 잘받습니다 ,10
958,진심 잼있네요~~강추요요요 ,10
959,대구 지하철 참사 희생자 명복을 빕니다 ,10
960,영화관에서볼만해요. 엄마랑갔는데 만족해하셨어요. 후반으로갈수록 더 재밌어요. ,9
961,진짜 종내 재미업네 와 영화관이었음 진짜 나왔다 휴 ,1
962,돈과 시간이 아까울 정도로 최악. 억지웃음 억지감동.너무 높은 평점에 어이없어 글남깁니다. 참고하세요. ,2
963,응 또 신파극.. 억지눈물 제발 그만좀 ,1
964,원래 영화를 좋아하는편 이라 어떤 영화를 봐도 무난 하게 보는 편인데 이번 영화는 억지로 감동을 만들려 하고 코매디 도 아니고 감동 영화도 아니고 너무나도 어중간한 영화 였습니다. 영화를 보는내내 억지 스러움에 어이...,1
965,제발 저 혼자만 낚이고 싶습니다. ,1
966,슬프면서 재미까지 잘 봤어요~ ,8
967,차승원 연기 잘하는건 알고있었지만 이정도일줄은 몰랐다. 흔해빠진 한국식 신파라는 비평가들도 있지만 오히려 그런 분위기를 즐기는 입장에서는 아직까지 여운이 남는 영화였다. 구글 무비에 올라오면 사서 소장할계획 ㅎ ,10
968,뭔가 아쉽다..뭔가.. ,5
969,차승원 연기 좋아재미있게 봤는데...왜 관객이 없냐 ,10
970,차승원 이리연기를잘하는 배우였다니...정말 좋은 영화였다... ,10
971,어제 서울대입구 롯데시네마 12층 4관에서 밤11시35분꺼 영화 봤습니다. 저는 무지 재밌게 봤습니다. 그런데 영화 재미 없다고 하는 분들도 이해갑니다. 오글거리는거 보기 힘든 분은 보지 마세요. 그리고 자기가 재미...,10
972,평점알바 ㄷㄷ해 안보길 정말 다행 ㅋㅋㅋ ,1
973,부모님이랑 보러 갔는데 초중반 정말 너무 지루했어요 . 부모님은 주무심. 중간중간 억지스러운 부분이 많았어요. 학폭당하던 여고생이 아픈 아이랑 몇 마디 했다고 뭘 깨우치고 가서 엎어버리고 했던 부분은 특히 ; 드라마...,3
974,잼있고 감동있음ㅜㅜ!!! ,10
975,안봤는데..안봐도 알거같은 ,6
976,이장과 군수는 이 영화에 비하면 마스터피스 입니다. 여러분들이 기대하는 그런 차승원식 코미디 안나옵니다. 시작하고 한시간 동안 극장안에 정적 뿐이었네요. 감독은 코미디에 대한 공부를 다시 하길..차승원도 찍으면서 이...,1
977,힘을내요 미스터 리는 무슨 이영화가 2019년에 나온 게 미스터리다 ,1
978,1점도 아까워요. 유치뽕짝. 처음부터 끝까지 한숨 나오네요. ,1
979, 알바 댓글에 속지 마세요!!! ,1
980,정말 여러가지로 별루예요ㅠ ,2
981,힘을내요 미스터리 넘잼있게 잘봤어요웃다가 울다가  감동그자체입니다. ,10
982,오랜만에 정말 재밌는영화 ,10
983,무거운 소재를 가볍게 담아냈다. 가벼워도 너무 가볍게 담아냈다.. 저때 진짜 가슴 찢어졌었는데..그래도 차승원은 백개만큼 좋아해 ,2
984,한국은 하여튼 가족 감동 신파는 기가 막히게 통한다 ,1
985,너무 재밌었고 감동적이라서 눈물이...ㅠㅠ ,10
986,가족 영화로 최고 입니다~~^^ ,10
987,웃다가 눈물콧물 다 짜내는 신파라니ㅜㅜ그 신파가 너무 좋았다!! 차승원!! 깡패구나! 감동깡패! ,9
988,어제 롯데시네마 부산본점 19시40분꺼본 실관람객이다 지금 개봉한 영화들중에 걍 맘편하게 영화 보고싶으면 이걸 보길 바람뻔한 스토리겠지만 아역배우랑 차승원이랑 케미좋다 울아부지도 편안한웃음 지으면서 집에옴 ,10
989,감동이 있는 영화입니다 ,10
990,와 알바 쩐닥. 억지 눈물 설정은 그렇다치고 영화과 졸작같은 촌스럽고 유치한 연출 뭐냐 나오고 싶었음 ,1
991,좀 지루하기도하고 작위적인 화면들이 많음. 옛날 사건 생각에 눈물이 나는것은있는데 스토리가 매우 좋다거나 아주 재미있거나 아주 감동적인건아님. 중간에 조폭 미화는 왜나오나 모르겠음.. 전반적으로 쏘쏘였음 ,6
