,Review,Rank
667,토니 그는 도덕책.. 몇수앞을 내다본 것인가 ,10
668,짱잼입니다!!!추천~ ,10
669,노잼....웹스윙은 뉴욕이 제맛 ,6
670,배급 소니픽쳐스인데 불매 운동 강요하시는 분들은 안보셨길 바랍니다. ,10
671,죄송하지만!   소니 일본영화사 입니다안봅니다 ,1
672,조금 많이 지루했어요.. ,4
673,하.. 중간에 화장실 너무 가고싶었는데 그걸 한시간넘게 참을만큼 재밌었습니다!!! 겉모습에 속지마라~~! ,10
674,너무 너무 재미있어요또 한번 볼꺼에요 ,10
675,좋았어요 역시 마블시리즈 ,10
676,니 스타크가 피터 파커를 ,10
677,톰 홀랜드  연기 너무 잘함 ,10
678,중간부분까진 지루해서.. 나가려다 말았음 ,6
679,이거 평점 왜 이렇게 높냐? 내돈주고 봤는데 10점 짜리 영화 절대 아님. 마블영화답게 액션신은 화려한데 스토리를 기대하고 보면 실망할거임. 세계 여러나라 여행다니면서 연애질하다가 악당 무찌르는게 다인 영화 솔직히 ...,4
680,일본거 불매 한다면서 소니가 제작한 영화는 엄청보네 ㅋㅋㅋ소니 한국에서 돈 많이 벌어서 좋겠다ㅋㅋ ,8
681,어딘가 엉성. 주잡스럽고 웃기지도 않은 개그. 그냥저냥 킬링타임용. ,5
682,개 돼 지 새 끼 들 ㅋㅋ불매한다면서 소니발급영화인 스파이더맨이 1위 물지못한다면 짖지도마라 . ,10
683,샘레이미의 스파이더맨을 따라가지 못한다. 평작 수준 ,6
684,다음 마블 작품을 위하여 ,10
685,아 너무 재밌었어요 피터 너무 귀여워ㅋㅋㅋ ,10
686,대박....~!!! ,10
687,피터가 쟬? 왜? 언제부터?이렇게 처음 시작으로 점점 여주한테 묘한 매력을 느끼게 돼요 ㅎ ,10
688,말이 필요없는 영화! 너무 재밌게 봤습니다. ,10
689,그닥 재밌다고는...저는 좀 지루했네요. ,6
690,그저그랬움...믿고보긴하는데 어벤져스가 너무 잘만들어서 그닥 ,8
691,스파이더맨 귀야움ㅠㅠ ,10
692,2시간 동안 눈호강 제대로 했습니다. ,10
693,3000만큼 사랑했다 ,10
694,최고의 오락성과 예상 못한 반전으로 놀라움을 자아낸 영화 ,10
695,역시 재밌음 ㅋㅋ 마블 시네마틱 유니버스는 확실히 코믹스랑은 따로 봐야할 듯 ,10
696,스파이디는 사랑입니다...! ,10
697,개인적으로 역대 스파이더맨 중 최고 ,9
698,어벤져스 이후 바로 나온 히어로물 치고는 좀 가볍게 느껴지지만 스파이더맨의 개성을 잘 살린 영화였습니다. 다음에 이어지는 스파이더맨에서는 피터파커가 좀 힘들어지겠지만.. 또 기대합니다. ,9
699,ㅜ.ㅜㅜㅜㅜ진짜 존잼 ,10
700,시리즈를 거듭할수록 허무맹랑해지는건 어쩔수 없나보다. ,6
701,"1편 떡밥 회수 안됨, 빌런이 약함, 3커플 꽁냥대는거만 재밌음, 쿠키 때문에 3편에 대한 관심이 커졌으나 떡밥 회수 안된 전력이 있는 관계로 기대는 하지 않겠음 ",6
702,영상미 빼고 볼거없는 그저그런영화 ,4
703,재밌음 토비 맥과이어는 그만 좀 놓아줘라 ,10
704,공상영화는 잘안보는디 스파이더맨은계속보게되네 재미있네요 울산상석 ,9
705,완벽한 영화 최고의 스파이더맨 ,10
706,어제 용산 cgv 아이맥스 8시 타임에 관람했는데 cg의 화려함은 좋았지만 피터의 답답함이 조금 재미를 반감시킨거 같네요. ,6
707,토비 맥과이어의 스파이더맨이 그립네 ,6
708,발암 케릭 한명은 영화에 몰입도를 높여주지만 발암케릭 두세명은 독이다 거기에다 주인공이 발암 케릭이면 더욱 끔찍하지 이거 보기전의 나로 돌아 가고 싶다. ,2
709,완전 잼나고 스파이더맨팬되버림ㅋㅋㅋ ,8
710,중간중간 개그요소 넣은거 같은데 전혀 안 웃기고..스토리는 뻔하디 뻔한 성장드라마.봐줄만한건 CG뿐. 초딩들이나 재미있게 보겠지. ,1
711,평범하고 지루한 스토리 그 이상도 이하도 아닌 영화 ,1
712,"기대이하였음 엔드게임보고 나서가 아니라전작 스파이더맨들, 홈커밍이랑 비교해도 많이 이하네요 ",1
713,개재밌고 그냥 톰홀랜드 사랑한다 ,7
714,MJ 연기 실화냐 거기다 외모도 별로고 피터보다 키도 크니까 전혀 어울리지도 않고...피터가 좋아하는 눈빛에 전혀 몰입이 안됨 ,6
715,"홈커밍보다 망할 수 있다니...ㄷㄷ소니 단독 시리즈였으면 개폭망했을....edith 빼면 아무것도 없는...닉퓨리와 쿠키영상만이 화재가 될 정도....와꾸되는 여케라도 있나 연기도 초딩 연극반 분위기에, 각자 따로 ...",1
716,다음 영화가 더 기대되는군요 ,10
717,영화 재미있었어요~~ ,8
718,재미있게 잘 봤습니다. 믿고보는 마블 ,10
719,역시 마블은 쿠키영상도 놓칠수엄따... ,10
720,일본 불매운동 한다 해놓고 800만명 ㄷㄷ 소니픽쳐스가 미국꺼라 괜찮다고? 진짜 개소리로 정신승리 하는것도 한국인 종특임ㅋㅋ ,10
721,망할 한국영화들때문에 개봉관이 확 줄었네. ,10
722,재미있으면서 스토리도 다 잡은 스파이더맨 ,10
723,소니픽처스면 일본거 아님? 아직안봤는데 ,2
724,난 이번꺼 별로던데.. ,6
725,0점 주고싶다. 존나 실망 ,2
726,"소니 자회사에서 만들었어요. https://www.sonypictures.com/corp/divisions.html 첫문장 ""Sony Pictures Entertainment (SPE) is a subsidi...",1
727,너무너무너무너무너무재밌다 ,10
728,너무 기대했나... 디즈니와 소니의 차이가 느껴진다 ,7
729,톰홀랜드가 맛있고 팝콘이 섹시해요 ,10
730,나라 망친 대통령 무능을 다른곳으로 책임 전가하지 말자 ,10
731,이런 류의 영화 이젠 질릴 때도 됐잖아. 작작 좀 우려 먹어라. ,1
732,"스파이더맨, 꼭 아이언맨 뒤를 이을 수 있기를! ",10
733,전편보다 모든게 발전한거같다.감독님 이대로만 해쥬십쇼 ,9
734,톰 홀랜드 출연하는 스파이더맨은 이번이 첨 관람인데 넘 신나고 잼났어요!! 액션도 최고 cg도 최고네요|간만에 느껴보는 10대들의 풋풋함도 좋았고요 ,10
735,역시 스파이더맨이네요~~^^ ,10
736,영화 재미있었어요. 좋았습니다. ,10
737,스파이더맨은 역시 너무 귀엽다 ,9
738,스릴있는 마블이였습니다 역시 스파이더맨은 갓 ,10
739,토니 스타크가 다시 그리워지는 영화 ,10
740,굿!!  마지막까지 봐야해요 ,10
741,홈커밍보다 훨씬 좋았다...!! ,10
742,완전 애들영화가 되어버림.. 전형적인 미국애들 영화. 10년 간의 마블이 그립다. ,6
743,토착왜구들 열라 많네 ㅋㅋㅋ ,2
744,재미있게 잘봤어요 정말멋짐!쿠키영상 2개 놓치지마세요!! ,10
745, 마블 특유의 개그 많음+시원시원한 히어로 액션만으로도 충분하다 ,10
746,"해피와 피터파커 대화할때 너무 뭉클... 정말 너무 귀엽고 안쓰럽고 ㅠㅠ 특히 피터한테 아이언맨 음악 깔릴때 ,, 정말 뭉클했어요 ",10
747,조금지루했어요 하품 3번 ,6
748,현란한 cg로 눈은 너무 즐겁다. 하지만 내용은 청춘하이틴로맨스 영화가 되버렸다. ,6
749,나도이런말하긴머하지만 엔드게임보다재밌었다 ,10
750,다섯손가락에꼽을 마블영화 ,10
751,마블 시네마틱 유니버스는 지금부터 다시 시작이다. 페이즈 3의 에필로그이자 페이즈 4의 프롤로그 ,10
752,개거품 노잼6점이 적절하다홈커밍 저리가라네 ,1
753,예전에 알던 스파이더맨 영화가 아니다. 너무 재미없다. 스파이더맨 영화라기보다는 어벤저스 시리즈 외전에 해당되는 영화.  유치한 10대 연예 영화로 하락.. 절대 보지 말 것 ,1
754,불매도 뷔페처럼!! 스파이더맨은 잼나니까요 ,1
755,진짜 핵노잼 앤드류 가필드가 그립다 ,1
756,진짜 애들 찐따수준 스토리.. ,2
757,불매 하시는분들 이거 보지맙시다 ,1
758,그냥저냥.. 보고나니 뭔가싶은느낌 ,6
759, 개연성이 떨어짐1. 그렇게 존경하는 사람의 유품을 알게된지 얼마 되지도 않은 사람한테 너무 쉽게 넘긴다2. 미스테리오에게 호되게 당한 후 해피에게 설득당하는 장면이 너무 어이없다 겨우 그정도로 설득될거였으면 영화 ...,3
760,"매력없는 빌런, 설정에 먹혀버린 스토리, 남자 둘이 목매는 이유를 모르겠는 히로인, 이보다 더 임팩트없을수가없는 각성. 마블영화중 최고로 못만듬 ",1
761,마블중 최고였습니다. 거미줄타면서 문자하지마! 쿠키영상 끝나고 2번 나와요 마지막까지 자리를 지키33 ,10
762,훌룡한 페이즈의 마무리였다.단... 다른영웅에 영향을 받지 않는 스파이더맨 탄생부분은 마블표 스파이더맨에선  영원히 볼수 없나?!?!?! 장점이자 단점인 MCU ,9
763,왜 평점을 10점씩이나 주는 거지?개인적인 사견으로 평점 1점도 아깝습니다.정말 재미 없어요.핵노잼입니다ㅠ졸려 죽는줄.... ,1
764,역대 최고 스파이더맨 영화 ,10
765,"마블을 좋아하는 사람들은 넋 놓고 보더군요... 허나 마블 히어로물을 안좋아하는 사람들에게는.... 듣기도 민망한 미국식 개그가 넘쳐나고, 영화의 반은 MJ와 쌍팔년도 애정전선... 아무리 만화 원작이라지만 보는내내...",1
766,핵노잼 완전잤음 ㅋㅋㅋ ,1
767,그닥 그냥 노잼 수준 ㅇㅇ ,4
768,배급사가 소니인데 니들이 하려는 그 불매운동인가 참여안하냐? 무슨 뷔페식 운동임? ,5
769,안그래도 정신없는데 계속 뒷통수 때리는 영화ㄷㄷㄷ이제 마블은 스파이더맨만 믿고 봅니다!! ,10
770,초4 아이가 너무 행복해하며 줄거리 얘기해준게 생각나네요 ,10
771,스파이더맨!! 불매합시다.일본 소니 제작사보이콧!!!! ,2
772,"진심으로 재밌다고 하는 건지, 아니면 나만 당할수 없지? ",1
773,다신 이런거 안본다  더 스트레스받는다  모가 잼잇다는거야대체 ,2
774,관객수준이 초등학생 수준으로 떨어진거같다 원래 스파이더맨같은 영화는 초등학생을 겨냥하던 영화였는데 지금은 영.. ,1
775,조잡... ㅋㅋㅋ 너무 별로다 ,1
776,거품이 너무 심해서 1점 줍니다개인적으론 5점 주고싶어요 ,1
777,지루하고 액션도 없고 진짜 재미없다 ,2
778,마블 영화중에 제일 재미없었다. 너무 억지스러운 스토리. 스파이더맨은 어메이징까지가 딱 좋았다. ,5
779,스파이더맨... 진짜 어린이영화도 아니고 재미없음.. ,1
780,???:일본 제품 불매 운동 합시다 (스파이더맨 너무 재밌어요) ㅋㅋㅋ 역대급 개돼지ㅋㅋㅋㅋ ,1
781,너무많은기대를하고 보러가지는마세여 지루한부분이 상당히많고 완성도도 좀미흡합니다 무엇보다 피터파커에대한 면은 좀 부족한게아니엿나싶네요 ,1
782,보다가 잠들었음. 혹시나는 역시나 였는데 히어로물은 너무 유치해서 보기가 힘들다 ,1
783,그냥 노잼임 빌런은 3류에도 못미치는 허술하고 공감 안되는 빌런이고 스파이더맨은 그런 큰 사건을 겪고도 아니 애새ㄲ에 불과하고 답답함 심지어 책임감도 없고 몇번 만난 사람을 그냥 믿어버림ㅋㅋ 그리고 2번째 쿠키 영상...,2
784,소니가 배급하는 영화인데 조센징들 일본불매란다면서 쳐보는 꼬라지 잘보고 갑니다^^ ,1
785,아주그냥 핵재미 와우베리굿뜨 ,10
786,... 아이언맨2탄의 느낌이야 빌런이 전혀.. 강하다고 느껴지지가 않아 ,6
787,진짜 두시간내내 뭔가 긴장감 넘쳣다...팝콘바닥에 내려놓고봄 ,10
788,소니가 배급하는 영화는 잘만 보시네요??? 767만명?? ㅋ ,1
789,재미없고 지루했어요 로다주의 빈자리가 넘 크네요 ,1
790,"블랙펜서, 캡틴마블. 그이어 스파이더맨 ㅋㅋ 개연성과 인물관계도에 정성 1도 안쓴 삼류 Cg떡칠한 영화들이 마블로고 달고 나와 개나 소나 봐주네 ㅋㅋ 역경을 이겨내는 성장물이 아닌 그저 아이언맨 또 빨아주는 저급한 ...",1
791,별로 재미없는 영화 지루하고 ,2
792,"초딩수준 영화. 폄하는 아니고, 뭔가 부족한 스토리른 억지로 짜 맞춘느낌. ",4
793,역대급 망작 피터파커가 똥싸고 똥치우는영화 자신이싼똥에 일말의 죄책감도 못느끼며 연애한다고 좋아한다. 오리지날 스파이더맨에 발끝도 못따라올 영화다. 너무 겉멋에만 치중한 스파이더맨.  왜 MJ이는 매번바뀌는거지?? ...,1
794,그냥 그러함 쩝쩝.. 알라딘 보다 못함 ,6
795,댓글알바보다 이거 마블빠돌이들이 평점 역테러하는거야 진짜 별 특별한것도 없고 기존 스파이더맨 장점만도 못한 영화를 9점대? ,1
796,아...좀 실망입니다.스파이더맨 시리즈중 제일.재미사 없어요...하이틴 B급영화느낌...ㅠㅠ ,2
797,여태껏 봤던 스파이더맨 시리즈 중 제일 노잼 너무 시시하게 끝남 ,1
798,진심 이게 재밌냐???? ,1
799,반개도 아까운 영화...마블영화보면서 처음 자봄캡틴마블도 3번봤을때나 살짝 졸았는데 이거뭐...잔것도 후회안함. 처음부터  끝까지 개인적으로유치하고 화만나는 영화 거기에 이런영화 평점이 9점대라는 것에 알바가 존재한...,1
800,아... '홈' 시리즈... 왓 더 풕 업!!! ,1
801,"스파이더맨은 과거의 자신에게서 진정한 '큰 책임을 지는 영웅'에 대해, 미스테리오는 벌쳐에게서 진정한 '카리스마 있는 악역'에 대해 배우고 오길... ",6
802,시나리오를 너무 잘 만듦.다음 편 기대 합니다~~~ ,10
803,영웅류 영화에서 주인공보다 적에 대한 상상력이 정말로 놀랍다. 허상과 첨단장비인 드론을 활용한 줄거리는 흥미롭고 즐겁다. 역시 히어로물 중에서는 스파이더맨. ,9
804,"스파이더맨은 꾸준히 재미는 있다만, 이번편은 스토리부분이 글쎄 . . 그리고, MJ가 너무 약하다 . . . ",7
805,"연애 초보의 풋풋하고 사랑스러운 하이틴 로맨스. 혹은, 쫄쫄이 입은 다정한 이웃의 호화찬란하고 가벼운 성장기. 나름의 매력은 있으나 샘 레이미 & 토비 맥과이어 조합이 문득 그리운 건 왜일까? ",6
806,액션씬은 좋았는데..아이언맨후계자인지 스파이더맨인지 모를정도로 아이언맨 비중이 크다. ,6
807,토니의 진짜 자산은 이디스가 아니라 피터이네요. ,8
808,액션에 지리고 cg에 지렸다.개인적인 생각으로는 어벤져스에 나왔어도 될만한 소재였던 것 같다.하지만 로맨스 끼워맞추기가 보기 불편했고 유치한 스토리로 그냥 이럴거면 어린이용이라고 포스터에 적어놔도 될 정도... ,7
809,최고 스파이더맨 톰홀랜드 짱 ,10
810,평점 9도 안 아까운 영화가 8.99라니 ,10
811,스파이더맨을 연기하는 톰홀랜드 모습이 너무 귀여워요 ,10
812,어벤져스가 보고싶어졌어요.. ,10
813,정말 짱쨍 재미있는 영화입니다 ,10
814,,5
815,아직은 시리즈에서 아이언맨의 부재가 좀 크게 느껴짐 아직 페이즈 시작일 뿐이니 몇편 더 나와봐야 알겠지만. 개봉 일정이 좀 더딘게 뭔가 영화사에서도 간보고 있는 느낌? 아무래도 투자비용도 만만치않을테니. 스파이더맨은...,8
816,만족합니다보세요 ㅋㅋ ,6
817,다좋은데 mj역에 이쁜대역 좀  쓰지 ,10
818,아이언맨을 추억할 수 있어서 행복했지 스파이더맨 자체의 매력도는 떨어졌음. ,8
819,전편만 못한 느낌이예요 ,6
820,이제 마블은 유치뽕짝 유아영화로 전락한 느낌 ,6
821,완전 정말로 재미있어요~! ,10
822,미스테리오는 죽어도 구질구질하다 ,8
823,CG진짜 미쳤고 쿠키영상 보고 20분간 소름돋아있었다. ,10
824,씨지가 정말 미친듯 잼게봤음 예전 스파이더맨 시리즈들을 생각해보면 확실히 마블은 다른 느낌 솔로무비긴 한데 엄청 넓게 보는거같음 이부분은 갠적으로 좀 아쉽다 글고 쿠키가 더 충격이라 담편 존버한다 ,7
825,사랑해 스파이디 마블로 꼭 돌아오렴 ,10
826,최고 돈 주고 보길 잘했다 ,10
827,재밌네요 역시 스파이더맨 멋져요 ,10
828,영화는 너무 재밌었는데 쿠키영상에서 다 털리고 나온 느낌 ㅋㅋㅋ 말로 표현할 수가 없는 허상 ... 그 어딘가... 하 ,8
829,주인공의 매력으로 반은 먹고가는 시리즈 ~ㅎ좋아요 ,9
830,"""사람들은 보이는대로 보고 들리는대로 듣는다"" ",7
831,재미없다는분들 많았는데 너무너무 재미났습니다 ,10
832,신난다. 재미난다. 액션도 풍부하고 웃긴 장면도 많은 꽤 잘만든 오락영화.악역도 GOOD! ,8
833,진짜 떠난 줄 알았잖아ㅠㅠ 잘 돌아왔어ㅠㅠ ,10
834,진짜 이번 스파이더맨은 그래도 덜 짠해서 좋다 했는데ㅠㅜ 젠장 ㅠㅠ 역시나 우리 피터파커는 도대체 전생에 무슨 죄를 그리 지었길래  못괴롭혀 안달인가ㅠㅠ 보고나서 짠해 죽겠음 ㅠㅠ ,10
835,우리 어리고 착하고 순진하고  그런 피터한테 그르지마라 진짜ㅜㅠ나뿐것들ㅜ역대 마블시리즈중 가장 안쓰럽고 맘아품ㅜ ,10
836,제미ㅋㅋ웃기고 신남ㅋㅋ ,10
837,스토리전개는 3%부족한데나머지는 100% ,10
838,톰홀랜드와 젠다야 버전의 스파이더맨은 10대 느낌이 더 강해서 귀엽고 좋아요. 개인적으로 미스테리오는 기대만큼 매력이 크진 않았어요. ,8
839,마지막에 반전..다음편이 기대된ㄷㄱㆍ ,10
840,이게 영화다... 마블은 실망시킨적이없어.. 캡마만 빼고 ,10
841,마블은배신하지않아역시 ,10
842,이제까지 스파이더맨 시리즈중 가장 좋았다 ,10
843,MJ가 왜케... 안... ,8
844,스릴과 재미를더한 진짜영화.  몇번을봐도재미있는 영화입니다 ,10
845,피터가 아주 순수하고 귀여워 죽겄다. 피터팅클 찌리릿. ,8
846,뉴욕을 벗어나 히어로물 기름기를 쫙 뺀 스파이더맨도 정다웠다. ,7
847,역시는 역시 재밌게봤어요 ,10
848,초록불빛  무슨  우뢰매인줄 알았네파커는   스파이더맨캐릭이랑  찰떡임근데   눈좀높여라   니가  ㅈㄴ    아깝다 ,2
849,마지막 액션씬이 스파이더맨영화를 보고있단걸 생각나게 해줌 ,9
850,cg가 이정도로 발전했구나 싶다. 너무 멋지다. 근데 왜 잠이 오는거야???? ,6
851,그냥 풋내나는 영화같지만 영화적 깊이나 완성도는 거의 뭐 황혼을 준비하는 할아버지 느낌 ,10
852,정말 이게 마지막 스파이더맨이야? ,8
853,역시믿고보는마블 초반에좀지루했는데 중간부터 시간가는줄모르고봤다 근데 쿠키영상쫌... 뭔가안맞음 ,10
854,"비주얼 끝판왕! 또 재밌기까지하지만 내용은 생각보다 단순해요. 울트론의 실수로 배우며 다친 스타크가, 그리 쉽게 타깃을 정해버리는 이디스를 만들었다는 건 많이 별로였어요. 이런 자잘한 부분들이 영화 곳곳에 좀 있구요...",8
855,형들말듣고 봤는데 재밌네요 ,10
856,톰 홀랜드의 스파이더맨의 매력을 한껏 느낄 수 있는 영화 ,10
857,개꿀잼입니다 믿고보는 마블 ,10
858,나쁘지 않았어요 내용도 탄탄했고 ,8
859,부담없이 재미있게 즐긴 영화입니다 ,10
860,꿀잼이네요 다시보고싶습니다 ,10
861,역시 스파이더맨은 절대 배신하지 않아 믿고 봅니다 ,8
862,우주최강 너무너무너무 재미져요. ,10
863,스파이더맨 나의 영원한 영웅! ,10
864,재미있게 잘 보고 왔습니다 ,9
865,톰 홀랜드의 매력이 너무 잘 보이고 내용과 여러 배우들의 연기력을 다시 감탄하게 만들었다. 또한 스토리도 탄탄하고 너무 재미있게 봤습니다. ,10
866,아이들과  재밌게 보기 좋은 영화 ,10
867,늦었지만 즐겁게 잘봤습니다 ,10
868,됴아됴아~~늠나재밌었음요!!! ,10
869,내용과 진행이 지루하지않고 재미있었어요 ,10
870,믿고보는 마블시리즈~ ,10
871,재밋엇어용 또 보고싶네요 ,9
872,사랑해요 스파이더맨! ,10
873,너무 사랑해 ~~ 역시 마블이야 ! ,10
874,피터파커는 얼굴공개됫다 ... ,10
875,어밴져스  덕후인 아들과 재미있게 잘 봤네요~~cg가 참 예술이더라구요~~~ ,9
876,스파이더맨 최고였음 너무 짱짱 ,10
877,피터 찌리릿 쿠키는 꼭 보세요 ,9
878,스파이더맨과 미스테리오가 앨리맨탈을 물리칠때도 완전 재밌음 ,10
879,갈수록발전되는걸보는재미 ,9
880,재밌어요 헤 !!!!ㅇ ,9
881,아이언맨을 닮아가는 소년의 성장기 ,10
882,나이트몽키나이트몽키 ,10
883,정말최고에요 최고최고 ,10
884,뭐..재미 재미 재미 기가막히네요..관람객이 많은 영화는 다 이유가있어요.. ,10
885,영하도 쩔었는데 쿠키가 더 쩔어 ,10
886,초등학생 두 아이와 함께 봤습니다.물론 제가 제일 재미있게봤구요 슬프고 뭉클하고 짜릿하고 스파이더맨 입덕ㅜㅜ토니스타크 그리워요 ,10
887,아들하고 아빠 둘이 보고나오더니 역시 재밌다고 하네요ㅋㅋ ,10
888,재밌었는데 계약이 안됐다니 슬프네요 ㅠㅠ ,10
889,아이들이 넘 재밌어하네요^^ 특히 초5 우리딸은 별 기대 없이 갔는데 진짜 재밌게 봤다고 하네요. ,10
890,마지막 쿠기보면...이를 계기로 스파이더맨이 정식 어벤저스멤버로 커밍아웃될듯 ,10
891,"재미있게 잘 보았다. 스토리, 액션 모두 기대를 져버리지 않았다. ",9
892,기대 이상으로 재밌어요~ ㅡ_ㅡd ,10
893,돌아와요 스파이더맨ㅠ ,10
894,파커..ㅎ 스파이더맨 최애 영화! ,9
895,애들이 너무 잼있어해요 ^^ ,9
896,역시 마블영화는 기본 이상은 합니다. ,10
897,재미나내요 재미나요~ 좋아요~ ,9
898,기대한만큼 재미도 있었습니다. 다음 마블 페이즈의 초석을 다지는 느낌도 들었네요 ,10
899,역시 젤 좋아하는 스파이더맨. 연출도 짱짱이었다 ,10
900,굿이용 ㅎ 정말 재밋게 봐써유루룰 ,10
901,역시 믿고보는 마블입니다 ,10
902,차세대 어벤져스를 위해 적당한 빌런을 배치하여 피터파커의 성장을 그려 재미있게 보았읍니다. ,10
903,재밌게 잘 보았습니다. 남주  잘생겼다~~ ,8
904,재밌게 봤습니다~~^^ ,9
905,스파이더맨이모를사랑한다에서 개터졌다 ㄹㅇ ㅋㅋㅋ ,10
906,존잼입니다~~~~!!! ,10
907,생각한것보다 훨씬 재미있었고끝난줄 알았는데 끝난게 아니다 ,10
908,피터파크!! CG가 많았어도 재밌네요 ,8
909,스파이더맨의 책임감을 보여준 최고의영화 ,10
910,시간 가는줄 모르고 재미있걱 잘 봤어요 ,10
911,.가족과 함께 재미있게 봤어요. ,10
912,꿀쟘이었음 안본사람 보셈 ,10
913,good 재미있는 영화네요 ,9
914,스파이더맨 사랑해용 ~~ ,8
915,잼있어여 시간이 금방가네요 굿 ,10
916,이건아직도 상영하네ㅋㅋ팔백만이면많이찍었다 ,10
917,소소한 즐거움을 주는 영화이네요 ,8
918,진짜진짜진짜진짜 잼있게본영화입니당 ,10
919,스파이더맨 너무 재밋어용ㅇㅇㅇㅇ ,10
920,재밌어요오 동일 문자는 등록이 안 되는군요:) ,10
921,스파이더맨 보는데 아이언맨이 더 그립고 생각나눼.. 네드랑 배티 너무 잘어울리는데ㅋ 의외의 조합에 빵터짐 ,10
922,재밌습니다. 미스테리오 ㅂㅅ ,8
923,시간가는줄 모르고 재미있게 봤네요~ ,10
924,또다른 마블영화가 기대되네요 ,9
925,역시 실망시켜주지않는 마블~!!! ,9
926,역시 스파이더맨은 혼자일때 더 좋은 영웅의 모습이네요 ,10
927,재밌게봣음 다음에 다시봐도재밌을거같어요 ,10
928,피터 파커의 보통사람과 히어로 역활에 따라 다르게 보이는  인격과 책임감 그리고 양면성과 갈등들 속에 여러가지로 생각들게 하는 영웅의 모습 ,9
929,1편의 씨끄러운 하이틴물이었다면 보다 진지하게 성장해가는게 더욱 괜찮아 졌다. 전 스파이더맨 배우들이 이제 머리속에 흐려지게 되는 정도였다. 마블 히어로물 중 처음부터 성장통을 보여주면서 성장해 가는 히어로가 아닌가...,10
930,역시나 넘 훌륭한 영화다 ,10
931,재미있었습니다 추천해요 ,10
932,너무 재미있게 봤습니다~~ ,10
933,스파이더맨 마블 포에버 ,9
934,굿 재밌어요 귀여워여 스파이더맨 ,10
935,이번에도 흥했어요 굿! ,10
936,피터 파커의 성장을 보여준 영화 ,10
937,재미씀 ㄴ재밌어재미써 ㅋ ,10
938,흥미진진 하게 잘봤어요 ,10
939,좋아요 재미있었어요 신나고 ,10
940,스파이더맨은 이렇게 좋아졌냐고 눈이 많이 호강하는 것 같아요 ,10
941,약간의 하이틴무비같은 느낌과 역시나 마블이라는 느낌과 아이언맨은 역시 아이언맨이라는 생각과 앞으로의 스파이더맨을 기대하며 ,10
942,완전 재밌어여.굿!!!! ,10
943,톰홀랜드가 너무 잘생겼다 ,10
944,딱 가볍고 재밌는 2시간!!! ,10
945,10년간 재밌게 봤습니다 ,10
946,초등4학년 아들이 너~~~무 잼있다고 해요 ,10
947,기대이상이었다 피터의 역량을 잘볼수있었다 ,10
