,Review,Rank
435,중간 까지 스파이더맨은 어리숙함을 후반 액션으로 마무리 ,9
436,"제이크 질렌할도 좋고 스티브 잡스도 좋지만, 이번엔 애플이 소니를 고소해야 할 듯. ",5
437,M J 는 진짜 바꾸자.... ,9
438,처음에 움...?이게뭐지?라고 생각햇는데 역시나 엿네용ㅎㅎ 반전!! ,10
439,스파이더맨 액션은 완전스릴넘칩니다 ,10
440,아이언맨 보고싶어ㅠㅠ ,10
441,하이틴 청춘 히어로 무비.  후반의 드론 전투씬은 압도적 ,7
442,마블시리즈중에서 스파이더맨을 가장 좋아했던 사람입장에서이번 에피소드 파프롬홈은 좀 별로였음... ,6
443,마블팬인데 솔직히 약간 지루했 ,7
444,마블 영화 잘 실망안하는데 쳐지는 맛이 좀 있습니다 캡틴마블 보다는 재밌었지만 뭔가 많이 아쉬웠어요 그리고 제발 영화관에 매너 좀 지키세요 폰은 좀 나중에 보자구요 ,7
445,"MCU라는 큰 틀에서 보면 엔드게임의 에필라그라고 볼 수 있으나, 작품 하나만 놓고 보면 먼가 아쉬웠음. 피터 파커의 성장이 눈에 보였던 전편이라면 이번 작품에서는 내면의 성장보다는 그냥 악당과 싸워 이기는 정도의 ...",7
446,스파이더맨은 사랑입니다 ,10
447,큰재미는 못느낌 11세 아들녀석은 좋아함^^ ,6
448,틴에이지 무비가 되어버린 스파이더맨. ,1
449,내가 봐왔던 스파이더맨 시리즈 중에서 젤 재미없음. ,4
450,두번보고싶었음 ..ㅠ 한번더볼쨔람 ,8
451,역쉬 볼꺼리 풍부하네요~지루하지않게 잘 봤어요~다음편 예고가 또 피터파커의 앞날을 어둡게해서 우리 아들이 걱정이 태산이지만요~^^;; ,10
452,액션부터 스토리 구성까지 완벽! 톰홀랜드가 스파이더맨 안했음 어쩔뻔했을까 싶은영화 ! ♡ ,10
453,두번봐도 볼만한가요 ?? ,10
454,이미지와 드론의 공격이라..참으로 시의적절한 소재 ,9
455,재미는 있는데.. 뒤로 갈수록 지루했어요. 청소년 성장드라마 학교2 이런거 보는느낌 ㅋㅋ ,7
456,돈아까웠음 솔직히   그렇게 느낀건 내맘 ,2
457,내용이 너무 가볍습니다.  빌런은 포스가 없고 스토리는 연애 이야기가 80프로인 듯  하네요. 상당히 실망스러웠습니다. 그리고 보면서 계속 평창 올림픽이 생각났습니다. ,6
458,이거 소니배급영화에요 ,2
459,태클이 아니고 이게 진짜 10점9점 줄만한 스토리인지 모르겠음..영상 효과는 늘 그렇듯 대단했고 배우들의 연기는 좋았으나 초반엔 지루하고 빌런이 좀 유치..아이언맨의 부재가 확 느껴졌음.ㅠ ,6
460,"솔직하게 시간 잘간다.하지만 예전같은 흡입력은 없다. 언제즈음 윈터솔져,그리고 시빌워 같은 흡인력있는 마블영화가 나올까. 토니가 스파이지를 왜 후계자로 생각한건지에 대한 명확한 이유는 영화에서 전혀 제시되지 않았다....",6
461,"어느 수필의 내용처럼""세번째는 않만나는게 좋을 뿐 했다""이젠 거미와는 영원히 안녕이군요!!!!사십대, 오십대라 감흥떨어지는건 사실. 중고등학생들보기에는 영화로 유럽관광한다 생각하고 보면 돈은 아깝지 않...",6
462,유럽의 풍광은 멋졌지만..감독양반..홈커밍같은 재미는 어디다 팔아드셨나?마블이 아닌 10대 성장영화가  웬 뜬금포? ,7
463,갓노스.. 떠나고야 빛인줄 알았습니다. ,5
464,하....오늘 시험인데 어제 보고왔다..근데 재밌다 ,10
465,"믿고보는 마블영화라서 평타이상은 쳤는데, 너무 영화가 가벼운  느낌... 주제에서 좀 벗어나있는 느낌을 받았고 이전 스파이더맨 같은 느낌은 없었다...조금 더 영화에 주제와 맞아 떨어졌으면 어떨가하는 영화... ",7
466,젤 유치하고 스파이더맨 망작 ㅋ 흥분감도 떻어디구 그래도 팬심으로 봤다 ,7
467,스파이더맨 시리즈 중 베스트 오브 베스트 ,10
468,노잼 ㅠㅜㅜ 지루함 ㅅㅂ ,4
469,액션이나 cg나 개그요소들은 나쁘지 않았는데 스토리가 너무 별로였다 다른 히어로 영화에서는 진짜 사회를 위협할만한 악당들과 싸우는데 이 영화는 무슨 애들 장난하는 것 같았다 어매이징 스파이더맨의 무거운 분위기가 그립...,1
470,재밌어요. 톰홀랜드가 스파이더맨 오래 맡았으면 좋겠네요.MJ는  감정이입이 잘 안되네요 커스틴던스트가 딱이었는데 ,10
471,토니 스파크가 계속 생각나는 영화 ,10
472,배우가 귀여워서 3점. 악당은 시시하고 전개도 뻔하다. 홈커밍은 9점 ,3
473,어...음 좀 유치하다 ,7
474,넘 기대했었나봐요...그냥.. ,6
475,마블팬인데 마블답지않은느낌..? 전작들때문에 기대감이 너무컸나 ,7
476,반일외치면서 영화흥행은 ㄷㄷㄷ반일도 분리수거식으로하냐???? ,10
477,생각한대로 기대이상도 이하도아니었음 ,4
478,보는 내내 눈이 즐거웠지만 영화를 보고 나온 뒤 찝찝하고 이내 씁쓸한 우울감이 든다. 토니 없는 마블이 너무 허전했고 그 존재감이 대단히 컸던 만큼 후계 캐릭터의 매력이 돋보이길 바란 것은 과한 욕심이었나 싶다. 토...,9
479,아이언맨 1편처럼 피터도 마지막에 자기가 스스로 밝혔으면 좋알을텐데.. ,1
480,유치했음. 미스테리오의 헬멧이나 녹색 연기나... 스파이더맨의 액션만 전편보다 좋아짐. ,6
481,개돼지들ㅋㅋㅋ 일제 불매는 얼어죽을ㅋㅋㅋ예매율 1위 보소 ,10
482,역대 스파이더맨 영화중에 제일 재미 없었던 영화지만 그래도 봐야 하긴 하는 영화입니다 ,5
483,"어설픈 반전, 환상과 실재를 구분하지 못하는 어설픈 연출 그리고 전반적으로 유치해서 성인이 보기엔 적절하지 않았습니다. 아이언맨의 뒷를잇는 스파이더맨의 내용인데 주제또한 잘 표현하지 못했구요. 저는 좀 아쉬운 영화였...",6
484,"기대치가 너무 높았나,  딱 이정도가 맞는듯... ",7
485,그냥저냥 평범한듯 ㅇㅇ ,7
486,재밌는데 마블 뽕을 너무 받는다. 어스2도 성장위주인데 그건 성장위주라 까이고 이건 찬양받네 ㅋㅋㅋㅋ 액션도 여전히 딸리고 전보단 낫지만. 나도 마블 좋아하는데 이건 좀 아님 너무 광신도임 10점은 ,5
487,와 진짜 너무 재미 없음 스토리 허술한 거야 그렇다 쳐도 스파이더맨의 정체성이... 머릿속엔 연애 사업에 대한 생각 뿐이고 계속해서 사고나 치고 다니는 철딱서니 없는 어린애의 모습에 실망감만 가득. 그래도 피터 MJ...,2
488,왜구가 만들고 조선인이 봅니다.  10점씩 주어가면서 밀입니다. ,1
489,"개허접, 메국 잡것들. ",1
490,스파이더맨인데 스파이더맨 안나옴. 이야기 구성 완전 노잼 ,1
491,불매운동 하자는 깨시민은 인터넷에만 존재하네 ,1
492,역대 스파이더맨중 가장망작임 .  스크린수줄이고 다른영화들 스크린수 분배하길. ,2
493,아이언맨1부터 어벤저스4까지 각각 다섯번이상씩 봤고 많이 마블영화 좋아하는 사람인데  처음으로 상영 중간에나오고싶었습니다 너무 실망했어요 ,6
494,최악의마블스파이더맨을 책임감없는.... 애기로만들다니아니 평범한 사람도 하고싶은거만 하고 살수는 없는데 ㅋ ,2
495,발암 진짜 암걸린다 아이언맨이보고싶다 ,2
496,액션과 이야기의 사이즈는 키웠지만  스토리는 허술.. ,6
497,핵 고구마.. 쿠키영상까지 고구마...보는 내내 욕만나옴...봤던 마블영화 중 젤 실망스러워서 속상함... ,2
498,이전 스파이더맨은 재밌게 봤는데 이번편은 너무 유치하고 억지설정에 실망함. 전투씬은 스케일이 크다만 스토리가 너무 허접... 빌런이 안경 손에 넣고 구구절절 상황 설명하는부분 정말 오그라들었음.. ,5
499,딱 캡틴마블 수준의 영화. 엑스맨이 다크피닉스로 시리즈 마무리를 망한것처럼 어벤저스는 엔드게임으로 대장정을 마무리했어야했다. ,4
500,무능력하고 멍청하고 단순한 바보천치 꼬맹이. 여태까지 본 마블영화 중에 최악. 쿠키영상도 뭔뜻인지 하나도 모르겠음. 앞으로 MCU와 어벤져스가 어떻게 전개될지 한숨만 푹푹 나온다. 이딴게 페이즈3 마지막 영화라니. ...,5
501,지루했음 ㅠㅠ돈내고봤으면 돈아까웟을듯 잠을 푹못자고 보면 졸려요 중간에 잠깐 잠 ,2
502,너무 기대를 했나 솔직히 별로임 ,4
503,아...진짜 뭘본거지.. 아~~~너무유치하고 식상한개그에 식상힐내용에.... 미치겠네 ,1
504,생각보다 별로였고 2시간 넘는 시간 후딱 갈만큼 매력있진 않았어요ㅠ 남주여주 어려보이기도 했지만 둘 조화도 살짝 아쉽고 내용도 중간중간 이해가 잘 안되서ㅠㅠ ,6
505,cg는 기대 이상이었으나 개인적으로 너무 유치했습니다. ,6
506,액션은 화려한데 하 뭔가 아쉽다 ,6
507,마블빨로 과하게 높게 잡혔다 평점이 파프롬홈은 진짜 홈커밍에 비하면 정말 ㅈ망이라고 할수있음. 토니스타크 빨로 좀 높은거같은데 진짜 스파이더맨 영화중 최악임 ,1
508,저기요.이거판권이 소니에요ㅡ_ㅡ코난이랑이거 불매해야하는거 아닌가요?지금 이사태에도 순위권이라는게참 놀랍습니다.불매안하는사람은  안하는군요.일본인이 했던말이생각나네요한국인도 좋은건 다안다.그래서 또찾을  것이다.저는 ...,1
509,소니가 배급하는 영화 입니다. 스파이더맨의 열혈 팬이지만 극장 관람은 포기했음. ,1
510,수익이 소니한테 간다는거 생각해본적은 있냐??내려라 안본다 ,1
511,잠와죽는줄 아... ㅜㅜ ,2
512,"엔드게임 이후 스파이더맨이 아이언맨의 뒤를 잇을 수 있게만든 영화.. 하지만... 빌런과의 싸움이 너무나도 허접하고,,, 러브라인 역시 허접하다.... 딱히 안봐도 되는 영화 ",6
513,스파이더맨을 왜 이지경으로 만들었나요 ㅠㅠ허접 마블은 이제 무조건 걸려야죠 ㅠㅠ ,1
514,마블영화치곤 초중반까지 너무 지루했음~ 후반에 터트리긴하지만. 손에 땀이나는 그런게 없어서 아쉬웠다. 마블영화중 최악.. 그치만 볼만은 함. ,6
515,생각보다 몰입도가 떨어지고 중구난방으로 벌어지는 악당과의 대결 중간에 졸렸고 잘 날아다닌다 그러나 스파이더맨 자체는 좋다 ,5
516,엔드게임을 끝으로 긴 휴식기가 필요했다. 여전히 화려 하지만 이제 조금 식상하고 반전은 억지스러웠다. ,5
517,하이틴》CG = 어린이.청소년관람기준☆ ,5
518,히어로의 내적 갈등과 풀어내는 드라마액션코미디 요소앞으로 이야기에 대한 떡밥모든것이 좋았다 ,10
519,참이렇게 지루하고 시끄러운데도 잠을어게하는 스파이더맨  이런게 낚인거라고 하는건가~ ,2
520,그냥 뻔한내용이네..~ ,1
521,나만 노잼이었나 너무 지루하던데 ,1
522,실사만화영화.초딩들 관람하시고 꿈을키우세요 ,1
523,지루하고 재미없습니다. 평점이 너무 높네요 ,1
524,솔직히 핵노잼 입니다 ㅜㅜ ,1
525,노잼이에요 아 돈 아까워 ㅠㅠ ,2
526,상영관을다 차지해서 어쩔수없이 보고옴~중간에잠자다일어났음 처음으로~ ,1
527,가상현실은 너무 개 억지였음 9점짜리 영화는 아니라고 본다 ,1
528,소니가 소니했다 베놈도 망치더니.... ,2
529,영화는 볼만한데 mj 래쉬포드 닮아서 집중안됨 ㄹㅇ 개못생김 ,8
530,이딴 영화가 인기라니 쪽바리 배급사 흐뭇하겠네 ,1
531,유니클로 도요타급 영향력의배급사 SONY라 안볼꺼임 ,1
532,돈 겁나 쳐들이고 아무런 내용없고 마블픽쳐스의 화려한 종말을 확인시켜주는 영화~~내용 정말없고 개연성없는 액션들ㅋㅋㅋ ,1
533,기대했는데 생각보단 별로였음... 그래픽이나 이런건 정말 멋졌지만 내용이나 사건구성이 관객들을 납듣시키긴 어려운 개연성이고 좀 뜬금없다고 생각되는 점들이 많아서 엔드게임 때처럼 완전히 몰입하긴 힘들었음 하지만 그럼에...,8
534,나는 내가 본 스파이더맨중에 최악이었음 보는내내 고구마 한박스 먹는 느낌이었고 솔직히 마지막까지 얘가 어디가 성공했는지 모르겠음 그냥 초딩같음 ,1
535,불매운동 하자면서 일본기업 소니꺼 영화는 왜 보는거임?  국민들 수준참 ㅋㅋ ,1
536,마블영화중에 젤 재미없었다 ,1
537,뭔가 소재고갈 되서 어떻게든 억지로 만든거 같음 ,3
538,"일본 애들이 얼마나 비웃을 지 슬픕니다...일본 제품 불매한다면서, 우리나라에서 정작 소니픽처스의 스파이더맨은 신나게 보고 있으니...제작을 어디서 하든, 결국 주인은 일본입니다. ",1
539,일본 제품 불매운동 한다면서 소니픽쳐스가 제작부터 배급까지 했는데 왜 보는거죠? 여론 안좋아지면 반일 감정 내세우는 문재인식 감성 팔이에 듣고 싶은거만 들으세요?  국민성 진짜 OOO기다 ㅋㅋㅋ ,1
540,이번에는 마블이 너무했다역대 스파이더맨중 가장 최악이다초딩영화에 멋있지도 안고  정말답답한스파이더맨으로 만들어버렸다소니에게 다시 넘기는 것이좋을 듯하네요 ,2
541,안그래도 캐릭터들이 전부 따로 놀아서 만산한데 드론까지 열라게 풀어 놓으니 더더욱 산만하다.ㅡㅡ ,1
542,마블답게 신선함은 좋았지만 재미는 많이 아쉽다 도라에몽의 진구같은 스파이더맨.... 히어로 물 특유의 시원함보다는 답답함이 지루하게 느껴졌다 ,10
543,아니 이게 8점 받을 수준이고 로튼에서도 샘스파2보다 높다고? 홈커밍에서 액션 부족하다니까 진짜 미스테리오 환영말곤 볼게 더 없어졌는데? 그나마 잼민이더맨에서 성장을 보여준 홈커밍 무시하고 다시 잼민이로 리셋 시켜놓...,4
544,기대만큼 재밌고 그러진 않았어요 액션은 좋았어요. 뚱보는 부럽더라고요.  귀여운 여친때문에 ,5
545,정말 재미는 있었다. 영화 리뷰 처음 남기는데 이전까지의 마블 영화가 아님 것 처럼 느껴짐. 스토리나 액션. 연출은 정말 좋았지만 보면서 자꾸 고구마 먹는 느낌.. 답답하면서도 허술함.. ,6
546,이거 다보고 쿠키영상까지 봤는데 의의로 재밌긴함. 근데 미스터레오는 역대 빌런중에 제일 역겹네요.3편에서는 베놈과 카네지 나온다는데 제발 2보단 재밌기를 바랍니다. ,8
547,"스파이더맨 시리즈 이제 종결해야 하지 않을까 싶을 정도로 시리즈중에 최악이었다. 부실한 스토리에 부실한 연출, 총체적으로 영화의 완성도가 떨어진다. 액션 또한 스파이더맨 시리즈 중에 제일 허접하다. ",5
548,망했다...원작 보니까 스파이더맨 정체 알려지면 악당이 숙모 죽이던데...;; ,10
549,아직도 너무 그리운 토니 스타크 ,8
550,,6
551,마지막 쿠키영상에서 내 머릿속에 물음표가 백만 개 생겼다 ,10
552,그냥 그랬어요! 어벤져스 인기 캐릭터를 이용해 돈을 벌어보려는 간단한 상업영화같아요. 스토리가 탄탄하지 않고 액션도 그저 그랬어요. ,7
553,피터파커 성장기 ,8
554,토니스타크가 보고싶어요 ,9
555,포스트 아이언맨의 자리는 스파이더맨 ,6
556,"스파이더맨 디즈니에서 안나오는게 너무 아쉽네.,. ",8
557,역대급 최고의 스파이더맨 액션무비 ,10
558,새로운 페이즈로의 전환을 이끈 무난한 징검다리 ,7
559,빨리 vod 나와라 빨리 dvd 나와라 ,10
560,소니야 안된다 진짜 안된다 안돼... ,10
561,너무 잼있게 잘봤습니다 ㅎㅎ ,10
562,너무 재밌었다 웃기기도 하고 액션도 멋지고... ,10
563,정말  재밋어요  짱짱짱짱 ,10
564,역시 믿고보는 마블입니다 ,10
565,난 개인적으로 마블 작 중에 이게 젤 재밌었던것 같음 뭣보다 톰홀랜드 너무 귀여워 ㅠㅠ ,10
566,톰 홀랜드 스파이더맨은 진리다 ,10
567,아주 신나게 잼나게 잘봤습니다 ,10
568,톰홀랜드 너무 귀여웡 내스타일 ,10
569,"번역, cg, 연기력까지 다 완벽한 영화 ",10
570,조금 예상되는 시나리오였음어릴적 만화보면 미스테리오는 악당이였으니..그래도 아쉬움을 채워줄만한 볼거리에 9점 ,9
571,매우 흥미 진진하고 시간이 어떻게 가는줄 모르는 영화 ,10
572,스파이더맨의 인간미를 느낄 수 있다 ,10
573,너무너무 재밋어요!또볼게요! ,10
574,기대안하고 보니까 괜찮았음 ,9
575,재밌게 관람 했습니다. ,10
576,최고였어요~~~  ^^ ,10
577,말이 필요없는 최고의영화!!! ,10
578,스파이더맨은 나랑 같다 물론 나의 그 이상의 존재이다 가상과 현실에서 깨닫고 성장하는 모습이 한국이나 나랑 너무 차이가 난다. 분할정도로 원통하다 ,10
579,그저 마블유니버스는  사랑입니다 ,10
580,기대를 잘 충족시켜주었어요 ,10
581,역시 실망시키지 않습니다 . ,10
582,스토리도좋고 재밌었어요 ,10
583,초등생보기에도 재밌어요 ,10
584,정말 일상을 잊고 즐길 수 있었던 최고의 2시간♡♡ ,10
585,톰홀랜드 너무 귀여워요..ㅜㅜ ,10
586,톰홀랜드멋있어요 ㅎㅎ ,10
587,이건진짜 10점 줄수밖에 없다 ,10
588,아이언맨의 자리를 이끌 사람은 스파이더맨밖에 없구나~ 후속 기대됩니다~ㅎ 여주가 너무 말랐어요~ ,10
589,정말 최고의 재미 쿠키영상 꼭 보세요 대박사건 ,10
590,스파이더맨의 성장기..!!!! ,10
591,굿. 돈을 얼마를 부었을지.. ,10
592,"톰홀랜드 정말 많이 성장해서 보기가 좋다 토니가 왜 아끼는지 알 것 같은느낌?!역시 마블은 실망시킨적이 없다 스토리, 액션 다좋다 빨리 다음시리즈가 나왔으면 싶다 ",10
593,스파이더맨의 성장과정을 보는 것 같았어요 이번편보다 다음편이 기대되네요 ,7
594,"재밌었고, 쿠키영상때문에 차기작이 더욱 기대됨 ",9
595,B급으로 시작해 A급으로 마무리 ,10
596,전작보고 별루라 기대안했는데 진짜 엄청 재미짐 ,10
597,스파이더맨 시리즈가 왜 인기있는지 알겠고 다음편이 기다려진다. ,9
598,토니의 빈자리를 느끼는 장면 마다 안타깝더라ㅠ ,10
599,너무 재밌다 또보고싶어요 ,10
600,꿀잼이다ㅠㅠ 2번 3번 보고싶다 ,10
601,일단 톰홀랜드 연기가 10점이다 ,10
602,역시 마블 3000번 보고싶다 ,10
603,재밌어요  찌리릿하게  재밌어요 ^^ ,10
604,또 보고싶다..나에게 최고의 스파이더맨은 톰 홀랜드 ,10
605,톰홀랜드진짜너무존잘입니다 ,10
606,영화보다 쿠키 영상이 더 재밌었던 ,7
607,쿠키영상 2개는 꼭 봐야함 ,10
608,진짜 넘나 잼슴.. 꼭 보세요ㅠㅠ 뭔가 스토리가 허술하다 싶었는데 통수통수통통수 ,10
609,처음으로 별점5개 신나게보고옴 ,10
610,너무 재밌다 마블영화 처음보는데 이렇게 재밌는 줄 알았다면 처음부터 볼 걸. ,10
611,쿠키영상 보고 넘 빡쳤어 누구든지 울피터 건들이는 사람은 나한테 디지는거에요 알았어 미스테리오? ,10
612,분명 재미있게 봤는데 극장나오는 순간 아무것도 기억이 안남 ,8
613,"액션씬은 아주 좋았음. 그외 모두 별로였다.특히 쓸대없이 억지로 짜맞춘듯히 등장하는 여친이 영화의 재미를 반감했고, 스토리도 전반적으로 별로였다. ",6
614,초반엔 재밌었는데 ㅠㅠ마블 영화 잘알못이라 그닥 별로였네요 ,8
615,죽어도 죽지않은 그 사람.. ,6
616,재밌게 봤어요 ㅎㅎ 듬직해진 스파이디 ,10
617,톰 홀랜드 배우연기가 매우 좋았다 ,10
618,쿠키영상보고 깜놀했네요! ,10
619,아 너무너무재밌었다 평점깎을이유가없다 ,10
620,벌떼같은 드론들과 싸우는 스파이더맨의 모습은 굉장히 역동적이어서 아름답기 까지 하다. ,10
621,화려한 CG로도 엉성한 스토리를 덮을 수는 없었다. 거미줄 타고 가는 유럽여행 정도만... ,6
622,진짜 톰홀랜드 너무좋아ㅜㅜ ,10
623,팔자주름 깊게 새기고 갑니다 ,10
624,상상도 못한 반전에 머리를 한대 맞은거같아요 꼭 보시길 바람다 ,10
625,스파이더맨에 나오는 빌런들 원인이 다 아이언맨이네;; 그래도 아이언맨 사랑해요!! ,10
626,스파이더맨 푸쉬를 엄청 해줘서 약간 어설프고 어린 스파이더맨을 안 좋아할 수 없게 해주는 영화 :) 마블 영화들이 앞으로 어떻게 될지 궁금하네요! 가끔 느슨하지만 재밌기도 했고 영화 무척 화려했어요. ,9
627,더이상 한국영화는 만원주고 못볼거같다 미스테리오늘 이렇게 영화화시킨 마블칭찬 ,10
628,환상적인 cg에 감탄했습니다. ,10
629,깜 안되는 스파이더맨에 억지로 후계자역 끼워맞추는 스토리가 너무 불편하다. 좀더 큰놈이 필요하다... ,6
630,역시 난 스파이더맨이 재미없다 ,6
631,역시 믿고보는 마블 CG ,8
632,그냥 거미싸움 노잼입니다 ,6
633,생각보다 스토리와 전개가 부족했어요 ,6
634,씨지는 좋았는데...영화는 딱히 재미없더라...마블영화중에 재미없는거 3개 뽑으라면 이거랑 캡틴마블이랑 캡팁아메리칸 1 요거 3개 뽑을수있겠다.별로 재미없...음 ,2
635,이번건 글쎄다??? 내가 톰을 좋아라해서 보긴 봤지만 그간 마블히어로 치고는 뭔가 이상함 ㅜㅜ ,1
636,별로재미없었음 기대한거치고 ,4
637,Mj 너무 못생김ㅠㅠㄹㅇ ,6
638,"톰홀랜드 앞으로 10번만 더 스파이더맨하자, 역대 가장 잘어울리는 스파이더맨같다. ",10
639,별로... MJ 미모 심하게 너프먹어서 전혀 매략적이지않은데 아주 미녀인것처럼 나와서 하나도 공감이 안된다. ,1
640,솔직히 홈커밍만 못 하다. 홀로그램과 드론만으로 기의 뭐 리얼리티스톤급으로 속임수가 가능하다는 부분에서 몰입감이 떨어지고 MJ와의 러브라인도 억지스럽다. 엔드게임에 이어 페이즈3를 마무리하는 시리즈인데 다소 아쉬운 ...,8
641,"내용이 너무 억지스럽고, 초등학생이 좋아할법한 내용 ",6
642,제일 재미없는 편일듯. 제대로 된 빌런도 아니고 일반인 상대로 장난하나? 액션 살리든지 극복하는 모습으로 성장했단걸 보여주든가. 제2의 아이언맨의 진지한 고민도 안보이고 반전 장난질과 로맨스로 풀어냈네. 실망임. ,5
643,정말 OOO기. 마블은 앞으로 기대안됨 ,4
644,평점은 호감순이 아니라 최신순으로 봐야 하는걸 깨닫게 해준영화..역대 최악이 아닐까싶은.. ,4
645,역대 최악의 스파이더맨이었다 ㅠㅠ 스파이더맨  거미줄타고 빌딩숲을 활보하는 전율과 감동이 전혀없다. 제목바꿔라 나이트몽키로 ,7
646,쿠키 영상에 임팩트를 제외하고는 감상하는 동안 너무 지루했다. ,4
647,1편도 별로였지만 더 최악이 됐다. 애들 장난같은 느낌 모든 마블 영화중 최악이었다.  어벤저스와 억지로 엮는 바람에 원작이 재미도 사라진듯 ,5
648,마블이라서 그나마 6점...800만 오바~!평점 9.0은 개 오바~!400만에 평점 6점... 적정!!기대하고 보지마시라~.. ,6
649,화장실 갔다 오느라 못 본 부분이 너무 신경쓰일 정도로 재밌었다 ,10
650,아들이 친구랑 보고 왔는데 재미있다고 합니다. ,9
651,재미있었고 신선합니다 ,10
652,3편도 꼭 보고싶다..진심으로 ,10
653,굿굿너무재밌음 반전소름 쿠키꼭봐야함 ,10
654,짱 재미나게 잘 봤습니다 ,10
655,새로운 시대를 이어갈 히어로 ,10
656,개인적으로 앤드게임보다 재미있었음 !! ,10
657,너무 재밌어요 진짜 반전에 충격 ㅎㅎ ,10
658,이건 토니스타크의 추모를 위한 영화임과 동시에 토니의 자리를 다음 후계자에게 넘기는 과정들을 보여주며 피터파커가 성장하는 과정이기도 하다. 댓글말대로 토니가 피터파커를 얼마나 사랑하는지 믿는지가 느껴졌고 다음 스파이...,10
659,찐한 딥키스가 아니라 뽀뽀뽀 ㅋㅋㅋ 아빠미소 지었음 ,10
660,아이랑 다같이 정말 재미있게 봤어요. 홀로그램 현실화될까봐 무섭네요. ,10
661,소니를 만든건 일본이다 머저리들아 불매불매 하면서 지들입맛대로 불매하죠? 이중성 잣대는 기본패시브로 갖춘 대한민국 대단해요! ,10
662,판권문제좀 어떻게해줘 ,10
663,"이야기가 길었으나, 재밌었음. 이거보고 썸이랑 몇일 후에 끝남.. ",10
664,재밌어요 스파이더맨 파블로홈 짱짱맨 ,10
665,cg와 액션은 별 10개도 부족하고 배우들의 연기는 충분히 좋았지만 그에 비한 시나리오나 스토리 전개는 많이 미흡하다고 느꼈습니다 캡틴마블 정도의 완성도 ,6
666,영화를 보면서 토니의 아이언맨은 이제 없구나... 라는게 점점 실감이 났네요. 다음에 나올 전개도 기대되고 충분히 즐겁게 관람하였습니다~ ,10
